"121","Panama","INFORMACION COMPLEMENTARIA - DOCUMENTO POWER POINT: AMBIENTES LIBRES DE HUMO PANAMA. http://www.gorgas.gob.pa/SitioWebTabaco/Documentos.htm 

Exposición al Humo de Tabaco Ajeno. Tomado del Informe de la Encuesta Mundial de Tabaco en Jóvenes, 2017.

RESUMEN: El 16.7% de los estudiantes estuvieron expuestos a humo de tabaco de segunda mano en el hogar, en tanto que cerca de 3 de 10 (31.7%) estuvo expuesto a humo de tabaco de segunda mano en espacios públicos cerrados. En ambos indicadores se reportaron descensos con respecto a los hallazgos de la GYTS 2012.

En casa: Un 83.3% de los entrevistados indicó que en los últimos 7 días no habían fumado en su casa en su presencia ningún día siendo que el 16.7% estuvo expuesto (chicos: 16.5%, chicas:17.2%). 

En Lugares Públicos Cerrados (por ejemplo: escuela, tiendas, restaurantes, centros comerciales, cines, teatros u otros): Cerca de 3 de cada 10 jóvenes entrevistados (31.7%) manifestó haber estado expuesto al HTA en lo últimos 7 días, en espacios públicos cerrados (Chicos=29.4%; chicas=34%), siendo las chicas las mayormente expuestas. 

En Lugares Públicos Abiertos
Cuatro de cada 10 jóvenes (35.1%) manifestó haber estado expuesto al humo de tabaco de segunda mano en lugares públicos abiertos (Chicos=32.9%; chicas=37.2%), siendo las mujeres las mayormente expuestas. La exposición al humo de tabaco en los últimos 7 días fue ligeramente mayor en espacios públicos abiertos que en los cerrados.  

En el Interior de los edificios escolares o en el área exterior propiedad de la escuela: El 28.9% de los entrevistados manifestó haber visto, en los últimos 30 días, a alguien fumando en áreas interiores de edificios escolares o en áreas exteriores propiedad de la escuela (Chicos=28.8%; chicas=28.8%), sin diferencias estadísticamente entre chicos y chicas.  Es decir, que cerca de siete de cada 10 (71.1%) de los jóvenes entrevistados indicó que nunca ve a nadie fumando en la escuela. 

Por su parte, en la EMTJ, en lo que se refiere a la exposición al humo de tabaco de segunda mano (HTSM), ha reportado un descenso progresivo de la exposición al humo de tabaco en los hogares durante los 4 años de realización del estudio (2002,2008,2012 y 2017). De igual forma, cada vez menos jóvenes están expuestos (HTSM) fuera de su casa,  aunque el 35.1% reporta haber estado expuesto fuera de su casa a pesar de la prohibición de fumar en ambientes cerrados, lo que nos lleva a  reflexionar sobre la necesidad de prohibir el consumo de tabaco en algunos espacios abiertos donde aún se puede fumar y de reforzar la vigilancia del cumplimiento del artículo 5 de la Ley 13 de 2008.

El estudio de Mercado de Productos de Tabaco realizado en el año  2017 reveló que el 92.1% de los dueños de locales de atención al público están a favor de la Ley 13 de 2008 y sus reglamentaciones.  El porcentaje se ha mantenido con respecto al año 2014. Fuente: Encuesta de mercado de productos de tabaco en los distritos de Panamá, Colón, David, Barú, San Miguelito y las Comarcas de Guna Yala y Ngäbe-Buglé. Panamá, 2017. http://www.gorgas.gob.pa/SitioWebTabaco/Inicio.htm


MEDICIÓN DE PM 2.5 EN LA VIGILANCIA Y CONTROL DE AMBIENTES LIBRES DE HUMO DE TABACO (ALHT). AÑO:2017


La vigilancia y control del cumplimiento de la Ley 13 del 24 de enero de 2008, sobre control de tabaco en Panamá la realiza el MINSA, mediante inspecciones programadas, atención de denuncias y operativos especiales. Desde el 2013, como parte de la vigilancia de “Ambientes Libres de Humo de Tabaco” se incluye la medición PM 2.5 en ambientes cerrados de interés sanitario, para detectar contaminación debido al uso de tabaco donde está prohibido fumar.

La medición del nivel de partículas finas PM 2.5 se utiliza como marcador de humo de tabaco ambiental (Archivos de Bronconeumología  Volumen 47,I Abril 2011 ), en los locales que han sido denunciados y es un método, utilizado por el Ministerio de Salud de Panamá, para comprobar el incumplimiento de la ley 13 del 24 de enero del 2008

Las PM 2.5 consiste en miles de partículas microscópicas inferior o igual a los 2.5 micrómetros, 100 veces más pequeño que el grueso de un cabello humano, producidos por la combustión de productos de tabaco entre otros contaminantes (Revista Ecologistas en Acción N°58 año 2010). Estás partículas pueden penetrar profundamente en los pulmones, albergándose en los alveolos donde se dividen y pasan al torrente sanguíneo. Pudiendo causar graves trastornos cardiovasculares y respiratorios, en particular coronariopatías y cáncer de pulmón (USEPA, 2013).  

Se realizaron 218 mediciones por quejas, de las cuales el 46.3%, no cumplen con las disposiciones del artículo 5 de la Ley 13 de 2008, las normas  de calidad de aire de USEPA y de las directrices de la OMS. La clasificación como detección moderada de partículas PM2.5 alcanzó un 27.5% del total estudiado, en tanto que en 18.8% las cifras detectadas eran de 35.5 ug/m3 o más. 

El 53.7% de las mediciones reportaron valores permisibles,  de los que el 21.1% alcanzó valores entre 0 y 12 ug/m3. 

En el 2.3% de los sitios investigados se percibió olor a tabaco, no hubo reporte de colillas, ni de fumadores. En ambientes exteriores a los puntos de medición, el 6.9% (15 sitios) reportó la presencia de colillas (115 colillas) y en 2.3% se notó la presencia de fumadores.

CONCLUSIONES:
Cerca de 1 de cada 2 (53.7%) quejas presentadas se identificaron valores de partículas PM 2.5 dentro de parámetros permisibles.

La atención de las quejas sobre ALHT contó con evidencias técnicas determinadas por la medición de las partículas PM 2.5, permitiendo valorar el cumplimiento o no del artículo 5 de la Ley 13 de 2008.
 
El uso de las mediciones de partículas PM 2.5 permite al Ministerio de Salud, tipificar más objetivamente las infracciones sobre ALHT y por tanto, sustentar mejor las sanciones que se apliquen.
 
En general, el uso del Sidepak ha fortalecido la vigilancia y control de los ambientes libres de humo de tabaco en Panamá.

El registro estructurado de las mediciones de partículas PM 2.5 relacionado con los ALHT, en base de datos contribuye con las estadísticas requeridas para el mapeo de calidad de aire interior en el territorio nacional. 


EXPOSICIÓN AL HUMO DE TABACO AJENO. TOMADO DE LA ENCUESTA DE TABACO
EN ADULTOS (EMTA – GATS) PANAMA, 2013

Respecto de la exposición al humo de segunda mano en el lugar de trabajo, es de mencionar que todos los individuos fumadores y no fumadores, reflejan una prevalencia de exposición del humo de tabaco de 5.6% (4.2-7.5), siendo para los hombres de 7,4% (5.1-10,6) y para las mujeres de 3.7% (2.4-5.7).  Estos resultados son similares a los observados entre los no fumadores.  Esta situación refleja un alto porcentaje de cumplimiento de las prohibiciones de fumar en espacios laborales cerrados.
 
Con relación a la exposición al humo de tabaco en el hogar, por condición de fumador la prevalencia general fue de 4,4% (3,7-5,2), de 5,3% (4,1-6,8) en los hombres y 3,5% (2,9-4,3) en las mujeres, indicando una baja prevalencia de exposición en el hogar y en principio una mayor presión del grupo familiar o conciencia del fumador sobre los efectos del humo de segunda  mano.

De la población adulta expuesta al humo de tabaco en los lugares públicos en los últimos 30 días, la prevalencia es más alta en las terminales de transporte, con el 15,3% (13,8-17,1), restaurantes con 5,9% (4,9-7,0) y en el transporte público con 5,0% (4,2-6,0), bares y clubs nocturnos con 8,0% (6,9-9,4), áreas comunes de edificios, 14,8% (12,5-17,5) y de 8,8% (6,5-11,7) facilidades deportivas, situación que refleja los ambientes con  mayores problemas en el cumplimiento de las prohibiciones de fumar, estos hallazgos llevan implícita la necesidad de fortalecer las acciones de vigilancia y control que adelantan las regiones de salud del Ministerio de Salud.
 
El análisis por área refleja que las terminales de transporte urbanas son las que concentran el mayor porcentaje de reportes de exposición al humo de tabaco, situación similar se refleja con el resto de los espacios investigados (áreas comunes de edificios públicos, bares, clubes nocturnos, casinos y similares, restaurantes), exceptuando esta percepción las facilidades deportivas en las áreas rurales. 

Sin embargo, con relación a las terminales de transporte, las mismas suelen ser áreas abiertas, muchas de las cuales son informales y en algunos casos sin estructuras adecuadas, lo que dificulta la vigilancia sobre todo en las del transporte colectivo.  Con relación a las universidades, las mismas están ubicadas en campus abiertos con facilidades de acceso amplio que dificulta el poder realizar una labor de vigilancia efectiva. 

En las áreas comunes de edificios una dificultad manifiesta es que son áreas privadas, con entrada restringida, que requiere de mayor concienciación de las asociaciones de residentes para el cumplimiento de la ley, al igual que con relación a facilidades deportivas privadas.

Con relación a las reglas en el hogar respecto al fumar,  el 84,6% (83,3-85,8) indicó que nunca  es permitido; el 2,6% (2,1-3,3) manifestó que es permitido en 2,6% y no permitido pero con excepciones fue reportado por el 7,5%  (6,7-8,3) de la población.  Es interesante destacar que entre los no fumadores no es permitido en el 86,5% (85,3-87,6) y con relación a los fumadores 55,5% (47,6-63,2).  Ello conlleva a considerar que en el hogar existe una mayor sensibilidad en cuanto a proteger el entorno familiar del humo de tabaco de segunda mano.
 
Las reglas de fumar en el lugar de trabajo tienen un alto cumplimiento, al observarse que en el 93,5% no se permite fumar en ningún lugar interior.  Igual también el porcentaje es alto entre los fumadores 90,5%(91,8-95,0)  y los no fumadores 93,8% (92,0-95,2) 

 Con la sanción y entrada en vigencia de la Ley 13 de 2008, se establece la prohibición de fumar ambientes laborales cerrados, en áreas comunes de edificios públicos y privados de uso comercial y doméstico, lugares públicos donde haya concurrencia de personas, ambientes públicos y privados, abiertos y cerrados, destinados a actividades deportivas. Los gerentes o encargados de los establecimientos son responsables de hacer cumplir la medida y podrán ser auxiliados por la Policía Nacional. Los resultados de la EMTA nos permiten indicar que el grado de protección contra el humo de tabaco de segunda mano  supera el 90% al considerar el hogar, los lugares de trabajo, las oficinas y edificios de gobierno, los centros de facilidades médicas y el transporte público, excepto en restaurantes donde alcanza el cerca del 88%. Esto demuestra que el fumador está fumando más en la casa. Lo cual es consono con la prevalencia general de consumo de productos fumados de tabaco, que se reportó en estudio en un 6.1%; lo que evidencia el cumplimiento de las medidas de control aplicables a los espacios abiertos y cerrados, tipificados en la Ley 13 de 2008.  También hace suponer que las personas tienen una respuesta más precisa y concreta cuando se habla del hogar y del lugar de trabajo que con relación a las áreas públicas.  

La ENSCAVI en el 2007 indicó que la percepción de los entrevistados sobre la exposición al humo de tabaco en el hogar fue de 19.3%, en el hogar de 11.4% y en los ambientes recreativos de 24.3%, durante este estudio se permitían espacios para fumadores y no fumadores en los lugares de trabajo y áreas recreativas. La EMTA permite identificar más ampliamente el grado de exposición percibida por la población panameña, o que refleja niveles de exposición significativamente menores. 

En la Encuesta de Prevalencia de Factores de Riesgo de Enfermedades Cardiovascular, PREFREC, 2010 realizada a población de 18 años y más se entrevistaron 3590 personas residentes en las provincias de Panamá y Colón, siendo 1074 hombres y 2516 mujeres. Las provincias antes mencionadas albergan cerca del 60% de la población panameña con 18 años y más y concentran el mayor porcentaje de establecimientos de interés de control definidos en el artículo 5 de la Ley 13 de 2008, referente a espacios 100% libres de humo de tabaco. Esta población a fines de la atención sanitaria está distribuida en 5 regiones de salud que son la de Panamá Este (n=667), Panamá Oeste (n=555), Metropolitana de Salud (n=813), San Miguelito (n=524) y Colón (n=1031). Este estudio indagó sobre la percepción de la población de 18 años y más con respecto a la exposición al humo de productos de tabaco en los últimos 30 días encontrándose que:
•	en casa: de los 3590 entrevistados, el 22.3% (799) manifestó que sí habían fumado en su presencia en su casa. 
•	en el trabajo: el 87.4% reportó que no habían fumado en su presencia en el área laboral, mientras que el 1.1% (39) no especificó su respuesta.
•	centros recreativos: cerca de ocho de cada 10 entrevistados (83.9%) indicó que no habían fumado en su presencia en centros recreativos en los últimos 30 días, en tanto que el 1.1% (40) no especificó su respuesta.

MAYORES DETALLES EN LOS INFORMES DE GYTS Y GATS PANAMA. DOCUMENTO POWER POINT SOBRE MEDICIONES DE PARTICULAS 2.5

ACTUALMENTE ESTAMOS EN LA FASE DE PROCESAMIENTO DE LOS DATOS DE LA GYTS 2017 POR LO QUE MAYORES DETALLES PODRÁN SER ENCONTRADOS A FUTURO EN LA PAGINA WEB REFERENCIADA PREVIAMENTE.","INFORMACION COMPLEMENTARIA - DOCUMENTO POWER POINT: AMBIENTES LIBRES DE HUMO PANAMA. http://www.gorgas.gob.pa/SitioWebTabaco/Documentos.htm 

Exposición al Humo de Tabaco Ajeno. Tomado del Informe de la Encuesta Mundial de Tabaco en Jóvenes, 2012.

RESUMEN: El 17.5% de los estudiantes estuvieron expuestos a humo de tabaco de segunda mano en el hogar, en tanto que cerca de 3 de 10 (35.2%) estuvo expuesto a humo de tabaco de segunda mano en espacios públicos cerrados.

4.3.1 En casa

Un 82.3% de los entrevistados indicó que en los últimos 7 días no habían fumado en su casa en su presencia ningún día (chicos=81.6%, chicas=82.8%) sin diferencias estadísticamente significativas por sexo, pero si entre los jóvenes de 15 años con respecto a los de 13 y 14 años. Cerca de 1 de cada 10 (9.5%) jóvenes indicaron que fumaron en su presencia 1 o 2 días (chicos=10.5%, chicas=8.6%). El 2.2% manifestó exposición durante 3 a 4 días; 1.5% indicó exposición durante 4 a 5 días, y el 4.5% reportó exposición al humo de tabaco ajeno durante los 7 días antes de su participación en este estudio (chicos=4.2%, chicas=4.8%), sin diferencias estadísticamente significativas por sexo y edad. Un 82.3% de los entrevistados indicó que en los últimos 7 días no habían fumado en su casa en su presencia ningún día (chicos=81.6, chicas=82.8%) sin diferencias estadísticamente significativas por sexo, pero si entre los jóvenes de 15 años con respecto a los de 13 y 14 años. Cerca de 1 de cada 10 (9.5%) jóvenes indicaron que fumaron en su presencia 1 o 2 días (chicos=10.5%, chicas=8.6%). El 2.2% manifestó exposición durante 3 a 4 días; 1.5% indicó exposición durante 4 a 5 días, y el 4.5% reportó exposición al humo de tabaco ajeno durante los 7 días antes de su participación en este estudio (chicos=4.2%, chicas=4.8%), sin diferencias estadísticamente significativas por sexo y edad.     

Con ello se puede concluir que la exposición al humo de tabaco ajeno en sus casas afecto al 17.7% de los jóvenes de 13 a 15 años entrevistados (Chicos=18.4%; chicas=17.2%), sin diferencias estadísticamente significativas por sexo, resultaron más expuestos los jóvenes de 15 años, reflejándose diferencias estadísticamente significativas de este grupo con respecto a los de 13 y 14 años 

4.3.2 Familiares u otras personas que fuman dentro del hogar

Al investigar sobre la frecuencia con que ve a su padre (padrastro o pareja de la madre) fumando  en su casa, el 35.6% de los entrevistados indicó que no tienen esa figura paterna (padre o padrastro). El 3.7%  manifestó que todos los días, un 7.1% que algunas veces y 53.6% que nunca, en ningún caso se registraron diferencias estadísticamente significativas por sexo y edad. 

En el caso de la madre (madrastra o pareja del padre) uno de cada 3 entrevistados (33.4%) indicó que no cuenta con esa  figura en su casa. El 2.5%  (chicos=3.2%, chicas=1.9%) indicaron que todos los días los ven fumando en el hogar, hallazgo que reflejó diferencias estadísticamente significativas entre chicos y chicas y entre los jóvenes de 14 y 15 años. El 3.1% comentó que en algunos casos ven esta figura fumando en el hogar (chicos=3.2%, chicas=3.1%). Seis de cada 10 (60.9%) de los entrevistados manifestó que nunca la figura materna fuma en el hogar (chicos=59.4%, chicas=62.2%), con diferencias estadísticamente significativas  entre chicos y chicas y entre los jóvenes de 13 y 15 años. 

Cerca de 3 de cada 10 entrevistados (28.7%) no tiene hermanos o hermanas (chicos=31.0, chicas=26.6) con diferencias estadísticamente significativas entre chicos y chicas, pero no por edad. El 7.4% ve a su hermano (a) fumando en el hogar siempre o a veces siendo mayor el porcentaje de los que lo ven a veces con 5.6%. Un 63.9% nunca ve a sus hermanos (as) fumando en el hogar (chicos=62.0, chicas=65.8) pregunta que permitió estimar diferencias estadísticamente significativas entre chicos y chicas. 

Cerca de 1 de cada 4 entrevistados manifestó ver a otras personas fumando en el hogar siempre o a veces, el mayor porcentaje reportado se ubicó entre los que indicaron a veces con un 17.9%, sin diferencias estadísticamente significativas por sexo. Uno de cada dos jóvenes reporto que nunca ve personas fumando en su casa (chicos=48.3, chicas=50.8) no encontrándose diferencias estadísticamente significativas por sexo y edad. 

4.3.3 Lugares públicos cerrados (por ejemplo: escuela, tiendas, restaurantes, centros comerciales, cines, teatros u otros)

Cerca de 2 de cada 6 jóvenes entrevistados (35.2%) manifestó haber estado expuesto al HTA en lo últimos 7 días, en espacios públicos cerrados (Chicos=32.0%; chicas=37.9%), siendo las mujeres las mayormente expuestas, sin diferencias estadísticamente significativas por edad. 

El 64.8% indicó que nunca ve a nadie fumando en lugares públicos cerrados con un diferencial hombre – mujer de 68.0% y 62.1%, respectivamente, estimándose diferencias estadísticamente significativas por sexo y entre los jóvenes de 13 años con respecto a los de 14 y 15 años, ya que el mayor porcentaje de jóvenes que reportó no haber estado expuesto al HTA en espacios cerrados en los últimos 7 días fue el de 13 años, con 71.6%.

4.3.4	Días de exposición al HTA en lugares públicos cerrados
Cerca de 6 de cada 10 jóvenes entrevistados (64.8%) manifestaron no haber estado expuestos al humo de tabaco de segunda mano en lugares públicos, donde más chicos que chicas reportaron no haber estado expuestos. Dos de cada 10 indicaron haber estado expuestos entre 1 y 2 días, más chicas que chicos reportaron haber estado expuestas. En ambos casos se estimaron diferencias estadísticamente significativas por sexo. El 7.3% de los entrevistados indicaron exposición al humo de tabaco de segunda mano, en lugares públicos en los últimos 7 días, todos los días, sin diferencias estadísticamente significativas por sexo. 


4.3.5	Lugares públicos abiertos
Cuatro de cada 10 jóvenes (35.2%) manifestó haber estado expuesto al humo de tabaco de segunda mano en lugares públicos abiertos (Chicos=37.8%; chicas=41.6%), siendo las mujeres las mayormente expuestas, aunque sin diferencias estadísticamente significativas por sexo, pero sí entre los jóvenes de 13 y 15 años;  de 13 y 14 años y de 14 y 15 años. La exposición al humo de tabaco en los últimos 7 días fue mayor en espacios públicos abiertos que en los cerrados, con diferencias estadísticamente significativas globalmente, entre los chicos de ambos grupos, no así entre las chicas. 

En tanto que el 6 de cada 10 jóvenes entrevistados indicó que nunca vio a nadie fumando en lugares públicos abiertos con un diferencial hombre – mujer de 62.2% y 58.4%, respectivamente, estimándose diferencias estadísticamente significativas por edad, no así por sexo. 

4.3.6	Transporte público por ejemplo autobuses, taxis o trenes de pasajeros
Cerca de tres de cada 10 (31.1%) estudiantes entrevistados no utilizaron transporte público en los 7 días antes de la entrevista (chicos=32.8%, chicas=29.7%). Un 61.1% usó transporte público pero no vio a nadie fumando en el interior del mismo (chicos=59.5%, chicas=63.4%), lo que indica que cerca de 9 de cada 10 (92.7%) estudiantes no vieron a alguien fumar en el transporte público y que un 7.3% de los estudiantes estuvieron expuestos al humo de tabaco de segunda mano en el transporte público de los que 4.2% reportó exposición por 1 o 2 días. 


4.3.7	En el Interior de los edificios escolares o en el área exterior propiedad de la escuela.

El 27.9% de los entrevistados manifestó haber visto, en los últimos 30 días, a alguien fumando en áreas interiores de edificios escolares o en áreas exteriores propiedad de la escuela (Chicos=29.4%; chicas=26.4%), con diferencias estadísticamente entre chicos y chicas, siendo los chicos quienes observaron este comportamiento; así como entre los jóvenes de 13 años con respecto a los otros dos grupos de estudiantes. 

Cerca de siete de cada 10 (72.1%) de los jóvenes entrevistados indicó que nunca ve a nadie fumando en la escuela con un diferencial hombre – mujer de 70.6% y 73.6%, respectivamente, estimándose diferencias estadísticamente significativas por sexo y edad. 





EXPOSICIÓN AL HUMO DE TABACO AJENO. TOMADO DE LA ENCUESTA DE TABACO
EN ADULTOS (EMTA – GATS) PANAMA, 2013

Respecto de la exposición al humo de segunda mano en el lugar de trabajo, es de mencionar que todos los individuos fumadores y no fumadores, reflejan una prevalencia de exposición del humo de tabaco de 5.6% (4.2-7.5), siendo para los hombres de 7,4% (5.1-10,6) y para las mujeres de 3.7% (2.4-5.7).  Estos resultados son similares a los observados entre los no fumadores.  Esta situación refleja un alto porcentaje de cumplimiento de las prohibiciones de fumar en espacios laborales cerrados.
 
Con relación a la exposición al humo de tabaco en el hogar, por condición de fumador la prevalencia general fue de 4,4% (3,7-5,2), de 5,3% (4,1-6,8) en los hombres y 3,5% (2,9-4,3) en las mujeres, indicando una baja prevalencia de exposición en el hogar y en principio una mayor presión del grupo familiar o conciencia del fumador sobre los efectos del humo de segunda  mano.

De la población adulta expuesta al humo de tabaco en los lugares públicos en los últimos 30 días, la prevalencia es más alta en las terminales de transporte, con el 15,3% (13,8-17,1), restaurantes con 5,9% (4,9-7,0) y en el transporte público con 5,0% (4,2-6,0), bares y clubs nocturnos con 8,0% (6,9-9,4), áreas comunes de edificios, 14,8% (12,5-17,5) y de 8,8% (6,5-11,7) facilidades deportivas, situación que refleja los ambientes con  mayores problemas en el cumplimiento de las prohibiciones de fumar, estos hallazgos llevan implícita la necesidad de fortalecer las acciones de vigilancia y control que adelantan las regiones de salud del Ministerio de Salud.
 
El análisis por área refleja que las terminales de transporte urbanas son las que concentran el mayor porcentaje de reportes de exposición al humo de tabaco, situación similar se refleja con el resto de los espacios investigados (áreas comunes de edificios públicos, bares, clubes nocturnos, casinos y similares, restaurantes), exceptuando esta percepción las facilidades deportivas en las áreas rurales. 

Sin embargo, con relación a las terminales de transporte, las mismas suelen ser áreas abiertas, muchas de las cuales son informales y en algunos casos sin estructuras adecuadas, lo que dificulta la vigilancia sobre todo en las del transporte colectivo.  Con relación a las universidades, las mismas están ubicadas en campus abiertos con facilidades de acceso amplio que dificulta el poder realizar una labor de vigilancia efectiva. 

En las áreas comunes de edificios una dificultad manifiesta es que son áreas privadas, con entrada restringida, que requiere de mayor concienciación de las asociaciones de residentes para el cumplimiento de la ley, al igual que con relación a facilidades deportivas privadas.

Con relación a las reglas en el hogar respecto al fumar,  el 84,6% (83,3-85,8) indicó que nunca  es permitido; el 2,6% (2,1-3,3) manifestó que es permitido en 2,6% y no permitido pero con excepciones fue reportado por el 7,5%  (6,7-8,3) de la población.  Es interesante destacar que entre los no fumadores no es permitido en el 86,5% (85,3-87,6) y con relación a los fumadores 55,5% (47,6-63,2).  Ello conlleva a considerar que en el hogar existe una mayor sensibilidad en cuanto a proteger el entorno familiar del humo de tabaco de segunda mano.
 
Las reglas de fumar en el lugar de trabajo tienen un alto cumplimiento, al observarse que en el 93,5% no se permite fumar en ningún lugar interior.  Igual también el porcentaje es alto entre los fumadores 90,5%(91,8-95,0)  y los no fumadores 93,8% (92,0-95,2) 

 Con la sanción y entrada en vigencia de la Ley 13 de 2008, se establece la prohibición de fumar ambientes laborales cerrados, en áreas comunes de edificios públicos y privados de uso comercial y doméstico, lugares públicos donde haya concurrencia de personas, ambientes públicos y privados, abiertos y cerrados, destinados a actividades deportivas. Los gerentes o encargados de los establecimientos son responsables de hacer cumplir la medida y podrán ser auxiliados por la Policía Nacional. Los resultados de la EMTA nos permiten indicar que el grado de protección contra el humo de tabaco de segunda mano  supera el 90% al considerar el hogar, los lugares de trabajo, las oficinas y edificios de gobierno, los centros de facilidades médicas y el transporte público, excepto en restaurantes donde alcanza el cerca del 88%. Esto demuestra que el fumador está fumando más en la casa. Lo cual es consono con la prevalencia general de consumo de productos fumados de tabaco, que se reportó en estudio en un 6.1%; lo que evidencia el cumplimiento de las medidas de control aplicables a los espacios abiertos y cerrados, tipificados en la Ley 13 de 2008.  También hace suponer que las personas tienen una respuesta más precisa y concreta cuando se habla del hogar y del lugar de trabajo que con relación a las áreas públicas.  

La ENSCAVI en el 2007 indicó que la percepción de los entrevistados sobre la exposición al humo de tabaco en el hogar fue de 19.3%, en el hogar de 11.4% y en los ambientes recreativos de 24.3%, durante este estudio se permitían espacios para fumadores y no fumadores en los lugares de trabajo y áreas recreativas. La EMTA permite identificar más ampliamente el grado de exposición percibida por la población panameña, o que refleja niveles de exposición significativamente menores. 

En la Encuesta de Prevalencia de Factores de Riesgo de Enfermedades Cardiovascular, PREFREC, 2010 realizada a población de 18 años y más se entrevistaron 3590 personas residentes en las provincias de Panamá y Colón, siendo 1074 hombres y 2516 mujeres. Las provincias antes mencionadas albergan cerca del 60% de la población panameña con 18 años y más y concentran el mayor porcentaje de establecimientos de interés de control definidos en el artículo 5 de la Ley 13 de 2008, referente a espacios 100% libres de humo de tabaco. Esta población a fines de la atención sanitaria está distribuida en 5 regiones de salud que son la de Panamá Este (n=667), Panamá Oeste (n=555), Metropolitana de Salud (n=813), San Miguelito (n=524) y Colón (n=1031). Este estudio indagó sobre la percepción de la población de 18 años y más con respecto a la exposición al humo de productos de tabaco en los últimos 30 días encontrándose que:
•	en casa: de los 3590 entrevistados, el 22.3% (799) manifestó que sí habían fumado en su presencia en su casa. 
•	en el trabajo: el 87.4% reportó que no habían fumado en su presencia en el área laboral, mientras que el 1.1% (39) no especificó su respuesta.
•	centros recreativos: cerca de ocho de cada 10 entrevistados (83.9%) indicó que no habían fumado en su presencia en centros recreativos en los últimos 30 días, en tanto que el 1.1% (40) no especificó su respuesta.

Por su parte, en la EMTJ, en lo que se refiere a la exposición al humo de tabaco de segunda mano (HTSM), ha reportado un descenso progresivo de la exposición al humo de tabaco en los hogares de 21.4 puntos porcentuales al comparar las cifras de 2002 con el 2012. De igual forma, cada vez menos jóvenes están expuestos (HTSM) fuera de su casa,  aunque el 35.1% reporta haber estado expuesto fuera de su casa a pesar de la prohibición de fumar en ambientes cerrados, lo que nos lleva a  reflexionar sobre la necesidad de prohibir el consumo de tabaco en algunos espacios abiertos donde aún se puede fumar y de reforzar la vigilancia del cumplimiento del artículo 5 de la Ley 13 de 2008.

Recientemente, el ICGES realizó una encuesta financiada por el IDRC en la cual el 92% de los gerentes, dueños o administradores de sitios de hostelería están de acuerdo con las disposiciones de ambientes libres de humo que establece la Ley 13 de 2008.


 
MAYORES DETALLES EN LOS INFORMES DE GYTS Y GATS PANAMA.","Más detalles en los informes técnicos de la EMTA – 2013 y de la EMTJ-2012 por publicar en el transcurso del I semestre de 2014","WHO Region of the Americas"
