"","Party","2018","2016","2014","Region"
"1","Afghanistan","78.3% of non-smokers are exposed to environmental tobacco smoke in places such as public transportation, offices and marketplaces, where others smoke.","78.3% of non-smokers are exposed to environmental tobacco smoke in places such as public transportation, offices and marketplaces, where others smoke.","Answer not provided","WHO Eastern Mediterranean Region"
"2","Albania","Report not provided","Report not provided","Answer not provided","WHO European Region"
"3","Algeria","- Exposition  à la maison: 30.0 %
- Exposition dans les lieux publics : 34.3 %","Exposition  à la maison : 27,5%  
- dans les lieux publics : 61,3%
   61,3 % des enquêtes   déclarent qu’elles sont exposées au tabagisme passif dans les lieux publics      clos   (bureau, café, restaurants,  transports, centres commerciaux).
-dans les lieux publics extérieurs : 62,1%
62,1 % des enquêtes   déclarent qu’elles sont exposées au tabagisme passif dans les lieux publics      extérieurs  (jardin, stade, parcs, plages).","- Exposition par sexe : 
- 22 7 % des hommes sont exposés à la maison contre 25 9 % pour les femmes. 
 - 74 9 % des femmes déclarent être exposées dans les lieux publics au tabagisme passif (transports administrations etc) contre 77 3 % pour les hommes.
-Exposition à la maison : 24 1 % 
- Exposition dans les lieux publics : 75 9 %","WHO African Region"
"4","Angola","Answer not provided","Answer not provided","Report not provided","WHO African Region"
"5","Antigua and Barbuda","Report not provided","Answer not provided","Answer not provided","WHO Region of the Americas"
"6","Armenia","Report not provided","Report not provided","Schoolchildren (13-15 years old) exposure to tobacco smoke in home 70.6% (69.2% boys and 71.6% girls). 
78.3% (80.7 % boys and 76.4 girls) are esposed to smoke in public places","WHO European Region"
"7","Australia","See attached in B24","As part of the National Health Survey in 2011-12, the Biomedical Results for Chronic Disease included a test for cotinine as an objective measure of smoking status. The body produces cotinine in the process of breaking down, or metabolising, nicotine from tobacco smoke. Levels of cotinine are generally proportionate to the amount of tobacco exposure a person receives through smoking, or in some cases, through exposure to second hand smoke. However, cotinine levels only remain elevated for around 20 hours after exposure to tobacco smoke; therefore it can only provide a measure of short-term exposure. Overall, 87.0% of current smokers aged 18 years and over had exposure to tobacco smoke, compared with only 5.7% of those who were ex-smokers and 0.3% of those who had never smoked.","As part of the National Health Survey in 2011-12. the Biomedical Results for Chronic Disease included a test for cotinine as an objective measure of smoking status. The body produces cotinine in the process of breaking down. or metabolising. nicotine from tobacco smoke. Levels of cotinine are generally proportionate to the amount of tobacco exposure a person receives through smoking. or in some cases. through exposure to second hand smoke. However. cotinine levels only remain elevated for around 20 hours after exposure to tobacco smoke; therefore it can only provide a measure of short-term exposure. Overall. 87.0% of current smokers aged 18 years and over had exposure to tobacco smoke. compared with only 5.7% of those who were ex-smokers and 0.3% of those who had never smoked.","WHO Western Pacific Region"
"8","Austria","Exposure at home (13 %; men 13 %, women 13 %), in the workplace (8 %; men 10 %, women 7 %)
Exposure to tobacco smoke in general (28 %; men 34 %, women 23 %), Exposure to tobacco smoke at least one hour per day (15 %; men 17 %, women 13 %)","Exposure at home (13 %), in the workplace (8 %)","In 2006-2007 9.9% of the Austrian population aged 15+ and being non-smokers or occasional Smokers (= not smoking every day) were exposed to tobacco smoke at home and 24.3 % of the working population were exposed to tobacco smoke at their workplace (11.9 % less than 1 hour/day 7.5 % from 1 to 5 hours/day and 4.9 % more than 5 hours/day). Tobacco smoke exposure at home as well as at the workplace was highest among 15-30 year old persons (15.9 % at home and 30.8 % at the workplace). Men are more often exposed to tobacco smoke at the workplace than women (27.5 % vs. 20.3 %); at home however women are more often exposed to tobacco smoke (10.2 % vs. 9.6 %).","WHO European Region"
"9","Azerbaijan","Among 18–69 years of population, 24.9% were exposed to second-hand smoke at home. The women more likely than men to be exposed to environmental tobacco smoke (ETS) at home (26.5% vs 23.3%). The overall rate of exposed to second-hand smoke in home for both sexes was higher in the young age group (18-44) than older (45-69) (26.6% vs 22.1).
Meanwhile, in the workplace only 18.3 from both sexes of respondents were exposed to second-hand smoke. As expected, men were more exposed than women (28.4% vs. 7.7% respectively), which can be explained by a higher share of employed people among the male respondents, especially in rural areas. Differences between age groups (18-44 and 45-69) for all respondents are not notable 
A significant decline in the trend of ETS at home among women (up to 35%)  and men (up to 23%) , and in the trend of ETS at work among men (up to 50%) were observed since submission of the last report.","Among 18 and older, the women more likely than men to be exposed to environmental tobacco smoke (ETS) at home (40.2% vs. 30.2%). ETS exposure at work and public places are higher in men (55.0% and 76.2% respectively), which can be explained by a higher share of employed people among the male respondents and women traditionally less likely to visit public places, especially in rural areas. The 59.6% exposed to ETS either at home, work or public places with men being exposed more frequently than women (67.5% and 52.3% respectively). For both sexes the exposure is more likely to happen at public places than at home or work (59.2% vs. 35.6% and 34.9%). By age groups, ETS exposure tended to be greater in younger ages.","Among 18 and older the women more likely than men to be exposed to environmental tobacco smoke (ETS) at home (40.2% vs. 30.2%). ETS exposure at work and public places are higher in men (55.0% and 76.2% respectively) which can be explained by a higher share of employed people among the male respondents and women traditionally less likely to visit public places especially in rural areas. The 59.6% exposed to ETS either at home work or public places with men being exposed more frequently than women (67.5% and 52.3% respectively). For both sexes the exposure is more likely to happen at public places than at home or work (59.2% vs. 35.6% and 34.9%). By age groups ETS exposure tended to be greater in younger ages.","WHO European Region"
"10","Bahamas","Report not provided","Environmental tobacco smoke exposure at home ( 7.7%) and in the workplace (11.3%)","Exposure at home: Male - 8.3% (CI: 4.0-12.7); Female - 7.1% (CI:0.0-16.5); Total: 7.7% (CI: 0.8-14.6)
Exposure in the workplace: Male - 17.4 % (CI: 0.0-39.0); Female - 5.2% (CI: 0.0-11.4); Total 11.3% (CI: 0.0-26.2)
(based on exposure on one or more days in the past 7 days)","WHO Region of the Americas"
"11","Bahrain (Kingdom of)","The study was conducted by using special PM2.5 monitoring instrument that measured the concentration of suspended SHS particulate matter (PM) in indoor air. Indoor Air monitoring was conducted for thirty minutes at every venue in a sample of hospitals, schools, public offices, transportation, and recreation venues. The study took place during July, 2010.  A total of 18 venues were monitored using PM2.5. A brief summary of the findings from this study is presented here.
In Manama, the study found an average PM2.5 level of 211 µg/m3 in venues with evidence of smoking, which is 15 times higher than indoor places where no smoking was observed. 
Study Findings 
Levels of PM2.5 in Indoor Places in Bahrain
•	PM2.5 levels were 15 times higher in venues where smoking was observed compared to venues with no smoking observed and nearly 8 times higher than outdoors.

•	Smoking was only observed in recreation venues.  All other venues had signs prohibiting smoking and very low levels of PM2.5.

•	The average PM2.5 levels detected in recreation venues with smoking was 211 µg/m3. In only 30 minutes, visitors to these venues would be exposed to levels 8 times higher than what is acceptable for a whole day (25 µg/m3), defined by the World Health Organization.6

•	There was no evidence of smoking in schools, hospitals, public offices or transportation venues included in this study.","The study was conducted by using special PM2.5 monitoring instrument that measured the concentration of suspended SHS particulate matter (PM) in indoor air. Indoor Air monitoring was conducted for thirty minutes at every venue in a sample of hospitals, schools, public offices, transportation, and recreation venues. The study took place during July, 2010.  A total of 18 venues were monitored using PM2.5. A brief summary of the findings from this study is presented here.
In Manama, the study found an average PM2.5 level of 211 µg/m3 in venues with evidence of smoking, which is 15 times higher than indoor places where no smoking was observed. 
Study Findings 
Levels of PM2.5 in Indoor Places in Bahrain
•	PM2.5 levels were 15 times higher in venues where smoking was observed compared to venues with no smoking observed and nearly 8 times higher than outdoors.

•	Smoking was only observed in recreation venues.  All other venues had signs prohibiting smoking and very low levels of PM2.5.

•	The average PM2.5 levels detected in recreation venues with smoking was 211 µg/m3. In only 30 minutes, visitors to these venues would be exposed to levels 8 times higher than what is acceptable for a whole day (25 µg/m3), defined by the World Health Organization.6

•	There was no evidence of smoking in schools, hospitals, public offices or transportation venues included in this study.","The study was conducted by using special PM2.5 monitoring instrument that measured the concentration of suspended SHS particulate matter (PM) in indoor air. Indoor Air monitoring was conducted for thirty minutes at every venue in a sample of hospitals schools public offices transportation and recreation venues. The study took place during July 2010. A total of 18 venues were monitored using PM2.5. A brief summary of the findings from this study is presented here.
In Manama the study found an average PM2.5 level of 211 µg/m3 in venues with evidence of smoking which is 15 times higher than indoor places where no smoking was observed. 

Study Findings 

Levels of PM2.5 in Indoor Places in Bahrain

PM2.5 levels were 15 times higher in venues where smoking was observed compared to venues with no smoking observed and nearly 8 times higher than outdoors.

Smoking was only observed in recreation venues. All other venues had signs prohibiting smoking and very low levels of PM2.5.

The average PM2.5 levels detected in recreation venues with smoking was 211 µg/m3. In only 30 minutes visitors to these venues would be exposed to levels 8 times higher than what is acceptable for a whole day (25 µg/m3) defined by the World Health Organization.6

There was no evidence of smoking in schools hospitals public offices or transportation venues included in this study.","WHO Eastern Mediterranean Region"
"12","Bangladesh","45% in public places. Males (69.4%) were more exposed than females (20.8%). 63.0% in workplace, 26.3% on public transport","45% in public places. Males (69.4%) were more exposed than females (20.8%). 63.0% in workplace, 26.3% on public transport","63.0% in workplace 26.3% on public transport","WHO South-East Asia Region"
"13","Barbados","Answer not provided","for young people 13-15:
19.1% exposed at home
33.2 exposed inside enclosed public places","Answer not provided","WHO Region of the Americas"
"14","Belarus","Каждый пятый респондент за последние 30 дней подвергся воздействию вторичного табачного дыма в домашних условиях за последние 30 дней. Доля таких пассивных курильщиков составляет 18,8% (мужчин – 18,9%, женщин – 18,8%). Существенных различий по возрасту пассивных курильщиков в домашних условиях также нет.Каждый пятый респондент за последние 30 дней подвергался воздействию вторичного табачного дыма на рабочем месте. Доля пассивных курильщиков на работе составляет 14,9% (мужчины – 22,5%, женщины – 8,5%)","Согласно полученным данным все еще  значительная часть населения подвержена пассивному курению, более половине опрошенных приходится находиться рядом с курящими в различных местах (дома, в гостях, на работе и т.д.), тем самым, выступая в роли пассивного курильщика (таблица 2.8.9). Наиболее часто приходиться сталкиваться с пассивным курением на остановках общественного транспорта (22,8%). 
За исследуемый период 2010-2015 гг. сохраняется положительная тенденция снижения доли тех, кто подвергается пассивному курению «часто» и увеличение доли тех, кто подвергается пассивному  курению «редко» и «никогда». Так, доля тех, кому приходиться часто находиться рядом с курящими дома снизилась на 13,5%; в гостях, у друзей – на 19,9%;  на работе/учебе – 22,6%; на остановках общественного транспорта – на 17,2%; в парках, скверах – на 16,6%; в кафе, барах – на 13,5%. 
Полученные данные свидетельствуют об эффективности мер по ограничению курения в общественных местах и необходимости дальнейшей работы в данном направлении.","'' 
(in% of respondents 2010 - 2012. 
Yes often Yes sometimes Yes rarely No never 
2010 2012 2010 2012 2010 2012 2010 2012 
Housing 28.3 20.5 20.0 17.2 12.1 15.7 34.4 41.6 
Visiting friends acquaintances 32.2 19.0 34.8 34.1 22.6 30.4 5.0 11.8 
At work / school 39.4 24.5 24.8 26.4 12.9 18.2 16.3 23.9 
At stops societies. Transport 40.0 36.4 32.6 34.5 14.8 17.7 7.1 7.6 
In parks squares 30.8 25.3 31.1 33.8 17.9 22.6 11.7 12.7 
In cafes bars etc. 28.6 24.1 25.4 28.7 15.7 18.7 20.5 21.0","WHO European Region"
"15","Belgium","Lors de leur dernière visite, 4% des personnes ont été exposées à la fumée dans un restaurant et 18 % des personnes ont été exposées à la fumée dans un bar.","Lors de leur dernière visite, 6% des personnes ont été exposées à la fumée dans un restaurant et 23 % des personnes ont été exposées à la fumée dans un bar. Sur le lieux de travail, 79 % des travailleurs ne sont jamais confrontés à la fumée,  12 % occasionnellement, 4% moins d’une heure par  jour, 3% de 1 à 5 heures par jour et 2 % plus de 5 heures par jour.

The indicator reflects the distribution of the population (aged 15 years and over) according to their level of daily exposure to tobacco smoke INDOORS (whether at home, at work or in transportation):
77% of women and 73% of men indicated they were never or almost never exposed to tobacco smoke. 17% women and 20% men are exposed to tobacco smoke less than 5 hours per day, while 6% women and 7% men are exposed to tobacco smoke more than 5 hours per day. 
As regard to age, the most exposed (more than 5 hours a day) are found in the groups 15-24 years (7,3%) and 55-64 years (9,7%).","Lors de leur dernière visite 6% des personnes ont été exposées à la fumée dans un restaurant et 23 % des personnes ont été exposées à la fumée dans un bar. Sur le lieux de travail 71 % des travailleurs ne sont jamais confrontés à la fumée 15 % occasionnellement 7% moins d’une heure par jour 4% de 1 à 5 heures par jour et 3 % plus de 5 heures par jour.","WHO European Region"
"16","Belize","Report not provided","Answer not provided","Answer not provided","WHO Region of the Americas"
"17","Benin","Hommes exposé à la maison 21.6% 
Femmes exposé à la maison  14.1%
Hommes et Femmes exposé à la maison 17.5% 
Hommes exposé au travail 14.1% 
Femmes exposé au travail  8.4%
Hommes et Femmes exposé au travail 10.2%","Hommes exposé à la maison 21.6% 
Femmes exposé à la maison  14.1%
Hommes et Femmes exposé à la maison 17.5% 
Hommes exposé au travail 14.1% 
Femmes exposé au travail  8.4%
Hommes et Femmes exposé au travail 10.2%","prévalence du tabagisme passif chez les élèves de 13-15 ans (29.2%","WHO African Region"
"18","Bhutan","15.3% (16.3% boys, 14.4% girls) of youths were exposed to tobacco smoke at home. 
46.6% (47.9% boys and 45.6% girls) were exposed to tobacco smoke at outdoor public places.","15.3% (16.3% boys, 14.4% girls) of youths were exposed to tobacco smoke at home. 
46.6% (47.9% boys and 45.6% girls) were exposed to tobacco smoke at outdoor public places.","Exposure to tobacco smoke at home: Overall 15.3% Boys (16.3) Girls (14.4 )
Exposure to tobacco smoke inside any enclosed public place: Overall % 42.8 Boys (43.0) Girls ( 42.7)
Exposure to tobacco smoke at any outdoor public place: Overall % 46.6 Boys (47.9) Girls ( 45.6","WHO South-East Asia Region"
"19","Bolivia (Plurinational State of)","El 50,3% de jovenes entre 13 y 15 años, estuvieron expuestos al HTA en lugares públicos abiertos, de los cuales 54.3% eran mujeres y el 49.3% hombres.

El 46.6% de los jovenes estuvieron expuestos al HTA en lugares públicos cerrados, de los cuales 50.5% fueron hombres y 49.2% mujeres.","Report not provided","Report not provided","WHO Region of the Americas"
"20","Bosnia and Herzegovina","Federation BiH: Exposure to tobacco smoke in the adults (18-65)  is 54,1% at home, 44,4% at work and 52.7% in public places. 

Republic of Srpska: Exposure to tobacco smoke at workplace is 53,6% (males - 60%, females 45,5%). Exposure at the public places is 87,7% (males 83.6%, females 76,4%). In this group of the public place exposure, the biggest number is in the 18 - 24 age group. At home, exposure to the tobacco smoke is 39,9% (male 37,9%, female 41,5%).
        
Brcko District BiH: There are no data available.","Adults ( 18-65) 
Exposure to ETS at home 54,1%
Exposure at work 44,4
Exposure in the public places 52.7%","More than half of adults in the Federation of B&H (54 1%) reported ETS exposure at home 44 4% ETS exposure at work and 52 7% reported ETS exposure in the public 
In Republika Srpska: at the workplace exposure to the tobacco smoke is 53.6% of adults (males - 60% females 45.5%). At the public places exposure to the tobacco smoke is 87.7% (males 83.6% females 76.4%). In this group of the public place exposure the biggest number is in the 18 - 24 age group. At home exposure to the tobacco smoke is 39.9% (male 37.9% female 41.5%)","WHO European Region"
"21","Botswana","At home and in the workplace which are regarded as private business places.","Report not provided","Report not provided","WHO African Region"
"22","Brazil","Individuals (smokers and nonsmokers) of 18 or more exposed to secondhand smoke at least 1 time per month at home:
Men: 18.8 (17.9 to 19.8)
Women: 17.2 (16.4 to 18.0)
 
Individuals (smokers and nonsmokers) of 18 or more exposed to secondhand smoke at work among those who work indoors / both:
Men: 20.5 (19.2 to 21.9)
Women: 12.1 (11.0 to 13.3)","Individuals (smokers and nonsmokers) of 18 or more exposed to secondhand smoke at least 1 time per month at home:
Men: 18.8 (17.9 to 19.8)
Women: 17.2 (16.4 to 18.0)
 
Individuals (smokers and nonsmokers) of 18 or more exposed to secondhand smoke at work among those who work indoors / both:
Men: 20.5 (19.2 to 21.9)
Women: 12.1 (11.0 to 13.3)","Exposure to secondhand smoke at home at least once a month was reported by 27.9% of respondents in 2008 (40 million individuals in Brazil 24 million being non-smokers). A higher proportion reported being exposed to secondhand smoke at home in rural than in urban area irrespective of gender (p values < 0.001).
In 2008 exposure to secondhand smoke in the workplace in Brazil was reported by 24.4% of respondents who worked in enclosed places representing around 12 million individuals in Brazil; of these nine million were not smokers. Women had a lower rate of secondhand smoke exposure at work than men (p value < 0.001). No differences were found between rural and urban areas pertaining to secondhand smoke at work.
Not including the workplace about one in every five individuals surveyed reported in 2008 exposure to tobacco smoke in public places corresponding to 26 million individuals in Brazil with 22 million being non-smokers. If exposure to tobacco smoke at work is also included a total of 28 million of non-smokers were exposed to secondhand smoke. Men and women reported similar proportions of exposure to tobacco smoke in public places such as health care facilities restaurants public transportation and government buildings. Individuals living in rural areas were less often exposed to tobacco smoke (p value < 0.001).","WHO Region of the Americas"
"23","Brunei Darussalam","Exposure to smoke (% who reported people smoked in their presence): total: 41.1%; by gender: males 47.3% & females 34.9%.","Report not provided","Exposure to smoke at home (39.7%) inside any enclosed public place (59.2%) and at any outdoor public place (56.4%","WHO Western Pacific Region"
"24","Bulgaria","About the half of the studied population aged 13-15 reported nearly identical exposure at their homes and inside enclosed public places (50.8% and 50.6% respectively) somewhat but not significantly more girls (55.4% and 56.6 respectively) than boys (46.7% and 45.2% respectively).","The question is: How often are you exposed to tobacco smoke indoors?
1. Never or almost never
2. Less than 1 hour per day
3. 1 hour or more a day
by indoors we mean at home, at work, at public places, at restaurants etc.","Analysis of results indicates that half of children which participate in the survey are exposed to passive smoking in their homes. 45 7 % of fathers and 30.0% of mothers are smoking. Only 42 5 % of children are living in the home without smoke. But including the indicator „smoking of elder relatives” (grandmother grandfather and other relatives) the percentage of this type of homes are reduced to 39 %. Most of the cases are one smoker in the family (respectively 32 % and 31 %). Both of parents smoke in ¼ of the cases and in 5 % of the families the smokers are 3 to 5.","WHO European Region"
"25","Burkina Faso","La prévalence de lexposition du tabac à fumée à domicile était de 36,3% chez les hommes et femmes âgés de 25 à 64 ans. Elle était de 47,1 % chez les hommes et de 27,2 chez les femmes.
Au lieu du travail, elle était de 22,6% chez les hommes et femmes âgés de 25 à 64 ans dont 31,5% chez les hommes et 14,9% chez les femmes.","La prévalence de lexposition du tabac à fumée à domicile était de 36,3% chez les hommes et femmes âgés de 25 à 64 ans. Elle était de 47,1 % chez les hommes et de 27,2 chez les femmes.
Au lieu du travail, elle était de 22,6% chez les hommes et femmes âgés de 25 à 64 ans dont 31,5% chez les hommes et 14,9% chez les femmes.","La prévalence de l’exposition passive à la fumée de tabac à domicile est de 36 3% chez les hommes et les femmes âgés de 25 à 64 ans. Elle est plus élevée chez les hommes (47 1%) que chez les femmes (27 2%).
Au lieu de travail elle est de 22 6% chez les hommes et les femmes âgés de 25 à 64 ans. Elle est plus élevée chez les hommes (31 5%) que chez les femmes (14 9%).
NB: Selon les termes de l’enquête STEPs Burkina Faso 2013 on entend par exposition à la fumée de tabac toute exposition à la fumée de tabac pendant au moins un jour au cours des sept jours ayant précédé l’entretien","WHO African Region"
"26","Burundi","Report not provided","Answer not provided","Report not provided","WHO African Region"
"27","Cambodia","Exposure by gender at home: Male: 69.5%, Female: 62.1%, Total: 65.6%
Exposure by gender at enclosed workplaces: Male: 50.8%, Female: 44.9%, Total: 48%
Exposure by gender at public places: 
   1. Government building: Male: 53.2%, Female: 43.9%, Total: 49.4%
   2. Health facilities: Male: 23.2%, Female: 20.3%, Total: 21.6%
   3. Restaurants: Male: 78.3%, Female: 73%, Total: 75.8%
   4. Public Transport: Male: 35.7%, Female: 31.5%, Total: 33.6%","Report not provided","Public Area Exposure to Tobacco Smoke: in 2011 NATSC subjects reported seeing (during the 30 days before survey response) indoor smoking occurring most commonly in restaurants and food stores (88.1%) followed by public transportation vehicles (56.7%). government offices (48.8%). offices where they work (44.3%). and health care facilities (17.1%).","WHO Western Pacific Region"
