"55","European Union","Council Directive 2011/64/EU on the structure and rates of excise duty applied to manufactured tobacco (codification) was adopted on 21 June 2011. 
According to this Directive, EU Member States have to apply to cigarettes a specific excise duty per unit of the product and a proportional excise duty calculated on the basis of the weighted average retail selling price. Furthermore, Member States may choose between either an ad valorem duty, or a specific duty or a mixture of both on manufactured tobacco products other than cigarettes. 
This Directive
-	defines the various categories of manufactured tobacco (cigarettes, fine cut tobacco intended for the rolling of cigarettes, cigars and cigarillos, other smoking tobacco); 
-	lays down the general principles governing taxation of manufactured tobacco; 
-	provides for an overall minimum excise duty of 60% of the weighted average retail selling price of cigarettes; 
-	provides for a minimum amount of excise duty of 90 Euro per 1000 cigarettes irrespective of the weighted average retail selling price;
-	determines the minimum rates for fine-cut smoking tobacco intended for the rolling of cigarettes (see 2.8.2); 
-	determines the minimum rates for cigars and cigarillos (see 2.8.2);
-	determines the minimum rates for other smoking tobacco (see 2.8.2).
Please find details on the applicable legislation at:
http://eurlex.europa.eu/LexUriServ/LexUriServ.do?uri=OJ:L:2011:176:0024:0036:EN:PDF","Council Directive 2011/64/EU on the structure and rates of excise duty applied to manufactured tobacco (codification) was adopted on 21 June 2011. 

According to this Directive, EU Member States have to apply to cigarettes a specific excise duty per unit of the product and a proportional excise duty calculated on the basis of the weighted average retail selling price. Furthermore, Member States may choose between either an ad valorem duty, or a specific duty or a mixture of both on manufactured tobacco products other than cigarettes. 

This Directive
-	defines the various categories of manufactured tobacco (cigarettes, fine cut tobacco intended for the rolling of cigarettes, cigars and cigarillos, other smoking tobacco); 
-	lays down the general principles governing taxation of manufactured tobacco; 
-	provides for an overall minimum excise duty of 60% of the weighted average retail selling price of cigarettes; 
-	provides for a minimum amount of excise duty of 90 Euro per 1000 cigarettes irrespective of the weighted average retail selling price;
-	determines the minimum rates for fine-cut smoking tobacco intended for the rolling of cigarettes (see 2.8.2); 
-	determines the minimum rates for cigars and cigarillos (see 2.8.2);
-	determines the minimum rates for other smoking tobacco (see 2.8.2).

Please find details on the applicable legislation at:
http://eurlex.europa.eu/LexUriServ/LexUriServ.do?uri=OJ:L:2011:176:0024:0036:EN:PDF","Council Directive 2011/64/EU on the structure and rates of excise duty applied to manufactured tobacco (codification) was adopted on 21 June 2011. 
According to this Directive EU Member States have to apply to cigarettes a specific excise duty per unit of the product and a proportional excise duty calculated on the basis of the weighted average retail selling price. Furthermore Member States may choose between either an ad valorem duty or a specific duty or a mixture of both on manufactured tobacco products other than cigarettes. 
This Directive
defines the various categories of manufactured tobacco (cigarettes fine cut tobacco intended for the rolling of cigarettes cigars and cigarillos other smoking tobacco); 
lays down the general principles governing taxation of manufactured tobacco; 
provides for an overall minimum excise duty of 60% of the weighted average retail selling price of cigarettes; 
provides for a minimum amount of excise duty of 90 Euro per 1000 cigarettes irrespective of the weighted average retail selling price;
determines the minimum rates for fine-cut smoking tobacco intended for the rolling of cigarettes (see 2.8.2); 
determines the minimum rates for cigars and cigarillos (see 2.8.2);
determines the minimum rates for other smoking tobaccos (see 2.8.2).
Please find details on the applicable legislation at:
http://eur-lex.europa.eu/LexUriServ/LexUriServ.do?uri=OJ:L:2011:176:0024:0036:EN:PDF","WHO European Region"
"56","Fiji","Report not provided","Report not provided","The trends has been the same since the tax implemented is 10% for 2 years","WHO Western Pacific Region"
"57","Finland","The tax rates were increased by on average 24% in 2016 and 2017. The increases came into force every 6 months, that is, tax rates were increased four times in 2016 and 2017. The tax rates in question B83 reflect the tax rates in force from 1.7.2017 to 31.12.2017. 

The tax rates will be further increased in 2018 and 2019 by altogether four times, totalling on average 21 %. The new tax rates for 2018 and 2019 are already implemented in the relevant tax law.","Tax rates on tobacco have been increased 2014 by on average 10% and in 2015 by on average 9 %. The tax rates will further be increased in 2016 and 2017 by altogether four times, totalling on average 24 %. The new tax rates for 2016 and 2016 are already implemented in the relevant tax law.","Tobacco taxes were increased from the beginning of year 2014. Tobacco fine cut smoking tobacco cigars and cigarillos and other smoking tobacco were all raised approximately 10 %.","WHO European Region"
"58","France","Avec un objectif de prix du paquet de 20 cigarettes à 10 euros en novembre 2020, le Gouvernement est pleinement mobilisé dès la fin 2017 pour  parvenir à ce que moins d’1 personne sur 5 entre 18 et 75 ans fume d’ici 2024, et que les jeunes de 18 ans soient moins de 5% à fumer en 2032 pour ainsi constituer la première « génération sans tabac ». 
Adopté dans le cadre de la Loi de financement de la sécurité sociale 2018, des augmentations de la fiscalité de tous les produits du tabac sont prévues jusqu’en 2020. Les références déclarées à la Direction général de douanes en février 2018, montrent que le prix du paquet de 20 cigarettes augmente, en moyenne, de presque 1 euro (94 centimes). Les prix homologués des paquets de 20 cigarettes s’établissent entre 7,50 euros et 9,10 euros. Le prix moyen du paquet de 20 cigarettes des références homologuées est d’environ 7,90 € (contre 7 € depuis novembre 2017). Concernant les conditionnements standards de tabac à rouler, les prix homologués des blagues de 30 grammes sont en hausse de 2 euros en moyenne et s’établissent entre 9,50 euros et 11,10 euros. Le prix moyen des références homologuées de 30 grammes est d’environ 10,50 € (contre 8,60 € depuis novembre 2017).","Hausse de la fiscalité en 2014 (tous produits) et 2015 (cigares uniquement)","2.8.1 : La fiscalité du tabac se compose de la TVA et du droit de consommation pour toutes les cigarettes. La remise brute allouée au débitant de tabac est de 8.74% du prix de vente au détail. Le droit de consommation est de 64.7% qui se décompose en une part proportionnelle au prix de vente au détail de 49.7 % et une part spécifique en euros pour 1000 cigarettes de 45.75 €. La TVA est de 20% (01/01/2014) mais calculée en dedans soit 16.6667 % du prix de vente au détail. Pour un paquet de 20 cigarettes à 7€ la charge fiscale pure est donc de près de 80% du prix de vente au détail. 
En 2013 des hausses de la fiscalité des droits de consommation du tabac ont été effectuées en janvier puis en juillet (accompagnées de hausse de prix de 20 centimes par paquet en juillet également). La Loi de Financement de la Sécurité Sociale pour 2013 a porté une simplification et une clarification de la fiscalité applicable aux tabacs (article 575 et 575 A du code général des impôts). Pour les cigarettes il existe un droit minimum pour le droit de consommation (minimum de perception) au-dessous duquel le droit daccise total devient constant.","WHO European Region"
"59","Gabon","La loi de finances 2018 introduit, par la modification de larticle 250 du Code général des impôts, des droits daccise sur le tabac comprenant un taux ad valorem de 25% et une taxe spécifique de 300 Fcfa par paquet produit ou importé.","Voir Ministère de léconomie","De 2011 à 2014 les tendances de l’imposition des produits du tabac sont constantes avec un taux de 30%.","WHO African Region"
"60","Gambia","Government has been increasing excise tax on tobacco products from 2013 to 2016.","Government has been increasing excise tax on tobacco products from 2013 to 2016.","The Gambia has several types of taxes for tobacco products. For cigarettes this includes import duty (20% Cost Insurance and Freight (CIF)) import sales tax (15% CIF plus duty) excise tax (165 dalasi per kilo) environment tax customs processing fees and 0.50% ECOWAS levy. For other tobacco products the excise tax is exempted; environment tax is increased to 75 dalasi per kg with the rest remaining the same as cigarettes resulting in lower taxation level of the other tobacco products. Over the recent years there is modest increase of tobacco taxation but the retail price has remained stable. Given the inflation rate is about 4.5% there is actually a real decrease to tobacco products which makes them more affordable and accessible. Increased tobacco taxation is one of the most effective demand side reduction measures particularly for the poor and the youth. The Gambia is in the process of introducing 15% ad valorem rate (VAT) tobacco tax next year but the excise taxation should also be considered. The Gambia Ministry of Finance and the Gambia Revenue Authority recognizes that price and tax measures are an effective and important means of reducing tobacco consumption and supports progressively higher taxation on tobacco products. The Ministry of Finance agreed in principle to implement such tax measures once they are proposed by the Gambia Revenue Authority.","WHO African Region"
"61","Georgia","Answer not provided","During past two years excise on tobacco products is increasing step by step. namely:
- from January 2015 excise tax on filtered cigarettes (20 sticks) increased by 0.15 GEL, on no-filtered cigarettes (20 sticks) by 0,05 GEL.
From July 2015 so called combined excise system was introduced (on filtered and non-filtered cigarettes) ad valorem component of combined excise system was 5% of the retail price. 
from January 1, 2016 specific excise increased:
- on filtered cigarettes (20 sticks) by 0.2 GEL
-on non-filtered cigarettes (20 sticks) by 0.05 GEL
- on cigars (1 stick) and cigarillos (20 sticks) - by 0.4 GEL
- on tobacco for pipe, chewing and smelling tobacco (1 kg) by 5 GEL
-on filtered and non-filtered cigarettes ad valorem  component increased from 5% to 10% of retail price. 
according to the article 199 of the Tax Code of Georgia, from July 1, 2016 tobacco products will not be free from import duty anymore.","Excise tax on filtered cigarettes was 0.6 GEL until September 2013. According to the decision of Ministyr of Finace excise tax on filtered cigarettes was increased by 0.15 GEL and became 0.75 GEL. Excise tax on non-filtered cigarettes was 0.15 GEL before September 2013 and it was icnreased by 0.5 GEL. There is still huge difference between excise rates of filtered and non-filtered cigarettes which is not in accordance to WHO FCTC guidelines on article 6.","WHO European Region"
"62","Germany","Grandual increase of tobacco duties on annual basis on 1st January 2012, 1st January 2013, 1st January 2014 and 1st January 2015","Grandual increase of tobacco duties on annual basis on 1st January 2012, 1st January 2013, 1st January 2014 and 1st January 2015","Increase of tobacco taxes 1st January 2012 1st January 2013 and1st January 2014","WHO European Region"
"63","Ghana","There was an increase of Ad valorem taxation from 150% in 2014 to 175% in 2016","Increase of Ad valorem taxation from 150% in 2014 to 175% in 2016","Currently the ad valorem rate applied is 150%.
Tobacco taxation income has increased very significantly over the last decade. In the last two years it has increased from 29 million (2010) to 52 million Ghana Cedis in 2012","WHO African Region"
"64","Greece","Report not provided","During the past two years the taxation for tobacco products in Greece remained stable.  It is expected to increase very soon with the new taxation law in Greece as a result of the negotiations between Greece and the IMF.","Question 2.8.1: The excise tax percentage on the Weighted Average Price (WAP) of cigarettes is 65.68% and the VAT percentage on this price is 18.7%. According to EU Directives the WAP serves as a reference price and not the MPPC of cigarettes.
Trend: During the past two years and especially in 2012 the level of taxes for tobacco products increased significantly.","WHO European Region"
"65","Grenada","Answer not provided","Answer not provided","Answer not provided","WHO Region of the Americas"
"66","Guatemala","No hay cambios recientes.
El valor reportado como base equivale a, no menos del 75% del precio sugerido al consumidor.
En cuanto a cigarros, puritos y picadura, el tabaco ""nacional"" incluye al producido en Centroamérica.","No hay cambios recientes","Se han reducido. como consecuencia de la interposición de un recurso legal por parte de la Industria","WHO Region of the Americas"
"67","Guinea","Report not provided","Limposition actuelle est juste la TVA qui est de 18 %","Report not provided","WHO African Region"
"68","Guinea-Bissau","Données disponibles seulement à partir de lannée 2017. Avant que les taxes ne soient exacerbées, il est maintenant prévisible de les réduire progressivement; en particulier LIQ_PCS.","Answer not provided","Report not provided","WHO African Region"
"69","Guyana","There is an increase in price of approximately USD 30 cents annually","Report not provided","Report not provided","WHO Region of the Americas"
"70","Honduras","El índice de Precios al Consumidor (IPC) a diciembre de 2013, de cuatro punto noventa y dos por ciento (4.92%).  La disposición forma parte de la Ley de Fortalecimiento de los Ingresos, Equidad Social y Racionalización del Gasto Público. Según los Artículos 24 y 25 de esa norma, el impuesto sobre el cigarrillo se debe calcular sobre cada millar o fracción de millar vendidos o importados y debía ser ajustado anualmente a partir de 2013. Se fijará con base en la tasa del IPC del año anterior, publicada por el Banco Central de Honduras (BCH), pero en ningún caso podrá exceder del 6%.","El índice de Precios al Consumidor (IPC) a diciembre de 2013, de cuatro punto noventa y dos por ciento (4.92%).  La disposición forma parte de la Ley de Fortalecimiento de los Ingresos, Equidad Social y Racionalización del Gasto Público. Según los Artículos 24 y 25 de esa norma, el impuesto sobre el cigarrillo se debe calcular sobre cada millar o fracción de millar vendidos o importados y debía ser ajustado anualmente a partir de 2013. Se fijará con base en la tasa del IPC del año anterior, publicada por el Banco Central de Honduras (BCH), pero en ningún caso podrá exceder del 6%.","Answer not provided","WHO Region of the Americas"
"71","Hungary","Report not provided","Minimum excise duties issued at cigars, cigarillos, 
Ad valorem taxation eliminated from cut tobacco taxation. 
The specific and minimum excise duties were increased in 2015 (+25,6% and +12,36%) above inflation. Meanwhile the ad valorem tax percentage of cigarette reduced with 6 points from 31 to 25","In relation to 2.8.1: 
2012. 
cigarette: 86.69%
fine cut smoking tobacco: 87.66%
other tobacco products: 76.10%
cigar. cigarillo: 49.76%
2013. 
cigarette: 80.98% 
fine cut smoking tobacco: 77.40%
other tobacco products: 61.48%
cigar. cigarillo: 49.76%
Trends: 
As it concerns cigarettes:
- the tax in proportion of price has been increased with 2.7% (to 9.5%)
- the quantitative tax has been increased with 33.7% 
- while the tax minimum with 43.8%.
As it concerns other tobacco products:
the tax minimum has been increased with 71.2% in the past two years. namely in 2011-2012.
The level of taxes has been modified/ has been increased (highly above the level of inflation rate) five times in 2011-2012. 
The level of VAT has been increased once. from 25% to 27%.","WHO European Region"
"72","Iceland","The VAT was lowered from 25.5% to 24%. The Specific tax was raised by 1.5%.
This leads to lower taxation on tobacco products for the last two years if inflation is taking into part. 
Retailers however have taken bigger share of the price and have done so for some years. Also recently for the fact that the icelandic krona have got stronger and therefore possibly better price for the tobacco products to buy from abroad.","The VAT was lowered from 25.5% to 24%. The Specific tax was raised by 1.5%.
This leads to lower taxation on tobacco products for the last two years if inflation is taking into part. 
Retailers however have taken bigger share of the price and have done so for some years. Also recently for the fact that the icelandic krona have got stronger and therefore possibly better price for the tobacco products to buy from abroad.","It has been increasingly raising over the past two years. The excise duty on cigarettes as been increased by about 24%. The excise duty on old traditional nose tobacco has been more than doubled.","WHO European Region"
"73","India","Report not provided","Excise tax has been increased progressively every year in the budget. However there is no increase in the rate of tax on Bidis since the last reporting instrument. In addition states have also imposed the VAT on tobacco products, which is being raised  each year.","Excise tax has been increased progressively every year in the budget for the year 2013-14 the excise on cigarettes was increased by 18%. in addition states have also imposed the VAT on tobacco products. which is being raised each year.","WHO South-East Asia Region"
"74","Iran (Islamic Republic of)","Specific Excise Tax is levied in the Budget law and is effective from 21 of March 2018 and is only for manufactured cigarettes
Other types of taxes has been ratified in the 6th National Five year development plan which has been implemented since 21th of March 2017","There has been a declining trend in taxation for tobacco products.","Answer not provided","WHO Eastern Mediterranean Region"
"75","Iraq","A great development on the tobacco taxes will be appear in next few days.","There is a great development on the subject of taxes on tobacco products and this may be appear in next few days.","The customs duties on tobacco products entering Iraq were raised at a rate ranging between 15-50% depending on the type of product as of 1/2/2014.","WHO Eastern Mediterranean Region"
"76","Ireland","In October 2016 there was a 50 cent price increase on 20 cigarettes and a pro rata increase on other tobacco products. In October 2017 there was a 50 cent increase on 20 cigarettes and a pro rata increase on other tobacco products and a further increase of 25 cent on a 30g pack of RYO tobacco.","On 1 May 2012 a minimum excise duty was introduced for cigarettes. The minimum excise duty on cigarettes is currently €307.61per thousand in respect of cigarettes sold by retail, if this amount is greater than the rate of tax calculated in accordance with the specific and ad valorem excise duty rate outlined in B83 above

Trends in taxation/changes in rates of excise duty on tobacco products are outlined here:
With regard to cigarettes for the period 16 Oct 2013 -14 Oct 2014
(a)	Specific excise duty: €241.83 per thousand together with Ad valorem excise duty of 8.72 per cent of the price at which the cigarettes are sold by retail. 
Or (b) €275.62 per thousand in respect of cigarettes sold by retail where the rate of tax would be less than that rate had the rate been calculated in accordance with paragraph (a).
And for the period 15 Oct 2014 -13 Oct 2015
(a) Specific excise duty: €255.69 per thousand together with Ad valorem excise duty of 8.85 per cent of the price at which the cigarettes are sold by retail. 
Or (b) €289.98 per thousand in respect of cigarettes sold by retail where the rate of tax would be less than that rate had the rate been calculated in accordance with paragraph (a).
And for the period 14 Oct 2015  –present  
(a) Specific excise duty: €271.96 per thousand together with Ad valorem excise duty of  9.20 per cent of the price at which the cigarettes are sold by retail. 
Or (b) €307.61per thousand in respect of cigarettes sold by retail where the rate of tax would be less than that rate had the rate been calculated in accordance with paragraph (a).
	16 Oct 13-14 Oct 2014	15 Oct 14 -13 Oct 2015	14 Oct 15 -present
Cigars	€271.337 per kilogram	€295.350 per kilogram	€315.359 per kilogram
Fine cut Tobacco for rolling cigarettes	€228.868 per kilogram	€273.177 per kilogram	€291.683 per kilogram
Other smoking tobacco	€188.243 per kilogram	€204.902 per kilogram	€218.783 per kilogram","Changes to the rates of excise duty on tobacco products since the last report are outlined in Annex 1.","WHO European Region"
"77","Israel","Report not provided","Report not provided","Report not provided","WHO European Region"
"78","Italy","The base rate for calculating excise duty on cigarettes has been increased from 58.7 to 59.1%, the rate of the specific component of the excise has been increased from 10% to 10,5%, the minimum tax charge (Excise duty + VAT) has been increased from  € 170,54 to € 175,54 per 1000 cigarettes; 
The minimum excise duty on fine cut tobacco for cigarettes was increased from 115 € / kg to 120 € per kg .
The minimum excise duty on cigarillos was increased from 25 € / kg to 30 € per kg .","From 1st August 2014: the base rate for calculating excise duty on cigarettes has been increased from 58.5% to 58.6% and the minimum excise duty has been fixed at € 126.80 per 1000 cigarettes; the minimum excise duty on fine cut tobacco for cigarettes was set at 108 € / kg.
From 1st January 2015 the base rate for calculating excise duty on cigarettes has been increased from 58.6 to 58.7%, the rate of the specific component of the excise has been increased from 7.5% to 10%, the ad valorem component has been calculated referring to WAP (not to MPPC) and has been introduced a minimum tax charge (Excise duty + VAT) of € 170 per 1000 cigarettes; 
The minimum excise duty on fine cut tobacco for cigarettes was increased from 108 € / kg to 115 € per kg .
For Cigars and cigarillos a minimum excise duty of 25 € per conventional Kg.","For all tobacco products in October 2013 VAT increased from 21% to 22% of retail selling price (vat excluded) or 18.03% of retail selling prices (vat included).
From January 2012 ad valorem excise of fine cut tobacco for cigarettes (RYO) increased from 56% to 58.5% of TIRSP","WHO European Region"
"79","Jamaica","Jamaica continues to increase tobacco taxes to bring us in compliance with FCTC Article 6. The increased tax on tobacco products is from $14 to $17 per stick over the past two years in which we have had two tax increases on cigarettes (tax periods 2015/2016 and 2016/2017)","There was an increase in taxes in 2015 by 14.5%  ($10.50 to $12.00 per stick)","There has been no increase in taxes for the past two years since January 2010.","WHO Region of the Americas"
"80","Japan","National and local tobacco tax will be raised by 3 yen per cigarette. The tax rate will be raised in three phases, by 1 yen per cigarette in each phase, starting from October 1, 2018. A new tax category will be created for heat-not-burn tobacco products and the taxation system will be revised in consideration of the product characteristics.

(fef.) https://www.mof.go.jp/tax_policy/tax_reform/index.html","Answer not provided","Answer not provided","WHO Western Pacific Region"
"81","Jordan","تم رفع   ضريبة المبيعات الخاصة مقطوعة من 482 فلس  عام 2017 الى 570  فلس عام 2018","تم رفع   ضريبة المبيعات الخاصة مقطوعة من 300 فلس  الى  420 فلس عام 2014 
والضريبة الخاصة  على المعسل من 300 فلس الى  450 فلس لكل 100 غم 
والتمباك من  300 فلس  لتصبح  1000 فلس لكل 100 غم","Answer not provided","WHO Eastern Mediterranean Region"
"82","Kazakhstan","","Report not provided","In accordance with the Tax Code from 1 January 2011 a uniform rate of excise on tobacco and January 1 2011 through 2013 was their annual 25% increase.","WHO European Region"
"83","Kenya","Answer not provided","Answer not provided","The overall proportion of taxes in the Retail Selling Price is 52%. This has not been adjusted for inflation since June 2011. The tax structure is hybrid both Ad Valorem and Specific rates are applied","WHO African Region"
"84","Kiribati","Brief description of Taxation Policy: Applies a combination of exercise taxes and also Value added tax","Brief description of Taxation Policy: Applies a combination of exercise taxes and also Value added tax","Brief description of Taxation Policy: applies a combination of excise taxes and also value added tax","WHO Western Pacific Region"
