"125","Philippines","Answer not provided","Available data from the Sworn Statements submitted consisted only of the manufacturer’s cost/price and did not include the mark-ups, which are used to determine the retail price. Likewise, there was no survey conducted on the retail price of tobacco products. The survey could have been used as a basis to determine the trend in the prices of tobacco products.

Note regarding the source of data: The Sworn Statements/ Statement of Removals and Excise Tax Collection report from the Bureau of Internal Revenue Official Register of Books which was used to answer the questions under B8 (Taxation of Tobacco Products) and B9 (price of Tobacco Products) cannot be attached to this report.","Answer not provided","WHO Western Pacific Region"
"126","Poland","The last increase of excise duty on cigarettes and smoking tobacco took place at the beginning of 2014. Since then, the excise duty  rates for above products remain unchanged. At the same time, the retail selling prices of tobacco products are successively increasing in comparison to the last report.","The last increase of excise duty on cigarettes and smoking tobacco took place  at the beginning of 2014. Since then, the excise duty  rates for above products remain unchanged. At the same time,  the retail selling prices of tobacco products are successively increasing in comparison to the last report. These price increases are expected to lead to reduction of tobacco consumption.","Annual increases of the excise duties on tobacco products as well as the structure of excise duty based on the increases of the specific duty with the ad valorem excise duty left at a fixed level lead to increases of retail prices in all price segments of tobacco products. The price increases are higher than the scale of inflation.","WHO European Region"
"127","Portugal","Prices registered a very small incresase.","Prices registered a very small incresase.","There has been a moderate rise in prices in all tobacco products reflecting the trend in taxation levels (e.g. Cigarettes Most Popular Prices Class increased 0 10 € in each of the past two years)","WHO European Region"
"128","Qatar","Answer not provided","Answer not provided","Answer not provided","WHO Eastern Mediterranean Region"
"129","Republic of Korea","British America Tobacco(BAT) launched 4 variants of Rothmans with the price of KRW 4,100 (Jan. 2016)

Japan Tobacco International(JTI) increased the price of Mevius Option Ice from KRW 4,000 to 4,500 (May 2016)

BAT launched the limited edition of Dunhil Remix with the price of KRW 4,000(Jul. 2017)","Japan Tobacco International in Korea increased the price of Mevius and Camel, to KRW 4,500 and 4,000 respectively, in January 2015.
Korean Tobacco & Ginseng increased the price of Esse to KRW 4,500 in January 2015.
Philip Morris increased the price of Marlboro and other products to KRW 4,700 in January 2015; then readjusted the price to KRW 4,500 in May 2015.
Japan Tobacco International in Korea launched Camel Evolution in August 2015 with the price of KRW 4,000.
British American Tobacco in Korea launched new Rothmans in October 2015 with the price of KRW 4,100.","Philip Morris in Korea released new Marlboro in March 2013 and sells it for KRW 2 700. 
British American Tobacco in Korea released new Dunhill in October 2013 and sells it for KRW 2 700. (?USD 2.5","WHO Western Pacific Region"
"130","Republic of Moldova","Prices of tobacco products in the past two years increase by 80%, introduced from 2017 minimum price for cigarette pack","Prices of tobacco products in the past two years increase by 10,5% which is almost the same level as inflation rate","Answer not provided","WHO European Region"
"131","Romania","Report not provided","Report not provided","The trend in the prices of tobacco products is in increasing since 2004 as the excise level increased according to the Tobacco Products Taxation Directive","WHO European Region"
"132","Russian Federation","Report not provided","Все наиболее популярные марки транснациональных табачных компаний производятся в России и потому не могут называться импортными","Rising cigarette prices due to higher excise taxes","WHO European Region"
"133","Rwanda","Report not provided","Report not provided","Report not provided","WHO African Region"
"134","Saint Kitts and Nevis","Report not provided","Answer not provided","Report not provided","WHO Region of the Americas"
"135","Saint Lucia","Prices have increased.","Answer not provided","Report not provided","WHO Region of the Americas"
"136","Saint Vincent and the Grenadines","Report not provided","Report not provided","Report not provided","WHO Region of the Americas"
"137","Samoa","Trend in the prices of tobacco products driven by various factors according to submissions from the tobacco company (BATS) such as: increase in implementation costs (new health warning and labelling requirements as stipulated in Tobacco Control Regulations); increase in technical and administrative fees as a result of new system upgrades; increase in market recharges; capital expenditure (renovation, maintenance).","Trend in the prices of tobacco products driven by various factors according to submissions from the tobacco company (BATS) such as: increase in implementation costs (new health warning and labelling requirements as stipulated in Tobacco Control Regulations); increase in technical and administrative fees as a result of new system upgrades; increase in market recharges; capital expenditure (renovation, maintenance).","Report not provided","WHO Western Pacific Region"
"138","San Marino","No tobacco manufactoring in San Marino.

On trends, please see reponses to B84.","No tobacco manufactoring in San Marino.

On trends, please see reponses to B84.","Answer not provided","WHO European Region"
"139","Sao Tome and Principe","sin datos","Report not provided","With higher taxes and surcharges on imports in 2009 has been an increase in the consumer price","WHO African Region"
"140","Saudi Arabia","Answer not provided","من الملاحظ ان اسعار جميع المنتجات المستورده للمملكة ترتفع ال ان اسعار بيعالسجائر شبه ثابته على مدى الاعوام السابقه","Increase in the price of a pack of cigarettes from seven to nine SR.","WHO Eastern Mediterranean Region"
"141","Senegal","Prix stable","Answer not provided","En 2011 il y a eu une baisse du prix de la marque Marlboro consécutive à un déclassement volontaire du produit par le fabricant qui l’a fait basculer dans la catégorie économique en manipulant le prix ex usine. Le gouvernement a réagi en ramenant par une note administrative la marque Marlboro dans la catégorie prémium","WHO African Region"
"142","Serbia","The trend in prices of tobacco products is growing in the weighted average retail selling price category:
2016/2015 = 9.77%
2017/2016 = 8.58%","The price of tobacco products, expressed in the weighted average retail selling price category, increased in 2014 compared to 2013 for 14%, while there was a slight decrease in 2015 compared to 2014 of - 0.39%:
2014/2013 = 14%
2015/2014 = -0,39%","The price of tobacco products has been increasing in the weighted average retail selling price category in the following way:
2011 vs. 2010 - 15%
2012 vs. 2011 - 19%
2013 vs. 2012 - 30%","WHO European Region"
"143","Seychelles","The price of  locally produced cigartees for a packet of 10 sticks has increased from SR 52.50 to SR.58.50 in 2017 due to increase in 10% excise tax

The price of  imported cigartees for a packet of 20 sticks has increased from SR 126 to SR.149 in 2017 due to increase in excise tax","The price of  locally produced cigartees for a packet of 10 sticks has increased from SR 37.50 to SR.52.50 in 2015 due to increase in excise tax

The price of  imported cigartees for a packet of 20 sticks has increased from SR 93 to SR.126 in 2015 due to increase in excise tax","The price of imported cigarettes have increased from SR 80.00 to SR.93.00 in 2013 while the price of the locally produced remain the same in Seychelles","WHO African Region"
"144","Sierra Leone","Cost change is not significant","cost did not change","Answer not provided","WHO African Region"
"145","Singapore","On 19 Feb 2018, tax on cigarettes and other manufactured tobacco was raised by 10% to $427/KG","On 21 Feb 2014, tax on cigarettes and other manufactured tobacco was raised by 10% to $388/KG","On 21 Feb 2014 tax on cigarettes and other manufactured tobacco was raised by 10% to $388/KG.","WHO Western Pacific Region"
"146","Slovakia","Report not provided","The price of the most popular price category of cigarettes has been increasing in the past three years.","The price of the most popular price category of cigarettes has been increasing in the past three years.","WHO European Region"
"147","Slovenia","Increase of retail prices for all smoking tobacco product.","Increase of retail prices for all smoking tobacco product.","Increase of retail prices for all smoking tobacco product.","WHO European Region"
"148","Solomon Islands","This importer is the only one importer licensee in country and he is running duty free sales from his duty free shop at the only International airport in the country. It is interesting to note from his records that he is not even importing cigarettes as the cigarettes sold from his shop are all locally produced from the Solomon Islands Tobacco Company (SITCO) the British American Tobacco branch here in country. His set up is new and he has been here for the past two years now.
The shop is selling a sleeve of 10 packets and he is selling packets of 25 cigarette initially until September when SITCO introduced their packet of 20s which is what most people are buying from the duty free shop now.","Report not provided","There was a price hike done by the tobacco manufacturers in isolation of a tax increase in late 2012. The government increased the excise tax in May of 2013 by 20%.","WHO Western Pacific Region"
"149","South Africa","Between 2014 and 2017 the nominal price of Peter Stuyvesant increased by 21%, of Rothmans by 30% and of Dunhill by 22%. Between 2014 and 2017 the real price of Peter Stuyvesant increased by 3%, of Rothmans by 11% and of Dunhill by 4%","Premium brands have become somewhat more expensive, but not by significantly more than the inflation rate. There has been a proliferation of brands at the bottom end, and prices there seem stable. In the past year BAT dropped price of Rothmans from about R29 to R21.90 to fight the bottom feeders. In late 2013 BAT also dropped the price of Peter Stuyvesant to fight the bottom feeders. There is a bit of a price war taking place. The price of cigarettes, on aggregate, has not increased much at all, and has probably decreased in real terms.","Premium brands have become somewhat more expensive but not by significantly more than the inflation rate. There has been a proliferation of brands at the bottom end and prices there seem stable. In the past year BAT dropped price of Rothmans from about R29 to R21.90 to fight the bottom feeders. In late 2013 BAT also dropped the price of Peter Stuyvesant to fight the bottom feeders. There is a bit of a price war taking place. The price of cigarettes on aggregate has not increased much at all and has probably decreased in real terms.","WHO African Region"
"150","Spain","Durante los años 2016 y 2017 se ha mantenido la tendencia de aumento de precios en los productos del tabaco. Así, el precio medio en el segmento de cigarrillos ha subido un 14,72% en la categoría premium y un 34,24% en la categoría media en 2017.","Desde 2013 a 2015 ha habido una subida de precios del 5,58 %, que respecto a cigarrillos supone un 3,26 %","La tendencia ha sido un traslado de los incrementos impositivo a los precios. con lo cual se ha generado un crecimiento de los mismos. encareciéndose especialmente la picadura","WHO European Region"
"151","Sri Lanka","The price has increased.
The imported brands now produced in Sri Lanka.","Answer not provided","Report not provided","WHO South-East Asia Region"
"152","Sudan","الأسعار غير عالية رغما عن التضخم الاقتصادي فهي في متناول اليد المدخنين ومستخدمي التبغ","Report not provided","Report not provided","WHO Eastern Mediterranean Region"
"153","Suriname","Prices of tobacco products increased in the past years since the taxes increased and
the exchange rate of the US $ also increased from $1 = SRD 5.28 to $1 =SRD7.80
Compared to 2016 these packages are approximately 2 times more expensive now.","Prices of tobacco products increased in the past years since the taxes increased and
the exchange rate of the US $ also increased  from  US $ = 3.35 SR $ in 2012 to as high as  US $ = 5.28 SR $ 
(05 april 2016)
Compared to 2012 these packages are 3x more expensive now, higher in price.
Compared to 2014 these packages are 2x more expensive now, higher in price","Prices of tobacco products increased in the past 2 years since the currency increased from 3.35 to 3.50","WHO Region of the Americas"
"154","Swaziland","Report not provided","Answer not provided","Report not provided","WHO African Region"
"155","Sweden","Answer not provided","Answer not provided","Year 2012 a package of Marlboro. 19 pack. cost SEK 48 and 2013 SEK 55.","WHO European Region"
"156","Syrian Arab Republic","هذه الأسعار تميل إلى الازدياد بالمقارنة مع العامين السابقين","هذه الاحصائيات لعام 2010  وكان سعر الدولار = 55 ليرة سورية ولقد طرأ تغير على سعر صرف الدولار اصبح  اليوم  10 شباط لعام 2016 = 398 ليرة سورية","Report not provided","WHO Eastern Mediterranean Region"
"157","Tajikistan","Report not provided","Report not provided","Answer not provided","WHO European Region"
"158","Thailand","There was an increase in prices in year 2016 from tax increasing.
And from tax system reformation in 2017, some brands have lower prices.","Answer not provided","1.Cigarette taxation gradually increased from 79% (2006) to 85% (2011) and finally to 87% of ex-factory price (August 22. 2012 to present) 
2. Shredded tobacco taxation increased from 0.01% (2011) to 10 % of price (August 22. 2012 to present)","WHO South-East Asia Region"
"159","The former Yugoslav Republic of Macedonia","Answer not provided","Answer not provided","Trend in prices have increased for 5 9%","WHO European Region"
"160","Timor-Leste","The trend of the price of tobacco is still same.","Report not provided","Report not provided","WHO South-East Asia Region"
"161","Togo","Inchangés","Inchangés","Prix stable.","WHO African Region"
"162","Tonga","Report not provided","Please note that this is the most recent data available from the responsible organization, Ministry of Labour and Commerce (MLC), which derived from a survey conducted to retail shops in the Nukualofa (capital) premises only in 2016. According to the Director of the MLC for Consumers Right, they do not keep a track of the prices of tobacco as this product is not on the regulated list under the Competent Authority.

However, the trend according to the data available, there is an increase in the prices of domestic products for Halo and Palataisi by 0.50cents over the past 2 years where as Tongan tobacco remains the same. For imported products, there is an increase in the price of Winfield from $9.50 in 2014 to $11 in  2016 whereas prices for Pall Mall decreased from $9.50 in 2014 to $9.00 in 2016. Long Beach remains the same.","The weighted average prices of tobacco have all increased by an average of 12%. This is the result of the increase of excise tax rate from $200 to $238 for local products and from $210 to $250 for imported products.","WHO Western Pacific Region"
"163","Trinidad and Tobago","Major brands have held stable prices; the cheaper brands have fallen slightly due to competition in the low-brand market.","Major brands have held stable prices; the cheaper brands have fallen slightly due to competition in the low-brand market.","Answer not provided","WHO Region of the Americas"
"164","Tunisia","En moyenne. augmentation annelle de 0.300 DT / paquet  depuis 2013","En moyenne. augmentation annelle de 0.300 DT / paquet  depuis 2013","En moyenne. augmentation de 0.300 DT / paquet 2 fois par an depuis 2013.","WHO Eastern Mediterranean Region"
"165","Turkey","There is an increasing trend in the price of tobacco products","There is an increasing trend in the price of tobacco products","There is an increasing trend in the price of tobacco products","WHO European Region"
"166","Turkmenistan","В течение 2017 года цены на сигареты возросли на 25%. Сигареты продаются только через государственную торговую сеть.","Цены на табачные изделия повышены на 5-10%","Sharp rise in tobacco prices in early 2012 - about 3 times or 200%","WHO European Region"
"167","Tuvalu","Report not provided","Report not provided","Answer not provided","WHO Western Pacific Region"
"168","Uganda","Report not provided","The prices of these products have not changed in the last 2 years.","The prices of these products have not changed in the last 2 years","WHO African Region"
"169","Ukraine","In 2016 prices of tobacco products increased by 23%, while inflation was 12%.
In 2017 prices of tobacco products increased by 36%, while inflation was 14%","In 2014 prices of tobacco products increased by 26%, while inflation was 25%.
In 2015 prices of tobacco products increased by 18%, while inflation was 43%.: in October-Decemebr 2015 tobacco producers greatly decreased prices trying to stop decline of tobacco market in Ukarine","In 2012-2013 real (inflation-adjusted) price of tobacco products increased by 24%","WHO European Region"
"170","United Arab Emirates","ارتفع سعر بيع التجزئه للسجائر بنسبة 100% بعد فرض الضريبة الإنتقائية علي منتجات التبغ","ارتفع سعر بيع التجزئه للسجائر بقيمة درهمين فقط","The retail price of cigarettes has increased by two dirhams only.","WHO Eastern Mediterranean Region"
"171","United Kingdom of Great Britain and Northern Ireland","Report not provided","As a result of the government announcements that the duty will increase by 2% above inflation this has caused retail prices to increase.","Report not provided","WHO European Region"
"172","United Republic of Tanzania","Prices are static.","Prices are static.","Increases","WHO African Region"
"173","Uruguay","Answer not provided","Answer not provided","Answer not provided","WHO Region of the Americas"
"174","Uzbekistan","Report not provided","По оценкам, в 2014 году по сравнению с 2013 годом номинальная розничная цена сигарет с фильтром были повышены на 6% (в среднем с 1,37$ США до 1,46$ США), которое предположительно можно связать с повышением ставки акцизного налога на 30%. В 2015 году номинальная розничная цена сигарет с фильтром сохранилась почти на том же уровне в среднем 1,45$ США, т.к. ставка акцизного налога была незначительно увеличена на 10%.

На 2014 год ставка акцизного налога на сигареты без фильтра не была увеличена. Несмотря н это, в 2014 году номинальная розничная цена сигарет без фильтра была увеличена на 30% (в 2013 г. - 0,32$ США, в 2014 г. - 0,42$ США). 
В 2015 году было отмечено повышение номинальной розничной цены сигарет без фильтра в среднем до 0,55$ США, что объясняется повышением ставки акцизных налогов на 28%. 
Таким образом, что повышение цены табачных изделий не всегда связано с повышением ставки акцизных налогов.","Analysis of the data shows that retail prices are increasing in parallel the manufacturer''s price . While in Uzbekistan. the share of excise duty in the average retail price in the years 2006-2013 ranged from 11.9-16.5 % which is probably due to the fluctuations in the relevant excise real load . Win excise in the average wholesale price of cigarettes with filter in 2010-2011 was 16.5-18.6 % and in 2012-2013 . decreased by 16.0-14.1 %. respectively. Thus. the rise in prices in 2012-2013 contributed to not only increase excise rates as pricing tobacco industry .","WHO European Region"
"175","Vanuatu","Report not provided","No change since 2014.","Price of tobacco brands varies among shops in Vanuatu. Most of tobacco products were imported. There is not a local tobacco industry","WHO Western Pacific Region"
"176","Venezuela","Report not provided","Report not provided","Aumentó","WHO Region of the Americas"
"177","Viet Nam","There is a trend of unchanged nominal price","There is a trend of unchanged nominal price","The price of cigarettes increase on par with inflation rate (about 7% per year)","WHO Western Pacific Region"
"178","Yemen","يوجد ارتفاع بسيط في جميع منتجات التبغ المحلي والمستورد نتيجة لموجة الغلاء العامة  بسبب ارتفاع سعر العملة والاضطراب السياسي والاقتصادي","يوجد ارتفاع بسيط في جميع منتجات التبغ المحلي والمستورد نتيجة لموجة الغلاء العامة  بسبب ارتفاع سعر العملة والاضطراب السياسي والاقتصادي","There is an increase in cigarette prices due to higher overall prices as well as the addition of a specific tax of 6 YER per pack containing 20 cigarettes in 2013.","WHO Eastern Mediterranean Region"
"179","Zambia","Answer not provided","Answer not provided","Report not provided","WHO African Region"
"180","Zimbabwe","The prices of tobacco products vary depending on where one is purchasing from. the average prices is as indicated above. The prices have not changed for the past two years","The prices of tobacco products vary depending on where one is purchasing from. the average prices is as indicated above. The prices have not changed for the past two years","Report not provided","WHO African Region"
"181","Party","2018","2016","2014","Region"
