"","Party","2018","2016","2014","Region"
"1","Afghanistan","increased for 10 % to 20 % in tariff","increased for 10 % to 20 %","Answer not provided","WHO Eastern Mediterranean Region"
"2","Albania","Report not provided","Report not provided","Steady","WHO European Region"
"3","Algeria","Le prix des produits tabagiques  a augmenté de 30  %  en fonction des produits , depuis l’année 2015","Le prix des produits tabagiques  a augmenté de 20 à 25  %  en fonction des produits , depuis l’année 2015","Le prix du tabac a légèrement augmenté depuis les deux dernières années.","WHO African Region"
"4","Angola","Hubo un marcado aumento de precio de cigarrilos importados como por efecto del aumento de la tasa de impuesto","There have been significant increases in cigarette prices over the last four years as a reflection of inflation.","Report not provided","WHO African Region"
"5","Antigua and Barbuda","Report not provided","In the past two years, Benson and Hedges increased by $0.40 ECD (forty (40) cents) while Kool and Newport increased by $0.75 ECD (seventy-five (75) cents).","In the past two years. Benson and Hedges increased by $0.40 ECD (forty (40) cents) while Kool and Newport increased by $0.75 ECD (seventy-five (75) cents","WHO Region of the Americas"
"6","Armenia","Report not provided","Report not provided","The prices of tobacco products was increased but not significantly which is connected with the changes in taxation system and with the inflation and in consequence to that the changes in the prices did not impact the consumption","WHO European Region"
"7","Australia","Between 2014 and 2016, a pack of Winfield 25s rose by $4.85, or 22.66%; a pack of Peter Jackson 30s rose by $6.50, or 27.43%; and a pack of Horizon 50s rose by $10 or 29.67%, although it should be noted that the source of prices has changed between 2014 and 2016 (previously the Retail Tobacconist magazine, now the Patterson Road website).

There is no domestically produced tobacco products in Australia.","Between 2014 and 2016, a pack of Winfield 25s rose by $4.85, or 22.66%; a pack of Peter Jackson 30s rose by $6.50, or 27.43%; and a pack of Horizon 50s rose by $10 or 29.67%, although it should be noted that the source of prices has changed between 2014 and 2016 (previously the Retail Tobacconist magazine, now the Patterson Road website).

There is no domestically produced tobacco products in Australia.","UPDATE - Between 2012 and 2014 a 25 pack of Winfield cigarettes has increased in price by AUD $(17.15 -16.55 = .60) or 3.5 per cent. a 40 pack of Longbeach cigarettes has increased by AUD ($ 24.80 – 23.95 = .85) or 3.4 per cent. and a 30 pack of Peter Jackson cigarettes has increased by AUD $(18.9 18.70 ) or 1.06p er cent. Please see Annex 1 for further information .","WHO Western Pacific Region"
"8","Austria","The retail prices of tobacco products have been constantly increasing, basically by 15-20 Eurocents/20 cigarettes annually.","Basically the prices of tobacco products have been constantly increasing. For some individual brands of cigarettes, however, industry lowered retail prices for limited periods of time in order to gain market shares.","prices are constantly increasing","WHO European Region"
"9","Azerbaijan","The prices of imported tobacco products have declined approximately 10-20-40% since last reporting.","The prices of tobacco products have increased approximately twice since last reporting. However, this trend is not due to any specific tobacco control policy. From February to December 2015 the US/AZN exchange rate has changed from 0.78 to 1.55, so the Azerbaijani manat lost half of its value. This was the main reason the prices of tobacco products increased in manats.","The prices of tobacco products increased by up to 30%. The trend has not linked to any specific tobacco control policy.","WHO European Region"
"10","Bahamas","Report not provided","Answer not provided","Answer not provided","WHO Region of the Americas"
"11","Bahrain (Kingdom of)","STARTING February 2016, A SPECIAL TAX WAS ADDED ON TOBACCO PRODUCTS TO MAKE THE TOTAL OF IMPORTED DUTIES 200% INSTEAD OF 100%. HOWEVER, GCC AGREED TO APPLY 100% SELECTIVE TAX ON TOBACCO PRODUCT UP TO 100% ON RETAIL PRICE. ACCORDINGLY THE SPECIAL FEES WAS CANCELLED. STARTING 30TH DECEMBER 2017, THE TAXATION ON TOBACCO PRODUCTS ARE 100% IMPORTED DUTIES + 100% ON RETAL PRICE. THE CHANGE IN TAXATION REVENUES WILL BE AVAIALBE FOR THE NEXT REPORT","There has been no change in taxes since the last report, in 2014. All changes will be effective as from September 2016.","I n Bahrain taxes on tobacco and tobacco products are levied based on ad valorem only however currently negotiation is underway between Gulf Council Countries to add other types of taxes such as sales tax.","WHO Eastern Mediterranean Region"
"12","Bangladesh","Answer not provided","Answer not provided","Answer not provided","WHO South-East Asia Region"
"13","Barbados","not available","not available","Answer not provided","WHO Region of the Americas"
"14","Belarus","Периодический рост цен на табачные изделия преимущественно 3 ценовой категории (наиболее дорогие)","Рост МРЦ в рамках компенсации роста ставок акцизного налога на табачные изделия - комментарий Белорусского государственного концерна пищевой промышленности ""Белгоспищепром""","Regular increase in prices of tobacco.","WHO European Region"
"15","Belgium","Answer not provided","Answer not provided","Stable. Pas d’augmentation significative","WHO European Region"
"16","Belize","Report not provided","Answer not provided","Prices for the retail of cigarettes have remained the same","WHO Region of the Americas"
"17","Benin","La tendance est à la baisse pour les marques de cigarettes conditionnant 20 tiges de cigarettes par paquets pour permettre aux clients dacheter autant leurs produits que ceux conditionnant 10 tiges de cigarettes et qui sont moins chères","La tendance est à la baisse pour les marques de cigarettes conditionnant 20 tiges de cigarettes par paquets pour permettre aux clients dacheter autant leurs produits que ceux conditionnant 10 tiges de cigarettes et qui sont moins chères","Tendance à la baisse car dautres marques Gold Seal venant de lAsie (Vietnam) sont apparues sur le marché avec des emballages de 10 tiges et sont vendues entre 80 et 100 FCFA","WHO African Region"
"18","Bhutan","Answer not provided","Answer not provided","Answer not provided","WHO South-East Asia Region"
"19","Bolivia (Plurinational State of)","Desde la gestion 2012, los precios se han incrementado paulatinamente.","Report not provided","Report not provided","WHO Region of the Americas"
"20","Bosnia and Herzegovina","The annual increase in prices of tobacco products is approximately equal to the increase of excise duty on tobacco products. Minimum annual increase in excise duty on cigarettes is prescribed by Article 21a of the Law on Excise in BiH (“Official Gazette of BiH”, No. 49/09, 49/14, 60/14 and 91/17).

Trend of increasing the price of tobacco products in BiH is in line with EU requirements.","increasing trends of tobacco products prices in line with EU requirements","Two times increasing trends of price for 35%","WHO European Region"
"21","Botswana","The price of legal products is affected by illicit trade because products of illicit trade are very cheap the owners evade TAX.","Report not provided","Report not provided","WHO African Region"
"22","Brazil","The Decree 8.656 of January 29th 2016 determined a new increase in taxes on cigarettes from May 1st and further increase after December 1st 2016. It also raises the minimum price of the cigarette packages to R$ 5.00 after May 1st 2016.

A chart with the historical retail prices is shown below.","xxx","DERBY - 2013 (US$ 2.28) 2012 (US$ 1.85) 2011 (US$ 1.50","WHO Region of the Americas"
"23","Brunei Darussalam","There are no cigarettes being sold by retailers in Brunei as there is no more licensed tobacco importer since May 2014.","Report not provided","No change","WHO Western Pacific Region"
"24","Bulgaria","In 2016, inexpensive cigarettes have risen by 20-30 cents, while the most expensive - by almost 2 lev. From 1 January 2017, the specific excise duty on cigarettes increased from BGN 70 to BGN 101 per 1000 pieces. Modified was also the ratio between the specific and proportional excise duty on cigarettes since the beginning of the year the proportional excise duty being 27% of the sale price since the beginning of the year 2017, and from 1 January 2018 - 28% of the sale price. This leads to an increase of 20 cents for all brands of cigarettes in 2017 and another 20 cents. The aim is to reach the minimum levels of taxation in the European Union by 2018.","Answer not provided","Since 2009 the prices of tobacco products are the same.","WHO European Region"
"25","Burkina Faso","Answer not provided","Answer not provided","Les prix sont stationnaires depuis plusieurs années ; ce qui explique la forte prévalence du tabagisme surtout dans les milieux défavorisés (jeunes pauvres élèves…","WHO African Region"
"26","Burundi","Report not provided","La tendance des  prix du tabac au Burundi au cours des deux dernières années est constante.","Report not provided","WHO African Region"
"27","Cambodia","The prices of tobacco products have been increased.","Report not provided","ARA $0.35. Khmer tobacco and hand rolled $0.06. Marlboro $1.10","WHO Western Pacific Region"
"28","Cameroon","les produits du tabac manufacturés sont accècibles, les tendances des prix sont à la baisse du fait de la circulation des produits de contrefaçons alimentés par lindustrie de tabac elle même","Answer not provided","Les prix sont stables mais la tendance de l’industrie du tabac est de mettre sur le marché des paquets de 10 bâtons (unités)","WHO African Region"
"29","Canada","Overall tobacco prices have been increasing in Canada over the reporting period based on the fact that cigarettes make up 93% of the market (by value) and cigarette prices have been increasing. In the past two years cigarette prices have increased by 7%, smokeless tobacco prices have increased by 3% while cigar prices have remained steady. Tobacco prices have risen due to increases in several provincial excise tax rates as well as a strategy of increased pricing incorporated by the tobacco industry.

Note: With respect to the currency used to complete the “Rate or amount” section of question B83 and the “Retail price” section of question B91B, figures should be considered in light of CAD $1 being US $0.81 on January 5th, 2018.","In Canada, the average retail price of cigarettes has been rising due to a federal duty rate increase and price and tax increases in most provinces and territories.","In Canada. the average retail price of cigarettes has been either stable or rising slightly. depending on the province or territory of sale within Canada.","WHO Region of the Americas"
"30","Cape Verde","Le prix est resté le même au cours des dernières années","Le prix est resté le même au cours des dernières années","Report not provided","WHO African Region"
"31","Central African Republic","Report not provided","Report not provided","Report not provided","WHO African Region"
"32","Chad","la tendance des prix  depuis 2015 est   à la hausse à cause des images chauquantes appostées sur les paquets de cigarette  qui découragent ou font peurs aux consommateurs donc certaines personnes  font  recourt aux produits  frauduleux comme malboro vendus sans ces avertissemensts sanitaires donc ces produits frauduleux ont tendance à augmenter le prix malgrè leur interdiction dimportation sur le teritoire tchadien.","Report not provided","Report not provided","WHO African Region"
"33","Chile","Answer not provided","Answer not provided","Debido al Terremoto ocurrido el 27 de Febrero del 2010 se produjo un aumento en el impuesto. Sumado a esto. el 31 de marzo del 2013. el Estado de Chile a través de su Ministerio de Hacienda. aplica una nueva fórmula para el cálculo de impuesto. Esto trae como consecuencia un alza del impuesto a la cajetilla de cigarrillos. siendo el más relevante el impuesto ad valorem. 
En este aspecto Chile tiene un impuesto acorde a las directrices del Convenio Marco de Control de Tabaco.","WHO Region of the Americas"
"34","China","2015年至2017年，中国境内卷烟加权平均零售价格从12.57元/盒（20支）增加到13.37元/盒（约2.12美元/盒），年均增长3.2%。","2013年至2015年，中国境内卷烟加权平均零售价格从11.00元/盒（20支）增加到12.57元/盒，年均增长6.9%。","The price of tobacco products increased year by year.","WHO Western Pacific Region"
"35","Colombia","•	Los precios promedio de cigarrillos son calculados con base en la información reportada al DANE por los grandes almacenes e hipermercados minoristas (GAHM) a nivel nacional, que cumplen con los parámetros de inclusión (200 a más personas ocupadas, y/o ventas anuales superiores o iguales a 3 millones de pesos de 2017).
•	Los precios de venta al público, son reportados para las cajetillas de 20 unidades de cigarrillos.
•	La información corresponde al precio promedio de la marca en el país y no al punto de venta más utilizado de la capital del país, esto debido a que la base de datos no identifica precios por ciudad, únicamente a nivel nacional.
•	Los precios de los productos de tabaco presentan crecimiento en los dos últimos años, principalmente por: a) mayor participación de productos y materias primas importadas; b) continua alza del dólar; c) Reforma tributaria que incrementó los impuestos para este tipo de productos.

Nota: La información de precios de las marcas más vendidas de cigarrillos se genera a partir de la Certificación de precios de cigarrillos para 2018, generada por el Departamento Administrativo Nacional de Estadística DANE, con información de enero a noviembre de 2017.","La información de precios que tiene el país proviene de la certificación anual del Departamento Administrativo Nacional de Estadística (DANE) (Precio de Venta al Público-PVP en grandes superficies) que sirve de insumo para la certificación de base gravable de la sobretasa al consumo de cigarrillos. Para el efecto, tomamos la certificación DANE expedida en diciembre de 2015, que tiene vigencia para el año 2016.

Los datos de precios no corresponden a las marcas más vendidas sino a la lista de precios de referencia para el año 2016, elaborada de acuerdo a la metodología prevista por la Comisión de Precios de Referencia de Cigarrillos creada por el Decreto 2427 de 2007.

Las certificaciones anuales de la base gravable de la sobretasa al consumo de cigarrillos  contienen el PVP certificado por el DANE para cada marca.","Answer not provided","WHO Region of the Americas"
"36","Comoros","Les prix des produits  de tabac  montent  une fois les taxes douanieres augmentés.","Report not provided","Report not provided","WHO African Region"
"37","Congo","Report not provided","See document under B88.

Le prix varie dun point à un autre. Pour le grand magasin cest 600 à 650 et les supermarchés pour les produits fabriqués localement puis 1000 pour la cigarette Marlboro qui est importé et des prix variant pour les cigares.","Le prix des produits du tabac a augmenté depuis la mise en application de la loi des finances 2013 : Donc il y a amélioration depuis la présentation du dernier rapport","WHO African Region"
"38","Cook Islands","Prices have increased from 2012 – 2014 to 30% and from 2015 to years thereafter is at 5%","Prices have increased from 2012 – 2014 to 30% and from 2015 to years thereafter is at 5%","July 2012 33% increase for three years","WHO Western Pacific Region"
"39","Costa Rica","Los precios de los productos de tabaco suben conforme se va actualizando el impuesto específico al tabaco cada año. 

El tipo de cambio actual al 8 de febrero del 2018 es de $1 = ₡575, según el Banco Central de Costa Rica.","Los precios de los productos de tabaco suben conforme se va actualizando el impuesto específico al Tabaco cada año  Tipo de cambio  $ 1 = ₡ 542 colones  BCCR","Los precios de los productos de tabaco se han incrementado con respecto al anterior informe. consecuencia de que la moneda nacional mantiene fluctuaciones con respecto al dólar. además con la aprobación de la Ley Nª 9028. capítulo VII. Impuestos a los productos de tabaco en sus artículos Nº 28 al 31 se establecen impuestos a los productos de tabaco.","WHO Region of the Americas"
"40","Côte d'Ivoire","Les prix restent sensiblement les mêmes","les prix sont restés stables","La tendance est à la baisse comparativement aux deux dernières années. Les marques de cigarettes vendues à 25 fcfa l’unité (Excellence) et à 1000 fcfa le paquet (Dunhill) en 2012 sont aujourd’hui respectivement à 100 fcfa les 5 unités et à 700 fca le paquet avec à l’appui une publicité.","WHO African Region"
"41","Croatia","The lowest price for cigarettes in 2016. was 18,00 HRK (2,40 €)  and the highest price was 38,00 HRK (5,07 €). The lowest price for cigarettes in 2017. was 19,00 HRK (2,53 €)  and the highest was 38,00 HRK (5,07 €). Prices for cigarettes are higher in 2017. compared to 2016. and 2015. during the fact that the amount of excise duties was increased in 2016. and 2017. 
Customs Administration collects data about most popular price category for cigarettes (2016.- 21,00 HRK= 2,80 €; 2017. – 27,00 HRK=3,60 €)","The lowest price for cigarettes in 2014. was 16,00 HRK (2,09 €)  and the highest price was 40,00 HRK (5,24 €). The lowest price for cigarettes in 2015. was 18,00 HRK (2,36 €)  and the highest was 40,00 HRK (5,24 €). Prices for cigarettes are higher in 2015. compared to 2014. during the fact that the amount of excise duties was increased in 2014. and 2015. 
Customs Administration collects data about most popular price category for cigarettes (2014.- 25,00 HRK= 3,27 €; 2015. – 21,00 HRK=2,75 €)","The lowest price for cigarettes in 2012. was 13 00 HRK (1 70 €) and the highest was 35 00 HRK (4 59 €). The lowest price for cigarettes in 2013. was 15 00 HRK (1 97 €) and the highest was 79 00 HRK (10 37 €). Prices for cigarettes are higher in 2013. compared to 2012. during the fact that the amount of excise duties was increased in 2012. and 2013. Customs Administration collects data about most popular price category for cigarettes (2013.- 19 00 HRK= 2 49 €; 2012. – 20 00 HRK)","WHO European Region"
"42","Cyprus","Report not provided","Approximately 20 cent increase since last report.","Prices of tobacco products are raising specially RYO tobacco.","WHO European Region"
"43","Czech Republic","Consumer prices of tobacco products were constantly growing, in line with gradual increase in excise duty rates on tobacco products during the period 2016 – 2018","Since the last report in 2014, weighted average price of cigarettes (WAP) has increased by 4,8 %. The most purchased price category (MPPC) increased by 9,7 %.","The price of tobacco products has been increasing in the last two decades. Regarding the situation in the past two years - price of a pack of 20 cigarettes (L&M blue) increased from 75 CZK to 80 CZK (since 2012).","WHO European Region"
"44","Democratic People's Republic of Korea","The tobacco products are sold at a price fixed by the government (article 23 of Tobacco control law), which is being raised gradually over the years.","Report not provided","The price of tobacco products is rising in the country and tobacco control organizations are making various interventions to raise the price.","WHO South-East Asia Region"
"45","Democratic Republic of the Congo","Prix sur le marché, Mars 2018 
le Franc Congolais, Taux: 1620Fc = 1$ Us
Pas beaucoup de variation malgré la dépréciation du franc congolais face au $Us","Les prix sont restés inchangés depuis plus de 5 ans malgré le changement à la hausse de taux déchange ce qui fait penser que la contrebande est considérable.","Report not provided","WHO African Region"
"46","Denmark","Answer not provided","Answer not provided","The prices on tobacco products have increased due to the increasing excise duties since 2012 (see 2.8.4).","WHO European Region"
"47","Djibouti","augmentation des prix au détail","augmentation des prix au détail","Les prix ont augmenté sensiblement sans modification de la marge fiscal.","WHO Eastern Mediterranean Region"
"48","Dominica","Report not provided","An increase in the price of cigarettes was observed.","Report not provided","WHO Region of the Americas"
"49","Ecuador","Los precios de los tabacos han incrementado en promedio un 25.44% en los dos últimos años, tomando como base los precios reportados a febrero de 2018, lo cual se justifica por el incremento anual de la tarifa específica del impuesto.","Los precios de los tabacos han incrementado en promedio un 30% en los dos últimos años, tomando como base los precios del año 2014, lo cual se justifica por el incremento semestral de la tarifa específica del impuesto.","En estos dos últimos años se ha producido un aumento progresivo de los precios de los productos de tabaco en razón de los impuestos generados por las políticas tributarias implementadas por el gobierno (impuesto específico. noviembre 2011)","WHO Region of the Americas"
"50","Egypt","Answer not provided","Answer not provided","Answer not provided","WHO Eastern Mediterranean Region"
"51","El Salvador","Hay una variación máxima del 10% entre el promedio de los precios sugeridos al consumidor y el promedio de precios de venta en los establecimientos. Esto puede deberse a incrementos no autorizados en los precios o bien al desfase entre los registros administrativos de 2017 y los precios corrientes en los establecimientos donde se vende cigarrillo ya que el monitoreo se realizó en marzo 2018. Este es el primer monitoreo de precios y servirá como línea base de los precios de venta en los establecimientos. 
Con base en los registros administrativos de las declaraciones de precios sugeridos al público, se ha visto un incremento progresivo de los precios en los últimos años 7 años.","Os productos Delta y Marlboro han mostrado una disminución en su precio, respecto al año 2013. En cuanto al producto Diplomat, no se tiene referencia del valor del año anterior.","Answer not provided","WHO Region of the Americas"
"52","Equatorial Guinea","Answer not provided","Answer not provided","Report not provided","WHO African Region"
"53","Estonia","Answer not provided","There is no data on the price of tobacco products gathered separately by brands, only the average retail price.","Answer not provided","WHO European Region"
"54","Ethiopia","Report not provided","Report not provided","Report not provided","WHO African Region"
"55","European Union","The EU covers 28 countries. Therefore, it is not possible to indicate the country-specific domestic and imported most sold brands. The overall average of the WAP (weighted average retail selling price) in all 28 Member States amounts to 235.03 Euro per 1000 cigarettes on 1 January 2018, with the lowest WAP in one Member State of 127.57 Euro and the highest WAP in one Member State of  503.5 Euro. (If translated into a price range, this would correspond to a price range per pack of 20 cigarettes from 2.55 to 10.07 EUR).
In 26 Member States the average price of cigarettes released for consumption during 2015 and 2017 increased. It should be noted that the WAP for 2018 for instance, is based on the average prices of all cigarettes released for consumption during the previous year.","The EU covers 28 countries. Therefore, it is not possible to indicate the country-specific domestic and imported most sold brands. The overall average of the WAP (weighted average retail selling price) in all 28 Member States amounts to 209,78 Euro per 1000 cigarettes on 1 January 2016, with the lowest WAP in one Member State of 121.18 Euro and the highest WAP in one Member State of  504.95 Euro. (If translated into a price range, this would correspond to a price range per pack of 20 cigarettes from 2.42 to 10.01 EUR).

In 25 Member States the average price of cigarettes released for consumption during 2013 and 2014 increased. It should be noted that the WAP for 2015 for instance, is based on the average prices of all cigarettes released for consumption during the previous year. More information including an overview of the development of the WAP in the Member states can be found at p.15 and in annex I of COM (2015)621 (http://eur-lex.europa.eu/legal-content/EN/TXT/?uri=COM:2015:0621:FIN).","Trend: increase of retail selling prices due to the mandatory increase of minimum taxes for the majority of EU Member States before 31 December 2013 and a further obligation to increase excise duties for a certain number of (new) EU Member States before 31 December 2017.","WHO European Region"
"56","Fiji","Report not provided","Report not provided","The trend has slightly increased","WHO Western Pacific Region"
"57","Finland","The average price of cigarettes has increased by 18 % from 2015 to 2017.","The average price of cigarettes has increased by 13 % and of fine-cut tobacco by 19 % from 2013 to 2015.","In year 2012 compared to year 2011 the average price of cigarettes increased approximately 9 % and price of fine cut increased 20 %. Between 2012 and 2013 price for cigarettes increased approximately 2.5% and there was no change in the price for fine-cut.","WHO European Region"
