"58","France","Il a été constaté depuis 2017 une augmentation des prix : 

- En novembre 2017  le prix moyen du paquet de 20 cigarettes progresse de 35 centimes. Près de 4 paquets de 20 cigarettes sur cinq sont arrivés à un prix égal ou supérieur à 7 euros, et  s’établissent entre 6,70 euros et 8,10 euros. Les prix homologués des blagues de 30 grammes de tabac à rouler s’établissent entre 7,20 euros et 10,70 euros.

-en mars 2018, une nouvelle augmentation est constatée : Le prix du paquet de 20 cigarettes augmente, en moyenne, de presque 1 euro (94 centimes). Les prix homologués des paquets de 20 cigarettes s’établissent entre 7,50 euros et 9,10 euros. Le prix moyen du paquet de 20 cigarettes des références homologuées est d’environ 7,90 € (contre 7 € depuis novembre 2017). Les conditionnements standards de tabac à rouler de 30 grammes sont en hausse de 2 euros en moyenne et s’établissent entre 9,50 euros et 11,10 euros. Le prix moyen des références homologuées de 30 grammes est d’environ 10,50 € (contre 8,60 € depuis novembre 2017).","Hausse des prix en janvier 2014. Depuis, stabilité des prix.","2012 : augmentation de 5% du prix annuel moyen du paquet de cigarettes le plus vendu 
2013 : augmentation de 6% du prix annuel moyen du paquet de cigarettes le plus vendu","WHO European Region"
"59","Gabon","Answer not provided","Légèrement à la hausse","Les prix nont pas changés depuis deux ans ou si peu.","WHO African Region"
"60","Gambia","Answer not provided","Answer not provided","Answer not provided","WHO African Region"
"61","Georgia","Answer not provided","due to the step by step increase of tobacco taxes the prices on tobacco products has slightly increased but it is still not proportionate to the inflation rate and therefore it is unlikely to have an effect on the consumption rates.","There is slight increased trend in price of cigarettes especially after increase of tax on cigarettes in September 2013 but considering inflation it is not significant","WHO European Region"
"62","Germany","The weighted average price increased from 2016 to 2017 by 
3.0% (cigarettes) 
16.6% (pipe tobacco) 
3.37% (cigars/cigarillos). 
The weighted average price for fine cut  decreased from 2016 to 2017 by 0.3 %.","The weighted average price increased from 2014 to 2015 by 
3.8% (cigarettes) 
5.3% (fine cut) 
16.7% (cigars/cigarillos). 
The weighted average price for pipe tobacco decreased from 2014 to 2015 by 1.7 %.","The weighted average price increased from 2012 to 2013 by
2.9% (cigarettes)
6.1% (fine cut)
1.9% (cigars/cigarillos).
The weighted average price for pipe tobacco decreased from 2012 to 2013 by 0.6%.","WHO European Region"
"63","Ghana","Retail Price of most common cigarette products have virtually remained the same despite increase in Ad valorem taxation from 150% i 2014 to 175% in 2016","Retail Price of most common cigarette products have virtually remained the same despite increase in Ad valorem taxation from 150% to 175%","The retail price of tobacco products have remained almost the same over the last two years.","WHO African Region"
"64","Greece","Report not provided","Answer not provided","The prices of tobacco products have gradually been increased.","WHO European Region"
"65","Grenada","Answer not provided","Answer not provided","Answer not provided","WHO Region of the Americas"
"66","Guatemala","Ligero incremento  en precios.","Ligero incremento","La tendencia refleja un incremento leve","WHO Region of the Americas"
"67","Guinea","Report not provided","Voir B67","Report not provided","WHO African Region"
"68","Guinea-Bissau","No changes observed.","No changes observed.","Report not provided","WHO African Region"
"69","Guyana","There have been minimal changes in the last two years.","Report not provided","Report not provided","WHO Region of the Americas"
"70","Honduras","Se puede apreciar un incremento anual de los productos derivados de tabaco, ya que se basa en el Indice de Precios al Consumidor que establece el Banco Central de Honduras. Es decir en la medida que sube la inflación se aprecia un incremento en dichos productos. En el año de 2010 el paquete 20 unidades de cigarrillos de tabaco de la marca Belmont tenia un costo de L.36.00 y en el año 2014 presenta un costo de L.46.00 en el transcurso de cuatro años presenta un incremento de L.10.00.","Se puede apreciar un incremento anual de los productos derivados de tabaco, ya que se basa en el Indice de Precios al Consumidor que establece el Banco Central de Honduras. Es decir en la medida que sube la inflación se aprecia un incremento en dichos productos. En el año de 2010 el paquete 20 unidades de cigarrillos de tabaco de la marca Belmont tenia un costo de L.36.00 y en el año 2014 presenta un costo de L.46.00 en el transcurso de cuatro años presenta un incremento de L.10.00.","Answer not provided","WHO Region of the Americas"
"71","Hungary","Report not provided","Price trends were affected by a tax raising integrated in a tax-composition reform in 2015.","As it concerns cigarettes: the tax in proportion of price has been increased with 2.7% (to 9.5%).the quantitative tax has been increased with 33.7% . while the tax minimum with 43.8%.
As it concerns other tobacco products:
The tax minimum has been increased with 71.2% in the past two years. namely in 2011-2012.
The level of taxes has been modified/ has been increased (highly above the level of inflation rate) five times in 2011-2012. 
The level of VAT has been increased once. from 25% to 27%.","WHO European Region"
"72","Iceland","Answer not provided","Answer not provided","The excise duty on cigarettes as been increased by about 24%. The retail price has gone up by slighly lower percentage or 22%","WHO European Region"
"73","India","Report not provided","The price of tobacco product (smoking & smokeless tobacco) has increased due to increase in Central Excise as well as the State Tax /  Value Added Tax(VAT) by States.","The price of tobacco product (smoking & smokeless tobacco) has increased due to increase in Central Excise as well as the State Tax /  Value Added Tax(VAT) by States.","WHO South-East Asia Region"
"74","Iran (Islamic Republic of)","Answer not provided","Answer not provided","Answer not provided","WHO Eastern Mediterranean Region"
"75","Iraq","Answer not provided","Answer not provided","There is a slight increase on the prices of cigarettes in the Iraqi market due to the imposition of tariffs.","WHO Eastern Mediterranean Region"
"76","Ireland","upward above the rate of inflation","upward above the rate of inflation","Upward trend","WHO European Region"
"77","Israel","Report not provided","Report not provided","Report not provided","WHO European Region"
"78","Italy","In the last two years average market prices of tobacco products increased of 1.6%","In the last two years average market prices of tobacco products increased of 2.1%","In the last two years average market prices of tobacco products increased of 0.6%","WHO European Region"
"79","Jamaica","The price of tobacco products has increased with the implementation of new tax measures. The retail prices of cigarettes have increased.The  Jamaican dollar has devalued over the past two years.","The price of tobacco products has increased with the implementation of new tax measures. The retail price of the most popular brand of cigarette Craven A has increased from JA$800 to JA$1000 The  Jamaican dollar has devalued over the past two years.","The price of tobacco products has increased as the Jamaican dollar has devalued over the past two years.","WHO Region of the Americas"
"80","Japan","Retail price of Marlboro Light Menthol Box, listed in B91B, rose to JPY 470 in October, 2017.","Answer not provided","Answer not provided","WHO Western Pacific Region"
"81","Jordan","تم رفع اسعار السجائر عام 2016, 2017,2018","تم تخفيض الاسعار من قبل شركات التبغ عام 2013 بنسبة 10%  ثم تم رفعه  عام 2014 الى القيمة السابقة وقامت الحكومة برفع الضريبة الخاصة على التبغ من 300 فلس420 فلس","Prices increased in 2013 due to an increase in the special tax.","WHO Eastern Mediterranean Region"
"82","Kazakhstan","Answer not provided","Report not provided","In accordance with the Government of the Republic of Kazakhstan dated March 6 2012 ? 294 minimum retail price for cigarettes with filter 20 (MRC) depending on the length of the year was up to 22.10.2013 in the amount of 90-100 m. According to the Government of the Republic of Kazakhstan from 11.10.2013 ? 1087 from 22.10.2013 till 31.12.2013 the MRC was in the amount of KZT 130 and from 01.01.2014 to 31.12.2014 the year is set at 150 m.","WHO European Region"
"83","Kenya","Answer not provided","Answer not provided","Prices have not changed in the last two years. Imported smoked products are insignificant. Smokeless tobacco products were not easily accessible in the market to access. Most are sold in confectionery shops out of the city centres","WHO African Region"
"84","Kiribati","Not available","Not available","Answer not provided","WHO Western Pacific Region"
"85","Kuwait","الأسعار الرسمية لم تتغير ولكن مؤخرا بسبب فرض الضريبة الانتقائية في دول الجوار ( مملكة البحرين والمملكة العرية السعودية فإنه تم رصد ارتفاع بالاسعار في مخالفة لقوانين وزارة التجارة وتم توقيع العقوبات كما لوحظ نقص في المعروض من منتجات التبغ لكثرة شراء السعوديين والبحرينيين من السوق الكويتية ولترقب فرض الضريبة الانتقائية قريبا قام بعض موزعي التبغ بحجب البضائع انتظارا لرفع اسعارها، مما جعل المعروض قليلا وبالتالي ارتفعت اسعاره، ووزارة التجارة ستتخذ الاجراءات القانونية تجاه ذلك","No channge yet but expected to increase soon once the new rsolution put int practice","Answer not provided","WHO Eastern Mediterranean Region"
"86","Kyrgyzstan","Report not provided","с июля 2014 года нет внутреннего производства, в связи с чем  указаны МРЦ на местные сигареты за 1-е полугодие 2014 года, а в 2015 году, так как эти же сигареты импортируются из России, поэтому указаны в разделе  импортные сигареты. Причем в скобке рядом розничной ценой указаны доля акцизного налога к стоимости","Answer not provided","WHO European Region"
"87","Lao People's Democratic Republic","The price is slightly increased","The price is slightly increased","Adeng is the most popular cigarettes in Laos its price trend has been increased from 4000LAK/Pack in 2009 5000LAK/Pack in 2010 6000LAK/Pack in 2011 and 7000LAK/Pack in 2013.","WHO Western Pacific Region"
"88","Latvia","With the increase of excise duty, the maximum retail selling price of cigarettes has a growing tendency.","With the increase of excise duty the maximum retail price of cigarettes has a growing tendency.","Excise tax was not changed in the period from 2011 to 2014. 
In 2012 VAT rate was changed from 18% to 21%. Accordingly to Central Statistical Bureau data consumer price for tobacco products has increased for 2% from January 2012 to January 2013 and for 2.1% from January 2013 to January 2014.","WHO European Region"
"89","Lebanon","Answer not provided","Answer not provided","The prices for tobacco products has in general increased by about 15-20%","WHO Eastern Mediterranean Region"
"90","Lesotho","Report not provided","Report not provided","Answer not provided","WHO African Region"
"91","Liberia","Answer not provided","Answer not provided","Report not provided","WHO African Region"
"92","Libya","الاسعار في تزايد نظرا لانخفاض قيمة العملة المحلية","الاسعار في تزايد نظرا لانخفاض قيمة العملة المحلية","Stable or increase slightly","WHO Eastern Mediterranean Region"
"93","Lithuania","There is increasing trend in price of tobacco products in last several years.","Answer not provided","Over past 2 years the prices of tobacco products have been increasing. The change of the costs categories oh the most popular cigarettes: the price of the most popular cigarettes (LTL/20 units) 2009 6.10 LTL 2010-7.60 LTL 2011 7.90 LTL 2013 8.90 LTL","WHO European Region"
"94","Luxembourg","Vers la hausse.","Answer not provided","Augmentation annuelle","WHO European Region"
"95","Madagascar","Answer not provided","une hausse légère des prix détaillants des produits du tabac dans les marchés","Prix des produits du tabac augmente chaque année","WHO African Region"
"96","Malaysia","No change in the price of tobacco products for the past two years",NA,"In the past 3 years prices of cigarettes have increased by approximately 14%: 
Premium brands from RM 10.50 in Jun 2013 to RM 12.00 in October 2013 
Value for money brands from RM 9.00 in Jun 2013 to RM 10.50 in October 2013 
Cheap brands remained at RM 7.00 
Note: 
The Malaysian Government introduced a floor price (Minimum Cigarette Price) in the 2009 amendment of Control of Tobacco Product Regulation.","WHO Western Pacific Region"
"97","Maldives","No Change. The last increase in tax to 38.88% and 33.33% respectively for Cigarettes and other tobacco products, caused an increase of the retail price of cigarettes from MVR 2.5 per stick to MVR 3.00 per stick at some outlets and for few months. As the wholesale price increased only by a negligible margin, retailers son reverted back to old pricing to compete with the retailers who maintained the old price.","No Change. The last increase in tax to 38.88% and 33.33% respectively for Cigarettes and other tobacco products, caused an increase of the retail price of cigarettes from MVR 2.5 per stick to MVR 3.00 per stick at some outlets and for few months. As the wholesale price increased only by a negligible margin, retailers son reverted back to old pricing to compete with the retailers who maintained the old price.","Tobacco seems to be sold at very high profit. Hence the prices do not change in relation to inflation or added taxes. There hasn''t been a significant change in the price of products for the last 2 years.","WHO South-East Asia Region"
"98","Mali","On constat une légère hausse des prix par rapport à 2012","On constat une léger hausse des prix par rapport à 2012","Les prix sont stationnaires.","WHO African Region"
"99","Malta","Retail Prices of cigarettes have increased in 2016 and also in 2017.","Retail Prices of cigarettes have increased in 2014 and also in 2015.","Retail Prices of cigarettes have increased during 2011 2012 and 2013. For example: Rothmans KS from €210 in 2011 to €220 in 2012 and €235 in 2013.","WHO European Region"
"100","Marshall Islands","Answer not provided","Answer not provided","RMI has minimal taxes on tobacco products and they have not been raised in line with cost-of-living increases; there are indications that this minimal level was even decreased for a period. Import excise is currently US$ 1 per pack of 20 cigarettes or 151% of import cost for cigars. For other tobacco products such as tinned leaf tobacco excise is US$ 2.75 per 34.2 gram unit. There has been no price increases for tobacco for some years. Retail prices for the major three brands range from US$ 2 to US$ 5 and Peter Jackson from US$ 1.75 to US$ 2.50. Copenhagen chewing tobacco sells for US$ 5 to US$ 7 per tin","WHO Western Pacific Region"
"101","Mauritania","Cest pour la première fois depuis 2000 que  les prix du tabac ont  vu un changement important malgré lintroduction de nouvelles taxes chaque année.

Nous ne savons pas encore, est ce que cette augmentation est suite à laugmentation de la taxe ou suite à une rupture du produit sur le marché car, il marrait quun bateau avec une quantité importante des cigarette  attend au port pour caster.

Les jours à venir vont montrer la vérité.","Depuis 2000 les prix du tabac nont pas vu un changement important malgré l introduction de nouvelles taxes chaque année","Il n’y a pas eu un grand changement sur les prix du tabac depuis plusieurs années malgré l’introduction de taxe supplémentaires de 10 % en 2010 puis de 30% en 2013.","WHO African Region"
"102","Mauritius","The prices of tobacco products have been constantly on the rise each and every year and same for the past two (2) years.","In 2014, the prices of tobacco products were increased by 5% while in year 2015, there was no increase in the prices of tobacco products.","An increase of 25% of excise duty on cigarettes in December 2011 National Budget followed by a further 15% increase in excise duty in December 2012.","WHO African Region"
"103","Mexico","Answer not provided","Answer not provided","La marca más popular entre los fumadores activos fue Marlboro (50.5%). seguida de Marlboro Blanco. Camel. Benson & Hedges. Montana y Delicados (10.9%. 8.7%. 7.2%. 6.1% y 4.1%. respectivamente). Marlboro fue más popular entre los adolescentes que entre los adultos. Por el contrario. las marcas Benson & Hedges y Delicados fueron relativamente populares sólo entre los adultos.","WHO Region of the Americas"
"104","Micronesia (Federated States of)","Prices of tobacco should increased by .005 from 2015 to 2017","Prices of tobacco should increased by .005 from 2015 to 2017","Starting in 2007 2009 and 2011 and increase of $.005 on all cigarettes imported to FSM. The retail price for Doral at some vendors increased the costs by .015.","WHO Western Pacific Region"
"105","Mongolia","Not significant changes.","Report not provided","All of the goods price has been increased in the past 2 years.","WHO Western Pacific Region"
"106","Montenegro","In period 2015-2017., the retail price  of cigarettes have raisen accordingly by increasing excise rates of cigarettes on average by about 25-35%.","The retail price of cigarettes in the past two years increased by 20% because of increase in excise rates on cigarettes by introducing excise calendar.","The retail price of cigarettes both domestic and imported in last two years have risen accordingly by increasing excise rates on cigarettes on average by about 20-30%.","WHO European Region"
"107","Myanmar","1 USD = 1330 MMK (March 2018)","1 USD = 1100 MMK (10 April 2016)","The prices of both smoking and smokeless tobacco products became slightly increased.","WHO South-East Asia Region"
"108","Namibia","Report not provided","Report not provided","Report not provided","WHO African Region"
"109","Nauru","Report not provided","Answer not provided","Report not provided","WHO Western Pacific Region"
"110","Nepal","Price is in an increasing trend.","Report not provided","Price is in an increasing trend.","WHO South-East Asia Region"
"111","Netherlands","Answer not provided","Prices increased","Prices have gone up in the last two years:
Excise tax on cigarettes
Date Retail price most popular price range per 1000/Percentage retail price/Excise rate per 1000
01-04-2012 € 251.74 7.57% € 138.23
01-04-2013 € 264.62 2.36% € 169.86
01-04-2014 € 291.91 0.95% € 173.97.
http://download.belastingdienst.nl/douane/docs/tarievenlijst_accijns_acc0552z67fol.pdf","WHO European Region"
"112","New Zealand","The price of tobacco products has increased significantly.","The price of tobacco products has increased significantly","The price of tobacco products has increased significantly in the past two years. The tobacco excise has increased by 21% over this period. Tax increases have generally been passed on to consumers though recently there has been some variation from brand to brand according to tobacco company pricing decisions. Companies have absorbed some of the tax increase for some brands.","WHO Western Pacific Region"
"113","Nicaragua","Los productos de tabaco presentan una tendencia de incremento de precios constante en los últimos dos años a una tasa del 16%","Los productos de tabaco presentan una tendencia de incremento de precios constante en los últimos dos años a una tasa del 16%","Report not provided","WHO Region of the Americas"
"114","Niger","Report not provided","Answer not provided","Report not provided","WHO African Region"
"115","Nigeria","Prices have remained essentially stable","Fairly stable","Rising with a flux influenced by smuggling","WHO African Region"
"116","Niue","Report not provided","Report not provided","According to retailers price increase tend to decrease sales and demand of that particular brand if another brand is cheaper smokers go for that brand.","WHO Western Pacific Region"
"117","Norway","From 2016 (last report) to 2018, the price of cigarettes, roll-your own and snus increased with 5–10%.","From 2014 (last report) to 2016, the price of cigarettes, roll-your own and snus increased with 3–12%.","From 2012 (last report) to 2014 the price of cigarettes roll-your own and snus increased with 9–12%.","WHO European Region"
"118","Oman","غير معروف","غير معروف","Prices rose so as the increase the selling price of tobacco companies have not benefited the government including the lack of a tax increase since 1999 and the prices are stable since 1999.","WHO Eastern Mediterranean Region"
"119","Pakistan","Prices decreased since last 1 year. The above quoted prices are Final consumer prices.","There is significant increase in the cigarette prices since last 2 years.","Answer not provided","WHO Eastern Mediterranean Region"
"120","Palau","Legislation  RPPLs 9-7 and 9-15  increased the taxation of cigarettes and all other tobacco products. Average price for the popular cigarette brands is now $6.95 per pack (of 20 units) and average of $23.50 per Redman 3 oz. packet.","Legislation  RPPLs 9-7 and 9-15  increased the taxation of cigarettes and all other tobacco products. Average price for the popular cigarette brands is now $6.95 per pack (of 20 units) and average of $23.50 per Redman 3 oz. packet.","The price of smokeless tobacco rose significantly in July 2013 when legislation changed the tax of these products to the same rate as cigarettes – all products taxed by weight. Prices increased in January 2014 on all tobacco products with the addition of another $1.50/pack tax. Previous tax increase had been in 2003 – thus the real price of tobacco products had been going down. Since January 2014 the prices have risen on all products.","WHO Western Pacific Region"
"121","Panama","Con respecto al informe anterior, la tendencia de los precios es al alza, tanto para los cigarrillos legales como para los ilegales y tienden a converger, situación que se aprecia porque la banda de precios tiende a estrecharse. 

Encuestas de 2014 y 2017 y tendencia creciente.  Para el 2017 los precios promedio de las marcas baratas, es decir menores a USD 3.00 en cajetilla de 20 unidades, oscilaron entre los USD 1.00 a USD 2.50.  En el caso de las marcas con precios iguales o mayores a 3.00, los mismos oscilaron entre USD 3.00 y USD 6.50.  La tendencia de los precios sigue al alza.

Fuente: Estudios de Mercado precitados. http://www.gorgas.gob.pa/SitioWebTabaco/Documentos.htm","Masticable Picadora Wolf  12 onzas. $ 6.90 
Tiparillos: cajas de 5 unidades. $. 6.25 o $ 1.25 por unidad
Pasta para Narguile: 5 onzas $.15.00

Con respecto al informe anterior, la tendencia de los precios es al alza, tanto para los cigarrillos legales como para los ilegales y tienden a converger, situación que aprecia porque la banda de precios tiende a estrecharse. 

En el 2012, cuando se trata del precio de los cigarrillos legales más caros fue de USD. 5.00 y en tanto que los cigarrillos más baratos oscilaban entre USD. 1 y 1.50 y eran marcas ilegales. Para el 2015, los cigarrillos legales más caros oscilaron entre USD. 5.00 y USD 7.00; en tanto que los cigarrillos ilegales oscilaban entre USD. 4.88 y USD 5.50 los más caros y los más baratos  entre  USD 1.58 y 2.25.

Fuente: Estudios de Mercado precitados. http://www.gorgas.gob.pa/SitioWebTabaco/Documentos.htm","Con respecto al informe anterior. la tendencia de los precios se mantiene estable toda vez que no se han aplicado nuevos incrementos a los impuestos (selectivo al consumo e IVA).","WHO Region of the Americas"
"122","Papua New Guinea","The tobacco prices has increase 2 years ago but stabilised now despite Government increasing the excise tax by 2.5%","The tobacco prices has increase 2 years ago but stabilised now despite Government increasing the excise tax by 2.5%","There is an annual increase of 5% tax. There was an increase of 15% in 2012.","WHO Western Pacific Region"
"123","Paraguay","Se observó un ligero aumento en los productos nacionales.","Se ha mantenido el aumento sufrido años atrás, del 30% y 50%.","Se ha mantenido el aumento de entre 30% y 50 % con respecto al último informe.","WHO Region of the Americas"
"124","Peru","La moneda peruana es el Sol (S/.). El tipo de cambio promedio interbancario del mes de enero de 2018 es S/. 3,227 Fuente: Banco Central de Reserva del Perú.","Answer not provided","En el año 2012. la cajetilla de 20 unidades de la marca más vendida en Perú (Hamilton) costaba S/. 5.00. en la actualidad cuesta S/. 5.50. lo que significa un incremento de 10% en el precio de los cigarrillos en dicho periodo.","WHO Region of the Americas"
