"55","European Union","In addition to the safeguards provided by the collegiate character of the decision-making process in the Commission (see in this regard the Commissions internal Rules of Procedure and the Rules giving effect to them), the ethical and integrity rules (notably Staff Regulations, Code of Conduct for the Members of the European Commission and Code of Good Administrative Behaviour), as well as the rules on access to documents and on transparency regarding relations with interest representatives, constitute a framework which is consistent with the WHO Framework Convention on Tobacco Control (FCTC), and ensures that the FCTC is respected including its provision on protecting public health policies from commercial and other vested interests of the tobacco industry.  
 The Staff Regulations for officials of the European Union contain legally binding ethical standards and ensure that the principles of independence, impartiality, objectivity and loyalty are applied in the European Public Service. Notably the principle of independence guarantees that conduct and decision-making are determined by the need to serve the common good and the public interest, and never by any other interests.
 As regards transparency, Regulation 1049/2001 on public access to documents is an important element, flanked by the other aspects of the Commissions transparency policy, such as the Transparency Register, and the proactive publication of information on meetings held by Commissioners, members of their cabinets and Directors-General with stakeholders. As of 1 December 2014, Commissioners, their Cabinet members and Directors General publish information on the meetings they hold with lobbyists. Moreover, they meet only with interest representatives whose organisations feature on the Transparency Register. As concerns other staff members, the Commission recommends to all staff to check the credentials of a given interest representative to make sure they are registered in the Transparency Register and, if they are not, encourage them to register. The Commission constantly promotes this ""good practice"" as part of its training and awareness-raising actions on relations with interest groups. Furthermore, the European Commission has endorsed the ""Practical recommendations for public officials’ interaction with interest representatives"" issued by the European Ombudsman in May 2017 and has disseminated them internally.","The ethical and integrity rules (notably Staff Regulations, Code of Conduct for Commissioners and Code of Good Administrative Behaviour), as well as the rules on access to documents and on transparency regarding relations with interest representatives, constitute a framework which is consistent with the WHO Framework Convention on Tobacco Control (FCTC), and ensures that the FCTC is respected including its provision on protecting public health policies from commercial and other vested interests of the tobacco industry.  

The Staff Regulations for officials of the European Union contain legally binding ethical standards and ensure that the principles of independence, impartiality, objectivity and loyalty are applied in the European Public Service. Notably the principle of independence guarantees that conduct and decision-making are determined by the need to serve the common good and the public interest, and never by any other interests.

A Practical Guide for staff on ethics and conduct, recently revised, contains recommendations regarding contacts with interest groups in general and sets out when a record of a meeting should be ensured (p. 12). 

As regards transparency, Regulation 1049/2001 on public access to documents is an important element, flanked by the other aspects of the Commissions transparency policy, such as the Transparency Register, and the proactive publication of information on meetings held by Commissioners, members of their cabinets and Directors-General with stakeholders. As of 1 December 2014, Commissioners, their Cabinet members and Directors General publish information on the meetings they hold with lobbyists. Moreover, they meet only with interest representatives whose organisations feature on the Transparency Register. As concerns other staff members, the Commission recommends to all staff to check the credentials of a given interest representative to make sure they are registered in the Transparency Register and if, they are not, encourage them to register. The Commission constantly promotes this ""good practice"" as part of its training and awareness-raising actions on relations with interest groups.","The Staff Regulations for officials of the European Union contain legally binding ethical standards and ensure that the principles of independence impartiality objectivity and loyalty are applied in the European Public Service. Notably the principle of independence guarantees that conduct and decision-making are determined by the need to serve the common good and the public interest and never by any other interests.","WHO European Region"
"56","Fiji","Report not provided","Report not provided","Answer not provided","WHO Western Pacific Region"
"57","Finland","Finnish public health policies are quite well protected from the tobacco industry. There is no tobacco industry in Finland. The interaction with the reprsentatives of industry is limited mainly to open requests for comment. However there is no extensive public repository on industrys activities.

NGOs like ASH Finland report that they actively disseminate information and raise discussion on the industrys activities, interests and methods. In addition, many NGOs have adopted the policy not to interact with the tobacco companies, their affiliates or any other companies which work with tobacco industry, such as advertising companies.","Finnish public health policies are well protected from the tobacco industry. The interaction with the industry is limited mainly to open requests for comment. However there is no extensive public repository on industrys activities. Several reports on the tobacco industry activities have been published.

Many non-governmental organizations report that they actively disseminate information and raise discussion on the industrys activities, interests and methods. For example Finlands ASH disseminates information and reveals the tactics of the tobacco industry and encourages public discussion on the tobacco industry´s methods to ensure their profits.In addition,Finland´s ASH and many other NGOs  have adopted the policy not to interact with the tobacco companies, their affiliates or any other companies which work with tobacco industry, such as advertising agencis.","Finnish public health policies are well protected from the tobacco industry. The interaction with the industry is limited mainly to open requests for comment. However there is no extensive public repository on industry''s activities. Several reports on the tobacco industry activities have been published.
Many non-governmental organizations report that they actively disseminate information and raise discussion on the industry''s activities interests and methods. For example Finland''s ASH disseminates information and reveals the tactics of the tobacco industry and encourages public discussion on the tobacco industry´s methods to ensure their profits.In addition Finland´s ASH and many other NGOshave adopted the policy not to interact with the tobacco companies their affiliates or any other companies which work with tobacco industry such as advertising agencis.","WHO European Region"
"58","France","L’article 26 de la loi du 26 janvier 2016 de modernisation de notre système de santé a posé un principe de transparence des relations d’influence de l’industrie du tabac. En application de cet article a été pris le décret n°2017-279 du 2 mars 2017 relatif à la transparence des dépenses liées aux activités d’influence ou de représentation d’intérêts des fabricants, importateurs, distributeurs de produits du tabac et de leurs représentants. 
Ces relations sont déclarées chaque année au ministère de la santé. Les déclarations sont consultables sur le site du ministère de la santé et restent accessibles pendant cinq ans, à compter de leur mise en ligne : http://solidarites-sante.gouv.fr/prevention-en-sante/addictions/article/transparence-des-relations-d-influence-de-l-industrie-du-tabac 
 
Conformément à l’article R. 3512-1-1 du code de la santé publique, les activités d’influence et de représentations d’intérêt sont définies comme étant les activités ayant pour objet d’influer sur la décision publique, notamment sur le contenu d’une loi ou d’un acte réglementaire en entrant en communication avec les personnes mentionnées au 3° du II de l’article L. 3512-7 du code de la santé publique.
Sont considérées comme des dépenses liées à des activités d’influence ou de représentation d’intérêts :
-  Les rémunérations de personnels employés en totalité ou en partie pour exercer des activités d’influence ou de représentation d’intérêts ;
-  Les achats de prestations auprès de sociétés de conseil en activités d’influence ou de représentation d’intérêts ;
-  Les avantages en nature ou en espèces, dont la valeur dépasse 10 €, procurés à  des membres du Gouvernement ;    des membres des cabinets ministériels ou à des collaborateurs du Président de la République ;    des collaborateurs du Président de l’Assemblée nationale ou du Président du Sénat ; des parlementaires ;    des personnes chargées d’une mission de service public que leur mission ou la nature de leur fonction appelle à prendre ou à préparer les décisions et les avis des autorités publiques relatifs aux produits du tabac ;    des experts, personnes physiques ou morales, chargés, par convention avec une personne publique, d’une mission de conseil pour le compte d’une personne publique qui a pour mission de prendre ou de préparer les décisions et les avis des autorités publiques relatifs aux produits du tabac.","La loi de santé du 26 janvier 2016 prévoit dans son article 26 que : ""Les fabricants, les importateurs et les distributeurs de produits du tabac ainsi que les entreprises, les organisations professionnelles ou les associations les représentants adressent chaque année au ministre chargé de la santé un rapport détaillant lensemble des dépenses liées à des activités dinfluence ou de représentation dintérêts. ""
Une partie de ces informations seront rendues publiques par le biais dun site Internet dédié.","Answer not provided","WHO European Region"
"59","Gabon","Le texte dapplication concernant larticle 5.3 fait partie des textes dapplication de la loi sur la lutte antitabac 006/2013 promulgués en 2017 par le Gouvernement.","Le texte dapplication concernant larticle 5.3 fait partie des textes soumis à la signature du Gouvernement.","Pour le point 3.1.2.1 Le Gabon dispose d’un code de conduite destiné aux agents de la fonction publique. En plus le chapitre 7 de la Loi interdit l’ingérence de l’industrie du tabac dans les politiques nationales de lutte antitabac dans son article 32 ; il interdit également tout partenariat direct ou indirect avec l’industrie du tabac et toute subvention publique ou mesure incitative en faveur de la culture de la production ou de la transformation du tabac ou des produits du tabac. L’article 33 stipule que tout rapport avec l’industrie du tabac doit être transparent. L’article 34 interdit tout partenariat et accord avec l’industrie du tabac et avec ceux qui s’attachent à promouvoir ses intérêts. Une fois promulguée la Loi constituera une base juridique solide pour l’application de l’article 5 3 de la CCLAT et des directives le concernant. ; Pour le point 3.1.2.2 la loi prévoit au chapitre 11 article 46 ainsi qu’au chapitre 6 article 31 de renforcer laction dinformation déducation et de communication sur les effets nocifs liés à la consommation du tabac et sur les avantages du sevrage tabagique grâce à la Commission Nationale de Lutte contre le tabagisme.
Le rapport des la mission de la CCLAT a relevé que Le Gabon a mené diverses activités d’éducation de communication et de sensibilisation aux méfaits de la consommation de tabac et de l’exposition à la fumée du tabac auprès du grand public et de groupes ciblés tels que les jeunes les professionnels des médias les éducateurs et les décideurs.","WHO African Region"
"60","Gambia","Answer not provided","Answer not provided","IT BEEN ADDRESS IN THE NEW TOBACCO CONTROL POLICY","WHO African Region"
"61","Georgia","Newly adopted tobacco control law has a provision on protecting health policies with respect of tobacco control from commercial and other vested interests of the tobacco industry. It entails provision of Governmental Normative Act on regulating civil servants and other state employees relation with the tobacco industry. The respective Normative Act is being developed and is under the process of approval by the Government of Georgia.","Answer not provided","Answer not provided","WHO European Region"
"62","Germany","There is information on tobacco control policy on the website of the Federal Ministry of Health. Further information, i.e. on tobacco products (database) can be found on the website of the Federal Ministry of Food and Agriculture.","There is information on tobacco control policy on the website of the Federal Ministry of Health. Further information, i.e. on tobacco products (database) can be found on the website of the Federal Ministry of Food and Agriculture, which had also published all statements submitted by stakeholders during the process of discussing the new draft of the tobacco directive in 2013.","There is information on tobacco control policy on the website of the Federal Ministry of Health. Further information i.e. on tobacco products (database) can be found on the website of the Federal Ministry of Food and Agriculture which had also published all statements submitted by stakeholders during the process of discussing the new draft of the tobacco directive in 2013.","WHO European Region"
"63","Ghana","Ministry of Health has carried out sensitization activities for Customs and Immigration Officers and all points of entry e.g. Elubo, Takoradi, Aflao, KIA and Tema to create awareness about Tobacco Industry tactics and interference and how to prevent them. In all about 2,000 officers were sensitized. (See picture of Officers at Aflao border)","Ministry of Health has carried out sensitization activities for Customs and Immigration Officers and all points of entry e.g. Elubo, Takoradi, Aflao, KIA and Tema to create awareness about Tobacco Industry tactics and interference and how to prevent them. In all about 2,000 officers were sensitized. (See picture of Officers at Aflao border)","The 2013 World No Tobacco day was commemorated in Techiman given the high prevalence of smoking in the Brong-Ahafo region. The key Note address was delivered by the Hon Deputy Minister of Health Dr Alfred Tia Sugri and also attended by the Deputy Brong-Ahafo Regional Minister. A total of about 600 people were in attendance and was followed by several TV and radio talks and discussions. Schools (102) Markets (12) Transport terminals (12) and Religious organizations (15) were also sensitized 
The Food and Drug Authority carried out Media sensitization programmes on Fourteen (14) TV and Twenty three (23) Radio Stations in Accra to create awareness on the provisions of the Tobacco Control Measures as specified by the Public Health Act. FDA also made 2 000 copies of ''The Smoker''s Body'' on A2 poster and 100 copies of ''The Smoker''s Body''on 2ft x 3ft banner on flexy and distributed to all FDA regional offices Ministry of Health Media houses Schools Markets Transport terminals and Religious organizations.","WHO African Region"
"64","Greece","Report not provided","Answer not provided","Answer not provided","WHO European Region"
"65","Grenada","Answer not provided","Answer not provided","Answer not provided","WHO Region of the Americas"
"66","Guatemala","La información pública se asegura a través de la aplicación de la Ley correspondiente: Ley de Acceso a la Información Pública, Decreto 57-2008 del Congreso de la República","La información pública se asegura a través de la aplicación de la Ley correspondiente: Ley de Acceso a la Información Pública, Decreto 57-2008 del Congreso de la República","Answer not provided","WHO Region of the Americas"
"67","Guinea","Report not provided","Voir C116","Report not provided","WHO African Region"
"68","Guinea-Bissau","Answer not provided","Answer not provided","Report not provided","WHO African Region"
"69","Guyana","The Integrated Prevention and Control of Non Communicable Diseases: Strategic Plan 2013- 2020 guides Tobacco Control activity and schedules. 

Through the Health Communication and Health Promotion Department, there is a some Communication Strategy that addresses Tobacco Education in all target groups and utilizes a medium that is suitable for each target group and the regions in which they live. The materials and information can be uplifted from the Ministry of Public Health.  

As mandated by the Health Facilities Licensing Act and the Ministerial Decree from the Ministry of Education, all Health Facilities and Education Facilities must be 100% smoke free. 

The Ministry of Public Health also has a Smoke Free Environments Program. At the moment it is a voluntary program and participants enter into it by choice. A declaration that is certified by the Minister of Public Health is presented to them along with Smoke Free Environments Signs. Assistance is also available for developing enforcement  and penalty strategies that are suitable. 
  
The Ministry of Public Health is in the process of reviewing the terms of reference for a Cessation Strategy to assist current smokers who are interested in quitting. This activity is being facilitated by the Chronic Diseases Unit, Pan American Health Organization and Guyana Chest Society (This is an NGO that works with the Ministry of Health in Tobacco Control activities through collaboration with the National Tuberculosis Clinic).","Report not provided","Report not provided","WHO Region of the Americas"
"70","Honduras","La ratificación en Honduras del Convenio Marco para el Control del Tabaco de la OMS y la Ley Especial para el Control del Tabaco y su Reglamentación contienen los articulados relativos a  la protección de las políticas de salud pública relativas al control del tabaco contra los intereses comerciales y otros intereses creados de la industria tabacalera y a la facilitación del acceso del público, conforme a lo prescrito en el artículo 12(c), a una amplia variedad de información sobre las actividades de  la industria tabacalera que revista interés para el objetivo del Convenio, disponible como fuente de información pública lo cual garantiza que en Honduras se cumpla con dichas disposiciones jurídicas.","La ratificación en Honduras del Convenio Marco para el Control del Tabaco de la OMS y la Ley Especial para el Control del Tabaco y su Reglamentación contienen los articulados relativos a  la protección de las políticas de salud pública relativas al control del tabaco contra los intereses comerciales y otros intereses creados de la industria tabacalera y a la facilitación del acceso del público, conforme a lo prescrito en el artículo 12(c), a una amplia variedad de información sobre las actividades de  la industria tabacalera que revista interés para el objetivo del Convenio, disponible como fuente de información pública lo cual garantiza que en Honduras se cumpla con dichas disposiciones jurídicas.","No se permite la injerencia de la industria tabacalera en el patrocinio de actividades de promoción a la salud y de otra índole establecida en las políticas públicas del sector salud. así como. de lo señalado en la Ley Especial para el Control del Tabaco y su Reglamentación","WHO Region of the Americas"
"71","Hungary","Report not provided","No further steps have been made in the implementation of Article 5.3.","Answer not provided","WHO European Region"
"72","Iceland","Comprehensive tobacco control law that include display ban on tobacco trademarks and ban on any form of media coverage of individual products for other purposes than to warn of their harmful effects.
http://eng.velferdarraduneyti.is/acts-of-Parliament/nr/19484 (act 7)","Comprehensive tobacco control law that include display ban on tobacco trademarks and ban on any form of media coverage of individual products for other purposes than to warn of their harmful effects.
http://eng.velferdarraduneyti.is/acts-of-Parliament/nr/19484 (act 7)","Comprehensive tobacco control law that include display ban on tobacco trademarks and ban on any form of media coverage of individual products for other purposes than to warn of their harmful effects.
http://eng.velferdarraduneyti.is/acts-of-Parliament/nr/19484 (act 7)","WHO European Region"
"73","India","Report not provided","In view of the huge human and economic loss to the country on account of tobacco use, a comprehensive legislation was adopted by Ministry of Health & Family Welfare in 2003 which  prohibits advertising/promotion and regulates production, supply and distribution of cigarettes and other tobacco products. Further, the enabling Rules and regulations have been notified under the framework of the tobacco control legislation thus insulating them from any commercial and other vested interests of the tobacco industry","In view of the huge loss caused by tobacco use to the public health exchequer. a comprehensive legislation was adopted by Ministry of Health & Family Welfare in 2003 which  prohibit advertising and regulate production. supply and distribution of cigarettes and tobacco products. Further the enabling Rules and regulations have been notified under the framework of the tobacco control legislation thus insulating them from any commercial and other vested interest of the tobacco industry.","WHO South-East Asia Region"
"74","Iran (Islamic Republic of)","Generally, public access is available through the internet and mass medias about the activities of tobacco industries, but even the government has not a wide access to their activities.","Generally, public access in available through the internet and mass medias about the activities of tobacco industries, but even the government has not a wide access to their activities.","Article 18 of the Bylaw prohibits any subsidy for the cultivation growth and harvest of tobacco Article 3 in the Act prohibits any form of sponsorship. I.R Iran has a code of conduct for public officials. It bans any financial relations between Government officials and the private sector. The code could be further utilized to implement Article 5.3 of the Convention and its guidelines.","WHO Eastern Mediterranean Region"
"75","Iraq","As a part of educational program aimed to aware people about tobacco hazards, we concentrated on the false and misleading means of tobacco production companies and the harmful chemicals of these industries.","The tobacco control act and its instructions modified the standard specification of tobacco product to provide the maximum protection to the public and requiring  tobacco companies to reduce the damage to the lowest possible level in their products.","Ensuring that the anti-smoking law in Iraq especially the development of standard specifications tobacco products obliges manufacturers dealers and importers in respect of rates of nicotine and tar as well as the graphic health warnings on tobacco products.","WHO Eastern Mediterranean Region"
"76","Ireland","One of the  recommendations in Tobacco Free Ireland is to: Take steps to ensure that all government officials, employees of state agencies and members of any government branch (executive, legislative and judiciary) responsible for setting and implementing tobacco control policies and protecting those policies against tobacco industry interests are aware of their obligations under article 5.3 of the WHO FCTC and are aware of the Guidelines developed to assist in meeting these obligations - p.34","A key recommendation in Tobacco Free Ireland is to : Take steps to ensure that all government officials, employees of state agencies and members of any government branch (executive,legislative and judiciary) responsible for setting and implementing tobacco control policies and protecting those policies against tobacco industry interests are aware of their obligations under article 5.3 of the WHO FCTC and are aware of the Guidelines developed to assist in meeting these obligations - p.34","A key recommendation in ''Tobacco Free Ireland'' is to: Take steps to ensure that all government officials employees of state agencies and members of any government branch (executive legislative and judiciary) responsible for setting and implementing tobacco control policies and for protecting those policies against tobacco industry interests are aware of their obligations under Article 5.3 of the WHO FCTC and are aware of the Guidelines developed to assist in meeting these obligations. –p34","WHO European Region"
"77","Israel","Report not provided","Report not provided","Report not provided","WHO European Region"
"78","Italy","Answer not provided","Answer not provided","Answer not provided","WHO European Region"
