"79","Jamaica","The Ministry of Health has taken steps to ensure that the Tobacco Industry does not influence public health policies . We continue to sensitize Government Officials in relation to tobacco industry interference through workshops and presentations regarding the activities of the industry, which are sometimes masked as corporate social responsibility.","The Ministry of Health has taken steps to ensure that Tobacco Industry does not participate in public health policies related to Tobacco Control. Government Officials were sensitized in relation to tobacco industry interference through workshops and presentations regarding the activities of the industry masked as corporate social responsibility. They were also sensitized in relation to Jamaicas obligations under Article 5.3 of the FCTC.","The Ministry of Health has ensured that Tobacco Industry does not participate in public health policies related to Tobacco Control. Government Officials were sensitized to and given copies of Article 5.3 for the FCTC.","WHO Region of the Americas"
"80","Japan","With reference to C121, commercial and other vested interests of the tobacco industry have been appropriately regulated in Japan by Articles 197.1-197.4, Article 198 of the Penal Code, Articles 21-22.9 of the Political Funds Control Act.","With reference to C121, commercial and other vested interests of the tobacco industry have been appropriately regulated in Japan by Articles 197.1-197.4, Article 198 of the Penal Code, Articles 21-22.9 of the Political Funds Control Act.","With reference to 3.1.2.1 commercial and other vested interests of the tobacco industry have been appropriately regulated in Japan by Articles 197.1-197.4 Article 198 of the Penal Code Articles 21-22.9 of the Political Funds Control Act.","WHO Western Pacific Region"
"81","Jordan","تم وضع دلائل ارشادية للاردن  بالتعاون مع منظمة الصحة العالمية للمادة 5.3 وتم تعميها  على الجهات المعنية ويتم متابعتها من قبل وزارة الصحة 
وقد تم التعميم على كافة الوزارات والمؤسسات بمنع التعامل مع شركات التبغ وعدم قبول الهبات والرعاية الخاصة والتدريب ،ويمنع الرعاية والترويج والاعلان","تم وضع دلائل ارشادية للاردن  بالتعاون مع منظمة الصحة العالمية للمادة 5.3 وتم تعميها  على الجهات المعنية ويتم متابعتها من قبل وزارة الصحة","Requesting tobacco companies to eliminate (due to circumvent the subject of publicity and promotion through websites) conducting tours of the press inside the factories and the emphasis on not accepting any support or sign agreements care for the various activities and to inform all parties to the Public Health Law and instructions.","WHO Eastern Mediterranean Region"
"82","Kazakhstan","Answer not provided","Report not provided","Information about the WHO FCTC is on the Ministry of Health and public NCPHLD antismoking organizations and also distributed in thematic press releases.","WHO European Region"
"83","Kenya","The Ministry of Health would have an inventory of the reports from Tobacco Industry and this would be accessible to the public upon request. Maybe in the recommendations we could in future establish a repository that can be readily available for access to the public.","The Ministry of Health would have an inventory of the reports from Tobacco Industry and this would be accessible to the public upon request. Maybe in the recommendations we could in future establish a repository that can be readily available for access to the public.","The Tobacco Control Act requires that the members of the Tobacco Control Board should not have any affiliation with the tobacco industry; the Act also requires the industry to provide information to the Board including information on tobacco products and their emissions sales and advertising data information on product composition ingredients hazardous properties and brand elements","WHO African Region"
"84","Kiribati","Answer not provided","Answer not provided","Answer not provided","WHO Western Pacific Region"
"85","Kuwait","Answer not provided","The awareness activities are continous all year with collaboration between different sectors includin MOE and MOI","Answer not provided","WHO Eastern Mediterranean Region"
"86","Kyrgyzstan","Report not provided","Статья 4. Национального  Закона КР по борьбе против табака включает:
Основными принципами  государственной политики в сфере защиты здоровья граждан от вредного воздействия табака являются:
 - политическая  приверженность делу разработки и определения государственной политики и государственной стратегии в области охраны  здоровья граждан от вредного воздействия табака, выбора приоритета жизни и здоровья граждан по отношению к производству табака и его реализации;

Согласно статье 5 Государство гарантирует:
 - обеспечение доступа ко всем видам медико-санитарной помощи в
организациях здравоохранения лицам, занятым в табачной отрасли, в
соответствии с законодательством об охране здоровья граждан; 
 - создание условий для повышения уровня информированности граждан
Кыргызской Республики о последствиях потребления табака для здоровья и
воздействия табачного дыма на окружающих. 

Статья 15 Национального Закона КР, в целях защиты здоровья граждан от вредного воздействия  табака  и регулирования потребления табачных изделий запрещает:
- организовывать культурно-массовые мероприятия, публичные акции и конкурсы в целях увеличения объема продаж табачных изделий;
- спонсорство  культурно-спортивных,  оздоровительных  мероприятий как местными, так и иностранными табачными компаниями;
- проведение  местными  и  иностранными табачными фирмами или совместными предприятиями культурно-спортивных,  оздоровительных мероприятий, каких-либо конкурсов, дискотек…
- все виды прямой и косвенной рекламы табака и табачных изделий на территории Кыргызской Республики (вступила в силу с 1 апреля 2009 года);


Запущена новая версия  информационного сайта для населения: www.help.kg","Answer not provided","WHO European Region"
"87","Lao People's Democratic Republic","Answer not provided","Answer not provided","There are two articles in the TC Law stated to protect government officials and public health policies from Tobacco Industry Interference","WHO Western Pacific Region"
"88","Latvia","In 2016  the Procedure against lobbying was approved in the Ministry of Health.","Answer not provided","Comment in 3.1.2.6.","WHO European Region"
"89","Lebanon","A focal point was created in 2014 at the Ministry of Finance, to serve as an information source and firewall between the state-owner tobacco monopoly and the Ministry of Public Health and other tobacco control advocates","A focal point was created in 2014 at the Ministry of Finance, to serve as an information source and firewall between the state-owner tobacco monopoly and the Ministry of Public Health and other tobacco control advocates","The NTCP has confronted the tobacco industry on several occasions where it sought to influence members of parliament in voting against law 174. Although the industry did seem to have an influence in postponing the approval of the law. it nevertheless was approved by the Parliament in 2011.
We have also hosted a WHO workshop in 2013 regarding article 5.3. and trained national stakeholders against tobacco industry interference.","WHO Eastern Mediterranean Region"
"90","Lesotho","Report not provided","Report not provided","Answer not provided","WHO African Region"
"91","Liberia","Answer not provided","Answer not provided","Report not provided","WHO African Region"
"92","Libya","تم انشاء موقع خاص لبرنامج مكافحة التدخين على شبكة المعلومات  الدولية   www.tcpl.ly   تم خلاله اتاحة جميع الوثائق كل المعلومات  المتعلقة بالموضوع","تم انشاء موقع خاص لبرنامج مكافحة التدخين على شبكة المعلومات  الدولية   www.tcpl.ly   تم خلاله اتاحة جميع الوثائق كل المعلومات  المتعلقة بالموضوع","Answer not provided","WHO Eastern Mediterranean Region"
"93","Lithuania","Answer not provided","Answer not provided","Answer not provided","WHO European Region"
"94","Luxembourg","http://www.sante.public.lu/fr/prevention/tabac/","Answer not provided","Pour suivre et évaluer le plan national TABAC un groupe national dexperts a été constitué qui se réunit en cas de besoin sous la présidence du Ministère de la Santé; campagnes annuelles brochures et outils par la Fondation Cancer et par la Division de la Médecine préventive Direction de la Santé.","WHO European Region"
"95","Madagascar","information auprès du public sur limportance de la protection de la santé publique","appui technique et financier par lUNION sur larticle  5.3","Trois ateliers nationaux pour les Départements Ministériels Journalistes et ONG sur l’ingérence de l’Industrie du Tabac a été tenu à Madagascar par l’appui de l’UNION INTERNATIONAL CONTRE LA TUBERCULOSE ET LES MALADIES RESPIRATOIRES et L’OMS pays","WHO African Region"
"96","Malaysia","","Answer not provided","Answer not provided","WHO Western Pacific Region"
"97","Maldives","Answer not provided","Answer not provided","Although this is made aware to policy makers the industry tries to infiltrate the mechanism to influence policies to the benefit of the industry. Though not fully robust and fools proof a limited mechanism is instilled to understand and recognise such instances through workshops and other information sessions to focused groups.","WHO South-East Asia Region"
"98","Mali","Chaque année des caravanes de sensibilisation à travers les grandes villes sur les méfait du tabac. Des spots passent à travers les médias","Chaque année des caravanes de sensibilisation à travers les grandes villes sur les méfait du tabac. Des spots passent à travers les médias","Il y a eu la relecture du décret dapplication des textes mais aussi lindustrie du tabac a été refusé dans le comité national de lutte contre le tabac .","WHO African Region"
"99","Malta","Administrative policies and work ethics prohibit any conflict.","Administrative policies and work ethics prohibit any conflict.","Administrative policies and work ethics prohibit any conflict.","WHO European Region"
"100","Marshall Islands","Answer not provided","Answer not provided","Answer not provided","WHO Western Pacific Region"
"101","Mauritania","Answer not provided","Answer not provided","Answer not provided","WHO African Region"
"102","Mauritius","The setting up of the Tobacco Control Unit at the level of the Ministry is a clear indication of the management initiatives to adopt and  implement public health policies in line with the WHO FCTC whereby the vested interest of the Tobacco Industry is never allowed to Interfere in the management and control of tobacco initiatives in general.","Answer not provided","The Public Health (Restrictions on Tobacco Products) Regulations 2008 ban direct and indirect advertising promotion and sponsorship. The Tobacco Industry is not allowed to carry out activities under CSR.","WHO African Region"
"103","Mexico","En México existe una ley de transparencia y acceso a la información pública que promueve y regula las bases para impulsar la transparencia y una ley federal de responsabilidades administrativas de los servidores públicos que establecen desde hace años la normatividad  para garantizar el adecuado ejercicio de los servidores públicos.","Answer not provided","En abril de 2010. el entonces Secretariado Técnico del Consejo Nacional contra las Adicciones (ST-CONADIC) y el Sistema Nacional para el Desarrollo Integral de la Familia (DIF). organizaron de manera conjunta tres Foros Regionales y un Foro Académico “Hacia la construcción de un modelo integral para la prevención y atención a las adicciones”. En el mes de enero de 2011. la Comisión Nacional contra las Adiciones convocó a representantes de 54 instituciones a participar en el Taller Interinstitucional de Actualización del Programa contra el Tabaquismo. Los principales actores de este esfuerzo fortalecido seguirán siendo los representantes de los sectores público. social y privado; los tres órdenes de gobierno y las tres esferas del desarrollo integral: la familia. la escuela y la comunidad. así como los profesionales y voluntarios que participan en este campo.","WHO Region of the Americas"
"104","Micronesia (Federated States of)","Protecting of public health policies are included in the code of conduct for the government employees and leaders working of the government especially the health employees. There is an attempt to post information on tobacco industry activities in the health webpage for general public use.","Protecting of public health policies are included in the code of conduct for the government employees and leaders working of the government especially the health employees. The is an attempt to post information on tobacco industry activities in the health webpage for general public use.","A Resolution on Article 5.3 was submitted to the Secretary of Health and Social Affairs for review before the President of the Nation send to the FSM Congress for action.","WHO Western Pacific Region"
"105","Mongolia","State Policy on Tobacco control reflected in the law on Tobacco control.","Report not provided","State policy on Tobacco control reflected in the law on Tobacco control.","WHO Western Pacific Region"
"106","Montenegro","We provided that tobacco industry can not finance any activity related to the protection of public health (activities of promotion, prevention, treatment and rehabilitation). Additionally, it is forbidden any covert promotion of tobacco industry sponsorship and public events by the manufacturer or retailer of tobacco products. The Law prohibits the sale of any products which imitate tobacco products or containing names (logos) of tobacco products or tobacco companies.","We provided that tobacco industry can not finance any activity related to the protection of public health (activities of promotion, prevention, treatment and rehabilitation). Additionally, it is forbidden any covert promotion of tobacco industry sponsorship and public events by the manufacturer or retailer of tobacco products. The Law prohibits the sale of any products which imitate tobacco products or containing names (logos) of tobacco products or tobacco companies.","We provided that tobacco industry can not finance any activity related to the protection of public health (activities of promotion prevention treatment and rehabilitation). Additionally it is forbidden any covert promotion of tobacco industry sponsorship and public events by the manufacturer or retailer of tobacco products. The Law prohibits the sale of any products which imitate tobacco products or containing names (logos) of tobacco products or tobacco companies.","WHO European Region"
"107","Myanmar","The Tobacco Control Cell under Public Health Division of Department of Public Health organized a National Workshop on Countering Tobacco Industry Interference with the objective of raising awareness of governmental and non-governmental organizations.  
The information regarding the tobacco industry activities is not much available yet in Myanmar.","The Tobacco Control Cell under Public Health Division of Department of Health organized a National Workshop on Countering Tobacco Industry Interference with the objective of raising awareness of governmental and non-governmental organizations. In collaboration with various partners, the Tobacco Control Cell is developing the guidelines and regulations on the protection of public health policies from commercial and other vested interests of the tobacco industry, based on the guidelines of Article 5.3 and discussions and recommendations from the above 
workshop.  
The information regarding the tobacco industry activities is not much available yet in Myanmar.","The Tobacco Control Cell under Public Health Division of Department of Health organized a National Workshop on Countering Tobacco Industry Interference with the objective of raising awareness of governmental and non-governmental organizations. In collaboration with various partners the Tobacco Control Cell is developing the guidelines and regulations on the protection of public health policies from commercial and other vested interests of the tobacco industry based on the guidelines of Article 5.3 and discussions and recommendations from the above workshop. 
The information regarding the tobacco industry activities is not much available yet in Myanmar.","WHO South-East Asia Region"
"108","Namibia","Report not provided","Report not provided","Report not provided","WHO African Region"
"109","Nauru","Report not provided","Answer not provided","Report not provided","WHO Western Pacific Region"
"110","Nepal","The Ministry of Health has never included the tobacco industry or any sector perceived to be in favor of the industry in its meetings. The Regulation states that any nominated member of the Committee “found to be involved directly or indirectly in the manufacture, import, export or sales and marketing of tobacco products” may be removed from his or her post.","Report not provided","The Ministry has never included the tobacco industry or any sector perceived to be in favour of the industry in its meetings. The Regulations states that any nominated member of the Committee “found to be involved directly or indirectly in the manufacture import export or sales and marketing of tobacco products” may be removed from his or her post.","WHO South-East Asia Region"
"111","Netherlands","There is a website available to the public where ministries can publish documents that refer to contact that was needed with representatives of the Tobacco industry for ensuring proper implementing of the law, or unsolicited letters ministries receive from the industry. 

The webpage is: https://www.rijksoverheid.nl/onderwerpen/roken/inhoud/transparant-over-contact-tabaksindustrie.","There is a website available to the public where ministries can publish documents that refer to contact that was needed with representatives of the Tobacco industry for ensuring proper implementing of the law, or unsolicited letters ministries receive from the industry. 

The webpage is: https://www.rijksoverheid.nl/onderwerpen/roken/inhoud/transparant-over-contact-tabaksindustrie.","The Dutch Government is transparent with regard to all contacts with the tobacco industry or retail industry and provides on request information on the nature and frequency of these contacts and the people who are involved. The Government only consults the industry on executive matters that have a direct influence on the industry and interacts with the industry only to the extent strictly necessary. 
The Government does not endorse any partnership or other non-binding agreements with tobacco industry. Tobacco control policy in general is not discussed with the industry.","WHO European Region"
"112","New Zealand","The Ministry of Health maintains a publicly available register of all meetings it has with the tobacco industry.  It provides dates of meetings, who attended and the topics discussed. These meetings have become increasingly rare. See:
http://www.health.govt.nz/our-work/preventative-health-wellness/tobacco-control/who-framework-convention-tobacco-control/meetings-tobacco-industry-representatives","The Ministry of Health maintains a publicly available register of meetings it has with the tobacco industry.  It provides dates of meetings, who attended and the topics discussed.  Such meetings have become increasingly rare. See:
http://www.health.govt.nz/our-work/preventative-health-wellness/tobacco-control/who-framework-convention-tobacco-control/meetings-tobacco-industry-representatives","The Ministry of Health maintains a publicly available register of meetings it has with the tobacco industry. It provides information on the dates of meetings who attended and the topics discussed. Such meetings have been rare in recent times.","WHO Western Pacific Region"
"113","Nicaragua","Answer not provided","Answer not provided","Report not provided","WHO Region of the Americas"
"114","Niger","Report not provided","Answer not provided","Report not provided","WHO African Region"
"115","Nigeria","Answer not provided","Answer not provided","Answer not provided","WHO African Region"
"116","Niue","Report not provided","Report not provided","Answer not provided","WHO Western Pacific Region"
"117","Norway","Answer not provided","Answer not provided","Ethical standards set in guidelines excluding tobacco producing companies from the Norwegian Government Pension Fund Global (GPFG).
http://www.regjeringen.no/en/dep/fin/Selected-topics/the-government-pension-fund/responsible-investments/guidelines-for-observation-and-exclusion.html?id=594254","WHO European Region"
"118","Oman","لا يوجد","لا يوجد","Does not meet the tobacco companies in general; developed a form to be signed by the members of the National Committee for Tobacco Control on conflict of interest. A circular letter was sent to all ministries not to buy medicines from the tobacco companies and agents and to prevent them from accepting aid and donations from tobacco companies.","WHO Eastern Mediterranean Region"
"119","Pakistan","For the time being, there are no measures in place requiring that that the public has access, either in accordance with Article 12(c) to a wide range of information on tobacco industry activities relevant to the objectives of the Convention, or to the minutes or information about meetings between Government officials and tobacco industry representatives.","Answer not provided","Pakistan is ensuring to protect public health policies with respect to tobacco control from the commercial and other vested interests of tobacco industry by following the guiltiness issued under Article 5.3 of FCTC.","WHO Eastern Mediterranean Region"
"120","Palau","Answer not provided","Answer not provided","Answer not provided","WHO Western Pacific Region"
