"111","Netherlands","The smoking ban is clearly set out in the Act, Jaunary 1st 2015. 

The exception for pubs and bars smaller than 70sq. meters that existed since 2011 was ended in 2015, so now there is a complete smoking ban in pubs and bars.","The smoking ban is clearly set out in the Act, Jaunary 1st 2015. 

The exception for pubs and bars smaller than 70sq. meters that existed since 2011 was ended in 2015, so now there is a complete smoking ban in pubs and bars.","Overall compliance is high. Bars and discotheques used to be openly resisting but they have gotten better since enforcement was increased by inspecting risk areas more often and by giving more and higher fines. 
In the second half of 2014 the smoking ban will apply to small pubs which had been exempted from the ban in 2011. Preparations for adjusting the law have been made and we expect the law to be enforced after July 2014.","WHO European Region"
"112","New Zealand","There have been no changes to the national legislation affecting exposure to tobacco smoke  (ie, the Smoke-free Environments Act 1990) in recent years.  Local authorities continue to strengthen the protection from exposure to tobacco smoke in their jurisdictions.","No national legislation changes.  Local authorities continue to strengthen the protection from tobacco smoke in their jurisdictions","New Zealand has continued running mass media campaigns on the dangers of exposure to second-hand smoke – the most recent focus has been on smoking in cars.  
Local authorities have continued to extend smoke-free areas within their jurisdictions. Smoke-free parks playgrounds sports grounds etc. are common. Recently some local Councils have begun to extend their smoke-free areas to selected streets / areas of town bus shelters and the like.","WHO Western Pacific Region"
"113","Nicaragua","Answer not provided","Answer not provided","Report not provided","WHO Region of the Americas"
"114","Niger","Report not provided","beaucoup de services sont en train dêtre fransformés en environnement sans tabac avec des panneaux qui lindiquent clairement.","Report not provided","WHO African Region"
"115","Nigeria","Honorable Minister of Health announced during the 2017 WNTD immediate implementation of Prohibition of smoking in anywhere on the premises of a child care facility; educational facility; and health care facility. Other prohibited places for smoking include playgrounds; amusement parks; plazas; public parks; stadium, public transports, restaurants, bars, or other public gathering spaces.","","Answer not provided","WHO African Region"
"116","Niue","Report not provided","Report not provided","No progress made as this Article implementation awaits the passing of the draft tobacco bill within the next 2 years","WHO Western Pacific Region"
"117","Norway","As of 1 July 2017, the use of e-cigarettes is included in the smoking ban.
https://lovdata.no/dokument/NL/lov/1973-03-09-14/KAPITTEL_5#KAPITTEL_5
(especially mentioned in §28a)","As of 1 July 2014, designated smoking rooms are forbidden everywhere except in certain institutions and on oil/gas platforms offshore. All tobacco use (smoking and smokeless) on school premises, both indoors and outdoors, is forbidden. In addition, students are not allowed to use any form of tobacco products during school hours. Smoking at the entrances of public offices and both public and private health facilities, is also banned.","Amendments to the Tobacco Control Act were adopted in 2013 strengthening the legislation. 
As of 1 July 2013 a Tobacco Control Act provision states that children have the right to be protected from second hand smoking.
As of 1 July 2014 designated smoking rooms are forbidden everywhere except in certain institutions and on oil/gas platforms offshore. All tobacco use (smoking and smokeless on school premises both indoors and outdoors) is forbidden. In addition students are not allowed to use any form of tobacco products during school hours. Smoking at the entrances of public offices and both public and private health facilities is also banned.","WHO European Region"
"118","Oman","يحظرالقانون التدخين في جميع الماكن العامة المغلقة الا ان هناك موضوعين وهما:
1- يسمح القانون بتحصيص اماكن معزولة للمدحنين ضمن الاماكن المقفلة الا انه لم يتقدم الكثير لهذا الطلب بتخصيص امكاكن للمدخنين ضمن الاماكن العامة المغلقة

2-مقاهي الشيشة لا يطبق بها القانون رغم ان القانون يشملها باعتبارها اماكن عامة مغلقة","يحظرالقانون التدخين في جميع الماكن العامة المغلقة الا ان هناك موضوعين وهما:
1- يسمح القانون بتحصيص اماكن معزولة للمدحنين ضمن الاماكن المقفلة الا انه لم يتقدم الكثير لهذا الطلب بتخصيص امكاكن للمدخنين ضمن الاماكن العامة المغلقة

2-مقاهي الشيشة لا يطبق بها القانون رغم ان القانون يشملها باعتبارها اماكن عامة مغلقة","In the year 2010 laws banning smoking in public places have been issued and there are also regulations applied in Bsttina shisha shops.","WHO Eastern Mediterranean Region"
"119","Pakistan","Tobacco Control Cell is coordinating with provincial and district governments to make public places smoke-free. Letters have been sent to Provincial CMs, all Federal Secretaries and provincial Chief Secretaries to ensure enforcement of laws.

Letter has been sent to Governor, State Bank of Pakistan to make all banks smoke-free.

Islamabad has been declared first Smoke-free city. Public Parks, Health and Educational Institutions are completely smoke-free. Regarding enforcement, more than 1000 cases have been registered against the violators of TC laws (violations at public places) across Pakistan.

In order to protect youth from epidemic of Sheesha smoking and exposure to tobacco smoke, Government of Pakistan banned import of Sheesha (tobacco and non-tobacco) and related substances.","Tobacco Control Cell is coordinating with provincial and district governments to make public places smoke-free. Islamabad has been declared first Smoke-free city. Public Parks, Health and Educational Institutions are completely smoke-free. Regarding enforcement, more than 800 cases have been registered against the violators of TC laws (violations at public places) across Pakistan.","Pakistan has promulgated “Prohibition of Smoking and Protection of Non-Smoker''s Health Ordinance 2002”. Subsequently an SRO (KE 51-2009) has been issued declaring all places of public work or use listed in Section 3 of the Ordinance as Smoke Free. Pakistan has enforced the law to protect people from exposure to tobacco smoke. Awareness of authorized persons about hazards second hand tobacco was raised through development printing and dissemination of Information Education and Communication materials. More than 175000 units of IEC materials were disseminated among different segments of society. Awarness materials targetting non-smokers to protect their right to breathe in clean air have also been disseminated. Signboards at public places have been installed. Capacity of authorized persons under TC laws was built at federal provincial and district level. More than 200 sessions were conducted in which about 8000 officers were trained. This activity supported the enforcement of TC laws at public places.","WHO Eastern Mediterranean Region"
"120","Palau","RPPL 8-27 came into effect in February, 2012.  In general, there is good compliance with the smoke free provisions of the law.  Enforcement training took place in May 2013.","RPPL 8-27 came into effect in February, 2012.  In general, there is good compliance with the smoke free provisions of the law.  Enforcement training took place in May 2013.","RPPL 8-27 came into effect in February 2012. In general there is good compliance with the smoke free provisions of the law. Enforcement training took place in May 2013.","WHO Western Pacific Region"
"121","Panama","Se implementó el programa de Calidad de Aire Interior y Exterior, para el control de ambientes 100% libres de humo de tabaco, en establecimientos de interés sanitario, llevados a cabo por los inspectores de salud y los funcionarios de protección de alimentos, para el cumplimiento de la normativa del Control de Tabaco, los cuales se realizan de una manera científica y tecnológica con los medidores de partículas, Sidepak AM510, para detectar la concentración de PM 2.5, la cual es el tamaño de  las partículas de tabaco. Adicionalmente, se adquirieron equipos de mayor capacidad DUST Track que mide partículas PM 1, PM 2.5 y PM10 y PST en forma simultánea y realiza muestreo de los componentes químicos y biológicos que se encuentren en el aire. También se adquirió el equipo Tiger ION que mide componentes químicos que han sido de utilidad para la atención de quejas en establecimientos de interés sanitario. Se cuenta con equipos para medición de parámetros ambientales.

Con la adquisición de  16 unidades de SidePack para la medición de partículas PM 2.5 en el 2014, hemos logrado contar con equipos especializados que apoya la vigilancia y control de los ambientes 100% libres de humo de tabaco, pues los resultados de las mediciones se emplean para sustentar la aplicación de sanciones en aquellos establecimientos que violan la normativa existente. Se han realizado dos rondas de capacitación teórico - práctica en las 15 regiones de salud que incluyen a inspectores de saneamiento ambiental y de protección de alimentos para el uso de los equipos.  Se cuenta con una programación de inspecciones para el desarrollo de operativos acompañados de la medición de partículas a fin de valorar en forma cualitativa y cuantitativa la calidad ambiental y por ende la contaminación por tóxicos de los productos fumados de tabaco, toda vez que en ambientes cerrados la detección de partículas PM 2.5 se asocia mayormente con el consumo de tabaco.

Así mismo, se han asignado a los inspectores de saneamiento ambiental y de protección de alimentos y a la Comisión Nacional para el Control de Tabaco en Panamá, 291 cámaras fotográficas con la finalidad de que se levante evidencia documental de los hallazgos encontrados en las inspecciones y pueda ser utilizada en el proceso de aplicación de las sanciones correspondientes.

Se tiene proyectada la implementación del Programa: “Disposición Adecuada de Colillas de Tabaco”, por medio de la Comisión Nacional de Control de Tabaco en Panamá, que ha estado retrasado por gestiones administrativas. 

Este programa  se está coordinando con 11 municipalidades  del país y trata de la instalación de dispositivos de colillas de tabaco en las calles de los distritos seleccionados. También se estarán colocando  tinacos con dos mensajes claves el de prohibido fumar y el de recicla y protege el ambiente. Los mismos serán colocados en los diferentes parques de estos municipios y áreas abiertas que no incumplan la disposición de No fumar. Este programa crea  una alianza interinstitucional, como parte del cuidado del ambiente y la salud de las personas, y está orientado a disminuir la contaminación que conlleva el desecho de los filtros de tabaco (Colillas), uno de los principales contaminantes ambientales.","Se implementó el programa de Calidad de Aire Interior y Exterior, para el control de ambientes 100 % libres de humo de tabaco, en establecimientos de interés sanitario, llevados a cabo por los inspectores de salud y los funcionarios de protección de alimentos, para el cumplimiento de la normativa del Control de Tabaco, los cuales se realizan de una manera científica y tecnológica con los medidores de partículas,Sidepak Am510, para detectar la concentración de PM 2.5, la cual es el tamaño de  las partículas de tabaco.

Con la adquisición de  16 unidades de SidePack para la medición de partículas PM 2.5 en el 2014, hemos logrado contar con una herramienta que apoya la vigilancia y control de los ambientes 100% libres de humo de tabaco, pues los resultados de las mediciones se emplean para sustentar la aplicación de sanciones en aquellos establecimientos que violan la normativa existente. Se han realizado dos rondas de capacitación teórico - práctica en las 15 regiones de salud que incluyen a inspectores de saneamiento ambienta y de protección de alimentos para el uso del aparato.  Se cuenta con una programación de inspecciones para el desarrollo de operativos acompañados de la medición de partículas a fin de valorar en forma cuantitativa la calidad ambiental y por ende la contaminación por tóxicos de los productos fumados de tabaco, toda vez que en ambientes cerrados la detección de partículas PM 2.5 se asocia mayormente con el consumo de tabaco.

Adicionalmente, se han adquirido 275 computadores portátiles que se entregaron a los inspectores con una base de datos instalada para el registro de los resultados de las inspecciones, considerando todas las disposiciones que en materia de control de tabaco se aplican en el país. 

Así mismo, se han asignado a los inspectores de saneamiento ambiental y de protección de alimentos y a la Comisión Nacional para el Estudio del Tabaquismo en Panamá 291 cámaras fotográficas con la finalidad de que se levante evidencia documental de los hallazgos encontrados en las inspecciones y pueda ser utilizada en el proceso de aplicación de las sanciones correspondientes.

Se tiene proyectado la implementación del Programa: “Disposición Adecuada de Colillas de Tabaco”, por medio de la Comisión Nacional para el Estudio del Tabaquismo en Panamá, que será lanzado a nivel nacional en el marco del Día nacional de No Fumar que se conmemora el 25 de Octubre de cada año. Este programa  se está coordinando con 11 municipalidades  del país y trata de la instalación de dispositivos de colillas de tabaco en las calles de los distritos seleccionados . También se estarán colocando  tinacos con dos mensajes claves el de prohibido fumar y el de recicla y protege el ambiente. Los mismos serán colocados en los diferentes parques de estos municipios y áreas abiertas que no incumplan la disposición de No fumar. Este programa crea  una alianza interinstitucional, como parte del cuidado del ambiente y la salud de las personas (CMCT), y está orientado a disminuir la contaminación que conlleva el desecho de los filtros de tabaco (Colillas), uno de los principales contaminantes ambientales.","Recientemente hemos adquirido 16 unidades de SidePack para la medición de partículas PM 2.5. con la finalidad de mejorar la vigilancia y control de los ambientes 100% libres de humo de tabaco. A la fecha. se ha cumplido con la capacitación de los inspectores de las 14 regiones sanitarias del país en el uso del aparato y se ha elaborado un cronograma para el desarrollo de operativos acompañados de la medición de partículas a fin de valorar en forma cuantitativa la calidad ambiental y por ende la contaminación por tóxicos de los productos fumados de tabaco. toda vez que en ambientes cerrados la detección de partículas PM 2.5 se asocia mayormente con el consumo de tabaco.
Adicionalmente. acabamos de culminar la recolección de data en 20 establecimientos de la ciudad de Panamá como parte del Estudio Comparativo: Exposición al humo de segunda mano en establecimientos de hospitalidad al aire libre: Evidencia de Panamá y Uruguay. en el mismo se utiliza el monitor de nicotina colocado durante 3 jornadas laborales en personal del establecimiento y la medición de partículas PM 2.5 con el Side Pack en los ambientes abiertos y cerrados del local. durante 30 minutos en cada área en una sola toma. que coincida con los días de colocación de los monitores de nicotina. Se aplicó una encuesta a gerentes y otra a los trabajadores. A la fecha el estudio está en fase de análisis. por lo cual no contamos con resultados que podamos compartir en este informe.","WHO Region of the Americas"
"122","Papua New Guinea","There is no data but generally no smoking is observed where no smoking signs are.","There is no data but generally no smoking is observed where no smoking signs are","Emphasis is being placed on Article 8 within the updates of the Legislation and Policy","WHO Western Pacific Region"
"123","Paraguay","Se cuenta actualmente con la Ley Nº 5538/15, que reglamenta el Articulo 8 del CMCT-OMS, ademas se sigue trabajando para la promulgación de nuevas ordenanzas municipales de espacios 100x100 libres de humo de tabaco.","Se cuenta actualmente con la Ley Nº 5538/15, que reglamenta el Articulo 8 del CMCT-OMS, ademas se sigue trabajando para la promulgación de nuevas ordenanzas municipales de espacios 100x100 libres de humo de tabaco.","Se cuenta con 10 nuevas ordenanzas municipales 100x100 libre de humo de tabaco. Una de las últimas en ser promulgada ha sido el del municipio de la capital del país. Asunción.","WHO Region of the Americas"
"124","Peru","Progresivamente, las autoridades y población se esta involucrando con el cumplimiento de la ley y su modificatoria, en especial en la capitales de los departamentos del país.","Desde el año 2013 se han iniciado las inspecciones fiscalizadoras, alcanzándose 50 inspecciones de la cuales 17 se iniciaron proceso administrativo sancionador.
En el año 2014, se realizado 38 inspecciones de la cuales 9 se iniciaron proceso administrativo sancionador.
En el año 2015, se realizado 146 inspecciones de la cuales 39 se iniciaron proceso administrativo sancionador.
En lo que va del año 2016, se realizado 13 inspecciones de la cuales 1 se iniciaron proceso administrativo sancionador.","El Ministerio de Salud a través de la Dirección General de Salud Ambiental ha realizado inspecciones de prevención. difusión e implementación del Decreto Supremo N° 001-2011-SA; es así que el año 2013 ha iniciado las inspecciones fiscalizadoras a Centros Comerciales. establecimientos (restaurantes. tragamonedas. casinos y pubs en diversos distritos de Lima Metropolitana.
Asimismo se ha realizado capacitación a diferentes Municipalidades. así como al personal técnico de las Direcciones de Salud Ambiental a nivel nacional","WHO Region of the Americas"
"125","Philippines","In 2017, Philippine President Rodrigo Duterte signed the Executive Order no. 26 or ""Providing for the Establishment of Smoke-free Environments in Public and Enclosed Places."" It provided a framework which encourages local government units to implement smoke-free policies. The order prohibits smoking within enclosed public places and public conveyances. Selling, distributing or purchasing tobacco products to and from minors is also deemed unlawful. Minors are not allowed to smoke, sell or buy cigarettes or any other tobacco products. The order also makes it unlawful for anyone to order a minor to use, light up, buy, sell, distribute, deliver, advertise or promote tobacco products, a practice which is very common especially in rural areas.

At the sub-national level, there is an increasing number of Local Government Units with local ordinances on 100% smoke free environments. Efforts are being made to ensure that local ordinances are consistent with FCTC provisions. The implementation of the Red Orchid Award (ROA) served as an incentive for LGUs to pursue a 100% smoke free environment in their localities. Local ordinances consistent with the FCTC guidelines were made criteria for selection of the winning LGUs in the ROA. The DOH was able to identify LGUs with good practices on 100% smoke free environment through the ROA. As a result, a network of LGUs leading in the implementation of 100% smoke free environment was organized through the Smoke Free Cities Asean Network (SCAN).","At the sub-national level, there is an increasing number of Local Government Units with local ordinances on 100% smoke free environments. Efforts are being made to ensure that local ordinances are consistent with FCTC provisions. The implementation of the Red Orchid Award (ROA) served as an incentive for LGUs to pursue a 100% smoke free environment in their localities. Local ordinances consistent with the FCTC guidelines were made criteria for selection of the winning LGUs in the ROA. The DOH was able to identify LGUs with good practices on 100% smoke free environment through the ROA. As a result, a network of LGUs leading in the implementation of 100% smoke free environment was organized through the Smoke Free Cities Asean Network (SCAN).","Answer not provided","WHO Western Pacific Region"
"126","Poland","Reduction in the smoking of electronic cigarette and novel tobacco products analogous to the current ban on smoking tobacco in public places.","There is a regulation allowing authorities such as the police, the municipal police and sanitary inspection of fining people for violations the smoking ban.

Details are as follows:

The Act of 9 November 1995 on protecting health from consequences of consumption of tobacco and tobacco products.
According to art. 5  sec. 1 of above mentioned act it is forbidden to smoke tobacco products:
1.	on the area of the healthcare providers and in the rooms of other objects, in which care services are provided,
2.	in schools and social care facilities which are mentioned in regulations on the educational and social care system,
3.	in universities,
4.	in rooms of other workplaces than mentioned in point 1 and 2,
5.	in public objects for culture and leisure,
6.	in catering-entertainment objects,
7.	in public transport and in objects of passengers service,
8.	at stops of the public transport,
9.	in sport objects,
10.	in public places intended for children amusement,
11.	in other rooms of public use.
Moreover, according to art. 13 sec. 2, who smokes tobacco products in places prohibited by art.5 sec. 1 shall be subject to the penalty up to 500 zl. It is not a new regulation (in the reporting period 2014-2016 there were no changes in this matter).","The proportion of people exposed to tobacco smoke in public places decreases regularly","WHO European Region"
"127","Portugal","Since 1st january 2018 it is not allowed to smoke heat-not-burn or eletronic cigarettes in the same places where smoking is not allowed. This measure was introduced by the second revision to the tobacco law (63/2017 of August 3).

This new law included in the concept of smoking all tobacco products that produce aerosols, vapors, gases or particles and reinforcing the measures to be applied to these new products, with regard to the protection of environmental tobacco smoke, advertising and promotion, as well as a total ban on smoking in oudoor playgrounds and holiday camps.

The first and second amended to the tobacco law - Law 109/205 of August 26 and Lam 63/2017 os August 3 -  introduced some progresses, but not yet a full ban of smoking in all public paces. Until 2020 it will be possible to mantain smoking areas already in place in the 1st of january 2016, according to the previous law (transitional períod), in work places, restaurantes, pubs bars, discos, aeroports, show rooms, fairs and exhibitions bingos and casinos.
In new establishments or after 2020 it will be possible to crate smoking rooms - with negative pressure - in restaurants, pubs and bars, casinos and bingos, fairs and exibhitions, hotels, shopping malls and aeroports. the acess to this new smoking areas is not alloed to minors. Service of meals will not be allowed.","The new tobacco law - Law 109/205 de 26th august introduced some progresses, but not yet a full ban of smoking in all public paces. Until 2020 it will be possible to mantain smoking areas already in place in the 1st of january 2016, according to the previous law (transitional períod), in work places, restaurantes, pubs bars, discos, aeroports, show rooms, fairs and exhibitions bingos and casinos.
In new establishments or after 2020 it will be possible to crate smoking rooms - with negative pressure - in restaurants, pubs and bars, casinos and bingos, fairs and exibhitions, hotels, shopping malls and aeroports. the acess to this new smoking areas is not alloed to minors. Service of meals will not be allowed.","The 2007 tobacco law imposed more restrictive measures regarding smoking inside public places and transports. This law entered into force on 1 January 2008. The overall accomplishment is good. Smoke free regulations in bars pubs and other nightclubs are less well accomplished.","WHO European Region"
"128","Qatar","Prohibition of designation smoking areas
Prohibiting smoking while driving with a child less than 18 years of age","submitting a strong bylaws to the cabinets that has bylaw regarding prohibiting smoking while driving with a child less than 18 years of age","An intensive campaign against smoking in enclosed places frequented by the public is run since 2010 in order to protect non-smokers from the dangers of passive smoking.","WHO Eastern Mediterranean Region"
