"86","Kyrgyzstan","Report not provided","Основание:  технический регламент Таможенного союза   на табачную продукцию, принятой Решением Евразийской экономической комиссией 12 ноября 2014 года №107","Answer not provided","WHO European Region"
"87","Lao People's Democratic Republic","The Health Minister Regulation was issued on 23 May 2016 required tobacco industries to report on the tobacco products disclosure.","The regulation was issued on 23 May 2016 required tobacco industries to report on the tobacco products disclosure. This information will be reported in the next report.","Answer not provided","WHO Western Pacific Region"
"88","Latvia","The draft law has been prepared to transpose the provisions of the TPD.","The draft law has been prepared to transpose the provisions of the TPD.","No changes in the procedure regulating tobacco product disclosures have been introduced past two years.","WHO European Region"
"89","Lebanon","Answer not provided","Answer not provided","Law 174 states that tobacco product manufacturers or importers are required to inform the Lebanese Regie/Ministry of Finance for about the use of quantitative and qualitative statements on tobacco products concerning constituents and emissions such as tar. nicotine and carbon monoxide yields.","WHO Eastern Mediterranean Region"
"90","Lesotho","Report not provided","Report not provided","Answer not provided","WHO African Region"
"91","Liberia","Answer not provided","Answer not provided","Report not provided","WHO African Region"
"92","Libya","Answer not provided","Answer not provided","Answer not provided","WHO Eastern Mediterranean Region"
"93","Lithuania","Answer not provided","Answer not provided","Answer not provided","WHO European Region"
"94","Luxembourg","Implémentation du portail EU-CEG de la Commission Européenne, pour les déclarations de la compostion de produits du tabac et cigarettes électronique.
Actuellement étude de la faisabilité, pour afficher les déclarations des ingrédients des produits du tabac et cigarette électronqie de la part des fabricanrs dans un portail de communication au public.","Answer not provided","Answer not provided","WHO European Region"
"95","Madagascar","des sensibilisations auprès des publics sont faites par les masses médias et les ONG afin de leur informer sur les constituants toxiques des produits du tabac","des sensibilisations auprès des publics sont faites par les masses médias et les ONG afin de leur informer sur les constituants toxiques des produits du tabac","Answer not provided","WHO African Region"
"96","Malaysia","Answer not provided","Answer not provided","Answer not provided","WHO Western Pacific Region"
"97","Maldives","No progress. The regulation developed to cover Article 9, remains unpublished pending government approval","No progress. The regulation developed to cover Article 9, remains unpublished pending government approval","The provisions of Article 10 are not implemented. Regulations relating to this have been in the process for over 2 years. However due to industry influence it has not been ratified still. Maldives is seeing more and more resistant to the steps that need to be taken against tobacco in the past few years.","WHO South-East Asia Region"
"98","Mali","Answer not provided","Answer not provided","Articles 11 à 13 de la régulation sur l’application de la Loi 2010.","WHO African Region"
"99","Malta","Legislation implemented.","Legislation implemented.","Legislation implemented.","WHO European Region"
"100","Marshall Islands","SEE PREVIOUS COMMENTS","SEE PREVIOUS COMMENTS","The regulations have not been developed and therefore the Act has not been implemented.
There are no regulations that accompany the legislation to specify the scope of harmful constituents and emissions that are to be disclosed.","WHO Western Pacific Region"
"101","Mauritania","-Tout est bien prévu dans le projet de loi qui attend encore ladoption par le parlement","-","Answer not provided","WHO African Region"
"102","Mauritius","Answer not provided","Answer not provided","Answer not provided","WHO African Region"
"103","Mexico","Existe una normatividad que señala la obligación de las tabacaleras de informar sobre los contenidos de sus productos de tabaco y publicar en el empaquetado lo relativo a nicotina, monóxido de carbono y alquitrán, sin embargo no existen reglamentaciones sobre las concentraciones máximas que deben tener dichos productos.","Existe una normatividad que señala la obligación de las tabacaleras de informar sobre los contenidos de sus productos de tabaco y publicar en el empaquetado lo relativo a nicotina, monóxido de carbono y alquitrán, sin embargo no existen reglamentaciones sobre las concentraciones máximas que deben tener dichos productos.","- Emisión y publicación de la Ley General para el Control del Tabaco. publicada en el Diario Oficial de la Federación el 30 de mayo de 2008. Dichas disposiciones normativas que efectivamente impulsan la lucha contra el consumo y exposición al humo del tabaco. reuniendo en un sólo cuerpo normativo la serie de acciones legislativas sugeridas por el CMCT y la evidencia científica que lo apoya. En este sentido. dicha normatividad representa una mayor responsabilidad del gobierno para la aplicación de las medidas interinstitucionales para el control del tabaco. situación prevista en la Ley Orgánica de la Administración Pública Federal. 
- Emisión y publicación del Reglamento de la Ley General para el Control del Tabaco. publicado en el Diario Oficial de la Federación el 31 de mayo de 2009.Instrumento normativo de carácter técnico que tiene por objetivo lograr la aplicación y ejecución de la Ley General para el Control del Tabaco. regulando aspectos técnicos y específicos que permitan proteger la salud de la población evitando su exposición al humo del tabaco. prevenir el inicio del hábito del tabaquismo. promover y apoyar el abandono y lograr una reducción del consumo de productos de tabaco en cualquiera de sus formas","WHO Region of the Americas"
"104","Micronesia (Federated States of)",NA,NA,"Answer not provided","WHO Western Pacific Region"
"105","Mongolia","The legal entity producing tobacco shall be responsible for the following provisions on tobacco control:
The name, address, business activities, and other related information of the tobacco industry and its share holders owning more than 20 percent shall be made available and transparent to the public at their web sites;

 Any standards set by the authorized organization regarding tobacco boxes, pack and packages shall be fulfilled within one year from the day of endorsement.

It shall be prohibited to provide financial, material aids and contributions to social, health, welfare and environmental organizations by the tobacco industry or through another
organizations under the name of “Social responsibility”.","Report not provided","The legal entity producing tobacco shall be responsible for the following provisions on tobacco control:

The name address business activities and other related information of the tobacco industry and its shareholders owning more than 20 percent shall be made available and transparent to the public at their web sites;

 Any standards set by the authorized organization regarding tobacco boxes pack and packages shall be fulfilled within one year from the day of endorsement.

It shall be prohibited to provide financial material aids and contributions to social health welfare and environmental organizations by the tobacco industry or through another
organization under the name of “Social responsibility”.","WHO Western Pacific Region"
"106","Montenegro","All manufacturers and importers of tobacco products are required to submit to the subjects (the Institute of Public Health) by the Government information on the contents and emissions of tobacco products. However, due to the impossibility of adequate controls, for the reasons stated  in the same part, can not be done in connection with the evaluation of the above information","All manufacturers and importers of tobacco products are required to submit to the subjects (the Institute of Public Health) by the Government information on the contents and emissions of tobacco products. However, due to the impossibility of adequate controls, for the reasons stated  in the same part, can not be done in connection with the evaluation of the above information","All manufacturers and importers of tobacco products as specified in section 3.2.3.5. are required to submit to the subjects (the Institute of Public Health) by the Government information on the contents and emissions of tobacco products. However due to the impossibility of adequate controls for the reasons stated in the same part can not be done in connection with the evaluation of the above information.","WHO European Region"
"107","Myanmar","“The Control of smoking and consumption of tobacco product law” doesn’t include the obligation regarding the disclosure of contents and emissions of the tobacco products to government authorities or public by the manufacturers or importers. There is also no other regulation yet requiring the disclosure of contents and emissions of the tobacco products.","“The Control of smoking and consumption of tobacco product law” doesn’t include the obligation regarding the disclosure of contents and emissions of the tobacco products to government authorities or public by the manufacturers or importers. There is also no other regulation yet requiring the disclosure of contents and emissions of the tobacco products.","“The Control of smoking and consumption of tobacco product law” doesn''t include the obligation regarding the disclosure of contents and emissions of the tobacco products to government authorities or public by the manufacturers or importers. There is also no other regulation yet requiring the disclosure of contents and emissions of the tobacco products.","WHO South-East Asia Region"
"108","Namibia","Report not provided","Report not provided","Report not provided","WHO African Region"
"109","Nauru","Report not provided","Answer not provided","Report not provided","WHO Western Pacific Region"
"110","Nepal","Answer not provided","Report not provided","Answer not provided","WHO South-East Asia Region"
"111","Netherlands","From May 20th 2016 the industry has to submit information about contents and emissions of tobacco products in the EU Common Entry Gate System. Besides this, the industry has to submit health risks reports and market research.","The industry is obliged to submit ingredients list every year in EMTOC. 
From May 20th 2016 the industry will submit the information in the EU Common Entry Gate (and no longer EMTOC). Besides the ingredients, the industry has to submit health risks reports and market research.","In December 2012 the National Institute for Public Health launched www.tabakinfo.nl a comprehensive website with a databank and information on tobacco products and its ingredients. As part of a European project the National Institute for Public Health and the Environment researched certain additives which has led to the so called PITOC which are also published and used on the website. The website is currently being evaluated.
 A database with information on additives in tobacco products aimed at youngsters will be launched shortly: www.watziterintabak.nl","WHO European Region"
"112","New Zealand","No changes since the 2016 report.","No change since the 2014 report","Answer not provided","WHO Western Pacific Region"
"113","Nicaragua","Answer not provided","Answer not provided","Report not provided","WHO Region of the Americas"
"114","Niger","Report not provided","Answer not provided","Report not provided","WHO African Region"
"115","Nigeria","The Nigerian Industrial Standard for tobacco and tobacco products has provision that
requires every manufacturer, distributor or importer operating in Nigeria to submit to
Standards Organisation of Nigeria (SON) within the month of December of each year
under reference, in print or in electronic form, the following information in addition to
requirements in Appendix A;
-General product information
-Cigarette design features
-Tobacco chemistry.
-Smoke chemistry (See details in clauses 4, 5 and Appendix A of the Standard)","The Nigerian Industrial Standard for tobacco and tobacco products has provision that
requires every manufacturer, distributor or importer operating in Nigeria to submit to
Standards Organisation of Nigeria (SON) within the month of December of each year
under reference, in print or in electronic form, the following information in addition to
requirements in Appendix A;
-General product information
-Cigarette design features
-Tobacco chemistry.
-Smoke chemistry (See details in clauses 4, 5 and Appendix A of the Standard)","The Nigerian Industrial Standard for tobacco and tobacco products has provision that requires every manufacturer distributor or importer operating in Nigeria to submit to Standards Organization of Nigeria (SON) within the month of December of each year under reference in print or in electronic form the following information in addition to requirements in Appendix A;
-General product information
-Cigarette design features
-Tobacco chemistry.
-Smoke chemistry (See details in clauses 4 5 and Appendix A of the Standard","WHO African Region"
"116","Niue","Report not provided","Report not provided","Answer not provided","WHO Western Pacific Region"
"117","Norway","There is an ongoing process implementing the EU Tobacco Products Directive 2014/40/EU that will contribute to the regulation of tobacco product disclosures. Entry into force in Norway expected January 2019.","There is an ongoing process implementing the EU Tobacco Products Directive 2014/40/EU that will contribute to the regulation of tobacco product disclosures. Entry into force 2016/17.","Answer not provided","WHO European Region"
"118","Oman","لا يوجد","لا يوجد","Answer not provided","WHO Eastern Mediterranean Region"
"119","Pakistan","Finance Act 2005 prescribes that no cigarettes factory shall clear cigarettes unless they conform to the health standards prescribed by the federal government. This provision has not been operationalized in view of the absence of internationally accredited laboratory system capable of accurately testing and reporting tobacco products in Pakistan. GoP is actively following international developments on the matter. 

We are also looking forward to the evolution of the proposed global database regarding tobacco product contents and emission disclosure. We are considering the option of earmarking special funds to set up internationally accredited laboratory in Pakistan to test the contents and emissions, as has been done by some countries in the Region","Finance Act 2005 prescribes that no cigarettes factory shall clear cigarettes unless they conform to the health standards prescribed by the federal government. This provision has not been operationalized in view of the absence of internationally accredited laboratory system capable of accurately testing and reporting tobacco products in Pakistan. GoP is actively following international developments on the matter. 

We are also looking forward to the evolution of the proposed global database regarding tobacco product contents and emission disclosure. We are considering the option of earmarking special funds to set up internationally accredited laboratory in Pakistan to test the contents and emissions, as has been done by some countries in the Region","Finance Act 2005 prescribes that no cigarettes factory shall clear cigarettes unless they conform to the health standards prescribed by the federal government. This provision has not been operationalized in view of the absence of internationally accredited laboratory system capable of accurately testing and reporting tobacco products in Pakistan. GoP is actively following international developments on the matter. 
We are also looking forward to the evolution of the proposed global database regarding tobacco product contents and emission disclosure. We are considering the option of earmarking special funds to set up internationally accredited laboratory in Pakistan to test the contents and emissions as has been done by some countries in the Region.","WHO Eastern Mediterranean Region"
"120","Palau","little progress to report at this time","little progress to report at this time","Answer not provided","WHO Western Pacific Region"
"121","Panama","Revisar  los detalles del punto C 237","Revisar  los detalles del punto C 237","En la actualidad está normada la colocación en el empaquetado de algunos de los contenidos y emisiones de los productos de tabaco. En el caso de los cigarrillos cada año. la IT debe presentar un informe sobre los contenidos y emisiones de sus productos . sin embargo no existen mecanismos de verificación.","WHO Region of the Americas"
"122","Papua New Guinea","The current law requires this information. Implementation will commence after the regulation is being endorsed.","Efforts are put in now to regulate this","Still working on the legislation and the enforcement unit on tobacco control.","WHO Western Pacific Region"
"123","Paraguay","La  Ley Nº 5538/15 en su Capitulo VIII Articulo 23, inciso f) los fabricantes deberán proveer a la autoridad sanitaria y al publico acerca de los ingredientes utilizados en los productos elaborados con tabaco.","La nueva Ley Nº 5538/15 en su Capitulo VIII Articulo 23, inciso f) los fabricantes deberán proveer a la autoridad sanitaria y al publico acerca de los ingredientes utilizados en los productos elaborados con tabaco.","El Art. 7 de la resolución 237. establece la obligatoriedad de la declaración jurada de la
composición físico química del producto de tabaco.","WHO Region of the Americas"
"124","Peru","","Answer not provided","Answer not provided","WHO Region of the Americas"
"125","Philippines","Answer not provided","Answer not provided","Answer not provided","WHO Western Pacific Region"
"126","Poland","Poland has adopted Article 5 of the Directive 2014/40/EU. Pursuant to Article 8a of the Polish Act implementing TPD the manufacturer or importer of tobacco products shall submit to the Inspector of Chemical Substances one-off information, indicating the brand and type, referring to:
1)	a list of all ingredients, and quantities thereof, used in the manufacture of the a tobacco product, in descending order of the weight of each ingredient included in a given tobacco product;
2)	the levels of emissions referred to in Article 10(1), and the levels of other emissions laid down in the provisions, referred to in Article 10(10);
3)	other emissions by tobacco products and their levels, if they are available.
The manufacturer or importer of tobacco products shall immediately inform the Inspector of changes in the composition of the tobacco product which impact the information specified above. For new or modified tobacco products, the one-off information shall be submitted to the Inspector 6 months prior to the date of placing on the market of those products.
Moreover the list of ingredients shall be supplemented by the following:
1)	a statement setting out the reasons for the inclusion of such ingredients in the tobacco products, together with information as to whether the ingredients have been registered pursuant to Regulation (EC) No 1907/2006, as well as their classification pursuant to Regulation (EC) No 1272/2008 of the European Parliament and of the Council of 16 December 2008 on classification, labelling and packaging of substances and mixtures, amending and repealing Directives 67/548/EEC and 1999/45/EC, and amending Regulation (EC) 1907/2006 (OJ L 353, 31.12.2008, p. 1, as amended);
2)	the relevant toxicological data regarding the ingredients in burnt or unburnt form, as appropriate, referring in particular to their effects on the health of consumers and taking into account, in particular, any addictive effects;
3)	a technical document setting out a general description of the additives used and their properties - for cigarettes and roll-your-own tobacco.
Furthermore Poland  has implemented enhanced reporting obligations in regards to the priority additives (Article 6 of TPD).  
A priority list of additives contained in cigarettes and roll-your-own tobacco is laid down in the Commission Implementing Decision (EU) 2016/787 of 18 May 2016 laying down a priority list of additives contained in cigarettes and roll-your-own tobacco subject to enhanced reporting obligations (OJ L 131, 20.5.2016, p. 88).
Pursuant to Article 8aa implementing the Article 6 of TPD the manufacturer and importer of cigarettes and roll-your-own tobacco containing an additive which appears on the list shall carry out a comprehensive study which shall examine whether the additive:
1)	contributes to the toxicity or addictiveness of the products concerned, and whether this has the effect of increasing the toxicity or addictiveness of any of the products concerned to a significant or measurable degree;
2)	results in a characterising flavour;
3)	facilitates inhalation or nicotine uptake;
4)	leads to the formation of substances that have CMR properties, with the quantities thereof provided, and whether this has the effect of increasing the CMR properties in any of the products concerned to a significant or measurable degree.
3The studies shall take into account the intended use of the products concerned and examine in particular the emissions resulting from the combustion process involving the additive concerned and the interaction of that additive with other ingredients contained in the products concerned.","Answer not provided","year=2013&act=1","WHO European Region"
"127","Portugal","No progresso to report.

Portugal applies the Directive 2014/40 of 3th April of the Parliament and the European Council, transposed by the law 109/2015 of 26th of August. This Directive follows the FCTC recommendations for the implementation of article 9 and 10, namely the ban on characterising flavours in cigarettes and RYO. However, these prohibition do not include additives which are essential for manufacture of tobacco products. Certain additives like vitamins, stimulants,  additives with colouring properties for emissions, that facilitate smoke inhalation, or have carcinogenic, mutagenic or reprotoxic  (CMR) properties in unburnt form, are prohibited in all tobacco products. Flavours in components of the tobacco products like filters, papers, packages, capsules, are prohibited in cigarettes and RYO.  Menthol flavour will be authorized until the end of 2020. The producers and tobacco importers have the obligation to disclose all tobacco ingredients to the General Directorate of Health. This entity has the obligation to disclosure the non confidential ingredients information to the public. 
A legal act to regulate the market entry of novel tobacco products is being discussed, but not yet published","The new tobacco law - Law 109/2015 - transposed the European Union Tobacco Products Directive (directive 2014/40 of 3th april, from the Parliament and the Council). According to this Directive new dispositions will be introduced in 1st January 2016: There are more notification of ingredients obligations, not only addictives, as in the past, but all tobacco ingredients including the tobacco leaf. must be notified in a european union common format. all the information without trade secret must be public in the oficial website of the General Directorate of Health.

Portugal applies the Directive 2014/40 of 3th April of the Parliament and the European Council, transposed by the law 109/2015 of 26th of August. This Directive follows the FCTC recommendations for the implementation of article 9 and 10, namely the ban on characterising flavours in cigarettes and RYO. However, these prohibition do not include additives which are essential for manufacture of tobacco products. Certain additives like vitamins, stimulants,  additives with colouring properties for emissions, that facilitate smoke inhalation, or have carcinogenic, mutagenic or reprotoxic  (CMR) properties in unburnt form, are prohibited in all tobacco products. Flavours in components of the tobacco products like filters, papers, packages, capsules, are prohibited in cigarettes and RYO.  Menthol flavour will be authorized until the end of 2020. The producers and tobacco importers have the obligation to disclose all tobacco ingredients to the General Directorate of Health. This entity has the obligation to disclosure the non confidential ingredients information to the public.","Answer not provided","WHO European Region"
