"70","Honduras","El IHADFA en los últimos dos años ha continuado su labor de vigilancia permanente de aplicación de lo dispuesto en el Artículo 13 del CMCT de la OMS en lo referente al cumplimiento de la industria de tabaco en la publicidad, promoción y patrocinio del tabaco a nivel nacional.","El IHADFA en los últimos dos años ha continuado su labor de vigilancia permanente de aplicación de lo dispuesto en el Artículo 13 del CMCT de la OMS en lo referente al cumplimiento de la industria de tabaco en la publicidad, promoción y patrocinio del tabaco a nivel nacional.","El Instituto Hondureño para la Prevención del Alcoholismo. Drogadicción y Farmacodependencia IHADFA en cumplimiento del Artículo 12 del CMCT y de acuerdo a lo estipulado en la Ley Especial para el Control del Tabaco ha dado seguimiento a lo estipulado sobre la prohibición de publicidad. promoción y patrocinio del tabaco a nivel nacional.","WHO Region of the Americas"
"71","Hungary","Report not provided","Answer not provided","According to Law No 49 of 2008 (Section 19) the advertising of tobacco products is prohibited. The prohibition also applies to any indirect advertising of tobacco products. Indirect advertising of tobacco products shall. in particular. mean:
a) when. although it does not specify a tobacco product. it is aimed at advertising a tobacco product by using any other marking or trademark that can be related to the tobacco product in question;
b) when it presents a tobacco product under the name. marking or trademark of another product;
c) when it presents another product under the name. marking or trademark of a tobacco product.
The advertising of a product whose name. marking or trademark is the same as that of a tobacco product shall not be deemed as the advertising of a tobacco product. provided that the name. marking or trademark of such product is clearly distinguishable from that of the tobacco product. According to Section 20 the Sponsorship of tobacco products shall be prohibited a) in connection with events or activities involving or taking place in several Member States of the European Economic Area or otherwise having cross-border effects; b) in connection with sporting and cultural events. or events or activities relating to health care; c) in connection with events and activities organized by political parties.(2) Tobacco companies shall publish the amount of their spending on advertisements and sponsorship during the current year on or before 31 March of the following year on their website and in at least two national daily newspapers. 
As the result of the Act CXXXIV of 2012 on „Reducing Smoking Prevalence among Young People and Retail of Tobacco Products”. on the outer walls of the tobacco store it is prohibited to display any picture or visualization relating to tobacco products or smoking.","WHO European Region"
"72","Iceland","Answer not provided","Answer not provided","Answer not provided","WHO European Region"
"73","India","Report not provided","Vide circular dated 30th May, 2014, Central Board of Secondary Education (CBSE) has advised all the schools under its affiliation not to allow its student to participate in events sponsored by any firms or by subsidiary of a firm that promotes the use of tobacco in any form and further directed school students not to accept any prize or scholarship instituted by tobacco industry.

Ministry of Health & family Welfare organised a meeting with the Ministry of Information and Broadcasting on the issue of surrogate advertisements under the Cable Television Networks (Regulation) Act, 1995 (CTNA). 
Ministry of Health & Family Welfare has also been in talks with the Ministry of corporate affairs  on the issue of violation of Article 13 by the Corporates under the New Companies Act of 2013 (India) which mandates all companies to spend 2% of their profits for CSR activities.","Implementation of Rules at Points of Sale (POS) : Hon''ble Supreme Court vide order dated 22.07.2013 set aside the stay granted by Hon''ble High Court of Bombay on the Rules related to regulation of advertisement of tobacco products at Points of Sale (POS) and issued directions to the Central and State Government to rigorously implement COTPA. 2003 and the 2004 Rules therein with its amendments. The Hon''ble Supreme Court''s order removed the impediments to an effective implementation of the Rules related to regulation of advertisement at Points of Sale. 
Secretary (Health & Family Welfare) sent an advisory to the Chief Secretaries and Director General of Police in  States and Union Territories to implement the 2003 Act and the Rules framed in 2004 and its subsequent amendments.
Regulation of tobacco products or their use in Films & TV Programmes: The Cigarettes and other Tobacco Products (Prohibition of Advertisement and Regulation of Trade and Commerce. Production. Supply and Distribution) (Second Amendment) Rules. 2011 notified vide GSR no. 786(E) dated 27-10-11 and subsequently amended vide GSR no. 708(E) dated 21-9-2012.came into effect from 2nd October. 2012 and has provisions to regulate the use of Cigarettes and other tobacco products in films and TV programmes. As per the Rules every film  or TV programme which depict tobacco product or their use shall provide 100 seconds of free airtime for two spots of ''30 second'' duration and general disclaimer of ''20 second'' duration in the beginning and middle of the films /TV Programmes . 
A sensitisation workshop was organised for members of films fraternity and production houses on the need to regulate the depiction of tobacco products in films and TV Programmes. Key personalities and big production houses participated in this workshop.","WHO South-East Asia Region"
"74","Iran (Islamic Republic of)","Adding flavor to tobacco has been considered as a symbol of advertisement in the national guidelines 
in response to the Tobacco industries complaints the national supreme council of justice has been confirmed the national guidelines and rejected their claims","Answer not provided","The Act (Articles 3 10 and 15) and the Bylaw (Articles 2 to 6 and 10) comprehensively ban all tobacco advertising promotion and sponsorship including both direct and indirect tobacco advertising promotion and sponsorship. The provisions of the Bylaw (Articles 2–6) specify the banning of various forms of indirect advertisements including the use of trade names and trademarks sales in a manner that promotes publicity grants of any aid 23 

assistance and support financial or other forms of incentives and promotional items. Article 10 of the Bylaw has prohibited sales of tobacco through the Internet and automatic vending machines which also have the effect of banning indirect advertisements. 
Article 10 of the Act imposes fines for violations of the law. In addition to that punishment the courts are obliged to order the confiscation of the products that are the objects of the advertisements. The Act further requests the Cabinet to revise the minimum and maximum levels of fines every three years on the basis of the official inflation rate. 
The HQ coordinates with the Ministry of Industry Mine and Trade the I. R. Iran Broadcasting (I.R.I.B) and the Department of Law Enforcement (Police) etc. in implementing this obligation. The I.R.I.B plays a key role and has established the Health Council to supervise the implementation of the comprehensive ban on tobacco advertising in all types of media generated from I.R. Iran''s territory. The I.R.I.B has also successfully banned the indirect advertising of tobacco via electronic media such as radio movies and television shows. The I.R.I.B has operated a routine monitoring mechanism to cut depictions of tobacco use the media under its authority. 
It was reported in the joint needs assessment meetings that compliance with the comprehensive ban on tobacco advertising promotion and sponsorship has been very satisfactory.","WHO Eastern Mediterranean Region"
"75","Iraq","Answer not provided","Answer not provided","The law against smoking prevents advertising and promotion of tobacco products directly or indirectly. It has been coordinated with the relevant authorities for the purpose of removing all the publicity that promote tobacco products from the squares and the streets and roofs of commercial buildings as well as shops and not allowed to renew the licenses of those who violate the law.","WHO Eastern Mediterranean Region"
"76","Ireland","Answer not provided","Answer not provided","Answer not provided","WHO European Region"
"77","Israel","Report not provided","Report not provided","Report not provided","WHO European Region"
"78","Italy","Answer not provided","Answer not provided","Answer not provided","WHO European Region"
"79","Jamaica","Under Jamaicas Radio Diffusion and Redistribution Act, there is a prohibition on Tobacco advertising, and promotion on television, radio and in cinemas. There has been an increase in advertising and promotion through other medium. There is also an increase in sponsorship over the last two years. The Ministry of Health continues to sensitize other ministries, departments and agencies. This Article will also be addressed comprehensively under the comprehensive tobacco control legislation.","Under Jamaicas Radio Diffusion and Redistribution Act, there is a prohibition on Tobacco advertising, and promotion on television, radio and in cinemas. Otherwise there has been voluntary restriction of TAPS by the tobacco industry for print media targeting children. There are no restrictions on sponsorship.","There is a restriction on Tobacco advertising and promotion on television radio and in cinemas. Otherwise there has been voluntary restriction of TAPS by the tobacco industry for print media targeting children. There are no restrictions on sponsorship.","WHO Region of the Americas"
"80","Japan","Answer not provided","Answer not provided","Answer not provided","WHO Western Pacific Region"
"81","Jordan","تقوم وزارة الصحة والحكومة الاردنية بمنع الترويج والدعاية على شبكة الانترنت وخاصة على المواقع الالكترونية الاردنية والاعلان على شبكة التواصل الاجتماعي ومتابعة جميع الصحف والمجلات ومنع دخول المنتجات الا ضمن المواصفة الاردنية ومنع الدعاية والترويج والرعاية ضمن الامكانيات المتوفرة","تقوم وزارة الصحة والحكومة الاردنية بمنع الترويج والدعاية على شبكة الانترنت وخاصة على المواقع الالكترونية الاردنية ومتابعة جميع الصحف والمجلات ومنع دخول المنتجات الا ضمن المواصفة الاردنية ومنع الدعاية والترويج والرعاية ضمن الامكانيات المتوفرة","Fines applied to violators were increased in the areas of advertising and promotion of tobacco products within the scope of the Public Health Act No. 47 of 2008 and request the World Health Organization and the Arab League to hold conventions to control this issue without access to the result of this.","WHO Eastern Mediterranean Region"
"82","Kazakhstan","Answer not provided","Report not provided","Since January 2008 the Law ''On Advertising'' has introduced a ban on tobacco advertising in one line without specifying locations. Since then no innovations regarding the ban on tobacco advertising was not introduced. Sponsorship still permitted.","WHO European Region"
"83","Kenya","Answer not provided","Answer not provided","The Law comprehensively bans domestic and cross-border direct and indirect tobacco advertising promotion and sponsorship","WHO African Region"
"84","Kiribati","Prohibit under the Tobacco Control Act 2013","Prohibit under the Tobacco Control Act 2013","Prohibited under the Tobacco Act 2013. Complete ban of tobacco advertising promotion and sponsorship was implemented.","WHO Western Pacific Region"
"85","Kuwait","discussion at the GCC level and the EMRo level","discussion at the GCC level and the EMRo level","Answer not provided","WHO Eastern Mediterranean Region"
"86","Kyrgyzstan","Report not provided","Answer not provided","Answer not provided","WHO European Region"
"87","Lao People's Democratic Republic","The Prime Minister decree 2010 bans all form of advertising, promotion and sponsorship except points of sale and CSR.
 Minister of Health regulation bans tobacco advertising at points of sale and CSR, but pack display is allowed.","The Prime Minister decree 2010 bans all form of advertising, promotion and sponsorship except points of sale and CSR.
 Minister of Health regulation bans tobacco advertising at points of sale and CSR, but pack display is allowed.","Art. 13 has been implemented accordance with the TC Law however the difficulties is with the POS advertising which is still an exception in the TC Law.","WHO Western Pacific Region"
"88","Latvia","Answer not provided","The term ""tobacco advertising"" had been amended in 2014 to include names (slogans), shapes, images, colors, lights and sound effects] used in shops while displaying tobacco products is also regarded as advertising. A draft law has been prepared to transpose the provisions of the TPD regarding advertising and sponsorship related to electronic cigarettes and e-liquids. No new initiatives.","Answer not provided","WHO European Region"
"89","Lebanon","Answer not provided","Answer not provided","Law 174 banned all forms of tobacco advertising. promotion and sponsorship. It states the following:
All kinds of advertisements and promotional elements for tobacco products. tobacco brands. logos or trademarks are totally prohibited unless they respect the conditions and terms stipulated in the present law and in its implementation decrees. 
It is also prohibited to produce. import. promote. sell or display all kinds of products that represent or imply to. in any way. tobacco products. such as and not solely. food items. candies. sweets and toys. especially those intended for the use by minors. 
All manufacturers. importers. wholesalers. retailers or distributors are prohibited to give for free. to the buyer of any tobacco product or its derivatives. any gift bearing the logo. any distinguishing mark. any trademark or even the right to participate in a draw or any other competition. 
It is prohibited to publish or broadcast. for free or in exchange for something. by any written or audiovisual media outlet. or by any other electronic or informational means and all media related mechanisms and means. any publicity or advertisement. program or article that can be considered as an advertisement or publicity of any tobacco products. 
It is prohibited to post advertising on the roads through ads on billboards or on the roofs of buildings and shop fronts. and generally by any means visible for pedestrians in public places. It is totally prohibited to provide sponsorship for any kind of cultural. sport or commercial events.","WHO Eastern Mediterranean Region"
"90","Lesotho","Report not provided","Report not provided","Answer not provided","WHO African Region"
"91","Liberia","Answer not provided","Answer not provided","Report not provided","WHO African Region"
"92","Libya","هناك تقييد تام لعدم الإعلان  والترويج في اطار الدولة عدا نقاط البيع","هناك تقييد تام لعدم الإعلان  والترويج في اطار الدولة عدا نقاط البيع","There is not full compliance with the advertising rules except in any POS.","WHO Eastern Mediterranean Region"
"93","Lithuania","The amendment of the Law on Tobacco Control was adoped in 2016.
Article 17. Prohibition of the Advertising of Tobacco Products
1. The advertising of tobacco products (hereinafter - advertising), with the exception of cases
referred to in paragraph 2 of the Article herein, as well as hidden advertising of tobacco products shall
be prohibited in the Republic of Lithuania.
2. The ban on advertising shall not apply to the following:
1) The information referred to in paragraph 3 of the Article herein, displayed in retail outlets
where tobacco products are sold to the consumer;
2) Publications that are intended exclusively for the specialists (professionals) of the tobacco
industry, as well as publications published and distributed in the states which are not party to the
European Economic Area Agreement, and where these publications are not intended for the market of
the European Community;
3) The registered names and trademarks of the legal entities or branches of foreign legal
entities manufacturing tobacco products (where the name of the tobacco product, the name of the
manufacturer or tobacco products or the trademark is an integral part of the registered name of these
legal entities or branches of foreign legal entities), where these names and trademarks are presented on
the signboards placed on the buildings of the registered offices or branches of these legal entities or
branches of foreign legal entities. Only the registered names of the legal entities or branches of foreign
legal entities engaged in the manufacturing or sale of tobacco products may be displayed on the
vehicles operated by these legal entities or branches of foreign legal entities.

3. Only the following information may be displayed on tobacco display equipment at retail
outlets:
1) The name and the registered address of the manufacturer and/or the seller;
2) The names of tobacco products sold;
3) The words “For sale” or “Sold here”;
4) The prices of tobacco products.
4. Information (warnings) regarding the harmful effects of tobacco consumption on health and
the prohibition on the sale of tobacco products to persons under 18 years of age shall be displayed at
retail outlets in the manner prescribed by the institution authorized by the Government of the Republic
of Lithuania.
5. The information referred to in paragraph 3 of the Article herein may be displayed only in
conjunction with tobacco products for sale. It may not be displayed in leaflets, flyers or by other
promotional measures designed to be taken away by the customers; in addition, the display of
imitations of tobacco products or their single packets and images at retail outlets shall be prohibited.
No other visual or graphic information on tobacco products, which is not expressly set out in
paragraphs 3 and 4 of the Article herein shall be displayed a retail outlets.

Article 17-1. Prohibition of Advertising of Electronic Cigarettes, Refillable Cartridges of
Electronic Cigarettes and Smokable Herbal Products
1. The advertising of electronic cigarettes, refillable cartridges of electronic cigarettes and
herbal smokable products, as well as hidden advertising of electronic cigarettes, refillable cartridges of
electronic cigarettes and herbal smokable products shall be prohibited in the Republic of Lithuania.
2. Commercial communications providing information society services for the purposes of
advertising electronic cigarettes, refillable cartridges of electronic cigarettes and/or smokable herbal
products shall be prohibited in the press and other print publications with the exception of publications
intended solely for the specialists in sales of electronic cigarettes, refillable cartridges of electronic
cigarettes and/or smokable herbal products and publications which are printed and published in
foreign countries, where these publications are not designed principally for the European Union
market.
3. Commercial communications by radio pertaining to a direct or indirect advertisement of
electronic cigarettes, refillable cartridges of electronic cigarettes and/or smokable herbal products shall
be prohibited.
4. Any kind of public or private sponsorship of radio programs which directly or indirectly
promotes the use of electronic cigarettes, refillable cartridges of electronic cigarettes and/or smokable
herbal products shall be prohibited.
5. Any type of public or private sponsorship of events, activities or individual persons directly
or indirectly promoting the use of electronic cigarettes, refillable cartridges of electronic cigarettes
and/or smokable herbal products, and associated with several States party to the European Economic
Area Agreement or taking place in several States party to the European Economic Area Agreement, or
having cross-border effects shall be prohibited.
6. Commercial audiovisual communication regarding electronic cigarettes, refillable cartridges
of electronic cigarettes and herbal smokable products, subject to the Republic of Lithuania Law on
Public Information, shall be prohibited.

Article 18. Other Prohibitions Related to Tobacco Products
1. The following shall be prohibited in the Republic of Lithuania:
1) The application of fixed discounts for tobacco products to the owners of such coupons,
printed from the media outlets or distributed otherwise, or the likening of such coupons to other means
of partial payment;
2) Distribution of tobacco products and/or their new samples free of charge;
3) Granting the buyer the right, immediately or within a certain period following the
conclusion of a purchase-sale agreement, to receive a gift or a supplement to the tobacco products;
4) Influencing the buyers by persistently offering to purchase tobacco products by indicating
an alleged reduction in price on price lists, price labels, the inside display cabinets, and by other means
or measures which are in contradiction to good morals and public order;
5) Selling of tobacco products as part of a set of other goods sold, as well as any other goods
as a mandatory accessory to the tobacco products for sale;
6) Giving out tobacco products as lottery, competition, sports competition or game prizes, or
in conjunction with them;
7) Organizing games or competitions and lotteries, which promote the acquisition and/or the
use of tobacco products;
8) Manufacturing and/or sale of toys, foodstuff and other goods the designs of which mimics
tobacco products or their single packets; 
9) Selling other goods (non-tobacco products and associated products), branded with the
trademarks of tobacco products; 
10) Using persons under 18 years of age for promotional activities associated with the
acquisition and/or use of tobacco products and associated products.
2. Legal entities or branches of foreign legal entities manufacturing tobacco products or whose
principal activity is the sale of tobacco products shall, in the Republic of Lithuania, be prohibited from
sponsoring events intended for persons under 18 years of age, television and radio programs, as well
as activities and events involving several states or which are conducted in several states, or by any
other means which may have an impact outside the territory of the Republic of Lithuania.","Answer not provided","Answer not provided","WHO European Region"
