"","Party","2018","2016","2014","Region"
"1","Afghanistan","involved different sector such as municipality, hotels union, environmental health dept, NEPA ( national environment protection administration) and Police for follow up
check list for monitoring has been developed and implmented
plan for monitoring developed
continue monitoring mission 
provinces informed for all above","involved different sector such as municipality, hotels union, environmental health dept for follow up
check list for monitoring has been developed
2 position has been hired for only tobacco in environmental health dept MoPH
plan for monitoring developed
monitoring mission started
provinces informed for all aboives","Answer not provided","WHO Eastern Mediterranean Region"
"2","Albania","Report not provided","Report not provided","Article 15 of the Law “For the protection of health from tobacco products” ban smoking in “Workplaces health institutions excluding institutions of mental health (only for patients) educational institutions public transport business areas bars restaurants disco night clubs and other public places”. So our law is in accordance with the convention and creates free tobacco environments. This article is not yet applied. State Sanitary Inspectorate has been not effective. When the task force nr.2 operated in Tirana the implementation of the law has been 78% effective and also in high level (60%) on national level but this situation was only when the task force operated in Albania. Task force nr 2 started on 02.08.2012 (order 362) and stopped on 22.10.2012 (order no 530). 
On 12.03.2013 the law “On health protection from tobacco products” has made same amendments modifications. Some of the most important modifications on the law 
; Its improved the definition of public place also the definition of workplace.
This article is not yet applied.","WHO European Region"
"3","Algeria","lancement des campagnes de sensibilisation sur les risques engendrés par le tabagisme par plusieurs secteurs ( santé ,intérieur et collectivités locales ,  solidarité nationale , communication  , jeunesse et sports , affaire religieuse, éducation nationale , enseignement supérieur, transport et  la justice.","Depuis la création du comité multisectoriel de prévention et de sensibilisation sur le tabagisme , une série de mesure ont été concrétisées pour lutter contre le tabagisme","Answer not provided","WHO African Region"
"4","Angola","According to the current legislation, each public space is responsible for enforcing the smoking ban in the respective area; the Ministry of Health produces and distributes, on a regular manner, materials on smoking bans. Media campaigns continue also to be developed on a regular basis.","According to the current legislation, each public space is responsible for enforcing the smoking ban in the respective area; the Ministry of Health produces and distributes, on a regular manner, materials on smoking bans. Media campaigns continue also to be developed on a regular basis.","Report not provided","WHO African Region"
"5","Antigua and Barbuda","Report not provided","Antigua & Barbuda has issued a Cabinet Decision which bans tobacco smoking in ALL Government Institutions including vehicles and premises. In addition draft legislation is being prepared guided by the FCTC.","Antigua & Barbuda has issued a Cabinet Decision which bans tobacco smoking in ALL Government Institutions including vehicles and premises. In addition draft legislation is being prepared guided by the FCTC.","WHO Region of the Americas"
"6","Armenia","Report not provided","Report not provided","Answer not provided","WHO European Region"
"7","Australia","The states and territory governments have lead responsibility for smoking restrictions to prevent second-hand smoking in Australia. Smoking is now banned in all indoor public places and transport and most jurisdictions have begun to extend bans on smoking to some outdoor public places. 

In Victoria, from 1 August 2017, smoking was banned:
•	in outdoor areas at hospitality and food venues used for eating food. This includes footpath dining areas, courtyards and beer gardens during times food is being eaten, or is available to be eaten
•	in all outdoor areas at food fairs. A food fair is an event where the principal activity is the supply of food for consumption at the event
•	within 10 metres of a food stall or food vendor at organised outdoor event (other than a food fair).
•	to complement smoke-free outdoor dining, smoking is banned in an outdoor drinking area if any part of that area is within 4 metres of an outdoor dining area, unless separated by a wall of at least 2.1 metres high. This means the two areas can be separated by either:
•	a 4 metre buffer zone; or
•	a wall of at least 2.1 metres high.

If the separation requirement is not met, smoking is banned in an outdoor drinking area. This law applies to the same venue as well as to neighbouring venues.

From 1 July 2015, smoking was banned in all areas at Victorian prisons.

The revised Smoke-Free Public Places Act 2003 came into force in the Australian Capital Territory on 18 March 2016. This streamlines the process for establishing new smoke-free areas by enabling the Chief Minister and responsible Minister to jointly declare new smoke-free areas and events via a disallowable instrument.  Public play spaces and public transport waiting areas have since been declared as smoke free public places. 

The South Australian Government has introduced smoke-free outdoor dining areas under the Tobacco Products Regulation Act 1997, including partnering with local governments to introduce declared smoke-free declared outdoor.","The states and territory governments have lead responsibility for smoking restrictions to prevent second-hand smoking in Australia. Smoking is now banned in all indoor public places and transport and most jurisdictions have begun to extend bans on smoking to some outdoor public places. 
In Victoria, from 13 April 2015, smoking was banned:
•	in outdoor areas of, and at and within 4 metres of entrances to, childcare centres, kindergartens and schools
•	at and within 4 metres of entrances to children’s indoor play centres and Victorian public premises (public hospitals, registered community health centres and certain Victorian Government buildings).
From 1 July 2015, smoking was banned in all areas at Victorian prisons.

Further, the ACT Government’s Future Directions for tobacco reduction in the ACT 2013-2016 (Future Directions) was launched on 31 May 2013 (World No Tobacco Day).  Future Directions focuses on two key action areas for further development: restricting access to tobacco and restricting places of tobacco use.

The Smoke-Free Public Places Amendment Bill 2016 was passed by the ACT Legislative Assembly on 10 March 2016 to facilitate the implementation of Future Directions. The revised Smoke-Free Public Places Act 2003, which came into force on 18 March 2016, streamlines the process for establishing new smoke-free areas by enabling the Chief Minister and responsible Minister to jointly declare new smoke-free areas and events via a disallowable instrument. The revised Act includes a framework to ensure a robust assessment of the costs and benefits associated with making a specific public place or event smoke-free.","The states and territory governments have lead responsibility for smoking restrictions to prevent second-hand smoking in Australia. Smoking is now banned in all indoor public places and transport and most jurisdictions have begun to extend bans on smoking to some outdoor public places. Please see Annex 1 for further information and Annex 2 for links to the relevant state and territory legislation.","WHO Western Pacific Region"
"8","Austria","Concerning the protection from exposure to tobacco smoke, the judiciary of the Austrian supreme courts is getting more and more strict. 

Since 2016 the Austrian Tobacco Act has been further tightened by means of regulations regarding the protection from exposure to tobacco smoke through further introduction of smoking bans in various places.","Concerning the protection from exposure to tobacco smoke, the judiciary of the Austrian supreme courts is getting more and more strict. 

In 2012 sanctions for violations of the smoking restrictions in indoor workplaces were raised according to article 130 Sect. 1 Z 15 of the Austrian law on health and safety at work act (Arbeitnehmerschutzgesetz).","Concerning the protection from exposure to tobacco smoke the judiciary of the Austrian supreme courts is getting more and more strict.
In 2012 sanctions for violations of the smoking restrictions in indoor workplaces were raised according to Para. 130 Sect. 1 Z 15 of the Austrian law on health and safety at work act (Arbeitnehmerschutzgesetz); for details see 3.2.2.10.","WHO European Region"
"9","Azerbaijan","The Code “On Administrative Violations” of the Republic of Azerbaijan enacted in 2000 and updated on 29 December 2015 provides the following penalties: for smoking cigarette in aircraft, railway (raised up to 40 manats), metro, sea and river (raised up to 40 manats) transports (respectively Articles ## 299; 305; 306 and 318); for smoking in other prohibited places, as pointed in the Law of the Republic of Azerbaijan “On Tobacco and Tobacco Products” - 30 manats (new Article 212.1.); in case of no ensuring allocation of special places for smoking and absence of ""No Smoking"" warning message or the sign in enterprises, institutions, organizations - 400 manats to officials and 1000 manats to legal entities (new Article 212.2.); smoking in the buses that move regularly through between or within towns and cities and on international routes shall result in the penalty amount of 40 to 50 manats (Article 322.0.4.); for violation the rules of commerce on ethylene (food) alcohol, and alcoholic beverages or tobacco goods (penalty raised up to 80 manats - Article 455.1.) (http://azertag.az/store/files/news/ASASNAME.pdf - available in Azerbaijani language only).","The Code “On Administrative Violations” of the Republic of Azerbaijan enacted in 2000 and updated on 29 December 2015 provides the following penalties: for smoking cigarette in aircraft, railway (raised up to 40 manats), metro, sea and river (raised up to 40 manats) transports (respectively Articles ## 299; 305; 306 and 318); for smoking in other prohibited places, as pointed in the Law of the Republic of Azerbaijan “On Tobacco and Tobacco Products” - 30 manats (new Article 212.1.); in case of no ensuring allocation of special places for smoking and absence of ""No Smoking"" warning message or the sign in enterprises, institutions, organizations - 400 manats to officials and 1000 manats to legal entities (new Article 212.2.); smoking in the buses that move regularly through between or within towns and cities and on international routes shall result in the penalty amount of 40 to 50 manats (Article 322.0.4.); for violation the rules of commerce on ethylene (food) alcohol, and alcoholic beverages or tobacco goods (penalty raised up to 80 manats - Article 455.1.) (http://azertag.az/store/files/news/ASASNAME.pdf - available in Azerbaijani language only).","Answer not provided","WHO European Region"
"10","Bahamas","Report not provided","Answer not provided","Draft Tobacco Control Bill 2014 which is being discussed among Cabinet Members for official tabling and passage contains provisions for all operational portions of the WHO FCTC (except taxation as this is already covered in the Tobacco Excise Stamp Tax Act 2013)","WHO Region of the Americas"
"11","Bahrain (Kingdom of)","We are still working closely to assist those willing to allocate a designated smoking area to ensure it is compliant with health specifications of smoking areas. However, we encourage business owners to keep their place smoke free. In addition, we are advocating to update antismoking law to ban indoor smoking completely in closed public areas.","We are still working closely to assist those willing to allocate a designated smoking area to ensure it is compliant with health specifications of smoking areas. However, we are advocating to update antismoking law to ban indoor smoking completely in closed public areas.","Work in the campaign which was launched to monitor the implementation of smoking ban in public places continued by Public Health Directorate in Ministry of Health. In addition we are still working closely to assisst those willing to allocate a designated smoking area to ensure it is compliant with health specifications of smoking areas.","WHO Eastern Mediterranean Region"
"12","Bangladesh","In the amended tobacco control law 2013 the owner/supervisor/manager of the public place and tranport are responsible to keep their premises smoke free, otherwise he/she will be punished. Moreover under the guidence of MOHFW, with the initiative of different NGOs working in Tobacoo Control, many mobile courts has been conducted for exemplary punishment","In the amended tobacco control law 2013 the owner/supervisor/manager of the public place and tranport are responsible to keep their premises smoke free, otherwise he/she will be punished. Moreover under the guidence of MOHFW, with the initiative of different NGOs working in Tobacoo Control, many mobile courts has been conducted for exemplary punishment","In the amended tobacco control law 2013 the owner/ spervisor/manager of the public place and tranport are responsible to keep their premises smoke free otherwise he/she will be punished. Moreover under the guidence of MOH&FW with the initiative of different NGO''s working in Tobacoo Control many mobile courts has been conducted for exemplary punishment","WHO South-East Asia Region"
"13","Barbados","The regulations related to smoking public places, prohibiting sales to minors, as well as those related to marketing and use of electronic cigarettes were consolidated in the Health Services (Smoking) Regulations 2017","no amendments made","Legislation banning smoking in public places was implemented in 2010 since that time the Ministry of Health through the Environmental Health Department has been monitoring compliance and continues to respond to enquiries to enable compliance.","WHO Region of the Americas"
"14","Belarus","Постановление Министерства здравоохранения Республики Беларусь от 03.11.2011г. № 111""О внесении дополнений и изменений в некоторые санитарные нормы, правила и гигиенические нормативы"", касающиеся запрещения курения в учреждениях (организациях) здравоохранения, образования, спорта, на объектах торговли и бытового обслуживания населения, на объектах общественного питания, вокзалах, станциях метрополитена, в вагонах поездов, на речных судах (за исключением мест, специально предназначенных для курения). Данная мера расширяет полномочия должностных лиц органов и учреждений, осуществляющих государственный санитарный надзор, по осуществлению контроля за соблюдением запрета курения и будет содействовать снижению распространения табакокурения в нашей стране и выполнению в полном объеме требований Декрета Президента Республики Беларусь от 17 ноября 2002 г. № 28.  По решению руководителя  вводится дополнительное поощрение некурящих или бросивших курить, в кафе и ресторанах осуществляется зонирование территории (места для курящих и некурящих).","Постановление Министерства здравоохранения Республики Беларусь от 03.11.2011г. № 111""О внесении дополнений и изменений в некоторые санитарные нормы, правила и гигиенические нормативы"", касающиеся запрещения курения в учреждениях (организациях) здравоохранения, образования, спорта, на объектах торговли и бытового обслуживания населения, на объектах общественного питания, вокзалах, станциях метрополитена, в вагонах поездов, на речных судах (за исключением мест, специально предназначенных для курения). Данная мера расширяет полномочия должностных лиц органов и учреждений, осуществляющих государственный санитарный надзор, по осуществлению контроля за соблюдением запрета курения и будет содействовать снижению распространения табакокурения в нашей стране и выполнению в полном объеме требований Декрета Президента Республики Беларусь от 17 ноября 2002 г. № 28.  По решению руководителя  вводится дополнительное поощрение некурящих или бросивших курить, в кафе и ресторанах осуществляется зонирование территории (места для курящих и некурящих).","Decree of the Ministry of Health of the Republic of Belarus of 03.11.2011. Number 111 ''On amendments and additions to some sanitary norms rules and hygienic standards'' regarding the prohibition of smoking in establishments (organizations) health education sports at trade and consumer services facilities catering railway stations subway stations in wagons on riverboats (except in places specially designated smoking area). This measure extends the powers of the officials of bodies and institutions exercising state sanitary inspection to monitor compliance with the ban of smoking and will help reduce the spread of smoking in our country and to fully implement the requirements of Presidential Decree of November 17 2002 ? 28. By decision of the director introduces additional encouragement non-smokers or ex-smokers in cafes and restaurants provided zoning (room for smokers and non-smokers).","WHO European Region"
"15","Belgium","les amendes et sanctions en cas dinfraction ont été renforcées. le nombres dinfractions dans les cafés a depuis diminué. les autres lieux publics ne posent pas de problème de respect de la legislation.","les amendes et sanctions en cas dinfraction ont été renforcées. le nombres dinfractions dans les cafés a depuis diminué. les autres lieux publics ne posent pas de problem de respect de la legislation.","Depuis le 1er juillet 2011 les dernières exceptions à l’interdiction de fumer ont été supprimés sur à un arrêt de la Cours Constitutionnelle. Depuis cette date le travail s’est concentré sur le contrôle et l’application de cette législation","WHO European Region"
"16","Belize","Report not provided","Answer not provided","The General Public has had good adherence to the implementation of the smoke free spaces initiatives.","WHO Region of the Americas"
"17","Benin","un effort est fait par les responsables des restaurants et bars, mais tous  les hôtels ne se sont pas encore conformés aux dispositions dinterdiction de fumer","un effort est fait par les responsables des restaurants et bars, mais tous  les hôtels ne se sont pas encore conformés aux dispositions dinterdiction de fumer","la plupart des restaurants et hôtels respectent linterdiction de fumée à lintérieur et installe les fumeurs sur les terrasses.","WHO African Region"
"18","Bhutan","Strengthen compliance with non -smoking policy. Designate smoking rooms in public places","Answer not provided","Authorised personnel identified advocacy programs conducted with the person in-charges for the entertainment centres Schools/cities/ tour guides; schools law clubs coordinators school guidance counsellors government and private commercial drivers and training of trainers all the concerned law enforcement officials","WHO South-East Asia Region"
"19","Bolivia (Plurinational State of)","Answer not provided","Report not provided","Report not provided","WHO Region of the Americas"
"20","Bosnia and Herzegovina","New laws on tobacco control which will include the issue of protection from exposure to tobacco smoke are being developed:
- by Federal Ministry of Health: Draft Law on Control and Limited Consumption of Tobacco, Tobacco and Other Products for Smoking (Federation of Bosnia and Herzegovina);
- by Ministry of Health and Social Welfare in the Government of Republic of Srpska: Draft Law on Protecting Health of Population from Tobacco and Other Smoking Tobacco Products (Republic of Srpska). 
In late 2017 the Assembly of Brcko District BiH adopted the Law on Banning Smoking and Other Forms of Consumption of Tobacco and Tobacco Products in Public Places in Brcko District BiH (""Official Gazette of Brcko District BiH"", No. 280/17).","Answer not provided","Increasing trends of indoor work and public places with completely ban of smoking caused by increasing awareness'' population and more active inspection services. Republika Srpska: Pprotection from exposure to tobacco smoke is enforced through Law on Prohibition of Smoking Tobacco Products in public places of the Republic of Srpska","WHO European Region"
"21","Botswana","Implementation of article 8 has challenges of resources especially manpower to reach the furthest parts of the country.  However, discussions are on going with local authorities to appoint focal persons at district level to address this gap.","Report not provided","Report not provided","WHO African Region"
"22","Brazil","The national smoke free law entered into force in December 2014. It banned closed smoking areas, even if a restaurant, bar or store is partially closed by a wall, ceiling or awning. Places where smoking is allowed – as tobacco shops and research sites - must have an exclusive closed area for consumption, with exhaust system regulated by the National Agency of Sanitary Surveillance (ANVISA) to reduce smoke emissions and avoid contamination to other areas.","The national smoke free law entered into force in December 2014. It banned closed smoking areas, even if a restaurant, bar or store is partially closed by a wall, ceiling or awning. Places where smoking is allowed – as tobacco shops and research sites - must have an exclusive closed area for consumption, with exhaust system regulated by the National Agency of Sanitary Surveillance (ANVISA) to reduce smoke emissions and avoid contamination to other areas.","In December 15th. 2011. the President has sanctioned a national law prohibiting smoking in public places nationwide. The smoke free measures of this law are not in force due to the lack on its regulation by the Executive.","WHO Region of the Americas"
"23","Brunei Darussalam","Currently revising the regulations to include more public places.","Report not provided","Prior to 2012 smoking rooms were allowed in certain specified places e.g private companies and airport. This has been prohibited in the Tobacco (Prohibition in Certain Places) (Amendment) Notification 2012","WHO Western Pacific Region"
"24","Bulgaria","Tobacco control legislation covers all the provisions concerning art.8, but inadequate fines reduce their effectiveness. Enforcement is a great problem because neither legal acts nor decrees for implementation of the Laws provide clear requirements for fines and violation penalties. 
For example: no political will exist to impose effective control on smoking in indoor public places, especially in restaurants, cafes, bars etc. The change in the Health Act, where the ban was enacted, do not include penalties as ""closure of the establishment for a defined time"" or ""revocation of the license"". 
The privatized Bulgarian tobacco industry presents Bulgarian tobacco control with even bigger challenges than the ones we are witnessing now and they, no doubt, should be directly putting at risk total population health.","Answer not provided","On June 1st 2012 g. are adopted changes in the Health Act which regulates total ban of smoking for indoor and open public places. The prohibition of smoking has been expanded to include premises with separate work places adjacent area and sidewalks of nurseries kindergartens schools student dormitories and places where social services are provided for children playgrounds places where events for children and pupils are organized sports facilities summer cinemas and theatres - during sports and cultural events. 
 The aim of the current ban on smoking in indoor and some open public places is to protect public health. This prohibition on the one hand protect the health of non-smokers who are exposed to tobacco smoke in indoor and some open public places on the other hand protects smokers from excessive use of tobacco and tobacco products.","WHO European Region"
