"94","Luxembourg","La publicité en faveur des produits du tabac continue a être fortement réglementée par larticle 3 de notre loi du 13 juin 2017:
1) La publicité en faveur du tabac, de ses produits, de ses ingrédients, des cigarettes électroniques et des flacons de recharge, ainsi que toute distribution gratuite d’un produit du tabac ou d’une cigarette électronique ou d’un flacon de recharge sont interdites.
Cette interdiction englobe l’utilisation de l’emblème de la marque ou du nom de la marque du
tabac ou de la cigarette électronique ou du flacon de recharge ainsi que l’utilisation
de toute autre représentation ou mention susceptible de s’y référer sur des objets usuels autres que
ceux qui sont directement liés à l’usage du tabac ou de la cigarette électronique.
(2) Ne sont pas à considérer comme publicité au sens du paragraphe qui précède:
– les panneaux ou enseignes apposés aux fins de les signaler sur les bâtiments des établissements dans lesquels les produits visés par la présente loi sont fabriqués ou entreposés, du moment qu’ils ne contiennent pas d’autre indication que le nom du fabricant ou distributeur, le nom de la marque produite ou distribuée ou une représentation graphique ou photographique de la marque ou de son emballage ou de son emblème;
- la simple indication, sur un véhicule servant ordinairement au commerce du tabac, ou de ses
produits ou des cigarettes électroniques et des flacons de recharge, de la dénomination du produit,
de sa composition, du nom et de l’adresse du fabricant et, le cas échéant, du distributeur, ainsi que
la représentation graphique ou photographique du produit, de son emballage et de l’emblème de la
marque.
(3) Les dispositions du paragraphe 1er ne s’appliquent pas:
- aux publications et services de communication en ligne édités par les organisations professionnelles
de producteurs, fabricants et distributeurs des produits du tabac, des cigarettes électroniques et des
flacons de recharge réservés à leurs adhérents, ni aux publications professionnelles spécialisées, ni
aux services de communication en ligne édités a titre professionnel qui ne sont accessibles qu’aux
professionnels de la production, de la fabrication et de la distribution des produits du tabac et des
cigarettes électroniques et des flacons de recharge.
– aux publications imprimées et éditées et aux services de communication en ligne mis à disposition du public par des personnes établies dans un pays n’appartenant pas à l’Union européenne, lorsque ces publications et services de communication en ligne ne sont pas principalement destinés au marché communautaire.
(4) Les dispositions du paragraphe 1er ne s’appliquent pas à la publicité faite à l’intérieur des débits de
tabac. Dans les commerces offrant en vente également des produits ne relevant pas de la présente loi,
la présente dérogation ne vaut que dans les surfaces réservées à la vente des produits du tabac ainsi que des cigarettes électroniques et des flacons de recharge et, dans les commerces ne comportant aucune subdivision en surfaces de vente, à proximité immédiate des étalages exposant des produits
du tabac, des cigarettes électroniques ou des flacons de recharge.
La publicité autorisée en vertu de l’alinéa qui précède ne peut être effectuée qu’au moyen d’affiches et de panneaux réclames. Elle ne peut s’adresser spécialement à un public de mineurs, ni faire usage d’arguments axés sur la santé, ni comporter un texte, une dénomination ou un signe figuratif laissant croire qu’un produit particulier est moins nocif qu’un autre, ni contenir une représentation d’une personne connue du grand public.
(5) Toute opération de parrainage en faveur du tabac ou de produits du tabac ou de cigarettes
électroniques ou de flacons de recharge est interdite.","Nouveau projet d eloi transposant la directive 2014/40/UE","Surveillance accrue de la communication en ligne émanant de producteurs et /ou de revendeurs de produits de tabac.","WHO European Region"
"95","Madagascar","Answer not provided","Answer not provided","Collaboration avec le centre de ressource de l’OMS Sur la collecte des données sur l’interdiction de la Publicité promotion et parrainages des produits du tabac à Madagascar Notification des industries du tabac sur l’affichage des prix du tabac sur le point de vente.","WHO African Region"
"96","Malaysia","Answer not provided","Answer not provided","A new requirement has been inserted into the CTPR 2004 in 2013 that the sales of tobacco product by promotion. This requirement clearly prohibits any person to promote the sale of any tobacco product directly or indirectly by any way such as contract agreement understanding or undertaking.","WHO Western Pacific Region"
"97","Maldives","NO FURTHER PROGRESS","NO FURTHER PROGRESS","This is an area where the Maldives regulations have been strong even before the FCTC. Advertising bans were imposed in the early 80''s and has continued since. However with the growth of tobacco industry indirect and subtle forms of advertising have crept in to the society. Deceptive promotional materials are widely in use and distributed to shops restaurants and cafes. These include signage boards ashtrays bill folders and such paraphernalia.","WHO South-East Asia Region"
"98","Mali","Au Mali aucune activité des firmes de tabac ne passent sur les média","Au Mali aucune activité des firmes de tabac ne passent sur les média","Depuis l’adoption de la loi antitabac ;des progrès ont été réalisés en terme de diminution de la publicité en faveur du tabac; de la promotion et du parrainage par les industries du tabac dans notre pays.","WHO African Region"
"99","Malta","Legislation – no advert/promotion is allowed by legislation.","Legislation – no advert/promotion is allowed by legislation.","Legislation – no advert/promotion is allowed by legislation.","WHO European Region"
"100","Marshall Islands","Answer not provided","Answer not provided","1. The Act has not completely banned tobacco advertising promotion and sponsorship; with exemptions include allowing promotion along with health warnings and opportunities for sponsorship by tobacco importers and retailers.
2. Youth exposure to tobacco adverting and promotion remains high.
3. “Socially responsible” activities by the tobacco industry have not been clearly banned by the Act.
4. Some stores still prominently display tobacco products at the point of sale.","WHO Western Pacific Region"
"101","Mauritania","-","-","Answer not provided","WHO African Region"
"102","Mauritius","Answer not provided","Answer not provided","There exists a comprehensive ban on tobacco advertising promotion and sponsorship in Mauritius since the coming into force of the new tobacco legislations in March 2009.","WHO African Region"
"103","Mexico","Answer not provided","Answer not provided","Answer not provided","WHO Region of the Americas"
"104","Micronesia (Federated States of)",NA,NA,"Policy Analyst and Coalition legal advisor working on the closing of loop holes on the law. In one of the four states Pohnpei States the annex #66 to Pohnpei State Law on Promotion. Advertisement and Sponsorship.","WHO Western Pacific Region"
"105","Mongolia","1. Tobacco advertising are banned in the following forms:
- advertising of tobacco by means of press, media, movies, fashion how, tertainment, sport events, competition, cell phone, and other advanced technologies, billboard, street advertising signs, poster, passenger ticket, and other direct physical forms involving cultural artists and sport celebrities, sportsman and famous public figures by using tobacco, rolling paper, pipe, facilities for rolling cigarettes, and other releted materials, name of the tobacco manufacturer, logo, tobacco products, brandname, trade-mark and its related colors, combination of colors, wording, design, pictures, images, smells and audios of tobacco products and manufacturers;
-  teach and encourage children to tobacco smoking
;-   naming of legal entity by the trade name of the tobacco industry and tobacco products; -  sponsorship of health, education, cultural, sports and other social events and any donations, contributions or grants by the tobacco industry;
- the use of trade-mark, trade-name and logos of the tobacco industry and tobacco products on goods, clothes and consumer items;
- manufacturing of candies, toys, and other non-tobacco products imitating tobacco products, distributing them as a free gifts, free samples and advertising tobacco via any forms of lotteries, competitions, contests, sales, promotions, discounts and sponsorships;
- all other forms except tobacco name, price and in direct physical forms in any sales points of tobacco;
-  include an additional image, message and other information on the outside or inside of tobacco box and packages to attract consumers attention except national standards;
-  activities of the tobacco industry on “Brand stretching” and “Brand sharing”;
- advertise tobacco directly or indirectly by means of financial and material donation by the tobacco industry themselves or through other organization and legal entity;
-  placing tobacco brand image, logo in nearby of entertainment areas and service organizations;
-  all kinds of advertisements that could give wrong, misleading information or perception about tobacco.
2. All kinds of tobacco advertisement materials shall be prohibited to enter the national border.
3.Cross border advertisement, promotion, and sponsorship activities of tobacco is prohibited.
- It shall be prohibited to provide financial, material aids and contributions to social, health, welfare and environmental organizations by the tobacco industry or through another organizations under the name of “Social responsibility”.","Report not provided","1. Tobacco advertising are banned in the following forms:
- advertising of tobacco by means of press media movies fashion how tertainment sport events competition cell phone and other advanced technologies billboard street advertising signs poster passenger ticket and other direct physical forms involving cultural artists and sport celebrities sportsman and famous public figures by using tobacco rolling paper pipe facilities for rolling cigarettes and other releted materials name of the tobacco manufacturer logo tobacco products brandname trade-mark and its related colors combination of colors wording design pictures images smells and audios of tobacco products and manufacturers;
- teach and encourage children to tobacco smoking
;- naming of legal entity by the trade name of the tobacco industry and tobacco products; - sponsorship of health education cultural sports and other social events and any donations contributions or grants by the tobacco industry;
- the use of trade-mark trade-name and logos of the tobacco industry and tobacco products on goods clothes and consumer items;
- manufacturing of candies toys and other non-tobacco products imitating tobacco products distributing them as a free gifts free samples and advertising tobacco via any forms of lotteries competitions contests sales promotions discounts and sponsorships;
- all other forms except tobacco name price and in direct physical forms in any sales points of tobacco;
- include an additional image message and other information on the outside or inside of tobacco box and packages to attract consumers attention except national standards;
- activities of the tobacco industry on “Brand stretching” and “Brand sharing”;
- advertise tobacco directly or indirectly by means of financial and material donation by the tobacco industry themselves or through other organization and legal entity;
- placing tobacco brand image logo in nearby of entertainment areas and service organizations;
- all kinds of advertisements that could give wrong misleading information or perception about tobacco.
2. All kinds of tobacco advertisement materials shall be prohibited to enter the national border.
3.Cross border advertisement promotion and sponsorship activities of tobacco is prohibited.
- It shall be prohibited to provide financial material aids and contributions to social health welfare and environmental organizations by the tobacco industry or through another organizations under the name of “Social responsibility”.","WHO Western Pacific Region"
"106","Montenegro","Article 21, manufacturers and importers of tobacco products must not advertise tobacco products through the Internet. Manufacturers and importers of tobacco products may not, for the purpose of hidden or open encouragement of the use of tobacco products, sponsor events, activities or individuals through radio programs.","Article 21, manufacturers and importers of tobacco products must not advertise tobacco products through the Internet. Manufacturers and importers of tobacco products may not, for the purpose of hidden or open encouragement of the use of tobacco products, sponsor events, activities or individuals through radio programs.","Article 21 manufacturers and importers of tobacco products must not advertise tobacco products through the Internet. Manufacturers and importers of tobacco products may not for the purpose of hidden or open encouragement of the use of tobacco products sponsor events activities or individuals through radio programs.''","WHO European Region"
"107","Myanmar","According to Article 11 of the National Tobacco Control Law, there is a ban on all forms of direct and indirect tobacco advertisement, sales promotion and sponsorship. 
Since 2013 July, a regular monitoring and reporting mechanism was established among Township, State/Regional and Central level regarding the TAPS. There were local actions by local tobacco control teams such as educating the shops’ owners on dangers of tobacco use and awareness raising on national regulations on TAPS, removing the advertisements found and warning not to accept the direct and indirect advertisements and promotion from tobacco companies. But, there was no direct action on tobacco industries for violating the law yet in Myanmar.","According to Article 11 of the National Tobacco Control Law, there is a ban on all forms of direct and indirect tobacco advertisement, sales promotion and sponsorship. Since 2013 July, a regular monitoring and reporting mechanism was established among Township, State/Regional and Central levels regarding the TAPS. 

Since 2013 July, a regular monitoring and reporting mechanism was established among Township, State/Regional and Central level regarding the TAPS. There were local actions by local tobacco control teams such as educating the shops’ owners on dangers of tobacco use and awareness raising on national regulations on TAPS, removing the advertisements found and warning not to accept the direct and indirect advertisements and promotion from tobacco companies. But, there was no direct action on tobacco industries for violating the law yet in Myanmar.","According to Article 11 of the National Tobacco Control Law there is a ban on all forms of direct and indirect tobacco advertisement sales promotion and sponsorship. Since 2013 July a regular monitoring and reporting mechanism was established among Township State/Regional and Central levels regarding the TAPS.","WHO South-East Asia Region"
"108","Namibia","Report not provided","Report not provided","Report not provided","WHO African Region"
"109","Nauru","Report not provided","Answer not provided","Report not provided","WHO Western Pacific Region"
"110","Nepal","Issues raised and discussion made with India in controlling cross-border TAPS ban.","Report not provided","Issues raised and discussion made with India in controlling cross-border TAPS ban.","WHO South-East Asia Region"
"111","Netherlands","From May 20th 2016 there is also an advertising ban for electronic cigarettes / e-liquids with nicotine. 
From","From May 20th 2016 there will also be a advertising ban for the e-cigarette and its refill cartridges.","The Dutch government commissioned a study collating the evidence for reducing the points of sale or a display ban in order to prevent people to start smoking. The study will be delivered this summer.","WHO European Region"
"112","New Zealand","As noted above, legislation providing for standardised or ""plain"" packaging came into force on 14 March 2018.","No legislative changes since 2014.  As noted above, Parliament is considering a Bill to provide for standardised or ""plain"" packaging.","New Zealand has had a comprehensive ban on tobacco advertising promotion and sponsorship since 1990. These provisions were strengthened when legislation banning the display of tobacco products came into force on 23 July 2012. As noted above Parliament is currently considering a Bill to provide for ''plain packaging''.","WHO Western Pacific Region"
"113","Nicaragua","Answer not provided","Answer not provided","Report not provided","WHO Region of the Americas"
"114","Niger","Report not provided","Answer not provided","Report not provided","WHO African Region"
"115","Nigeria","The Law provides for complete ban on tobacco advertising, promotion and sponsorship. However there are subtle forms of tobacco promotion and sponsorship by the tobacco industry.
Honorable Minister of Health announced during the 2017 WNTD immediate implementation of prohibition of tobacco advertising, promotion and sponsorship of any kind.","The Law provides for complete ban on tobacco advertising, promotion and sponsorship. However there are subtle forms of tobacco promotion and sponsorship by the tobacco industry.","National universal enforcement on ban on tobacco advertising promotion and sponsorship","WHO African Region"
"116","Niue","Report not provided","Report not provided","Tobacco advertising has never been promoted in Niue.","WHO Western Pacific Region"
"117","Norway","No changes.","No changes.","As of 1 July 2013 tobacco surrogates and tobacco imitations are covered by the Norwegian ban on tobacco advertising. Surrogates/imitations include e.g. electronic cigarettes.","WHO European Region"
"118","Oman","صدر قرار من وزارة الاعلام  والتجارة والصناعه بمنع الاعلان والترويج والتخفيضات  لمنتجات التبغ","رغم عدم وجود قانون شامل لحظر الدعاية والرعاية والاعلان  الا  انه لا يتم اي اعلان عن التبغ ومنتاجاته في جكيع وسائل الاعلام لانها مرتبطة بجهات حكومية لا تقبل بالاعلان عنة او السماح له","Although advertising of tobacco and tobacco products does not exist in Oman for several years there is no national law that requires the currently applied ban; this is because of the restrictions imposed by the Ministry of Information requiring that the display of any advertising of any product must obtain the approval of the Ministry of Information.","WHO Eastern Mediterranean Region"
"119","Pakistan","Under Article 13 of FCTC, Pakistan is mandated to put comprehensive ban on Tobacco Advertising, Promotion and Sponsorship (TAPS). Current legislation imposes restrictions on TAPS. In order to impose comprehensive ban on TAPS, step-wise approach is being followed.  Using this approach, Tobacco Control Cell banned tobacco and tobacco products advertisements in print, electronic and outdoor media. This legislation was challenged in Sindh High Court by M/s Philip Morris, Pakistan, but they had to withdraw the petition against the arguments of the Ministry.

Ban has been imposed on free goods, cash rebates, free samples, discount or goods below the market value offered for the purpose of advertisement of tobacco or tobacco products. Moreover, ban has been imposed on manufacturing or offering for sale sweets, snacks and toys in the form of cigarettes that may appeal to any person under the age of eighteen. The focus of these measures are to deter youth from taking up smoking.  

Despite these restrictions on TAPS, some promotional activities at Point of Sale (PoS) are going on. In 2017, current legislation to ban TAPS will be strengthened by banning POS advertising. For this, Committee on Tobacco Advertisement Guidelines (CTAG) is being reconstituted.","Under Article 13 of FCTC, Pakistan is mandated to put comprehensive ban on Tobacco Advertising, Promotion and Sponsorship (TAPS). Current legislation imposes restrictions on TAPS. In order to impose comprehensive ban on TAPS, step-wise approach is being followed.  Using this approach, Tobacco Control Cell banned tobacco and tobacco products advertisements in print, electronic and outdoor media in 2013. These restrictions could not be enforced because Philip Morris Pakistan Limited challenged the legislation in the Honorable Sindh High Court. This Ministry is defending the case in the honorable court.

Despite these restrictions on TAPS, some promotional activities at Point of Sale (PoS) are going on. Tobacco industry is also sponsoring some activities under the umbrella of Corporate Social Responsibility (CSR).  In 2016, current legislation to ban TAPS will be strengthened by banning POS advertising and tobacco industry CSR activities.","In line with the provisions of the Prohibition of Smoking and Protection of Non-Smokers Health Ordinance 2002 the Federal Government in November 2013 reconstituted the Committee on Tobacco Advertisement Guidelines (CTAG). The functions of CTAG are to:
prepare plan and implement guidelines for the advertisements of tobacco and tobacco products in light with FCTC Guidelines;
monitor the implementation of the guidelines; and
evaluate effectiveness and in the light of data so collected improve upon the guidelines from time to time.
In its 12th meeting held on 29th November 2013 following new Guidelines related to tobacco and tobacco products advertisement and promotion on television and radio in cinema theater and print media and through billboards posters and on-store boards/fascia were issued w.e.f. 31st May 2014:
No tobacco or tobacco product advertisement shall be allowed: 
in print media including a newspaper magazine book periodical or any such printed publication except as provided by Federal Excise Rules 2005;
in cinema or theater including mobile or mini cinema or theater;
on television or radio including cable television or closed circuit television network;
through depiction of a human or animal image or silhouette;
through branding on clothes/garments including caps;
through a poster or banner made out of paper plastic cloth or any other material affixed outside a shop kiosk or mobile trolley;
through a hard or soft on-store board/fascia affixed outside a shop kiosk or mobile trolley;
through out-of-home billboard whether fixed or mobile.","WHO Eastern Mediterranean Region"
