"","Party","2018","2016","2014","Region"
"1","Afghanistan","A new tobacco control act was adopted in 2015 which provides for a broad interpretation of an advertising ban. Depending on the rules of its enforcement, this requirement of the Act could cover all items under C272.","A new tobacco control act was adopted in 2015 which provides for a broad interpretation of an advertising ban. Depending on the rules of its enforcement, this requirement of the Act could cover all items under C272.","No any advertisement is allowed on trade of the Tobacco production","WHO Eastern Mediterranean Region"
"2","Albania","Report not provided","Report not provided","Answer not provided","WHO European Region"
"3","Algeria","La publicité des produits du tabac na pas connu un développement en raison de la règlementation actuellement en vigueur.","La publicité des produits du tabac na pas connu un développement en raison de la règlementation actuellement en vigueur.","Answer not provided","WHO African Region"
"4","Angola","There is a comprehensive tobacco control bill currently awaiting Government approval, for later being sent to the National Assembly.","There is a comprehensive tobacco control bill currently awaiting Government approval, for later being sent to the National Assembly.","Report not provided","WHO African Region"
"5","Antigua and Barbuda","Report not provided","Draft legislation has been refined and legal processing is now progressing","Draft legislation has been refined and legal processing is now progressing slowly","WHO Region of the Americas"
"6","Armenia","Report not provided","Report not provided",".....","WHO European Region"
"7","Australia","Prohibitions on certain forms of tobacco advertising, promotion and sponsorship including, in particular, point-of-sale advertising and the display of tobacco products in retail locations, are in place at the state and territory level. As reported in our previous periodic Reports, all states and territories have bans on the following forms of tobacco product sales and promotion:
•the sale of a tobacco product to a person under 18 years; and
• the sale of cigarettes in a package of less than 20 cigarettes.

Excluding Western Australia, all states and territories also have bans on the following forms of tobacco sales and promotion: 
• the sale of a tobacco product from a temporary outlet; 
• the inclusion of tobacco products purchases in rewards and shopper loyalty schemes; and
• the mobile selling of tobacco products.

Other forms of retail display bans vary across Australian jurisdictions.

In the Australian Capital Territory tobacco products can’t be sold by vending machine and can’t be included in customer reward schemes, promotions, sponsorships or product give aways. These measures are designed to reduce access to tobacco products, including by children, and minimise the harms associated with tobacco use. From 1 July 2016 the Australian Capital Territory restricted the sale, promotion and use of electronic cigarettes in the same way as tobacco. It is will be illegal to sell electronic cigarettes to people under the age of 18 and to use electronic cigarettes in legislated smoke-free areas (enclosed public places, outdoor eating or drinking areas, underage functions, in cars where children under the age of 16 are present, in declared smoke-free public places and at declared smoke-free events). Restrictions also apply to electronic cigarette advertising, displays and marketing. 

Also as reported in our previous periodic Reports, Australia also has tobacco advertising, promotion and sponsorship bans at the national level.","Prohibitions on certain forms of tobacco advertising, promotion and sponsorship including, in particular, point-of-sale advertising and the display of tobacco products in retail locations, are in place at the state and territory level. As reported in our previous periodic Report, all states and territories have bans on the following forms of tobacco product sales and promotion:
•	the sale of a tobacco product to a person under 18 years
•	the sale of a tobacco product from a temporary outlet
•	the sale of cigarettes in a package of less than 20 cigarettes
•	the inclusion of tobacco products purchases in rewards and shopper loyalty schemes
•	the mobile selling of tobacco products.

Other forms of retail display bans vary across Australian jurisdictions.

For example, in Victoria, tobacco advertising at a retail outlet point of sale is banned. An exemption exists for certified specialist tobacconists. From 1 April 2014, a person is no longer able to apply to have their business certified specialist tobacconists. As of 1 April 2014 the display of a tobacco advertisement for direct or indirect pecuniary benefit in a theatre, public place or on the outside of any road, sea or air vehicle or vessel, distributing leaflets or other documents to the public that are tobacco advertisements,  the selling of films or videos that contains a tobacco advertisement; sponsored events which include the promotion of tobacco products or the interest of a tobacco manufacturer or distributor are all banned.

In the ACT tobacco products cant be sold by vending machine and cant be included in customer reward schemes, promotions, sponsorships or product give aways. These measures are designed to reduce access to tobacco products, including by children, and minimise the harms associated with tobacco use. Further from 1 July 2016 new legislation will take effect in the ACT that restricts the sale, promotion and use of electronic cigarettes in much the same way as tobacco. From 1 July, it will be illegal to sell electronic cigarettes to people under the age of 18 and to use electronic cigarettes in legislated smoke-free areas (enclosed public places, outdoor eating or drinking areas, underage functions, and in cars where children under the age of 16 are present). Restrictions will also apply to electronic cigarette advertising, displays and marketing. 

Also as reported in our previous periodic Reports, Australia also has tobacco advertising, promotion and sponsorship bans at the national level.","Australia has comprehensive legislation and regulations in place prohibiting tobacco advertising. promotion and sponsorship. 
Under the Tobacco Advertising Prohibition Act 1992. it is an offence to publish or broadcast a tobacco advertisement. with certain limited exceptions. In 2012. the Tobacco Advertising Prohibition Amendment Act was enacted. extending the ban on tobacco advertising to the internet and other electronic media (for example. mobile phones) in Australia. 
Compliance and enforcement activities on tobacco advertising related matters are ongoing.
The legislation is available online at www.comlaw.gov.au. 
As detailed at section 3.2.5 above. the Australian Government has also introduced legislation requiring plain packaging of tobacco products sold in Australia. 
Prohibitions on certain forms of tobacco advertising. promotion and sponsorship including. in particular. point-of-sale advertising and the display of tobacco products in retail locations. are in place at the state and territory level. Please see Annex 1 and Annex 2 for further information.","WHO Western Pacific Region"
"8","Austria","The Austrian jurisdiction (constitutional court, higher administrative court, supreme court) confirmed in various judgements restrictive interpretations regarding the provisions for prohibition of commercials and sponsorings.","The Austrian jurisdiction (constitutional court, higher administrative court, supreme court) confirmed in various judgements restrictive interpretations regarding the provisions for prohibition of commercials and sponsorings.","Answer not provided","WHO European Region"
"9","Azerbaijan","New Law of Azerbaijan Republic ""On restriction of tobacco use"" - 01 December 2017 
https://tobaccocontrol.az/upload/File/catalog/02-2018/catalog-53-file.pdf
On 01 December 2017 the new Law of Azerbaijan Republic ""On restriction of tobacco use"" was adopted. The article 14, and especially article 9.1.4 of the Law total ban of all tipe of the direct and indirect TAPS.","Law of the Azerbaijan Republic On Advertising was updated in 15 May 2015
http://www.tobaccocontrollaws.org/files/live/Azerbaijan/Azerbaijan%20-%20Law%20on%20Advertising.pdf","Answer not provided","WHO European Region"
"10","Bahamas","Report not provided","Answer not provided","Bans have been implemented via policy on the advertisement of tobacco products in the local media and sponsorship of local and international events in country. The Draft Tobacco Control Bill 2014 which is being discussed among Cabinet Members for official tabling and passage contains provisions for all operational portions of the WHO FCTC (except taxation as this is already covered in the Tobacco Excise Stamp Tax Act 2013) addresses a more comprehensive ban on tobacco advertising promotion and sponsorship in accordance with the guidelines.","WHO Region of the Americas"
"11","Bahrain (Kingdom of)","Bahrain completely bans Tobacco advertising, promotion and sponsorship since 2009. we are still monitoring the implementation of this ban even in social media (instagram and facebook). Violators are being referred to public prosecutor.","Bahrain completely bans Tobacco advertising, promotion and sponsorship since 2009. we are still monitoring the implementation of this ban even in social media (instagram and facebook). Violators are being referred to public prosecutor.","Articles 6 7 and 15 of Antismoking law and decree (3) of 2011 prohibit any form of advertising promotion and sponsorship by tobacco manufacturers distributors and sales. In addition social media like facebook and instagram originating from Bahrain is closly monitired.","WHO Eastern Mediterranean Region"
"12","Bangladesh","Answer not provided","Answer not provided","Answer not provided","WHO South-East Asia Region"
"13","Barbados","No legislation however there is a general agreement within the private sector that there is no advertising, sponsorship or marketing to the public in print and audiovisual media.","No legislation however there is a general agreement with the private sector that there is no advertising, sponsorship or marketing to the public in print and audiovisual media","A regional approach to facilitate Article 13 has been proposed by the Government of Guyana because of the similarity of advertising promotion and sponsorship issues in the Caribbean region. This approach is being supported by the Government of Barbados and PAHO.","WHO Region of the Americas"
"14","Belarus","За последние два года на территории Республики Беларусь случаи рекламы табачных изделий не выявлены.","Запрет на рекламу табачных изделий в Республике Беларусь введен с 1 января 2008 года. Со времени предоставления последнего доклада изменений в законодательство относительно рекламы, стимулирования продажи и спонсорства табачных изделий не вносилось.","Ban on advertising of tobacco products in the Republic of Belarus introduced on January 1 2008. Since the last report providing changes in legislation on tobacco advertising promotion and sponsorship of tobacco products have been made.","WHO European Region"
"15","Belgium","Answer not provided","Answer not provided","Pas de changements concernant ces aspects depuis le dernier rapport.","WHO European Region"
"16","Belize","Report not provided","The Bureau of Standards is curently working on drafing a bill to address advertising and marketing of tobacco products.","Answer not provided","WHO Region of the Americas"
"17","Benin","interdiction de la publicité , du parrainage , de la promotion des produits du tabac et effective partout sauf sur les points de vente","interdiction de la publicité , du parrainage , de la promotion des produits du tabac et effective partout sauf sur les points de vente","Remarque: la publicité sur les points de vente se fait à grande échelle par le tabac les armoires les parasols drapés à leffigie des marques de cigarettes et aussi des scooters et des gros véhicules qui circulent dans la ville pour faire de la distribution sur les points de vente.","WHO African Region"
"18","Bhutan","Chapter 4, section 18 & 19 of Tobacco Control Act 2010 entails ban of Tobacco Advertisement, promotion and sponsorship","Chapter 4, section 18 of Tobacco Control Act 2010 entails ban of Tobacco Advertisement, promotion and sponsorship","Section.38(c) of the Tobacco Control Act empowered the Royal Bhutan Police to assist the relevant agencies on prohibition of tobacco advertisement promotion and sponsorship and; Bhutan inforcomm and media authority to monitor and take measures on domestic direct and indirect advertisements and promotion of tobacco products","WHO South-East Asia Region"
"19","Bolivia (Plurinational State of)","","Report not provided","Report not provided","WHO Region of the Americas"
"20","Bosnia and Herzegovina","Answer not provided","Answer not provided","New Tobacco Control Law in the Federation of B&H enforced in 2011 enforced ban of tobacco advertisement promotion and sponsorship in line with international recommendations and FCTC requirements. RAK (Regulatory Agency for Media) is responsible for monitoring of advertisement activities in electronic and print media related to Codex of advertisement. However there are still practice that some international tobacco industries occasionally advert and promote new their new tobacco products mainly use print media and billboards. Ban of tobacco advertisement promotion and sponsorship is enforced in Republika Srpska through Law on Prohibition of Advertising Tobacco Products","WHO European Region"
"21","Botswana","Complete ban of tobacco advertising has been achieved. The challenges faced are of impoted goods especially clothing which are found with promotional messages. Such goods are siezed and destroyed if found. The owner face charges for possesing such goods. The country does not have strict regulations on global internet and other forms of communication such as films and amgazines.","Report not provided","Report not provided","WHO African Region"
"22","Brazil","New regulation ban the exposition of tobacco products close to candy, confectionery, chewing gum, chocolates  etc…","In 2014 it was published a decree regulating the federal law that banned the advertising of tobacco products in points of sale.","The Federal Law 12.546 published on December 2011 banned all tobacco advertising in points of sales. except for the exhibition of products for sale.","WHO Region of the Americas"
"23","Brunei Darussalam","Currently revising Tobacco Order 2005 to include all forms of advertising and promotions.","Report not provided","Since Tobacco Order 2005 was enforced in 2008 all forms of tobacco advertising (including advertisements at point of sale and by social media) promotion and sponsorship are banned. Point of sale display using display cabinets provided by tobacco companies are also banned.","WHO Western Pacific Region"
"24","Bulgaria","The ""Coalition for a Life Without Tobacco Smoke"" lead a campaign for setting supportive ground for legislative change to enact comprehensive Tobacco Advertising Promotion and Sponsorship (TAPS) ban and build and maintain steady media attention to influence policy makers and activate public support for and engagement with FCTC-related policies’ implementation.","Answer not provided","The depicted above requirements are adopted by the national legislation at 01.01. 2007. There is no new legislative rules at the present.","WHO European Region"
"25","Burkina Faso","Answer not provided","Answer not provided","Le Burkina Faso a respecté le délai d’application de ses obligations vis-à-vis de l’article 13. La loi 040 prévoit des sanctions et amendes en cas de publicité de la promotion et du parrainage en faveur des produits du tabac.","WHO African Region"
"26","Burundi","Report not provided","Le Ministère ayant la  communication dans ses attributions a reçu une copie de linstruction ministérielle interdisant la publicité, la promotion et parrainage des produits du tabac","Report not provided","WHO African Region"
"27","Cambodia","Answer not provided","Report not provided","The Council of the Ministers approved the Sub-Decree on the measures for banning of Tobacco Product advertising which was signed by the Prime Minister on 24 February 2011 and came into effect on 24 August 2011.","WHO Western Pacific Region"
"28","Cameroon","Un processus damendement des dispositions actuelles de la législation en vigueur sur la publicité est en cours. loption et de passer à une interdiction complète de la publicité du tabac et des produits du tabac
un projet de texte portant protection du domaine scolaire de toute activité en faveur du tabac, des boissons alcooliques et des jeux de hasard est en cours délaboration dans le cadre des activité de la Commission et de son secrétariat techniqyue","Answer not provided","De très rare publicité de tabac sur les axes routiers plus de parrainage des évènements ni de promotion de session de dégustation","WHO African Region"
"29","Canada","Answer not provided","Answer not provided","The promotion of tobacco products in Canada is prohibited except as authorized by the Tobacco Act and its regulations. For example. tobacco products advertising is restricted to informative and brand-preference advertising on signs in adult-only locations such as in nightclubs. and in publications that are provided by mail and addressed to named adults. Furthermore. Canada has legislated a prohibition of lifestyle tobacco products advertising. including a total ban on sponsorship promotion by way of tobacco product-related brand names and manufacturers'' names.
The Promotion of Tobacco Products and Accessories Regulations (Prohibited Terms) came into force on September 22. 2011. They prohibit the use of the terms ''light'' and ''mild''. and variations thereof. on various tobacco products. their packaging. promotions. retail displays. as well as on tobacco accessories. These regulations apply to cigarettes. little cigars. cigarette tobacco. kreteks. bidis. tobacco sticks. cigarette papers. cigarette tubes and filters.","WHO Region of the Americas"
"30","Cape Verde","Answer not provided","Answer not provided","Report not provided","WHO African Region"
"31","Central African Republic","Report not provided","Report not provided","Report not provided","WHO African Region"
"32","Chad","mise en place de la sous commission surveillance industrie de tabac qui assure le suivi régulier
formation des différents acteurs ( conseillers juridiques et techniques  des différents ministères, des personnels du ministère de commerce, du comité national de lutte contre le tabac, des médias, etc sur larticles 3.5 de la CCLAT","Report not provided","Report not provided","WHO African Region"
"33","Chile","De acuerdo a las modificaciones de la Ley 19.419  
Art 2º  b)  Industria tabacalera: Comprende a fabricantes, distribuidores mayoristas e importadores de productos de tabaco (Se modifica la frase - productos con tabaco-  por - productos de tabaco-)    
Artículo 3ª señala
°.- Se prohíbe la publicidad del tabaco y de elementos de las marcas relacionados con dicho producto. 
(Se incorporan a este Artículo las siguientes prohibiciones): 
- La prohibición indicada se extiende en los mismos términos y con los mismos efectos a la publicidad indirecta realizada por medio de emplazamiento, donde se muestra en medios de comunicación masiva el consumo de productos o marcas de productos hechos de tabaco.  
- Del mismo modo, se prohíbe en programas transmitidos en vivo, por televisión o radio, en el horario permitido para menores, la aparición de personas fumando o señalando características favorables al consumo de tabaco. 
- Asimismo, se prohíbe la publicidad en las señales internacionales de los medios de comunicación chilenos o de páginas de internet cuyos dominios correspondan a la terminación “punto cl”. (En este párrafo, se incorpora la palabra ""Asimismo"")
- Las compañías tabacaleras deberán informar anualmente al Ministerio de Salud el detalle de donaciones efectuadas, así como de los gastos en que incurran en virtud de convenios con instituciones públicas, organizaciones deportivas, comunitarias, entidades académicas, culturales y organizaciones","De acuerdo a las modificaciones de la Ley 19.419  
Art 2º  b)  Industria tabacalera: Comprende a fabricantes, distribuidores mayoristas e importadores de productos de tabaco (Se modifica la frase - productos con tabaco-  por - productos de tabaco-)    
Artículo 3ª señala
°.- Se prohíbe la publicidad del tabaco y de elementos de las marcas relacionados con dicho producto. 
(Se incorporan a este Artículo las siguientes prohibiciones): 
- La prohibición indicada se extiende en los mismos términos y con los mismos efectos a la publicidad indirecta realizada por medio de emplazamiento, donde se muestra en medios de comunicación masiva el consumo de productos o marcas de productos hechos de tabaco.  
- Del mismo modo, se prohíbe en programas transmitidos en vivo, por televisión o radio, en el horario permitido para menores, la aparición de personas fumando o señalando características favorables al consumo de tabaco. 
- Asimismo, se prohíbe la publicidad en las señales internacionales de los medios de comunicación chilenos o de páginas de internet cuyos dominios correspondan a la terminación “punto cl”. (En este párrafo, se incorpora la palabra ""Asimismo"")
- Las compañías tabacaleras deberán informar anualmente al Ministerio de Salud el detalle de donaciones efectuadas, así como de los gastos en que incurran en virtud de convenios con instituciones públicas, organizaciones deportivas, comunitarias, entidades académicas, culturales y organizaciones","De acuerdo a las modificaciones de la Ley 19.419 
Art 2º b) Industria tabacalera: Comprende a fabricantes. distribuidores mayoristas e importadores de productos de tabaco (Se modifica la frase - productos con tabaco- por - productos de tabaco-) 
Artículo 3ª señala
°.- Se prohíbe la publicidad del tabaco y de elementos de las marcas relacionados con dicho producto. 
(Se incorporan a este Artículo las siguientes prohibiciones): 
- La prohibición indicada se extiende en los mismos términos y con los mismos efectos a la publicidad indirecta realizada por medio de emplazamiento. donde se muestra en medios de comunicación masiva el consumo de productos o marcas de productos hechos de tabaco. 
- Del mismo modo. se prohíbe en programas transmitidos en vivo. por televisión o radio. en el horario permitido para menores. la aparición de personas fumando o señalando características favorables al consumo de tabaco. 
- Asimismo. se prohíbe la publicidad en las señales internacionales de los medios de comunicación chilenos o de páginas de internet cuyos dominios correspondan a la terminación “punto cl”. (En este párrafo. se incorpora la palabra Asimismo)
- Las compañías tabacaleras deberán informar anualmente al Ministerio de Salud el detalle de donaciones efectuadas. así como de los gastos en que incurran en virtud de convenios con instituciones públicas. organizaciones deportivas. comunitarias. entidades académicas. culturales y organizaciones","WHO Region of the Americas"
"34","China","1.2016年以来依据中国《广告法》相关规定在中国境内广泛禁止烟草广告。2016年7月，工商总局公布了《互联网广告管理暂行办法》，明确规定不得利用互联网发布烟草广告，为全面规范我国互联网广告市场秩序、防止烟草广告通过互联网传播提供了有力的法律支撑。2016、2017年全国工商和市场监管部门共查处烟草广告违法案件54件，罚没款约443.5万元。
2. 2016年，国家卫生计生委委托中国控烟协会在11个城市开展烟草广告调查活动。调查结果显示，除烟草销售点外，公共场所、户外的烟草广告明显好转。
另外，国家卫生计生委委托中国控烟协会连续9年开展热播国产影视剧烟草镜头监测，旨在倡导影视界承担社会责任，拍摄无烟影视作品，做社会先进文化和移风易俗的引领者。监测结果显示，有烟草镜头影视剧作品数量、烟草镜头个数、时长均明显下降。
3.2016年9月1日，《慈善法》正式施行。其中第四十条第二款涉及烟草捐赠赞助的内容为：“任何组织和个人不得利用慈善捐赠违反法律规定宣传烟草制品，不得利用慈善捐赠以任何方式宣传法律禁止宣传的产品和事项。”","2015年4月，修订后的《广告法》正式颁布，同年9月开始实施，在大众传播媒介、公共场所、公共交通工具、户外等发布烟草广告，广泛禁止了烟草广告发布。同时禁止向未成年人发送任何形式的烟草广告。","Industrial and commercial administration authorities according to the law on advertising and its provisions strictly investigated and dealt with cases of tobacco advertising from 2011 to 2013 a total of nearly 200 tobacco advertising case were prosecuted. While the State administration for industry and commerce actively promote China''s tobacco control program (2012-2015) implementation during the course of the revision of the law on advertising actively put forward proposals to restrict tobacco advertising.","WHO Western Pacific Region"
