"41","Croatia","Croatia has transposed Directive2014/40/EU into national legislation regarding the contents of tobacco products and of tobacco products disclosures.","Croatia is in transitional phase in regard to contents of tobacco products and of tobacco products disclosures due to transposing the Directive 2014/40/EU into the national law.","According to the Regulations on the content of information on all ingredients and their quantities strengthened by the type used in the manufacture of tobacco products and the method of informing the public (Official Gazette no. 39 /09 ) manufacturers and importers of tobacco products “ are obliged not later than 31 March of the current year for the previous year to submit to the Ministry of Health and Social Welfare through the Croatian National Institute for Public Health the list of all ingredients and their quantities by type and the type used in the manufacture of tobacco products. The list of ingredients is made specifically for each type of tobacco product and for each component indicates its function and category. The list of ingredients must be accompanied by a statement of the manufacturer or importer of tobacco products which addresses the reasons for the use of certain ingredients in tobacco products”. “All information submitted must be obtained or verified by an accredited laboratory based in Croatia and one of the authorized laboratories in the field of European Union”.“If the content of the contents of tobacco products is changed the manufacturer or importer of tobacco products is obliged to immediately notify the Ministry through the Croatian National Institute of Public Health.”

Tobacco Institute has accredited test methods for carbon monoxide nicotine and tar.","WHO European Region"
"42","Cyprus","Report not provided","With the passing of the new national legislation the way by which the information on tobacco products will be delivered to the appropriate officials will change. Information will be delivered through an online system hosted by the European Comittee.","Answer not provided","WHO European Region"
"43","Czech Republic","Act No. 110/1997 Coll. on Foodstuffs and Tobacco Products, on the amendment and additions to some related acts, as amended subsequently, applies. This is a national law implementing the current EU Tobacco Products Directive (Directive 2014/40/EU of the European Parliament and of the Council of 3 April 2014 on the approximation of the laws, regulations and administrative provisions of the Member States concerning the manufacture, presentation and sale of tobacco and related products and repealing Directive 2001/37/EC), which has been revised accordingly following the transposition of the Directive. Transposition process of the Directive to the aforementioned law was finished in 2016.The Directive includes, inter alia, provisions regarding regulation of tobacco product disclosure. 
Information on contents/emissions of tobacco products are publicly available on the websites of the Czech Agriculture and Food Inspection Authority:  http://www.szpi.gov.cz/lstDoc.aspx?nid=11323","Act No. 110/1997 Coll. on Foodstuffs and Tobacco Products, on the amendment and additions to some related acts, as amended subsequently, applies. 
It implements the current EU Tobacco Products Directive (2001/37/EC). 
Since 2015 revision of the mentioned law has been under way. Main reason is transposition of Directive 2014/40/EU of the European Parliament and of the Council of 3 April 2014 on the approximation of the laws, regulations and administrative provisions of the Member States concerning the manufacture, presentation and sale of tobacco and related products and repealing Directive 2001/37/EC, to the national law.  The Directive includes among others provisions regarding regulation of tobacco product disclosure. Draft bill is currently negotiated in the Senate of the Parliament of the Czech Republic.

Information on contents/emissions of tobacco products are publicly available on the websites of the Czech Agriculture and Food Inspection Authority:  http://www.szpi.gov.cz/lstDoc.aspx?nid=11323","nid=11323 
No substantial progress in the past two years.","WHO European Region"
"44","Democratic People's Republic of Korea","Updated tobacco law mandates the display of content of emission of CO and content and tobacco on all tobacco products.","Report not provided","Answer not provided","WHO South-East Asia Region"
"45","Democratic Republic of the Congo","Answer not provided","Actuellement, seules les teneurs en nicotine et en goudron sont exigées sur le conditionnement
des cigarettes.","Report not provided","WHO African Region"
"46","Denmark","Answer not provided","Answer not provided","Answer not provided","WHO European Region"
"47","Djibouti","Answer not provided","Answer not provided","Answer not provided","WHO Eastern Mediterranean Region"
"48","Dominica","Report not provided","Answer not provided","Report not provided","WHO Region of the Americas"
"49","Ecuador","Answer not provided","Answer not provided","El Art. 5 del Reglamento de la Ley Orgánica para la Regulación y Control del Tabaco. expresa: “El Ministerio de Salud Pública mediante acuerdo ministerial regulará el contenido y emisiones de los productos de tabaco. La información correspondiente que se entregue a la Autoridad Sanitaria Nacional por parte de la industria del tabaco dentro de este proceso regulatorio. será actualizada anualmente hasta el 30 de junio de cada año. La Autoridad Sanitaria Nacional definirá la información que debe ser difundida a la población. a fin de precautelar su salud”","WHO Region of the Americas"
"50","Egypt","Answer not provided","Answer not provided","Disclosure only concernt the content of nicotine and tar of tobacco products.","WHO Eastern Mediterranean Region"
"51","El Salvador","Reglamento de la Ley para el Control del Tabaco. Decreto 63. 29 de mayo de 2015. Capítulo III. Advertencias sanitarias. Viñetas Informativas. Art. 10.· Además de las advertencias sanitarias, los envases primarios de los productos de tabaco y derivados deben llevar las viñetas informativas en las caras laterales, debiendo expresar en una de sus caras, textos en castellano con letra de color negro y fondo blanco, que pueda leerse de la base a la parte superior de la cajetilla, el siguiente mensaje: (a) Este producto MATA, (b) Tiennicotina, alquitrán y monóxido de carbon c)Busca ayuda al teléfono del MINSAL y FOSALUD. d) Venta prohibida a menores. Se prohíbe el uso de mensajes, símbolos, figuras, imágenes, signos figurativos y logos al interior de la cajetilla que estén vinculados con la fabricación, indicaciones de uso y promocionales de los productos de tabaco.","Reglamento de la Ley para el Control del Tabaco. Decreto 63. 29 de mayo de 2015. Capítulo III. Advertencias sanitarias. Viñetas Informativas. Art. 10.· Además de las advertencias sanitarias, los envases primarios de los productos de tabaco y derivados deben llevar las viñetas informativas en las caras laterales, debiendo expresar en una de sus caras, textos en castellano con letra de color negro y fondo blanco, que pueda leerse de la base a la parte superior de la cajetilla, el siguiente mensaje: (a) Este producto MATA, (b) Tiennicotina, alquitrán y monóxido de carbon c)Busca ayuda al teléfono del MINSAL y FOSALUD. d) Venta prohibida a menores. Se prohíbe el uso de mensajes, símbolos, figuras, imágenes, signos figurativos y logos al interior de la cajetilla que estén vinculados con la fabricación, indicaciones de uso y promocionales de los productos de tabaco.","Todas las cajetillas de cigarrillos exhiben por ley esta leyenda ''Este producto MATA.  contiene nicotina. alquitrán y monóxido de carbono''","WHO Region of the Americas"
"52","Equatorial Guinea","NO DISPONEMOS DE UNA LEY","NO DISPONEMOS DE UNA LEY","Report not provided","WHO African Region"
"53","Estonia","No changes since the last report.","No changes since the last report.","Answer not provided","WHO European Region"
"54","Ethiopia","Report not provided","Report not provided","Report not provided","WHO African Region"
"55","European Union","In the area of ingredients reporting (i.e. disclosure), Directive 2014/40/EU foresees a common electronic format for the reporting of tobacco ingredients, including both tobacco leaf and ingredients, including additives. 
 
For certain additives on a priority list, more in-depth studies and their disclosure is required by June 2018. The list of these additives (contained in cigarettes and roll-your-own tobacco) for which enhanced reporting obligations shall be set up by the Commission taking into account additives, 

a) for which initial indications, research, or regulation in other jurisdictions exist suggest that they contribute to the toxicity or addictiveness of the products concerned, impart a characterising flavour; facilitate inhalation or nicotine uptake; or lead to the formation of substances that have CMR properties, and

b) which are amongst the most commonly used additives by weight or number.

The Directive also requires manufacturers and importers to submit internal and external studies available to them on market research and preferences of various consumer groups, including young people and current smokers, as well as executive summaries of any market surveys they carry out when launching new products. Manufacturers and importers are also required to report the sales volume data per product.  
Member States shall ensure the submitted information is made publicly available on a website, taking into account the need to protect trade secrets.","In the area of ingredients reporting (i.e. disclosure), Directive 2014/40/EU foresees a common electronic format for the reporting of tobacco ingredients by May 2016, including both tobacco leaf and ingredients, including additives. 
 
For certain additives on a priority list (foreseen to be adopted Q2 2016), more in-depth studies and their disclosure is required. The list of these additives (contained in cigarettes and roll-your-own tobacco) for which enhanced reporting obligations shall be set up by the Commission taking into account additives, 

a) for which initial indications, research, or regulation in other jurisdictions exist suggest that they contribute to the toxicity or addictiveness of the products concerned, impart a characterising flavour; facilitate inhalation or nicotine uptake; or lead to the formation of substances that have CMR properties, and

b) which are amongst the most commonly used additives by weight or number.

The Directive also requires manufacturers and importers to submit internal and external studies available to them on market research and preferences of various consumer groups, including young people and current smokers, as well as executive summaries of any market surveys they carry out when launching new products. Manufacturers and importers are also required to report the sales volume data per product.  
Member States shall ensure the submitted information is made publicly available on a website, taking into account the need to protect trade secrets.","In the area of ingredient reporting (= disclosure) the EU Directive 2014/40/EU foresees a common electronic format for the reporting of tobacco ingredients including both tobacco leaf and ingredients including additives. 
For certain additives on a priority list (still to be established) more in-depth studies and their disclosure is required. The list of these additives (contained in cigarettes and roll-your-own tobacco) for which enhanced reporting obligations shall be set up by the Commission taking into account additives 
a) for which initial indications research or regulation in other jurisdictions exist suggest that they contribute to the toxicity or addictiveness of the products concerned impart a characterising flavour; facilitate inhalation or nicotine uptake; or lead to the formation of substances that have CMR properties.
b) which are amongst the most commonly used additives by weight or number.
The Directive also requires manufacturers and importers to submit internal and external studies available to them on market research and preferences of various consumer groups including young people and current smokers as well as executive summaries of any market surveys they carry out when launching new products. Manufacturers and importers are also required to report the sales volume data per product. 
Member States shall ensure the submitted information is made publicly available on a website taking into account the need to protect trade secrets.","WHO European Region"
"56","Fiji","Report not provided","Report not provided","This has been covered under the Tobacco Control Regulation 2012 to which it is mandatory","WHO Western Pacific Region"
"57","Finland","The regulation is coming from the Tobacco Products Directive (EU/2014/40):

Section 14: Notifications regarding ingredients, emissions and fire safety
Section 15: Notifications of modifications
Section 16: Market research and sales volumes
Section 17: Studies on primary additives
Section 18: Enhanced reporting obligation
Section 19: Derogation for small and medium-sized enterprises
Section 20: Notification of a novel tobacco product
Section 21: Method, format and time of submitting information on tobacco products","Answer not provided","Answer not provided","WHO European Region"
"58","France","L’Ordonnance n°2016-623 du 19 mai 2016 a introduit l’article L3512-17 du code de la santé publique : « I.- Avant la mise sur le marché de tout produit du tabac, les fabricants et importateurs de produits du tabac transmettent, par marque et par type, à létablissement public désigné par arrêté la liste de tous les ingrédients utilisés dans la fabrication des produits du tabac et leurs émissions.
Cette déclaration comporte des informations portant notamment sur le statut des ingrédients au regard du règlement (CE) n° 1907/2006 du 18 décembre 2006 et du règlement (CE) n° 1272/2008 du 16 décembre 2008, les données toxicologiques et les effets sur la santé du produit, la raison de lutilisation des ingrédients, ainsi quune description générale des additifs utilisés et leurs propriétés.
II.- Au plus tard dix-huit mois après quun additif a été inscrit sur la liste prioritaire établie par décision européenne mentionnée à larticle 6 de la directive 2014/40/ UE, les fabricants et les importateurs soumettent les études approfondies quils ont réalisées le concernant.
III.- Pour les nouveaux produits du tabac définis au troisième alinéa de larticle L. 3512-1, une notification complémentaire est transmise six mois avant la mise sur le marché. Cette notification comporte des études portant notamment sur la toxicité, les effets de dépendance, lattractivité et le marché du produit.

L’Article L3512-18 prévoit également que « Les fabricants et importateurs de produits du tabac communiquent à létablissement public désigné par arrêté les études internes et externes concernant le marché et les préférences des groupes de consommateurs en matière dingrédients et démissions et des synthèses détudes en vue du lancement de nouveaux produits. Ils déclarent annuellement à cet établissement le volume de leurs ventes pour lannée écoulée, par marque et par type.
Le fabricants doivent payer une taxe pour les frais d’enregistrement, stockage, traitement et analyse des données ainsi transmises.","Answer not provided","Answer not provided","WHO European Region"
"59","Gabon","Answer not provided","Answer not provided","La loi prévoit uniquement que le fabricant ou l’importateur puisse communiquer au public les informations au niveau du paquet de cigarette sur la teneur en nicotine et en goudron ainsi que sur les émissions des produits du tabac. Par contre rien n’est dit sur les informations à fournir aux autorités gouvernementales. Il est prévu d’ajouter ces dispositions dans les textes d’application qui vont être rédigés.","WHO African Region"
"60","Gambia","Answer not provided","Answer not provided","Answer not provided","WHO African Region"
"61","Georgia","Newly prepared Order of the Minister requires tobacco industry to provide information about emissions and contents of the tobacco products.","currently there is no provision in place to ensure information disclosure about tobacco products. Amendments project to current legislation include such provisions but it is not passed in the parliament yet.","Currently there is no provision in place to ensure information disclosure about tobacco product. Amendment project to current legislation include such provisions but it is not passed in the parliament yet.","WHO European Region"
"62","Germany","Answer not provided","Answer not provided","Answer not provided","WHO European Region"
"63","Ghana","Answer not provided","Answer not provided","At customs importers are required to disclose quantity cost and content of tobacco products being brought into the country. It is upon inspection and approval of FDA that the product is allowed into the country.","WHO African Region"
"64","Greece","Report not provided","Implementation of TPD article 5,6,7","Answer not provided","WHO European Region"
"65","Grenada",NA,"Answer not provided","Answer not provided","WHO Region of the Americas"
"66","Guatemala","Ninguno","Ninguno","Answer not provided","WHO Region of the Americas"
"67","Guinea","Report not provided","Answer not provided","Report not provided","WHO African Region"
"68","Guinea-Bissau","Answer not provided","Answer not provided","Report not provided","WHO African Region"
"69","Guyana","The  Tobacco Control Act was successful passed in July 2017","Report not provided","Report not provided","WHO Region of the Americas"
"70","Honduras","La ratificación del CMCT de la OMS, la Ley Especial para el Control del Tabaco y su Reglamentación establecen las disposiciones del Artículo 10 del CMCT de la OMS referente a la divulgación de la información sobre los productos derivados de tabaco para lo cual se ha cumplido con dichas obligaciones jurídicas en Honduras.","La ratificación del CMCT de la OMS, la Ley Especial para el Control del Tabaco y su Reglamentación establecen las disposiciones del Artículo 10 del CMCT de la OMS referente a la divulgación de la información sobre los productos derivados de tabaco para lo cual se ha cumplido con dichas obligaciones jurídicas en Honduras.","Con la entrada en vigencia de la Ley Especial para el Control del Tabaco LECT y su Reglamentación las empresas que producen o importan productos de tabaco han impreso los contenidos en las cajetillas de cigarrillos de 10 unidades y de 20 unidades imprimiendo que dicho producto es para  comercialización en el territorio de Honduras.","WHO Region of the Americas"
"71","Hungary","Report not provided","A new legislation of the relevant field has been adopted:   Directive 2014/40/EU of the European Parliament and of the Council of 3 April 2014 on the approximation of the laws, regulations and administrative provisions of the Member States concerning the manufacture, presentation and sale of tobacco and related products and repealing Directive 2001/37/EC Text with EEA relevance. Transposition of the directive is in process at national level.","Answer not provided","WHO European Region"
"72","Iceland","Answer not provided","Answer not provided","Answer not provided","WHO European Region"
"73","India","Report not provided","Section 11 of the Tobacco Control Act of India (COTPA-2003) mandates setting up of tobacco product testing labs. The process of setting up of the  testing labs and apex lab has been finalised. The process of procurement of equipments has been initiated. In 1st Phase, the Minsitry of Health & Family Welfare will be setting up three labs (regional - 2 and Apex -1)","Section 11 of the Tobacco Control Act of India (COTPA-2003) mandate setting up of tobacco product testing labs. The process of setting of the 4 Regional Testing Labs and 1 Apex Lab has been finalised. The process of procurement of equipments is underway","WHO South-East Asia Region"
"74","Iran (Islamic Republic of)","Through the national campaign, randomly, many of Waterpipe dispensaries have been included in sampling test of thier tobacco used for Waterpipe and results of the tests publicly broadcast-ed via mass media.","Through the national campaign, randomly, many of Waterpipe dispensaries have been included in sampling test of thier tobacco used for Waterpipe and results of the tests publicly broadcast-ed via mass media.","According to the national tobacco control headquarters'' resulution tobacco companies are obliged to report about the content and emission of tobacco products to the MOH. Regarding the public disclusure the tar and nicotine content of tobacco products (any brands of manufactured cigarettes) is mentioned on the tobacco packages.","WHO Eastern Mediterranean Region"
"75","Iraq","Answer not provided","Answer not provided","The anti-smoking law in Iraq No. (19) of 2012 regulates the contents of tobacco products and packaging and labeling of tobacco products all in accordance with the requirements of the WHO FCTC.","WHO Eastern Mediterranean Region"
"76","Ireland","In compliance with E.U. law.","In compliance with E.U. law.","In compliance with E.U. law","WHO European Region"
"77","Israel","Report not provided","Report not provided","Report not provided","WHO European Region"
"78","Italy","The Legislative decree n.6/2016 adopted the European Directive 40/2014/UE which regulate tobacco products and e-cigarettes disclosures. Commission Implementing Decision (EU) 2015/2186 of 25 November 2015 establishing a format for the submission and making available of information on tobacco products. European Commission established a portal called EU-CEG which gathered all the notification of tobacco products (and ecigs). Italy realized a website to disclose available information to the general public.","The Legislative decree n.6/2016 adopted the European Directive 40/2014/UE which regulate tobacco products and e-cigarettes disclosures.","Manufacturers and importers transmit the list of all ingredients used by brand. The format includes a Common Table 1 for the delivery of the full report on ingredients contained in each of the brands marketed in Italy (including the information covered by trade secret) and a Table 2 for the delivery of information on the summary of toxicological data available for each ingredient. 
The major companies have disclosed the information but some manufacturers are still failing. The Ministry of Health is setting up a dedicated database and the construction of a dedicated website to make available the information to the citizens.","WHO European Region"
"79","Jamaica","The Public Health (Tobacco Control) Regulation 2013 which was enacted on July 15, 2013 and amended in 2014 makes provision for Article 10. 
This will be addressed comprehensively in the impending comprehensive tobacco control legislation, that is, the FCTC (Implementation) Bill.","The Public Health (Tobacco Control) Regulation 2013 which was enacted on July 15, 2013 and amended in 2014 makes provision for Article 10.","The Public Health (Tobacco Control) Regulation 2013 was enacted on July 15 2013","WHO Region of the Americas"
"80","Japan","Answer not provided","Answer not provided","Answer not provided","WHO Western Pacific Region"
"81","Jordan","يتم مراقبة المصانع من قبل مؤسسة الموصفات والمقاييس واخذ عينات دورية عشوائية لفحصها لدى الاقسام المختصه في الجمعية العلمية الملكية","يتم مراقبة المصانع من قبل مؤسسة الموصفات والمقاييس واخذ عينات دورية عشوائية لفحصها لدى الاقسام المختصه في الجمعية العلمية الملكية","Tobacco companies have been required to disclose the contents of tobacco flavors and additives within the audit committee and the current standards work is underway to disclose to the public.","WHO Eastern Mediterranean Region"
"82","Kazakhstan","Answer not provided","Report not provided","22.11.2011 approved by Resolution of the Government of the Republic of Kazakhstan ? 1368 ''On approval of rules for reporting by manufacturers and importers of tobacco and tobacco products'' which obliges to disclose the composition and emissions of tobacco products.","WHO European Region"
"83","Kenya","Answer not provided","Answer not provided","Answer not provided","WHO African Region"
"84","Kiribati","All importers of tobacco are required to submit annual reports (this is closely monitored by the Tobacco Control Point) regarding the composition and contents of tobacco products","All importers of tobacco are required to submit annual reports (this is closely monitored by the Tobacco Control Point) regarding the composition and contents of tobacco products","All importers of tobacco are required to submit annual reports (this is closely monitored by the Tobacco Focal Point) regarding the composition and content of tobacco products","WHO Western Pacific Region"
"85","Kuwait","The Tobacco laboratory in the MOH is responsile in such examinations and testing but it is limited to cigarettes not including the shisha products in the examination","The Tobacco laboratory in the MOH is responsile in such examinations and testing but it is limited to cigarettes not including the shisha products in the examination","Answer not provided","WHO Eastern Mediterranean Region"
