"120","Palau","Significant progress was made with RPPL 8-27 coming into effect in February, 2012. Only a few exemptions make it less than 100% comprehensive. A notable achievement was the ban of point of sales (POS). The law states “No person shall advertise or otherwise promote any tobacco brand, manufacturer or seller by any means, directly or indirectly that is intended to have or is likely to have the direct or indirect effect of promoting the purchase or use of tobacco or a tobacco brand, or of promoting a tobacco manufacturer or seller. Ads and promotions include words, messages, mottos, slogans, letters, numbers, pictures, images, graphics, sounds or any other auditory, visual, or sensory matter, in whole or part that are commonly identified or associated with a tobacco brand, manufacturer or seller. This prohibition includes a total ban on any display and on the visibility of tobacco products at points of sales (POS) but does not include the broadcast of television programming generated from outside Palau. Brand-stretching is prohibited. Tobacco sponsorship are prohibited. Sweepstakes, contests, rebates are prohibited. Cigarettes cannot be sold as single sticks; no person shall manufacture or distribute any product designed for or likely to appeal to children that evokes an association with a tobacco product, including but not limited to, candy or gum cigarettes or other sweets or snacks in the form of tobacco products.","Significant progress was made with RPPL 8-27 coming into effect in February, 2012. Only a few exemptions make it less than 100% comprehensive. A notable achievement was the ban of point of sales (POS). The law states “No person shall advertise or otherwise promote any tobacco brand, manufacturer or seller by any means, directly or indirectly that is intended to have or is likely to have the direct or indirect effect of promoting the purchase or use of tobacco or a tobacco brand, or of promoting a tobacco manufacturer or seller. Ads and promotions include words, messages, mottos, slogans, letters, numbers, pictures, images, graphics, sounds or any other auditory, visual, or sensory matter, in whole or part that are commonly identified or associated with a tobacco brand, manufacturer or seller. This prohibition includes a total ban on any display and on the visibility of tobacco products at points of sales (POS) but does not include the broadcast of television programming generated from outside Palau. Brand-stretching is prohibited. Tobacco sponsorships are prohibited. Sweepstakes, contests, rebates are prohibited. Cigarettes cannot be sold as single sticks; no person shall manufacture or distribute any product designed for or likely to appeal to children that evokes an association with a tobacco product, including but not limited to, candy or gum cigarettes or other sweets or snacks in the form of tobacco products.","Significant progress has been made with RPPL 8-27 coming into effect in February 2012. Only a few exemptions make is less than 100% comprehensive. A notable achievement has been the ban of point of sales (POS). The law states “No person shall advertise or otherwise promote any tobacco brand manufacturer or seller by any means directly or indirectly that is intended to have or is likely to have the direct or indirect effect of promoting the purchase or use of tobacco or a tobacco brand or of promoting a tobacco manufacturer or seller. Ads and promotions include words messages mottos slogans letters numbers pictures images graphics sounds or any other auditory visual or sensory matter in whole or part that are commonly identified or associated with a tobacco brand manufacturer or seller. This prohibition includes a total ban on any display and on the visibility of tobacco products at points of sales (POS) but does not include the broadcast of television programming generated from outside Palau. Brand-stretching is prohibited. Tobacco sponsorships are prohibited. Sweepstakes contests rebates are prohibited. Cigarettes cannot be sold as single sticks; no person shall manufacture or distribute any product designed for or likely to appeal to children that evokes an association with a tobacco product including but not limited to candy or gum cigarettes or other sweets or snacks in the form of tobacco products.","WHO Western Pacific Region"
"121","Panama","Como producto de los resultados de las opiniones expresadas por los entrevistados en la GYTS 2012 y en la GATS 2013, el MINSA en conjunto con el ICGES definió realizar el el estudio de evaluación de la PPPPT, en puntos de venta, medios de comunicación, internet, redes sociales, plataformas móviles de mensajería, videojuegos y empaquetado/etiquetado, 2015. Su Objetivo General buscaba evaluar el cumplimiento de la prohibición total de publicidad, promoción y patrocinio de productos de tabaco de conformidad con las disposiciones de los artículos 6 al 14 de la Ley 13 de 2008.

Entre sus objetivos específicos estaban los siguientes: 

i.	Describir las características generales de la publicidad, promoción y patrocinio a favor de productos de tabaco considerando su tipo (directa, indirecta, subliminal), su ámbito (nacional o transfronteriza), población objetivo por sexo, edad, tipo de medio de comunicación o espacio publicitario utilizado (empaquetado o etiquetado de  producto de tabaco en los medios de entretenimiento e internet, plataformas móviles y  video juegos).
ii.	Estimar el grado de cumplimiento de la prohibición de la publicidad, promoción y patrocinio a favor de los productos de tabaco exhibidos en medios de entretenimiento tales como cine y  televisión.
iii.	Medir el grado de cumplimiento de la prohibición de publicidad, promoción y patrocinio de productos de tabaco en internet y plataformas móviles
iv.	.Estimar el grado de cumplimiento de la prohibición de la publicidad, promoción y patrocinio a favor de los productos de tabaco exhibidos en los video juegos
v.	Medir el grado de cumplimiento de la prohibición de publicidad, promoción y patrocinio de productos de tabaco en los puntos de ventas.
vi.	Estimar el impacto del empaquetado de los productos de tabaco en los fumadores en cuanto a las  características de su diseño  elementos de ubicación, su contenido, su tamaño o dimensiones, su forma, el uso de terminología engañosa y las advertencias sanitarias , que se muestran en los empaquetados elaborados para la realización de este estudio o tomados de los productos que circulan en el mercado nacional.

Sus resultados y demás detalles metodológicos pueden ser consultados en http://www.gorgas.gob.pa/SitioWebTabaco/Publicaciones.htm

Adicionalmente, se ha realizado gestiones con la Autoridad de Servicios Públicos (ASEP), ente que regla los medios de comunicación para potenciar el trabajo colaborativo entre el MINSA y la ASEP para la vigilancia y control efectiva de la prohibición total de la publicidad, promoción y patrocinio de productos de tabaco. 

La Comisión Nacional de Control de Tabaco  en Panamá realiza consultas periódicas en  el internet y redes sociales en busca de incumplimientos de la prohibición total de la PPP de productos de tabaco que tiene el país, encontrando, en algunas ocasiones violaciones a la norma, para aplicar las sanciones correspondientes. Sin embargo y a pesar de los esfuerzos aún no contamos con estrategias efectivas para su control. 

Reiteramos que se ha identificado a la publicidad en televisión y cine como las de más difícil control, una situación similar se ha previsto para el tema de la publicidad en internet, plataforma móviles de mensajería y redes sociales, situación que se confirma en el estudio de evaluación de la PPPPT, antes enunciado.

Avances importantes se tienen con la eliminación de la publicidad del empaquetado y etiquetado de cigarrillos. La Comisión emite criterios técnicos de aprobación u objeción de aquellas cajetillas que por su diseño y mensajes violentan la prohibición total de la PPP de los productos de tabaco, las cuales son asumidas por la Dirección General de Salud Pública. La aplicación de estas medidas a ocasionados que la IT demande ante la Corte Suprema de Justicia, en más de una ocasión al MINSA. Así mismo, la IT ha interpuesto habeas data sobre  procedimientos  relacionados con este tema.

Ver presentación sobre PPP de Productos de Tabaco en Panamá. http://www.gorgas.gob.pa/SitioWebTabaco/Documentos.htm -- http://www.gorgas.gob.pa/SitioWebTabaco/Publicaciones.htm
Demandas de la IT ante la Corte Suprema de Justicia.

La GYTS 2017 reflejó que el 26.5% (chicos: 27.2% -chicas: 25.9%) vieron publicidad o promoción de tabaco en los puntos de venta, en tanto que 55.6% indicaron haberla visto en televisión, videos o películas (chicos: 57.0% -chicas: 54.2%). Cerca de 1 de cada 10 estudiantes (11.3%) posee algún objeto con la marco o logo de una compañía tabacalera (chicos: 12.4% -chicas: 10.0%), superando esta condición en 2.4 puntos porcentuales los chicos a las chicas. Por otro lado, las tabacaleras han ofrecido producto de tabaco gratuito al 7.3% de los entrevistados (chicos: 9.1% -chicas: 5.3%) con 4% más acceso gratuito de productos de tabaco para los chicos que para las chicas.

Uno de cada dos entrevistados (49.5%) vieron mensajes antitabaco en algún medio de comunicación, sin diferencias entre chicos y chicas. Cerca de 4 de cada 10 (41.6%) los vieron en eventos deportivos o sociales (chicos: 44.1% -chicas: 38.5%) donde más chicos que chicas visualizaron estos mensajes en actividades deportivas o sociales.","Como producto de los resultados de las opiniones expresadas por los entrevistados en la GYTS 2012 y en la GATS 2013, el MINSA en conjunto con el ICGES definió realizar el ESTUDIO DE PUBLICIDAD EN TV NACIONAL Y CABLE, CINE, REDES SOCIALES, INTERNET Y EMPAQUETADO Y ETIQUETADO DE PRODUCTOS DE TABACO 2015. En estos momentos nos encontramos en la última etapa de recolección de datos en puntos de venta. Se trata de un estudio observacional cuyos objetivos son los siguientes: 
General: Evaluar el cumplimiento de la prohibición total de publicidad, promoción y patrocinio de productos de tabaco de conformidad con las disposiciones de los artículos 6 al 14 de la Ley 13 de 2008.

Específicos

i.	Describir las características generales de la publicidad, promoción y patrocinio a favor de productos de tabaco considerando su tipo (directa, indirecta, subliminal), su ámbito (nacional o transfronteriza), población objetivo por sexo, edad, tipo de medio de comunicación o espacio publicitario utilizado (empaquetado o etiquetado de  producto de tabaco en los medios de entretenimiento e internet, plataformas móviles y  video juegos).
ii.	Estimar el grado de cumplimiento de la prohibición de la publicidad, promoción y patrocinio a favor de los productos de tabaco exhibidos en medios de entretenimiento tales como cine y  televisión.
iii.	Medir el grado de cumplimiento de la prohibición de publicidad, promoción y patrocinio de productos de tabaco en internet y plataformas móviles
iv.	.Estimar el grado de cumplimiento de la prohibición de la publicidad, promoción y patrocinio a favor de los productos de tabaco exhibidos en los video juegos
v.	Medir el grado de cumplimiento de la prohibición de publicidad, promoción y patrocinio de productos de tabaco en los puntos de ventas.
vi.	Estimar el impacto del empaquetado de los productos de tabaco en los fumadores en cuanto a las  características de su diseño  elementos de ubicación, su contenido, su tamaño o dimensiones, su forma, el uso de terminología engañosa y las advertencias sanitarias , que se muestran en los empaquetados elaborados para la realización de este estudio o tomados de los productos que circulan en el mercado nacional.


Adicionalmente, se ha realizado gestiones con la Autoridad de Servicios Públicos (ASEP), ente que regla los medios de comunicación para potenciar el trabajo colaborativo entre el MINSA y la ASEP para la vigilancia y control efectiva de la prohibición total de la publicidad, promoción y patrocinio de productos de tabaco. 

Así mismo, en mayo de 2014 efectuamos en el marco de la cooperación regional un taller conjunto con OPS, ONG´s de AMRO para que fue financiado por Panamá, cuyas conclusiones fueron los siguientes:
1.	América Latina tiene grandes avances en la última década, en relación al resto del mundo, por lo que es importante atraer recursos de diversas fuentes gubernamentales y no gubernamentales, para continuar generando evidencia científica. 
2.	Uruguay y Panamá son países líderes a la vanguardia impulsando iniciativas de control de tabaco.
3.	En el ámbito de PPP en puntos de venta, se identificaron varias prioridades de investigación a saber: 
a.	Impactos de la prohibición de la PPP en puntos de venta en la salud pública, 
b.	Monitoreo y vigilancia e investigación legal
c.	Otros aspectos incluidos entre las  prioridades identificadas durante el trabajo grupal sobre Puntos de Venta.  
4.	Toda vez que el empaquetado es una herramienta de publicidad de la industria tabacalera y que existe evidencias sobre percepción del empaquetado y tabaquismo, es necesario continuar generando evidencias para temas aún pendientes tales como: 
o	impacto del tamaño de la advertencia (para sustentar iniciativas que aumentan el tamaño) 
o	frecuencia de rotación de contenidos (en muchos países de la región rotan cada año, pero puede ser más eficaz un periodo de  rotación diferente  pero con mayor número de  advertencias).  
o	resumen de la literatura en español, sobre el empaquetado, para su uso en las iniciativas locales.  
o	impacto del uso del empaquetado para promocionar el uso de cigarrillos con cápsula de sabor en el filtro, esto debido a que la IT promueve cada más el uso de esta tecnología entre los fumadores.  Es importante investigar sobre el impacto de esta estrategia en jóvenes.
o	impacto de las diversas formas y diseños de la cajetilla, enfocándose al  estudio del impacto para promover iniciativas que limitan las formas del empaquetado. 
o	profundizar la investigación sobre el marco legal de los derechos de marca y su relación con tratados de comercio, para sustentar  las iniciativas de cambios en el empaquetado que promueven los países.  

5.	Enfocar la investigación científica en niños, adolescentes y otros grupos vulnerables ya que puede resultar de mayor impacto para la incidencia política y la toma de decisiones. 

6.	Integrar la investigación sobre el impacto económico de diferentes políticas públicas, para incidir en los tomadores de decisión.  Ya se cuenta con algunos modelos de simulación que pueden ser de utilidad (como los de David Levy) donde se incluyen parámetros de diferentes prohibiciones de PPP y se proyectan los impactos en la salud y en los costos. 

7.	Avanzar en la investigación sobre  internet como medio de PPP, así como en la promoción de los cigarrillos normales y su relación con la promoción y venta de cigarrillos electrónicos.  Hopkins está finalizando un protocolo sobre el tema de internet que pondrá a disposición de los países. Este protocolo incluye tips sobre palabras claves que se pueden poner en los buscadores de cada país.   

8.	Realizar talleres de capacitación para la implementación de protocolos de investigación sobre PPP de productos de tabaco ya disponibles, a fin de contar con  una masa crítica capacitada y orientada, así como promover y definir los mecanismos para su uso. 

9.	Desarrollar protocolos compartidos para ser adaptados al contexto local de cada país, que establezcan  elementos claves que permitan la comparación entre países. Estos protocolos deberían considerar el ámbito de PPP y el  ámbito del análisis de componentes del producto, entre otros. 

10.	Revisar  los protocolos disponibles sobre análisis de componentes  monitoreo del tabaco en medios de entretenimiento que facilitan el análisis del tabaco en películas que son exitosas en cada país, aplicando la base de datos existente  para hacerlo.

11.	Gestión de recursos financieros ante las agencias financiadoras de proyectos de investigación  de carácter multi-céntricos que puedan aplicarse en diversos  países que tienen la finalidad de aportar evidencia científica para impulsar los avances en la implementación de las políticas del control del tabaco  en América Latina. 

12.	Promover en los países la asignación de recursos financieros para la  investigación en control de tabaco procedentes, entre otras fuentes, de los impuestos  y del pago de multas en el marco de la vigilancia del cumplimiento de las medidas de control de tabaco.  


La Comisión Nacional para el Estudio del Tabaquismo en Panamá, periódicamente entra en  el internet y redes sociales en busca de incumplimientos de la prohibición total de la PPP de productos de tabaco que tiene el país, encontrando, en algunas ocasiones violaciones a la norma, para aplicar las sanciones correspondientes. Sin embargo y a pesar de los esfuerzos aún no contamos con estrategias efectivas para su control. 
Reiteramos que se ha identificado a  la publicidad en televisión y cine como la de más difícil control, una situación similar se ha previsto para el tema de la publicidad en internet y redes sociales.

Avances importantes se tienen con la eliminación de la publicidad del empaquetado y etiquetado de cigarrillos. La Comisión emite criterios técnicos de aprobación u objeción de aquellas cajetillas que por su diseño y mensajes violentan la prohibición total de la PPP de los productos de tabaco, las cuales son asumidas por la Dirección General de Salud Pública. La aplicación de estas medidas a ocasionados que la iT demande ante la Corte Suprema de Justicia, en más de una ocasión al MINSA. Así mismo, la IT ha interpuesto habeas data sobre  procedimientos  relacionados con este tema.

Ver presentación sobre PPP de Productos de Tabaco en Panamá. http://www.gorgas.gob.pa/SitioWebTabaco/Documentos.htm
Demandas de la IT ante la Corte Suprema de Justicia.","En estos momentos estamos trabajando en conjunto con OPS. ONG´s de AMRO para el desarrollo de un taller sobre PPP de productos de tabaco. financiado por Panamá. que se ha proyectado para el mes de mayo. que tienen entre sus objetivos los siguientes:
Revisar el estado de la situación de la política de publicidad. promoción y patrocinio en América Latina.
Determinar los elementos claves para avanzar en el proceso de implementación de esta política y las crecientes interferencias de la industria tabacalera relacionadas con el tema.
Compartir experiencias y aprendizajes nacionales y/o regionales sobre PPP.
Conocer las metodologías y evidencias científicas resultado de las investigaciones relacionadas con la salud pública y el marco legal del PPP.
Coordinar acciones para responder a los retos que plantea el desarrollo legislativo para lograr una prohibición completa de la PPT.
Se busca poder formular estrategias de intervención de aplicación conjunta. Se ha identificado a la publicidad en televisión y cine como la de más difícil control. una situación similar se ha previsto para el tema de la publicidad en internet.","WHO Region of the Americas"
"122","Papua New Guinea","The current law is capturing advertisement at the point of sale and others","This article was well implemented in the 90s. During the years there have been sponsorship of academics. This was able to be resolved.","There is a complete ban. Sponsorship are going which we were not aware of. In 2012 a letter was submitted from the NCD Taskforce and stopped further sponsorship.","WHO Western Pacific Region"
"123","Paraguay","La Ley Nº 5538/15 en su Capitulo 4 Articulo 12 reglamenta el Articulo 13 del CMCT - OMS. Anterior a la Ley 5538, se contaba con la  Ley N° 1333/98: ""prohíbe la venta, publicidad y patrocinio de tabaco en el perímetro, así como a 150 mts a la redonda de una institución educativa y de salud"".","La Ley Nº 5538/15 en su Capitulo 4 Articulo 12 reglamenta el Articulo 13 del CMCT - OMS. Anterior a la Ley 5538, se contaba con la  Ley N° 1333/98: ""prohíbe la venta, publicidad y patrocinio de tabaco en el perímetro, así como a 150 mts a la redonda de una institución educativa y de salud"".","Answer not provided","WHO Region of the Americas"
"124","Peru","Mediante Ley N° 28705, se aprobó la Ley General para la prevención y Control de los Riesgos del Consumo del Tabaco. 

Decreto Supremo N° 15-2008 – SA, se aprobó el Reglamento de la Ley N° 28705, Ley General para la prevención y Control de los Riesgos del Consumo del Tabaco, modificado posteriormente mediante Decreto Supremo N° 001-2010 – SA .

Mediante Ley N°29517, se modificó la Ley N° 28705, para adecuarla al Convenio Marco de la Organización Mundial de la Salud (OMS) para el control del Tabaco 

Los proyectos de ley presentados en el 2012 –que plantean la restricción total de la publicidad del tabaco– se basan en la recomendación del Convenio Marco para el Control de Tabaco (CMCT), que en el 2004 firmó el Perú con la Organización Mundial de la Salud (OMS).

El 16 de junio pasado, la Comisión de Salud del Congreso puso en agenda la discusión de las iniciativas legislativas. Sin embargo, esta nunca se dio. El congresista Jaime Delgado, autor de uno de los proyectos, denunció que el presidente de esa comisión, solicitó un receso en pleno debate, se retiró del hemiciclo y no regresó.

Mediante Ley N°29517, se modificó la Ley N° 28705, para adecuarla al Convenio Marco de la Organización Mundial de la Salud (OMS) para el control del Tabaco.

Los proyectos de ley presentados en el 2012 –que plantean la restricción total de la publicidad del tabaco– se basan en la recomendación del Convenio Marco para el Control de Tabaco (CMCT), que en el 2004 firmó el Perú con la Organización Mundial de la Salud (OMS). 

El 16 de junio 2016, la Comisión de Salud del Congreso puso en agenda la discusión de las iniciativas legislativas. Sin embargo, esta nunca se dio. El congresista Jaime Delgado, autor de uno de los proyectos, denunció que el presidente de esa comisión, Aldo Bardalez (Fuerza Popular), solicitó un receso en pleno debate, se retiró del hemiciclo y no regresó.

Desde 2017 se ha vuelto a presentar propuesta legislativa que elimina toda forma de publicidad de productos de tabaco que continúan en espera e debate para dictamen de Ley y eventual debate en Plenario del Congreso de la República.","Answer not provided","-	Mediante Ley N° 28705. se aprobó la Ley General para la prevención y Control de los Riesgos del Consumo del Tabaco.
-	Por Decreto Supremo N° 15-2008 – SA. se aprobó el Reglamento de la Ley N° 28705. Ley General para la prevención y Control de los Riesgos del Consumo del Tabaco. modificado posteriormente mediante Decreto Supremo N° 001-2010 – SA .
-	Mediante Ley N°29517. se modificó la Ley N° 28705. para adecuarla al Convenio Marco de la Organización Mundial de la Salud (OMS) para el control del Tabaco.
-	Dichas normas forman parte de un proceso legislativo que tiende a una mayor restricción de la publicidad. promoción y patrocinio del tabaco.","WHO Region of the Americas"
"125","Philippines","The Philippine Constitution does not preclude a comprehensive ban on TAPS. Under RA 9211, TAPS is restricted in national media and outdoor advertisements. In 2015, the Department of Health conducted a TAPS monitoring in 16 selected municipalities and cities. Results indicated good practices among selected LGUs implementing a comprehensive ban on TAPS. However, TAPS were also found to be rampant in points of sale and other localities such as variety stores and restaurants that advertise tobacco products through the use of posters or other collateral. Comprehensive TAPS ban was made a criteria in the selection of ROA winners.","The Philippine Constitution does not preclude a comprehensive ban on TAPS. Under RA 9211, TAPS is restricted in national media and outdoor advertisements. In 2015, the Department of Health conducted a TAPS monitoring in 16 selected municipalities and cities. Results indicated good practices among selected LGUs implementing a comprehensive ban on TAPS. However, TAPS were also found to be rampant in points of sale and other localities such as variety stores and restaurants that advertise tobacco products through the use of posters or other colaterals. Comprehensive TAPS ban was made a criteria in the selection of ROA winners.","Answer not provided","WHO Western Pacific Region"
"126","Poland","According to polish legislation Trade Inspection in responsible for law enforcement in this area.","According to polish legislation Trade Inspection in responsible for law enforcement in this area.","Answer not provided","WHO European Region"
