"","Party","2018","2016","2014","Region"
"1","Afghanistan",NA,NA,"We have law on ban of the tobacco production and ban for the children specially under 18 years old","WHO Eastern Mediterranean Region"
"2","Albania","Report not provided","Report not provided","Answer not provided","WHO European Region"
"3","Algeria","Answer not provided","Answer not provided","Answer not provided","WHO African Region"
"4","Angola","Answer not provided","Answer not provided","Report not provided","WHO African Region"
"5","Antigua and Barbuda","Report not provided","This Article of the FCTC is embodied in our draft legislation of which we are currently awaiting legal processing","This Article of the FCTC is embodied in our draft legislation of which we are currently awaiting legal processing","WHO Region of the Americas"
"6","Armenia","Report not provided","Report not provided","Answer not provided","WHO European Region"
"7","Australia","As a result of a senate Inquiry into the Tobacco Industry and Tobacco Related Illnesses in 1997 the three largest tobacco manufacturers in the Australian market agreed in 2000 to report annually on the ingredients of their cigarettes including per brand variant. This is a voluntary agreement between the Commonwealth Government and Philip Morris Limited, British American Tobacco Australia Limited and Imperial Tobacco Australia Limited.  The data is posted unmodified at http://www.health.gov.au/internet/main/publishing.nsf/Content/health-pubhlth-strateg-drugs-tobacco-ingredients.htm. The three tobacco companies also undertook cigarette emissions testing on a one off basis in 2001. The emissions data were supplied to the Australian Government Department of Health and posted unmodified at http://www.health.gov.au/internet/main/publishing.nsf/Content/tobacco-emis.

The Australian Government Department of Health is in the early stages of considering options and developing a regulation impact statement for implementation of the WHO FCTC Partial Guidelines for Article 9 (relating to regulation of the contents of tobacco products) and Article 10 (relating to regulation of tobacco product disclosures), to reduce the harmful effects of tobacco use.","As a result of a senate Inquiry into the Tobacco Industry and Tobacco Related Illnesses in 1997 the three largest  tobacco manufacturers in the Australian market agreed in 2000 to report annually on the ingredients of their cigarettes including per brand variant. This is a voluntary agreement between the Commonwealth Government and Philip Morris Limited, British American Tobacco Australia Limited and Imperial Tobacco Australia Limited.  The data is posted unmodified at  http://www.health.gov.au/internet/main/publishing.nsf/Content/health-pubhlth-strateg-drugs-tobacco-ingredients.htm. The three tobacco companies also undertook cigarette emissions testing on a one off basis in 2001.  The emissions data were supplied to the Australian Government Department of Health and posted unmodified at http://www.health.gov.au/internet/main/publishing.nsf/Content/tobacco-emis.
The Australian Government Department of Health is in the early stages of considering options and developing a regulation impact statement for implementation of the World Health Organization Framework Convention on Tobacco Control (WHO FCTC) Partial Guidelines for Article 9 (relating to regulation of the contents of tobacco products) and Article 10 (relating to regulation of tobacco product disclosures), to reduce the harmful effects of tobacco use.","The three main tobacco companies involved in the Australian market (Philip Morris Limited. British American Tobacco Australia Limited and Imperial Tobacco Australia Limited) disclose information about the ingredients of cigarettes pursuant to a voluntary agreement with the Australian Government Department of Health. The data is posted unmodified at http://www.health.gov.au/internet/main/publishing.nsf/Content/health-pubhlth-strateg-drugs-tobacco-ingredients.htm. The three tobacco companies also undertook cigarette emissions testing on a one off basis in 2001. The emissions data were supplied to the Australian Government Department of Health and posted unmodified at http://www.health.gov.au/internet/main/publishing.nsf/Content/tobacco-emis.
The Australian Government Department of Health is developing a regulation impact statement on options for further implementation of WHO FCTC Partial Guidelines for Article 9 (relating to regulation of the contents of tobacco products) and Article 10 (relating to regulation of tobacco product disclosures). to reduce the harmful effects of tobacco use.","WHO Western Pacific Region"
"8","Austria","In order to transpose the EU Tobacco Products Directive (TPD II) into national law, an amendment of the Austrian Tobacco Act, which entered into force on 20 May 2016, stipulates reporting obligations for all ingredients.","Austria is currently finalizing the transposition of the EU Tobacco Products Directive (TPD II) into national law. This results in an amendment of the Austrian Tobacco Act which will become effective on 20 May 2016 and takes into account reporting obligations for all ingredients and enhanced reporting obligations for additives on a “priority list”.","Austria is already preparing for the transposition of the EU Tobacco Products Directive (TPD II) into national law: This will result in an amendment of the Austrian Tobacco act also taking into account reporting obligations for all ingredients and enhanced reporting obligations for additives on a “priority list”.","WHO European Region"
"9","Azerbaijan","On 01 December 2017 the new Law of Azerbaijan Republic ""On restriction of tobacco use"" was adopted. The article 7 of the Law states the right to receive information about tobacco and effects of its use as follow:
""Everyone has the right to receive information on tobacco products and emissions of tobacco products...""","Answer not provided","Answer not provided","WHO European Region"
"10","Bahamas","Report not provided","Answer not provided","Draft Tobacco Control Bill 2014 which is being discussed among Cabinet Members for official tabling and passage contains provisions for all operational portions of the WHO FCTC (except taxation as this is already covered in the Tobacco Excise Stamp Tax Act 2013) addresses regulation of tobacco product disclosures","WHO Region of the Americas"
"11","Bahrain (Kingdom of)","Tobacco products manufacturers are requested to submit annual reports about contents of their products.","Tobacco products manufacturers are requested to submit annual reports about contents of their products.","Answer not provided","WHO Eastern Mediterranean Region"
"12","Bangladesh","Answer not provided","Answer not provided","Answer not provided","WHO South-East Asia Region"
"13","Barbados","No progress on emissions and content","No progress on emissions and content","Answer not provided","WHO Region of the Americas"
"14","Belarus","Принят и с 15 мая 2016 года вступил   в силу технический регламент Таможенного союза ""Технический регламент на табачную продукцию"" (ТР ТС 035/2014).","Требования к сигаретам из табака изложены в ГОСТ 3935-2000 ""Сигареты. Общие технические условия"". Последние изменение к стандарту утверждено в декабре 2008 г. Регламентирующие характеристики - содержании смолы и никотина в конденсате дыма сигарет (миллиграмм на сигарету). Принят и с 15 мая 2016 года вступает   в силу технический регламент Таможенного союза ""Технический регламент на табачную продукцию"" (ТР ТС 035/2014).","Requirements for cigarettes of tobacco contained in ISO 3935-2000 ''Cigarettes. General technical conditions''. Latest revision of the standard was approved in December 2008 Regulatory features - the tar and nicotine in cigarette smoke condensate (milligrams per cigarette).","WHO European Region"
"15","Belgium","La nouvelle directive européenne 2014/40/UE est dapplication depuis le 20 mai 2016.  Le système EUCEG mis en place par la Commission européenne est utilisée pour récolter les données des fabricants de tabac.","Answer not provided","Pas de changements concernant ces aspects depuis le dernier rapport. Obligation annuelle pour les producteurs de fournir aux autorités certaines informations sur le contenu des produits (ingrédients données toxicologiques étiquetage émission de CO nicotine et goudron).","WHO European Region"
"16","Belize","Report not provided","Answer not provided","Answer not provided","WHO Region of the Americas"
"17","Benin","Les importateurs de cigarettes déposent les résultats danalyse de leurs produits vendus sur le marché béninois une fois par an au ministère de la santé selon le décret dapplication de la loi antitabac du Bénin","Les importateurs de cigarettes déposent les résultats danalyse de leurs produits vendus sur le marché béninois une fois par an au ministère de la santé selon le décret dapplication de la loi antitabac du Bénin","le décret dapplication de la loi antitabac du Bénin exige que les vendeurs de cigarettes marquent sur les emballages la teneur en nicotine monoxyde de carbone et en goudron les normes à respecter sont 10 mg goudron 1 mg nicotine et 10 mg CO","WHO African Region"
"18","Bhutan","Answer not provided","Answer not provided","Advocacy programs conducted to the officials of all the concerned agencies","WHO South-East Asia Region"
"19","Bolivia (Plurinational State of)","Answer not provided","Report not provided","Report not provided","WHO Region of the Americas"
"20","Bosnia and Herzegovina","Answer not provided","Answer not provided","In 2011 by State Authority for taxation as well as the Ministry of Trade of Federation BiH enforced the Rule on packaging of tobacco products with mandatory placement of all information''s related tobacco ingredients. In all imported and exported tobacco products supposed to be placed information''s related to content of CO tar and nicotine
Contents and emissions of tobacco products are harmonised with FCTC and covered by Republic of Srpska''s tobacco control bylaw on marking of packages of tobacco products.","WHO European Region"
"21","Botswana","International standards are used to regulate the contents and emissions since most of the products are imported. The local produced products are exported  and they have to comply with the stadards of where they are being  exported.  The only challenge we have is of products that get into our country illegaly. Some of them do not have enough information for the consumer. That being the case we have ensured that our upcoming law takes care of this.","Report not provided","Report not provided","WHO African Region"
"22","Brazil","• Inclusion of new information that must be contained in the analytical reports presented at the time of registration / renewal of registration.","In the last two years, there haven´t been changes in the Brazilian sanitary legislation regarding the implementation of Article 10.","Answer not provided","WHO Region of the Americas"
"23","Brunei Darussalam","No change.","Report not provided","No change","WHO Western Pacific Region"
"24","Bulgaria","In 2016, the Law amending and supplementing the Law on Tobacco and Tobacco Products was adopted by the XIIIth National Assembly on 24 March 2016,","All manufacturers and importers of tobacco products provide information to the Tobacco and Tobacco Products Institute /System EMTOС/
Tobacco and Tobacco Products Institute publish information to the public on its website http://www.ttpi-bg.com/ /system PITOC/
Reporting and publication of information on tobacco products are enshrined in the Law on tobacco and tobacco products.","In compliance with the Bulgarian Legislation (Tobacco and Tobacco Products Law) the tobacco products manufacturers and importers have to submit the information about the tobacco products ingredients to the Tobacco and Tobacco Products Institute (TTPI member of the Agricultural Academy - Ministry of Agriculture and Food).","WHO European Region"
"25","Burkina Faso","Answer not provided","Answer not provided","Confer l’article 10 de la Loi 040","WHO African Region"
"26","Burundi","Report not provided","Answer not provided","Report not provided","WHO African Region"
"27","Cambodia","Answer not provided","Report not provided","Answer not provided","WHO Western Pacific Region"
"28","Cameroon","Answer not provided","Answer not provided","Le marquage sanitaire informe le public sur les produits contenu dans le bâton de cigarette et de sa dangerosité","WHO African Region"
"29","Canada","The Tobacco Reporting Regulations enacted in 2000 require that tobacco manufacturers report to the Government the content and emissions of consumer tobacco products sold in Canada.

Under the previous labelling requirements, the toxic emissions statements displayed numerical values for six toxic emissions (tar; nicotine; carbon monoxide; formaldehyde; hydrogen cyanide; and, benzene). Research conducted by Health Canada has shown that the numerical values were not clearly understood by some smokers and most had little idea what the range of numbers displayed for each chemical meant. The numerical values have been replaced by four text-based statements that provide clear, concise and easy to understand information about the toxic substances found in tobacco smoke.","The Tobacco Reporting Regulations enacted in 2000 require that tobacco manufacturers report to the Government the content and emissions of consumer tobacco products sold in Canada.

Under the previous labelling requirements, the toxic emissions statements displayed numerical values for six toxic emissions (tar; nicotine; carbon monoxide; formaldehyde; hydrogen cyanide; and, benzene).  Research conducted by Health Canada has shown that the numerical values were not clearly understood by some smokers and most had little idea what the range of numbers displayed for each chemical meant.  The numerical values have been replaced by four text-based statements that provide clear, concise and easy to understand information about the toxic substances found in tobacco smoke.","The Tobacco Reporting Regulations enacted in 2000 require that tobacco manufacturers report to the Government the content and emissions of consumer tobacco products sold in Canada.
Under the previous labelling requirements. the toxic emissions statements displayed numerical values for six toxic emissions (tar; nicotine; carbon monoxide; formaldehyde; hydrogen cyanide; and. benzene). Research conducted by Health Canada has shown that the numerical values were not clearly understood by some smokers and most had little idea what the range of numbers displayed for each chemical meant. The numerical values have been replaced by four text-based statements that provide clear. concise and easy to understand information about the toxic substances found in tobacco smoke.","WHO Region of the Americas"
"30","Cape Verde","A Confirmer avec DGC : si la loi exiger des fabricants et des importateurs de produits du tabac qu’ils communiquent aux autorités gouvernementales des informations relatives à :","A Confirmer avec DGC : si la loi exiger des fabricants et des importateurs de produits du tabac qu’ils communiquent aux autorités gouvernementales des informations relatives à :","Report not provided","WHO African Region"
"31","Central African Republic","Report not provided","Report not provided","Report not provided","WHO African Region"
"32","Chad","Answer not provided","Report not provided","Report not provided","WHO African Region"
"33","Chile","Comprendido en el Artículo 9° de la Ley 19.419 de Tabaco en Chile.

El proceso es el indicado en la ley 19.419 para solicitar autorización de venta de productos en la cual los fabricante e importadores deben informar al Ministerio de salud lo referido a los componente incorporados a los productos de tabaco en su proceso de fabricación. La no entrega de esta documentación implica la prohibición de la venta del producto.","Comprendido en el Artículo 9° de la Ley 19.419 de Tabaco en Chile.

El proceso es el indicado en la ley 19.419 para solicitar autorización de venta de productos en la cual los fabricante e importadores deben informar al Ministerio de salud lo referido a los componente incorporados a los productos de tabaco en su proceso de fabricación. La no entrega de esta documentación implica la prohibición de la venta del producto.","Comprendido en el Artículo 9° de la Ley 19.419 de Tabaco en Chile.","WHO Region of the Americas"
"34","China","对烟草农药残留以及主要组成部分，如添加剂、烟用纸张等进行检测，结果向政府当局报告。对卷烟烟气的焦油、烟碱、一氧化碳以及设计参数进行检测，结果向政府当局报告。对烟气中焦油、烟碱和一氧化碳含量进行检测，结果向公众披露，并在烟盒上进行标识。","部分烟草制品成分、烟草燃烧释放物、烟草设计参数及组成成分向政府当局报告。在烟盒上标识焦油、烟碱和一氧化碳量。","Cigarette tar nicotine carbon monoxide and residues of pesticides of there is no relevant legislative and administrative provisions. Cigarette tar nicotine and carbon monoxide parameters for testing have been designed and results reported to the administration. Pesticide residues on tobacco as well as major components such as additives cigarette paper are tested and results reported to the administration. Notes on the cigarette tar nicotine and carbon monoxide revealed to the public.","WHO Western Pacific Region"
"35","Colombia","El Ministerio de Salud y Protección Social ha liderado el proceso de articulación con el Ministerio Comercio, Industria y Turismo para la reglamentación del artículo 22 de la Ley 1335 de 2009, en el que se exige a los fabricantes e importadores que presenten cada año, siempre que el Ministerio de Salud y Protección Social lo solicite y en la forma que lo solicite, un informe sobre los ingredientes añadidos al tabaco, así como sobre los niveles de alquitrán, nicotina y monóxido de carbono presentes en el humo del tabaco.

Se cuenta con un Proyecto de Resolución para reglamentar este artículo de la Ley. Con el fin de adoptar esta reglamentación, se gestionó ante ICONTEC la conformación del comité de tabaco para la adopción de las normas ISO a Norma Técnica Colombiana de los estudios analíticos de los componentes del humo de tabaco de los cigarrillos. Este comité se ha denominado “Comité de plantas aromáticas y tabaco”, el cual sesiona cada 2 meses desde noviembre del 2014. Desde esa fecha se ha avanzado en la adopción de las Normas ISO necesarias para la reglamentación del artículo 22 de la Ley 1335 de 2009.","El Ministerio de Salud y Protección Social ha liderado el proceso de articulación con el Ministerio Comercio, Industria y Turismo para la reglamentación del artículo 22 de la Ley 1335 de 2009, en el que se exige a los fabricantes e importadores que presenten cada año, siempre que el Ministerio de Salud y Protección Social lo solicite y en la forma que lo solicite, un informe sobre los ingredientes añadidos al tabaco, así como sobre los niveles de alquitrán, nicotina y monóxido de carbono presentes en el humo del tabaco.

Se cuenta con un Proyecto de Resolución para reglamentar este artículo de la Ley. Este proyecto aún se encuentra en revisión por parte del área jurídica del Ministerio de Salud. Con el fin de adoptar esta reglamentación, se gestionó ante ICONTEC la conformación del comité de tabaco para la adopción de las normas ISO a Norma Técnica Colombiana de los estudios analíticos de los componentes del humo de tabaco de los cigarrillos. Este comité se ha denominado “Comité de plantas aromáticas y tabaco”, el cual sesiona cada 2 meses desde noviembre del 2014.

Exigencia de que se revele al público información relativa a:

El Estatuto del Consumidor (Ley 1480 de 2011), prevé dentro de sus disposiciones, lo siguiente: 
“ARTÍCULO 31: Publicidad de productos nocivos. En la publicidad de productos que por su naturaleza o componentes sean nocivos para la salud, se advertirá claramente al público acerca de su nocividad y de la necesidad de consultar las condiciones o indicaciones para su uso correcto, así como las contraindicaciones del caso. El Gobierno podrá regular la publicidad de todos o algunos de los productos de que trata el presente artículo.

Sobre el particular, el Ministerio de Comercio, Industria y Turismo tiene previsto realizar eventualmente una reglamentación del citado artículo. Además, la Ley reconoce que dicha información “es secreto industrial y será tratada de forma confidencial y con absoluto secreto”.","El Ministerio de Salud y Protección Social ha liderado el proceso de articulación con el Ministerio Comercio. Industria y Turismo para la reglamentación del artículo 22 de la Ley 1335 de 2009. en el tema de suministro de la información sobre ingredientes y emisiones de humo de tabaco por parte de la industria del tabaco al gobierno. Se cuenta con un Proyecto de Resolución para reglamentar este artículo de la Ley. al mismo tiempo que se está liderando el proceso de desarrollo de la fuente de información para recolección de los datos. El Ministerio de Comercio. Industria y Turismo. ha participado activamente en el proceso de consulta pública de la mencionada reglamentación. 

Exigencia de que se revele al público información relativa a:

El Estatuto del Consumidor (Ley 1480 de 2011). prevé dentro de sus disposiciones. lo siguiente: 
“ARTÍCULO 31: Publicidad de productos nocivos. En la publicidad de productos que por su naturaleza o componentes sean nocivos para la salud. se advertirá claramente al público acerca de su nocividad y de la necesidad de consultar las condiciones o indicaciones para su uso correcto. así como las contraindicaciones del caso. El Gobierno podrá regular la publicidad de todos o algunos de los productos de que trata el presente artículo.

Sobre el particular. el Ministerio de Comercio. Industria y Turismo tiene previsto realizar eventualmente una reglamentación del citado artículo.","WHO Region of the Americas"
"36","Comoros","Answer not provided","Report not provided","Report not provided","WHO African Region"
"37","Congo","Report not provided","Answer not provided","Voir l’article 10 de la loi relative à la lutte antitabac .","WHO African Region"
"38","Cook Islands","no change since the last report","Answer not provided","All importers of tobacco are required to submit annual reports (this is closely monitored by the Tobacco Focal Point) regarding the composition and content of tobacco products.","WHO Western Pacific Region"
"39","Costa Rica","Ley 9028, Capitulo lll Autoridad Sanitaria. Articulo 8 Potestades y Deberes de la autoridad sanitaria. Capitulo lV Etiquetado de los productos de tabaco. Artículo 9 El etiquetado de los productos de tabaco.                                 

Reglamento Capitulo lll artículos 11 al 15 de la declaración jurada de los ingredientes y emisiones de los productos de tabaco que se comercializan en el país costa Rica.    

Reglamento de etiquetado de los productos de tabaco y sus derivados N° 37778-S Gaceta 138","Ley 9028, Capitulo lll Autoridad Sanitaria. Articulo 8 Potestades y Deberes de la autoridad sanitaria. Capitulo lV Etiquetado de los productos de tabaco. Artículo 9 El etiquetado de los productos de tabaco.                                 Reglamento Capitulo lll artículos 11 al 15 de la declaración jurada de los ingredientes y emisiones de los productos de tabaco que se comercializan en el país costa Rica.                                                                                                                                                                     Reglamento de etiquetado de los productos de tabaco y sus derivados N° 37778-S Gaceta 138","Ley 9028. cap. III de la declaración jurada de los ingredientes y emisiones de los productos de tabaco que se comercializan en el país costa rica. articulo 11 al 15.","WHO Region of the Americas"
"40","Côte d'Ivoire","Answer not provided","Answer not provided","Answer not provided","WHO African Region"
