"41","Croatia","In relation to the Act on the implementing of customs legislation of the European union, and in regard to Article 70, the goods that were the object of a customs offense, as well as any means of transport or conveyance used for the transport or conveyance of goods that were the object of the offence, shall be confiscated. In case of goods that were the object of criminal proceedings, Articles 556-563 of the Criminal Proceedings Act prescribe the penalty of confiscating the earnings, that is property, accumulated in the criminal act, which in this case is smuggling of tobacco products.","Article 15.4(e): Pursuant to Article 21 and 81 of the Act implementing of customs provisions of the European union, and in regard to Article 71 and 74, the goods that were the object of a customs offense, as well as any means of transport or conveyance used for the transport or conveyance of goods that were the object of the offence, shall be confiscated. In case of goods that were the object of criminal proceedings, Articles 556-563 of the Criminal Proceedings Act prescribe the penalty of confiscating the earnings, that is property, accumulated in the criminal act, which in this case is smuggling of tobacco products","Article 15.4(e): Pursuant to Article 240 paragraph 1 points 1 and 2 of the Customs Act and in regard to Article 245 the goods that were the object of a customs offense as well as any means of transport or conveyance used for the transport or conveyance of goods that were the object of the offence shall be confiscated. In case of goods that were the object of criminal proceedings Articles 556-563 of the Criminal Proceedings Act prescribe the penalty of confiscating the earnings that is property accumulated in the criminal act which in this case is smuggling of tobacco products.","WHO European Region"
"42","Cyprus","Report not provided","Answer not provided","Answer not provided","WHO European Region"
"43","Czech Republic","International co-operation in the field of tax administration is gradually improving. It is based mainly on regular exchange of information, data sharing, usage of the EU electronic system (ELO), and bilateral contacts.","International co-operation in the field of tax administration is gradually improving. It is based mainly on regular exchange of information, data sharing, usage of the EU electronic system (ELO), and bilateral contacts.","Answer not provided","WHO European Region"
"44","Democratic People's Republic of Korea","Answer not provided","Report not provided","Answer not provided","WHO South-East Asia Region"
"45","Democratic Republic of the Congo","Il est prévu prochainement de signer un protocole avec tous les services publics oeuvrant aux frontières pour reiner le commerce illicite.","Il est prévu prochainement de signer un protocole avec tous les services publics oeuvrant aux frontières pour reiner le commerce illicite.","Report not provided","WHO African Region"
"46","Denmark","Answer not provided","Answer not provided","Answer not provided","WHO European Region"
"47","Djibouti","Answer not provided","Answer not provided","Answer not provided","WHO Eastern Mediterranean Region"
"48","Dominica","Report not provided","Answer not provided","Report not provided","WHO Region of the Americas"
"49","Ecuador","De acuerdo al Servicio Nacional de Aduana del Ecuador (SENAE), en el ámbito de la frontera terrestre, constituye delito de contrabando la descarga, venta y acopio en la zona de libre tránsito, de cantidades comerciales de mercancías extranjeras que no se han sometido al cumplimiento de las formalidades aduaneras.

En caso de viajeros mayores de 18 años de edad que ingresan por las fronteras terrestre, es permitido el ingreso máximo 3 cajetillas de cigarrillos;

De acuerdo a las atribuciones de la Dirección Nacional de Intervención (DNI) en coordinación con la Unidad de Vigilancia Aduanera (UVA) del Servicio Nacional de Aduanas del Ecuador (UVA), dentro de sus objetivos  se encuentra programado el control a este tipo de mercancías “productos de tabaco” y evitar el tráfico de ilícito de esta clase de mercancías. 

Para efectos sancionatorios por contrabando, se considera la siguiente normativa en el cual expresa el respectivo procedimiento.

Resolución Nro. SENAE-DGN-2015-0051-RE “Lineamientos para Regularizar la Mercancía Aprehendida en Zona Secundaria Respecto de la cual se ha Iniciado un Proceso de Contravención Administrativa”.

Resolución Nro. SENAE-DGN-2013-0361-RE “Generalidades del Régimen Transfronterizo"".

Para el intercambio de información entre autoridades aduaneras, tributarias y otras autoridades, el Servicio Nacional de Aduanas del Ecuador (SENAE) realiza intercambio de información con el SRI, la Agencia Nacional de Tránsito (ANT), la Dirección Nacional de Registro de Datos Públicos (DINARDAP), el Ministerio de Comercio Exterior, entre otros.

De acuerdo a la normativa aduanera, se consideran como mercancías no aptas para ser subastadas las siguientes: 

Mercancías de prohibida importación 
Mercancías que vulneren derechos de propiedad intelectual 
Mercancías no aptas para el consumo humano
Mercancías que carezcan de documentos de acompañamiento o de soporte relacionados con restricciones técnicas al comercio. 

Así también, mediante Resolución (SENAE-DGN-2012-00238-RE, 03-jul-12) Artículo 7, se establece lo siguiente:
""Mercancía no apta para el consumo humano.- La mercancía caducada o no apta para el consumo humano, exceptuando a los medicamentos, será obligatoriamente destruida sentando los hechos en un acta a cargo de la Dirección de Zona Primaria. En la destrucción se observarán las normas vigentes en materia medioambiental.""

El SENAE controla dentro de sus procesos aduaneros el ingreso de la mercancía , así como puede efectuar controles posteriores para constatar que se ha cumplido con la obligación aduanera en todo aspecto.

Además el Código Orgánico de la Producción, Comercio e Inversiones (COPCI) establece:
Art. 207.- Potestad Aduanera.- La potestad aduanera es el conjunto de derechos y atribuciones que las normas supranacionales, la ley y el reglamento otorgan de manera privativa al Servicio Nacional de Aduana del Ecuador para el cumplimiento de sus fines.

Art. 145.- Control Posterior.- Dentro del plazo de cinco años contados desde la fecha de pago de los tributos al comercio exterior el Servicio Nacional de Aduana del Ecuador podrá someter a verificación las declaraciones aduaneras, así como toda información que posea cualquier persona natural o jurídica que guarde relación con mercancías importadas.

El SENAE lidera el “Plan Integral de Lucha Contra el Contrabando y la Defraudación”, en el cual se ha logrado integrar los esfuerzos y recursos de 20 instituciones.

Este Plan se compone de estrategias integrales, con acciones para conseguir mejoras y modernizaciones en los sistemas de control, servicios y otros como la tipificación de delitos aduaneros, restructuración de infraestructura y asistencia técnica oportuna.","Answer not provided","Answer not provided","WHO Region of the Americas"
"50","Egypt","Answer not provided","Answer not provided","Answer not provided","WHO Eastern Mediterranean Region"
"51","El Salvador","Answer not provided","Answer not provided","Answer not provided","WHO Region of the Americas"
"52","Equatorial Guinea","NO EXISTE LEY","NO EXISTE LEY","Report not provided","WHO African Region"
"53","Estonia","Answer not provided","Answer not provided","Answer not provided","WHO European Region"
"54","Ethiopia","Report not provided","Report not provided","Report not provided","WHO African Region"
"55","European Union","* Related to the answer to question C.3.1.9, the Union Customs Code (Articles 197 -200) contains provisions related to the destruction of goods – but does not set out rules as to environmentally friendly methods.
OLAF webpage on cigarette smuggling: https://ec.europa.eu/anti-fraud/investigations/eu-revenue/cigarette_smuggling_en
* Related to the answer to question C.3.1.5: the secondary legislation relating to the establishment and operation of the EUs traceability system requires that a human readable code to accompany all unique identifier markings on unit packets, allowing electronic access to the information contained in the unique identifer","OLAF’s web page on cigarettes:  https://ec.europa.eu/antifraud/investigations/eu-revenue/cigarette_smuggling_en.","The EC and its Member States currently have legally binding and enforceable Agreements with four major tobacco manufacturers namely Philip Morris International (PMI) Japan Tobacco International (JTI) British American Tobacco (BAT) and Imperial Tobacco Limited (ITL). These Agreements oblige the Manufacturers to comply with the requirements outlined at 3.3.1.1 to 3.3.1.7. 
Details on the OLAF''s work on this area: http://ec.europa.eu/anti_fraud/investigations/eu-revenue/cigarette_smuggling_en.htm","WHO European Region"
"56","Fiji","Report not provided","Report not provided","Answer not provided","WHO Western Pacific Region"
"57","Finland","Answer not provided","Answer not provided","Answer not provided","WHO European Region"
"58","France","Answer not provided","Answer not provided","Answer not provided","WHO European Region"
"59","Gabon","Answer not provided","Answer not provided","Answer not provided","WHO African Region"
"60","Gambia","Answer not provided","Answer not provided","Answer not provided","WHO African Region"
"61","Georgia","Answer not provided","Answer not provided","Answer not provided","WHO European Region"
"62","Germany","The Member States of the European Union monitor and control the movement of excisable products by applying the ""Excise Movement an Control System"" (EMCS). It also enables governments and authorities to exchange data and collaborate in case of dubious or uncompleted movements.","The Member States of the European Union monitor and control the movement of excisable products by applying the ""Excise Movement an Control System"" (EMCS). It also enables governments and authorities to exchange data and collaborate in case of dubious or uncompleted movements.","Answer not provided","WHO European Region"
"63","Ghana","Answer not provided","Answer not provided","Answer not provided","WHO African Region"
"64","Greece","Report not provided","Very recently, a new law on tobacco product illicit trade control is open to public discussion. However, the interference of tobacco industry in implementing track and tracing systems for illicit trade control is not excluded, contrary to the Preamble and article 4 of the Protocol.","Answer not provided","WHO European Region"
"65","Grenada","There is also a Negative List issued by The Ministry Of  Trade which requires an Importer to apply for a Trade Licence to Import Cigarettes from an Extra-Regional Country into Grenada.","There is also a Negative List issued by The Ministry Of  Trade which requires an Importer to apply for a Trade Licence to Import Cigarettes from an Extra-Regional Country into Grenada.","Answer not provided","WHO Region of the Americas"
"66","Guatemala","La legislación sobre contrabando no es específica para productos del tabaco.  Algunas reformas recientes han intentado fortalecerla.

Existe legislación complementaria, por ejemplo, la Ley de Extinción de Dominio, que funciona para el caso de contrabando de productos del tabaco, aunque no sea específica para este tipo de materiales.","En enero de 2016 fue presentada una Iniciativa de Ley en el Congreso de la República, que pretende fortalecer las acciones de combate al comercio ilícito de productos del tabaco.  La denominada ""Comisión Nacional contra el Contrabando"" también ha implementado acciones parciales en el tema.","Answer not provided","WHO Region of the Americas"
"67","Guinea","Report not provided","Answer not provided","Report not provided","WHO African Region"
"68","Guinea-Bissau","Answer not provided","Answer not provided","Report not provided","WHO African Region"
"69","Guyana","Answer not provided","Report not provided","Report not provided","WHO Region of the Americas"
"70","Honduras","Es imperativo el apoyo de los operadores de justicia (Poder Judicial, Ministerio Público, Polícia Nacional, Inteligencia etc.) para el cumplimiento del Artículo 15 del CMCT de la OMS.","Es imperativo el apoyo de los operadores de justicia (Poder Judicial, Ministerio Público, Polícia Nacional, Inteligencia etc.) para el cumplimiento del Artículo 15 del CMCT de la OMS.","La Ley Especial para el Control del Tabaco y su Reglamentación establece además que las sanciones aplicables al comercio ilícito de productos derivados de tabaco. serán regulados conforme a las disposiciones del Capítulo XIII-A Artículo 392-A de los Delitos de Contrabando y Defraudación Fiscal y sus Penas. contenidos en el Código Penal vigente.","WHO Region of the Americas"
"71","Hungary","Report not provided","Answer not provided","The Act CXXXIV of 2012 on „Reducing Smoking Prevalence among Young People and Retail of Tobacco Products” from 1st July 2013. tobacco products can only be purchased in 7000 supervised tobacco stores with concession. instead of in more than 40 000 shops all over the country before.","WHO European Region"
"72","Iceland","We do not have any official data on illicit trade on tobacco products.","We do not have any official data on illicit trade on tobacco products.","Answer not provided","WHO European Region"
"73","India","Report not provided","The  theme of World No Tobacco day (2015)  was related to Illicit trade, Ministry of Health & Family Welfare organized a sensitization programme  for the relevant stakeholders, who are primarily responsible for implemementation of the Protocol.","Answer not provided","WHO South-East Asia Region"
"74","Iran (Islamic Republic of)","Answer not provided","Answer not provided","Answer not provided","WHO Eastern Mediterranean Region"
"75","Iraq","Answer not provided","Answer not provided","Answer not provided","WHO Eastern Mediterranean Region"
"76","Ireland","Answer not provided","Answer not provided","With regard to the answers provided to questions 3.3.1.1 3.3.1.2 and 3.3.1.3 in relation to tobacco products and product movement excisable tobacco products are subject to specific requirements by the Revenue Commissioners up to the point where the tax is paid with a view to ensuring collection of tax revenues. Tax stamps are required for specified tobacco products (cigarettes & RYO). Tax stamps contain information showing the trader and the payment of Irish excise duty. Excisable tobacco products are also subject to the terms of Directive 2008/118/EC as regards control & movement of duty suspended product.","WHO European Region"
"77","Israel","Report not provided","Report not provided","Report not provided","WHO European Region"
"78","Italy","Italy has not signed the Protocol to Eliminate Illicit Trade in Tobacco Products yet","Italy has not signed the Protocol to Eliminate Illicit Trade in Tobacco Products yet","Italian Legislation is coordinated to the EU legislation and it achieves most of art.15 provisions. 
Italy has not signed the Protocol to Eliminate Illicit Trade in Tobacco Products yet","WHO European Region"
"79","Jamaica","Answer not provided","Answer not provided","Answer not provided","WHO Region of the Americas"
"80","Japan","Answer not provided","Answer not provided","Answer not provided","WHO Western Pacific Region"
"81","Jordan","Answer not provided","Answer not provided","Answer not provided","WHO Eastern Mediterranean Region"
"82","Kazakhstan","Ввиду низкой стоимости сигарет, практически отсутствует мотивация к контрабанде табачных изделий в/из Казахстана.","Report not provided","Due to the low cost of cigarettes virtually no motivation to tobacco smuggling to / from Kazakhstan.","WHO European Region"
"83","Kenya","-	Excise Duty Act, 2015
-	Legal Notice 110 of 18th June, 2013 (Excisable Goods Management System Regulations)
- EPZ Act, 
- EACCMA","Answer not provided","Answer not provided","WHO African Region"
"84","Kiribati","Not available","Not available","Answer not provided","WHO Western Pacific Region"
"85","Kuwait","Answer not provided","Answer not provided","Answer not provided","WHO Eastern Mediterranean Region"
"86","Kyrgyzstan","Report not provided","Answer not provided","Answer not provided","WHO European Region"
"87","Lao People's Democratic Republic","Answer not provided","Answer not provided","Answer not provided","WHO Western Pacific Region"
"88","Latvia","Answer not provided","Additionally the State Revenue Service of Latvia proceeds with tobacco products and tobacco manufacturing equipment under the jurisdiction of the state according to the Cabinet Regulation No.1354 of 26 November 2013 “Order of public accounting, valuation, realization, granting of the property under the jurisdiction of the state and the offsetting of the revenue to the state budget occurred from the realization of the property under the jurisdiction of the state.” Article 35 of the mentioned order stipulates the tobacco products manufacturing equipment to be irretrievably destroyed or utilized by recycling its metal parts into scrap metal. Article 38.2 of the mentioned order also obliges tobacco products to be burnt in the fireboxes for the powdered waste or in the furnaces for solid fuel and which are equipped with fuel gas’ solid particles perception system.","Answer not provided","WHO European Region"
"89","Lebanon","This falls under the authority of the national tobacco monopoly, which is itself under the authority of the Ministry of Finance.","This falls under the authority of the national tobacco monopoly, which is itself under the authority of the Ministry of Finance.","Answer not provided","WHO Eastern Mediterranean Region"
"90","Lesotho","Report not provided","Report not provided","Answer not provided","WHO African Region"
"91","Liberia","Answer not provided","Answer not provided","Report not provided","WHO African Region"
"92","Libya","ليبيا وقعت على البروتوكول الخاص  بالإتجار الغير مشروع بمنتجات التبغ 

No progress up to date regarding ratification of Protocol due to political instability.","ليبيا وقعت على البروتوكول الخاص  بالإتجار الغير مشروع بمنتجات التبغ 

No progress up to date regarding ratification of Protocol due to political instability.","Answer not provided","WHO Eastern Mediterranean Region"
"93","Lithuania","Since 2016 the administrative liability to purchasers in regards to excised goods (including tobacco products) was introduced (before it was only for sellers).","Answer not provided","Answer not provided","WHO European Region"
"94","Luxembourg","Answer not provided","Answer not provided","Answer not provided","WHO European Region"
"95","Madagascar","3.3.1.4 15(2b) la filière tabac est réglémentée dès la culture jusquà transformation. LOFMATA assure le suivi dès la culture jusquà la collecte des feuilles. La DGI garantira à son tour le suivi dès la fabrication jusquà la mise en vente.
3.3.1.8 15.4(b) confiscation des produits et liquidation des taxes
3.3.1.13 15.7 A Madagascar seul les fabricants qui ont droit à importer les cigarettes (03.01.06 de CGI) et limité à 5% de la production prévisionnelle totale. En outre, il faut lautorisation dachat de ladministration fiscale avant tout achat effectif","Answer not provided","Answer not provided","WHO African Region"
"96","Malaysia","Answer not provided","Answer not provided","Answer not provided","WHO Western Pacific Region"
"97","Maldives","NONE","NONE","More political and decision making level awareness is needed to successfully design and formulate these programmes","WHO South-East Asia Region"
"98","Mali","Answer not provided","Answer not provided","Answer not provided","WHO African Region"
"99","Malta","3.3.1.2. Excise stamps on packets x 20 cigarettes as per Excise Act 382. Requiring marking of all unit packets of cigarettes and packages of tobacco products 
3.3.1.6. Data is entered in electronic data bases 
3.3.1.7. Information is forwarded to World Customs Organisation (WCO) and European Anti-Fraud Office (OLAF) 
3.3.1.8 Excise Act Chapter 382 
3.3.1.9 Counterfeit products are destroyed in Customs presence 
3.3.1.10 Products are controlled by relevant Customs documents and under Customs supervision. 
3.3.1.11 As per Excise Act Chapter 382 
3.3.1.12 Customs takes part in meetings, workshops and operations with OLAF and WCO. Customs keeps active cooperation with The Police and  Armed Forces of Malta (AFM). 
3.3.1.13. Excise Act Chapter 382","3.3.1.2. Excise stamps on packets x 20 cigarettes as per Excise Act 382. Requiring marking of all unit packets of cigarettes and packages of tobacco products 
3.3.1.6. Data is entered in electronic data bases 
3.3.1.7. Information is forwarded to World Customs Organisation (WCO) and European Anti-Fraud Office (OLAF) 
3.3.1.8 Excise Act Chapter 382 
3.3.1.9 Counterfeit products are destroyed in Customs presence 
3.3.1.10 Products are controlled by relevant Customs documents and under Customs supervision. 
3.3.1.11 As per Excise Act Chapter 382 
3.3.1.12 Customs takes part in meetings, workshops and operations with OLAF and WCO. Customs keeps active cooperation with The Police and  Armed Forces of Malta (AFM). 
3.3.1.13. Excise Act Chapter 382","3.3.1.2. Excise stamps on packets x 20 cigarettes as per Excise Act 382. 
Requiring marking of all unit packets of cigarettes.
and packages of tobacco products
3.3.1.6. Data is entered in electronic data bases 
3.3.1.7. Information is forwarded to World Customs Organisation (WCO) and European Anti-Fraud Office (OLAF) 
3.3.1.8 Excise Act Chapter 382 
3.3.1.9 Counterfeit products are destroyed in Customs presence 
3.3.1.10 Products are controlled by relevant Customs documents and under 
Customs supervision. 
3.3.1.11 As per Excise Act Chapter 382 
3.3.1.12 Customs takes part in meetings workshops and operations with 
OLAF and WCO. Customs keeps active cooperation with The Police and 
Armed Forces of Malta (AFM). 
3.3.1.13. Excise Act Chapter 382","WHO European Region"
"100","Marshall Islands","ONLY LICENSING COVERED IN TOBACCO CONTROL ACT","ONLY LICENSING COVERED IN TOBACCO CONTROL ACT","Answer not provided","WHO Western Pacific Region"
"101","Mauritania","-","-","Answer not provided","WHO African Region"
"102","Mauritius","NONE","Answer not provided","Answer not provided","WHO African Region"
"103","Mexico","Se han firmado acuerdos de colaboración con dos portales de internet (Mercado Libre y Segunda Mano);  no obstante, con el portal Viva Anuncios (eBay México) también se está colaborando aunque aún no se ha formalizado la firma del convenio de colaboración

Con base en los acuerdos de colaboración, al detectarse publicidad o anuncios clasificados de productos del tabaco en dichas páginas, se envía una “ATENTA INVITACIÓN” electrónica al portal para que en máximo 24 horas se suspendan los anuncios que infringen la legislación sanitaria. 

Además, con los medios de comunicación masiva (Televisión y Radio) también se tiene el mecanismo similar para poder suspender en 24 hrs. la publicidad de productos de Tabaco que se pudiera difundir en las emisoras.

Durante el monitoreo de la publicidad que se realiza en COFEPRIS, se hace un barrido de los portales mencionados con la intención de detectar mensajes de productos de tabaco que infrinjan la legislación sanitaria, en caso de detectarlos se realiza el listado para posteriormente enviarse por correo electrónico a los enlaces de cada portal web y los anuncios sean dados de baja durante las próximas 24 horas.","Se han firmado acuerdos de colaboración con dos portales de internet (Mercado Libre y Segunda Mano);  no obstante, con el portal Viva Anuncios (eBay México) también se está colaborando aunque aún no se ha formalizado la firma del convenio de colaboración

Con base en los acuerdos de colaboración, al detectarse publicidad o anuncios clasificados de productos del tabaco en dichas páginas, se envía una “ATENTA INVITACIÓN” electrónica al portal para que en máximo 24 horas se suspendan los anuncios que infringen la legislación sanitaria. 

Además, con los medios de comunicación masiva (Televisión y Radio) también se tiene el mecanismo similar para poder suspender en 24 hrs. la publicidad de productos de Tabaco que se pudiera difundir en las emisoras.

Durante el monitoreo de la publicidad que se realiza en COFEPRIS, se hace un barrido de los portales mencionados con la intención de detectar mensajes de productos de tabaco que infrinjan la legislación sanitaria, en caso de detectarlos se realiza el listado para posteriormente enviarse por correo electrónico a los enlaces de cada portal web y los anuncios sean dados de baja durante las próximas 24 horas.","Answer not provided","WHO Region of the Americas"
"104","Micronesia (Federated States of)",NA,NA,"Answer not provided","WHO Western Pacific Region"
"105","Mongolia","Answer not provided","Report not provided","Answer not provided","WHO Western Pacific Region"
"106","Montenegro","Answer not provided","Answer not provided","Answer not provided","WHO European Region"
"107","Myanmar","Answer not provided","Answer not provided","Answer not provided","WHO South-East Asia Region"
"108","Namibia","Report not provided","Report not provided","Report not provided","WHO African Region"
