"62","Germany","In the Youth Protection Act, a general ban on the sale of tobacco products to minors in the public is anchored. For offering tobacco in the public by vending machines it must be ensured by technical means or by constant supervision that minors under the age of 18 cannot purchase tobacco from a vending machine. Violations can be punished with a fine of up to 50,000 euros. 
Accordingly, the industry has changed the tobacco vending machines and the age control is 
- based on bank cards, which are equipped with a chip, or 
- on the European driving license. 
The smart card reader in vending machinesverifies that the cardholder has the minimum age requirement.","In the Youth Protection Act, a general ban on the sale of tobacco products to minors in the public is anchored. For offering tobacco in the public by vending machines it must be ensured by technical means or by constant supervision that minors under the age of 18 cannot purchase tobacco from a vending machine. Violations can be punished with a fine of up to 50,000 euros. 
Accordingly, the industry has changed the tobacco vending machines and the age control is 
- based on bank cards, which are equipped with a chip, or 
- on the European driving license. 
The smart card reader in vending machinesverifies that the cardholder has the minimum age requirement.","In the Youth Protection Act a general ban on the sale of tobacco products to minors is anchored which also involves the duty of machines. It must be ensured by technical means or by constant supervision that children and youth cannot purchase tobacco under the age of 18 from a vending machine. Violations can be punished with a fine of up to 50 000 euros.
Accordingly the industry has changed the tobacco vending machines. The technical backup for age control in the delivery of tobacco products is made
- based on bank cards which are equipped with a chip or
- on the European driving license.
The smart card reader in vending verifies that the cardholder has the minimum age requirement.","WHO European Region"
"63","Ghana","Answer not provided","Answer not provided","Answer not provided","WHO African Region"
"64","Greece","Report not provided","Although by law the sales of tobacco products to minors are totally forbidden by law, according to our research, approximately 90% of children aging less than 18 years old have not difficulties in buying cigarettes and other tobacco products. In summary, the legislation is in place but often not enforced.","Answer not provided","WHO European Region"
"65","Grenada","N/A","N/A","Answer not provided","WHO Region of the Americas"
"66","Guatemala","Answer not provided","Answer not provided","Answer not provided","WHO Region of the Americas"
"67","Guinea","Report not provided","Answer not provided","Report not provided","WHO African Region"
"68","Guinea-Bissau","Answer not provided","Answer not provided","Report not provided","WHO African Region"
"69","Guyana","Answer not provided","Report not provided","Report not provided","WHO Region of the Americas"
"70","Honduras","El cumplimiento de la disposición del Artículo 16 del CMCT de la OMS se logra mediante la articulación de los esfuerzos interinstitucionales con las organizaciones o instituciones del Estado y de la Sociedad Civil como ser la Alianza Hondureña Antitabaco.","El cumplimiento de la disposición del Artículo 16 del CMCT de la OMS se logra mediante la articulación de los esfuerzos interinstitucionales con las organizaciones o instituciones del Estado y de la Sociedad Civil como ser la Alianza Hondureña Antitabaco.","Se ha trasladado personal de la unidad de inspecciones del Departamento Legal del IHADFA. a los diferentes estadios de futbol a nivel nacional. conciertos musicales. universidades públicas y privadas. así como. a todo lugar de trabajo abierto o cerrado. con el objeto de vigilar y dar fiel cumplimiento de lo establecido en la Ley Especial para el Control del Tabaco y su Reglamentación","WHO Region of the Americas"
"71","Hungary","Report not provided","Answer not provided","Answer not provided","WHO European Region"
"72","Iceland","Reference: article 8 of the Law. http://eng.velferdarraduneyti.is/acts-of-Parliament/nr/19484","Reference: article 8 of the Law. http://eng.velferdarraduneyti.is/acts-of-Parliament/nr/19484","Reference: article 8 of the Law. http://eng.velferdarraduneyti.is/acts-of-Parliament/nr/19484","WHO European Region"
"73","India","Report not provided","Answer not provided","Answer not provided","WHO South-East Asia Region"
"74","Iran (Islamic Republic of)","Answer not provided","Answer not provided","Answer not provided","WHO Eastern Mediterranean Region"
"75","Iraq","Answer not provided","Answer not provided","Answer not provided","WHO Eastern Mediterranean Region"
"76","Ireland","Answer not provided","Answer not provided","Answer not provided","WHO European Region"
"77","Israel","Report not provided","Report not provided","Report not provided","WHO European Region"
"78","Italy","Answer not provided","Answer not provided","For point 3.3.2.2 there is no a specific law but the sellers of tobacco products place a sign inside their point of sale about the prohibition of tobacco sales to minors
For point 3.3.2.9 in Italy is forbidden the sale of cigarettes individually but there is the possibility to sale 10 cigarettes packs.","WHO European Region"
"79","Jamaica","This will be treated with comprehensively under the impending comprehensive tobacco control legislation.","Answer not provided","Answer not provided","WHO Region of the Americas"
"80","Japan","Answer not provided","Answer not provided","Answer not provided","WHO Western Pacific Region"
"81","Jordan","تم حضر ترخيص اي من المنشات التي تبيع التبغ وتحديد المسافة لتبعد عن المنشات التعليمية والصحية بمسافة 250 م وذلك من خلال تعليمات نظام عرض منتجات التبغ","Answer not provided","Not allowing those under 18 years old to enter places which provide argela even if accompanied by their parents and violation is prosecuted in the event of non-compliance.","WHO Eastern Mediterranean Region"
"82","Kazakhstan","Answer not provided","Report not provided","Answer not provided","WHO European Region"
"83","Kenya","Answer not provided","Answer not provided","Answer not provided","WHO African Region"
"84","Kiribati","Not available","Not available","Answer not provided","WHO Western Pacific Region"
"85","Kuwait","Answer not provided","Answer not provided","Answer not provided","WHO Eastern Mediterranean Region"
"86","Kyrgyzstan","Report not provided","Answer not provided","Answer not provided","WHO European Region"
"87","Lao People's Democratic Republic","Answer not provided","Answer not provided","Answer not provided","WHO Western Pacific Region"
"88","Latvia","The draft amendments to the Tobacco Law were submitted to the Parliament in 2017:
imposing stricter restrictions, including the prohibition on the production and placing on the market of sweets, snacks, and toys and other items that are attractive to minors, which visually reminiscent of cigarettes or other tobacco products or electronic smoking devices and can attract the attention of minors to smoking, or promote certain tobacco products or their manufacturers. Similarly, the draft amendment prohibits the packaging of tobacco products, herbal smoking products, electronic smoking devices and their filling containers and any external packaging with the Latvian national symbols, animated images and the display of natural persons (except for persons represented on combined warnings). In addition, the bill stipulates the norms that currently apply to electronic cigarettes (with nicotine-containing liquids), to be attributed to all electronic smoking devices, hence nicotine-free liquids, in areas such as advertising, circulation of electronic smoking devices etc.","Latvia now transposes EU Tobacco products directive 2014/40/EU, so it is expected that soon no cigarette packs were there are less than 20 cigarettes per pack and no RYO packs where there is less than 30 g of tobacco will be available on the market. Law has not into force yet.","Answer not provided","WHO European Region"
"89","Lebanon","Answer not provided","Answer not provided","Answer not provided","WHO Eastern Mediterranean Region"
"90","Lesotho","Report not provided","Report not provided","Answer not provided","WHO African Region"
"91","Liberia","Answer not provided","Answer not provided","Report not provided","WHO African Region"
"92","Libya","Answer not provided","Answer not provided","Answer not provided","WHO Eastern Mediterranean Region"
"93","Lithuania","Answer not provided","Answer not provided","Answer not provided","WHO European Region"
"94","Luxembourg","Answer not provided","Answer not provided","Answer not provided","WHO European Region"
"95","Madagascar","Answer not provided","Answer not provided","Answer not provided","WHO African Region"
"96","Malaysia","Answer not provided","Answer not provided","Answer not provided","WHO Western Pacific Region"
"97","Maldives","NONE","NONE","Answer not provided","WHO South-East Asia Region"
"98","Mali","Answer not provided","Answer not provided","Answer not provided","WHO African Region"
"99","Malta","Answer not provided","Answer not provided","Answer not provided","WHO European Region"
"100","Marshall Islands","Answer not provided","Answer not provided","Answer not provided","WHO Western Pacific Region"
"101","Mauritania","-Toutes le mesures pré cités sont prévues dans le projet de loi en attente dadoption au parlement","-","Answer not provided","WHO African Region"
"102","Mauritius","NONE","Answer not provided","Answer not provided","WHO African Region"
"103","Mexico","Answer not provided","Answer not provided","Answer not provided","WHO Region of the Americas"
"104","Micronesia (Federated States of)","Answer not provided","Answer not provided","In the state of Kosrae (it now has the No. Sale of Loose Cigarette Law) the monitoring of loose cigarettes will be conducted in conjunction to the compliance check to Article 16.","WHO Western Pacific Region"
"105","Mongolia","Answer not provided","Report not provided","Answer not provided","WHO Western Pacific Region"
"106","Montenegro","Answer not provided","Answer not provided","Answer not provided","WHO European Region"
"107","Myanmar","The Section 8 of the National Tobacco Control Law defines the penalties for the above offences. But, the compliance and enforcement are still weak in Myanmar.","The Section 8 of the National Tobacco Control Law defines the penalties for the above offences. But, the compliance and enforcement are still weak in Myanmar.","Answer not provided","WHO South-East Asia Region"
"108","Namibia","Report not provided","Report not provided","Report not provided","WHO African Region"
"109","Nauru","Report not provided","Answer not provided","Report not provided","WHO Western Pacific Region"
"110","Nepal","Tobacco products selling through vending machines is not clearly mentioned in tobacco control act and regulation; it is mentioned in directives which is yet to be approved. No vending machine culture yet in practice in the country.","Report not provided","Tobacco products selling through vending machines is not clearly mentioned in tobacco control act and regulation however it is mentioned in directives which is yet to be approved.","WHO South-East Asia Region"
"111","Netherlands","From May 20th 2016 there is also a salesban to minors for electronic cigarettes / e-liquids with nicotine. And since July 1st 2017, there is also such ban for electronic cigarettes / e-liquids without nicotine and herbal products for smoking.
The Netherlands is willing to ban sales by vending machines when no salesperson is involved with the payment and the handling of the product to the customers.","Answer not provided","Answer not provided","WHO European Region"
"112","New Zealand","Answer not provided","Answer not provided","Answer not provided","WHO Western Pacific Region"
"113","Nicaragua","Answer not provided","Answer not provided","Report not provided","WHO Region of the Americas"
"114","Niger","Report not provided","Answer not provided","Report not provided","WHO African Region"
"115","Nigeria","Answer not provided","Answer not provided","Answer not provided","WHO African Region"
"116","Niue","Report not provided","Report not provided","Answer not provided","WHO Western Pacific Region"
"117","Norway","Concerning question 3.3.2.5, there is an exception for sweets that are not lifelike a tobacco product (e.g. a chocolate/gum cigarette is sold with age limit and display ban, whilst non-lifelike liquorice pipes are openly allowed).","Concerning question 3.3.2.5, sales of sweets, snacks, toys and other imitations of tobacco products to minors (below 18) is forbidden, as well as advertising and display of such products at points of sale.","Concerning question 3.3.2.5 sales of sweets snacks toys and other imitations of tobacco products to minors (below 18) is forbidden as well as advertising and display of such products at points of sale.","WHO European Region"
"118","Oman","لا يوجد","لا يوجد","Answer not provided","WHO Eastern Mediterranean Region"
"119","Pakistan","Answer not provided","Answer not provided","Answer not provided","WHO Eastern Mediterranean Region"
"120","Palau","The Ministry of Health conducts regular random unannounced inspections of tobacco vendors to assess compliance with the law.  Merchant education material is distributed to vendors and certificates provided to merchants found in compliance with the law.","The Ministry of Health conducts regular random unannounced inspections of tobacco vendors to assess compliance with the law.  Merchant education material is distributed to vendors and certificates provided to merchants found in compliance with the law.","The Ministry of Health conducts regular random unannounced inspections of tobacco vendors to assess compliance with the law. Merchant education material is distributed to vendors and certificates provided to merchants found in compliance with the law.","WHO Western Pacific Region"
"121","Panama","Answer not provided","Answer not provided","Answer not provided","WHO Region of the Americas"
"122","Papua New Guinea","Monitoring is a challenge especially with sale to minors. Once the regulation is endorsed, will require technical assistance is monitoring of this article.","Answer not provided","Answer not provided","WHO Western Pacific Region"
"123","Paraguay","La Ley Nº 5538/15, establece en su Capitulo II y artículos 5,6,7: la venta, suministro de productos de tabaco asi como la prohibición de venta a menores y por menores.","La Ley Nº 5538/15, establece en su Capitulo II y artículos 5,6,7: la venta, suministro de productos de tabaco asi como la prohibición de venta a menores y por menores.","Answer not provided","WHO Region of the Americas"
"124","Peru","Answer not provided","Answer not provided","Answer not provided","WHO Region of the Americas"
"125","Philippines","The Department of Education (DepEd) has initiated the development of a Comprehensive Policy and Guidelines on Tobacco Control to address not only the problem of smoking in schools and Department premises but also address tobacco industry interference in DepEd implementation policies in the guise of Corporate Social Responsibility (CSR). The DepEd policy includes education and information on harmful effects of tobacco use and exposure to second hand smoke as well as tobacco industry interference tactics; and guidelines to access effective cessation intervention services. It also includes guidelines on the enforcement of absolute smoking bans, access restrictions to minors, ban on tobacco outdoor advertisements, promotion and sponsorship as well as school donations received through the CSR activities of tobacco companies.","The Department of Education (DepEd) has initiated the development of a Comprehensive Policy and Guidelines on Tobacco Control to address not only the problem of smoking in schools and Department premises but also address tobacco industry interference in DepEd implementation policies in the guise of Corporate Social Responsibility (CSR). The DepEd policy includes education and information on harmful effects of tobacco use and exposure to second hand smoke as well as tobacco industry interference tactics; and guidelines to access effective cessation intervention services. It also includes guidelines on the enforcement of absolute smoking bans, access restrictions to minors, ban on tobacco outdoor advertisements, promotion and sponsorship as well as school donations received through the CSR activities of tobacco companies.","Answer not provided","WHO Western Pacific Region"
"126","Poland","Another issue that has been settled in Poland, on the occasion of the implementation of the Directive 2014/40/UE, are the provisions prohibiting sales at a distance, including cross-border sales of tobacco products and electronic cigarettes. The adopted directive is consistent with the principle of prudence regarding the use of a toxic, poisonous substance – nicotine. Moreover, such a solution will introduce significant limitations in the availability of electronic cigarettes and liquids filling minors. With this in mind, all sorts of proposals involving the registration of those making mail-order sales and the introduction of devices that verify the age of the customer, do not deserve acceptance because of the illusory control and inefficiency in reducing the possibility to purchase by unauthorized persons.
Through the implementation of the provisions concerning the ban on distance selling, Poland was also in the group of fourteen European Union Member States which have decided to introduce this type of solution. Undoubtedly, this is an example of the proper clarification of Member States’ cooperation in the field of the protection of the health of young Europeans.","Answer not provided","Answer not provided","WHO European Region"
"127","Portugal","Answer not provided","Answer not provided","Answer not provided","WHO European Region"
"128","Qatar","according to the article 2 in our national tobacco control law no 20 it is stated that it is prohibited to import or to use any automatic machines for vending of cigarette","according to the article 2 in our national tobacco control law no 20 it is stated that it is prohibited to import or to use any automatic machines for vending of cigarette","Answer not provided","WHO Eastern Mediterranean Region"
"129","Republic of Korea","*C321
 - In accordance with Article 17(Cancellation, etc. of Designation as Retailer) of the Tobacco Business Act, when a retailer has sold tobacco to adolescents(minors), the city mayor, governor or head of Gu can order business suspension for up to a maximum of 1 year.
 - Tobacco retailer or tobacco seller through vending machine shall indicate the phrase ‘Ban on selling tobacco to minors’ in retail store or front of the machine under Paragraph 1 of Article 25(Indication of harmfulness to juveniles, etc.) of Enforcement Decree of the Juvenile Protection Act. According to Paragraph 2 of the same Article, it is stipulated that the warning phrase of ‘It is prohibited to sell cigarettes to minors under the age of 19’ should be posted on the back of the cigarette pack.

*C3211
 - Minors shall be prohibited from registering the business of importing and selling tobacco or the business of wholesaling tobacco under Article 14(Disqualification of the Registration of Tobacco Sales Business) of the Tobacco Business Act.
 - In accordance with Article 16(Designation of the Retailers) of the Tobacco Business Act, the person wishing to conduct tobacco retail sales business (refers to the business of selling directly to consumers) shall be designated as the retailer by the mayor or governor. However, minors do not apply.","*C321
 - In accordance with Article 17(Cancellation, etc. of Designation as Retailer) of the Tobacco Business Act, when a retailer has sold tobacco to adolescents(minors), the city mayor, governor or head of Gu can order business suspension for up to a maximum of 1 year.
 - Tobacco retailer or tobacco seller through vending machine shall indicate the phrase ‘Ban on selling tobacco to minors’ in retail store or front of the machine under Paragraph 1 of Article 25(Indication of harmfulness to juveniles, etc.) of Enforcement Decree of the Juvenile Protection Act. According to Paragraph 2 of the same Article, it is stipulated that the warning phrase of ‘It is prohibited to sell cigarettes to minors under the age of 19’ should be posted on the back of the cigarette pack.

*C3211
 - Minors shall be prohibited from registering the business of importing and selling tobacco or the business of wholesaling tobacco under Article 14(Disqualification of the Registration of Tobacco Sales Business) of the Tobacco Business Act.
 - In accordance with Article 16(Designation of the Retailers) of the Tobacco Business Act, the person wishing to conduct tobacco retail sales business (refers to the business of selling directly to consumers) shall be designated as the retailer by the mayor or governor. However, minors do not apply.","Answer not provided","WHO Western Pacific Region"
"130","Republic of Moldova","Answer not provided","Answer not provided","Answer not provided","WHO European Region"
"131","Romania","Report not provided","Report not provided","Answer not provided","WHO European Region"
"132","Russian Federation","Report not provided","В соответствии с пунктом 2 части 7 статьи 19 Федерального закона № 15-ФЗ «Об охране здоровья граждан от воздействия окружающего табачного дыма и последствий потребления табака» запрещается продажа табачной продукции на расстоянии менее чем сто метров по прямой линии без учета искусственных и естественных преград от ближайшей точки, граничащей с территорией, предназначенной для оказания образовательных услуг.
Международные исследования показали, что высокая плотность розничной сети по реализации табачной продукции способствует потреблению табака детьми и молодежью, делая сигареты более доступными и создавая среду, в которой купить и употребить табачные изделия не составляет труда, формируя атмосферу, при которой курение является социально приемлемым.  
Использование торговых автоматов для выдачи табачной продукции запрещено частью 3 статьи 19 Федерального закона от 23.02.2013 г. № 15-ФЗ.","Answer not provided","WHO European Region"
"133","Rwanda","Report not provided","Report not provided","Report not provided","WHO African Region"
"134","Saint Kitts and Nevis","Report not provided","Answer not provided","Report not provided","WHO Region of the Americas"
"135","Saint Lucia","Answer not provided","Answer not provided","Report not provided","WHO Region of the Americas"
"136","Saint Vincent and the Grenadines","Report not provided","Report not provided","Report not provided","WHO Region of the Americas"
"137","Samoa","Answer not provided","Answer not provided","Report not provided","WHO Western Pacific Region"
"138","San Marino","Answer not provided","Answer not provided","Answer not provided","WHO European Region"
"139","Sao Tome and Principe","La ley 3/2012 (Acceso a los menores) prevé lo siguiente:
Artículo 6
Prohibición de ventas y consumos de Bebidas Alcohólicas y de Tabacos

Queda prohibida la venta y el consumo de bebidas alcohólicas y de tabaco en los establecimientos mencionados en el artículo anterior cuando promuevan actividades destinadas a los jóvenes.

Artículo 7
Fijación de Placas

1. ..

2. En el interior de los recintos públicos en referencia, también en un lugar visible, deberá colocarse la placa en la que conste la prohibición de la venta de bebidas alcohólicas y de tabaco a menores de dieciséis años de edad.","Report not provided","Answer not provided","WHO African Region"
"140","Saudi Arabia","Answer not provided","Answer not provided","Answer not provided","WHO Eastern Mediterranean Region"
"141","Senegal","Answer not provided","Answer not provided","Answer not provided","WHO African Region"
"142","Serbia","Answer not provided","Answer not provided","Answer not provided","WHO European Region"
"143","Seychelles","Virtually all above mentioned items are included in 2009 Seychelles Tobacco Control act,  but some regulations need to be issued for full implementation.","Virtually all above mentioned items are included in 2009 Seychelles Tobacco Control act,  but some regulations need to be issued for full implementation.","Answer not provided","WHO African Region"
"144","Sierra Leone","Answer not provided","Answer not provided","Answer not provided","WHO African Region"
"145","Singapore","Nil.","Nil.","Answer not provided","WHO Western Pacific Region"
"146","Slovakia","Report not provided","Answer not provided","Answer not provided","WHO European Region"
"147","Slovenia","Answer not provided","Answer not provided","Answer not provided","WHO European Region"
