"","Party","2018","2016","2014","Region"
"1","Afghanistan","sell of tobacco products on and by children is only prohibited by law , still there ae no measures to regulate them or put fine on offinders","Answer not provided","Answer not provided","WHO Eastern Mediterranean Region"
"2","Albania","Report not provided","Report not provided","It is not prohibited in our law the sale in smaller packets (less than 20 cigarettes","WHO European Region"
"3","Algeria","Answer not provided","Answer not provided","Answer not provided","WHO African Region"
"4","Angola","Answer not provided","Answer not provided","Report not provided","WHO African Region"
"5","Antigua and Barbuda","Report not provided","Answer not provided","Answer not provided","WHO Region of the Americas"
"6","Armenia","Report not provided","Report not provided","Answer not provided","WHO European Region"
"7","Australia","As outlined in 3.3.2.12 Australian states and territories govern the sale of tobacco products to consumers, and it varies across different jurisdictions. 

For example, the Victorian Minister for Health has power to ban a product or class of product if the product:
• resembles a tobacco product;
• is a tobacco product and possesses a distinctive fruity, sweet or confectionary-like character; or
• is of a nature or is advertised in way that may encourage children or young people to smoke.

Victoria and New South Wales also operate successful state-wide programs to test retailer compliance with cigarette sales to minor’s laws. New South Wale’s program also tests retailer compliance with the ban on selling e-cigarettes to minors. There are substantial penalties for those who breach the law. 

South Australia’s Minister for Mental Health and Substance Abuse has a power under their legislation to declare that a class of tobacco products specified in a Gazette notice are prohibited tobacco products. The Minister must not make this declaration unless the Minister is satisfied that— (a) the tobacco products, or the smoke of the products, possesses a distinctive fruity, sweet or confectionary-like character; and (b) the nature of the products, or the way they are advertised, might encourage young people to smoke.

A retailer compliance testing program is also implemented in South Australia.","As outlined in C3213, Australian states and territories govern the sale of tobacco products to consumers, and it varies across different jurisdictions. 

For example, the Victorian Minister for Health has power to ban a product or class of product if the product:
•	resembles a tobacco product
•	is a tobacco product and possesses a distinctive fruity, sweet or confectionary-like character
•	is of a nature or is advertised in way that may encourage children or young people to smoke.
Victoria also operates a successful state-wide program to test retailer compliance with cigarette sales to minors laws. There are substantial penalties for those who breach the law.","Answer not provided","WHO Western Pacific Region"
"8","Austria","Since 1/1/2007 vending machines are locked and can only be unlocked after inserting a chip card (ex. by bank card) proving that the customer is of the minimum legal age for purchase of tobacco products of 16 years.

Tenants of vending machines who do not comply with this requirement and tobacconists who sell tobacco products to persons under 16 years of age risk losing their license for vending cigarettes.

Furthermore tobacconists as well as shop keepers and owners of hospitality venues/pit stops selling tobacco products to minors can be fined according to the provisions laid down in the youth proction acts of the different provinces.

For further details see tobacconists code of conduct (""Standesregeln"") at http://mvg.at/index.php?page=view&id=1 as well as the Austrian tobacco monopoly act (Federal law gazette No. 830/1995 idgF) at https://www.ris.bka.gv.at/GeltendeFassung.wxe?Abfrage=Bundesnormen&Gesetze
snummer=10005006","Under current Austrian legislation the legal age for purchasing tobacco products is defined on the provincial level; all nine provinces have fixed 16 years as minimum required age in their youth protection acts (Jugensdschutzgesetze). 

Since 1/1/2007 all vending machines are locked and can only be unlocked after inserting a chip card (ex. by bank card) proving that the customer is of the minimum legal age for purchase of tobacco products of 16 years.

Tenants of vending machines who dont comply with this requirement and tobacconists who sell tobacco products to persons under 16 years risk loosing their license for vending cigarettes.

Furthermore tobacconists as well as shop keepers and owners of hospitality venues/pit stops selling tobacco products to minors can be fined according to the provisions laid down in the youth proction acts of the different provinces.

For further details see tobacconists code of conduct (""Standesregeln"") at http://mvg.at/index.php?cid=91 as well as the Austrian tobacco monopoly act (Federal law gazette No. 830/1995 idgF) at https://www.ris.bka.gv.at/GeltendeFassung.wxe?Abfrage=Bundesnormen&Gesetze
snummer=10005006","Under current Austrian legislation the legal age for purchasing tobacco products is defined on Federal State level; all nine Federal States have fixed 16 years as minimum required age in their youth protection acts (Jugensdschutzgesetze).
Since 1/1/2007 all vending machines are locked and can only be unlocked after inserting a chip card (ex. by bank card) proving that the customer is of the minimum legal age for purchase of tobacco products of 16 years.
Tenants of vending machines who don''t comply with this requirement and tobacconists who sell tobacco products to persons under 16 years risk loosing their license for vending cigarettes.
Furthermore tobacconists as well as shop keepers and owners of hospitality venues/pit stops selling tobacco products to minors can be fined according to the provisions laid down in the youth proction acts of the different federal states (f.ex. Upper Austria - up to € 7.000 -).
For further details see tobacconists code of conduct (''Standesregeln'') at http://mvg.at/index.php?cid=91 as well as the Austrian tobacco monopoly act (Federal law gazette No. 830/1995 idgF) at https://www.ris.bka.gv.at/GeltendeFassung.wxe?Abfrage=Bundesnormen&Gesetzesnummer=10005006","WHO European Region"
"9","Azerbaijan","Sources: 
Law on Tobacco and Tobacco Product of Azerbaijan Republic – Articles 15;
The Code of the Azerbaijan Republic On administrative violations – Article 236
Law ""On restriction of tobacco use"" - Article 13","Sources: 
Law on Tobacco and Tobacco Product of Azerbaijan Republic – Articles 15;
The Code of the Azerbaijan Republic On administrative violations – Article 236","Sources: 
Law on Tobacco and Tobacco Product of Azerbaijan Republic – Articles 15;
The Code of the Azerbaijan Republic On administrative violations – Article 236","WHO European Region"
"10","Bahamas","Report not provided","Legislation drafted.","Answer not provided","WHO Region of the Americas"
"11","Bahrain (Kingdom of)","Answer not provided","Answer not provided","Answer not provided","WHO Eastern Mediterranean Region"
"12","Bangladesh","Answer not provided","Answer not provided","Answer not provided","WHO South-East Asia Region"
"13","Barbados","Answer not provided","Answer not provided","Answer not provided","WHO Region of the Americas"
"14","Belarus","Answer not provided","Answer not provided","Answer not provided","WHO European Region"
"15","Belgium","Pas de changements concernant ces aspects depuis le dernier rapport.","Pas de changements concernant ces aspects depuis le dernier rapport.","Answer not provided","WHO European Region"
"16","Belize","Report not provided","Answer not provided","Answer not provided","WHO Region of the Americas"
"17","Benin","Answer not provided","Answer not provided","Answer not provided","WHO African Region"
"18","Bhutan","Answer not provided","Answer not provided","Answer not provided","WHO South-East Asia Region"
"19","Bolivia (Plurinational State of)","Answer not provided","Report not provided","Report not provided","WHO Region of the Americas"
"20","Bosnia and Herzegovina","As some relevant survey’s findings (GYTS 2013, implemented in Federation of Bosnia and Herzegovina and Republic of Srpska) showed access of minors to tobacco products, more efforts should be focus on efficient law enforcement in Federation of Bosnia and Herzegovina and Republic of Srpska through support of inspection services of Federation of Bosnia and Herzegovina and Republic of Srpska, monitoring and additional public support.","Answer not provided","As some relevant surveys findings ( GYTS 2008 ) recently showed high access of minors to tobacco products more efforts should be focus on efficient law enforcement through support of inspection services monitoring and additional public support","WHO European Region"
"21","Botswana","Answer not provided","Report not provided","Report not provided","WHO African Region"
"22","Brazil","Proof of age at the time of purchasing tobacco products is not a common practice in Brazil. In the retail sector, it is not required to provide the buyers identity document, despite the prohibition in law. Thus, access to tobacco products is easier for young people.","Proof of age at the time of purchasing tobacco products is not a common practice in Brazil. In the retail sector, it is not required to provide the buyers identity document, despite the prohibition in law. Thus, access to tobacco products is easier for young people.","Answer not provided","WHO Region of the Americas"
"23","Brunei Darussalam","Answer not provided","Report not provided","Answer not provided","WHO Western Pacific Region"
"24","Bulgaria","Answer not provided","Answer not provided","Answer not provided","WHO European Region"
"25","Burkina Faso","Answer not provided","Answer not provided","L’article 19 de la loi 040 autorise toutefois des exceptions sur la vente aux mineurs avec des expressions telles que « à l’exception des espaces autorisés par les textes réglementaires.","WHO African Region"
"26","Burundi","Report not provided","Answer not provided","Report not provided","WHO African Region"
"27","Cambodia","Answer not provided","Report not provided","Answer not provided","WHO Western Pacific Region"
"28","Cameroon","Answer not provided","Answer not provided","Answer not provided","WHO African Region"
"29","Canada","In response to C321a, the legal age differs by province being either 18 or 19 years of age. 

In response to C325 while Canada does not have a federal prohibition, two Canadian territories, Yukon and Nunavut, have legislation prohibiting candy or sweets that look like tobacco products. 

In response to C327. the federal Tobacco Act bans vending machines in public places except in a bar, tavern or beverage room that have a prescribed security mechanism. Several provinces/territories go further. Manitoba, Ontario, Quebec, Nova Scotia, Prince Edward Island, the Northwest Territories and Nunavut ban the sale of tobacco products through vending machines.","In response to C325, while Canada does not have a federal prohibition,  two Canadian territories, Yukon, Nunavut as well as three provinces (Ontario, Manitoba and Quebec) and have legislation prohibiting candy or sweets that look like tobacco products.  

In response to C327, the federal Tobacco Act bans vending machines in public places except in a bar, tavern or beverage room that have a prescribed security mechanism.

Several provinces/territories go further.  Ontario, New Brunswick, Quebec, Nova Scotia, Prince Edward Island, Northwest Territories, Yukon and Nunavut ban the sale of tobacco products through vending machines.","Answer not provided","WHO Region of the Americas"
"30","Cape Verde","Answer not provided","Answer not provided","Report not provided","WHO African Region"
"31","Central African Republic","Report not provided","Report not provided","Report not provided","WHO African Region"
"32","Chad","Answer not provided","Report not provided","Report not provided","WHO African Region"
"33","Chile","No hay infomación","Answer not provided","Answer not provided","WHO Region of the Americas"
"34","China","Answer not provided","Answer not provided","Answer not provided","WHO Western Pacific Region"
"35","Colombia","Answer not provided","Answer not provided","Answer not provided","WHO Region of the Americas"
"36","Comoros","Answer not provided","Report not provided","Report not provided","WHO African Region"
"37","Congo","Report not provided","Answer not provided","Answer not provided","WHO African Region"
"38","Cook Islands","no change since the last report","Answer not provided","Answer not provided","WHO Western Pacific Region"
"39","Costa Rica","De acuerdo a la Encuesta Nacional sobre Consumo en Población Secundaria, que contempla tabaco, alcohol y drogas ilícitas efectuada por el IAFA en 2015, en una muestra de 5863 estudiantes de secundaria de 263 secciones, pertenecientes a su vez a 50 colegios de todo el país, se indica que 2 de cada 10 jóvenes adquieren tabaco en pulperías (mini supermercados), 6 de cada 10 jóvenes adquieren tabaco en casas de amigos y 2 de cada 10 jóvenes indican en otros lugares","De acuerdo a la Encuesta Nacional en Estudiantes de Secundaria sobre consumo de drogas en 2015 que contempla tabaco, alcohol y drogas ilícitas efectuada por el IAFA. En una muestra de 5863 estudiantes de secundaria de 263 secciones, pertenecientes a su vez a 50 colegios de todo el país se indica que 2 de cada 10 jóvenes adquieren tabaco en pulperías, 6 de cada 10 jóvenes adquieren tabaco en casas de amigos y 2 de cada 10 jóvenes indican en otros lugares","Answer not provided","WHO Region of the Americas"
"40","Côte d'Ivoire","toutes les questions de la présente section sont prises en compte dans dans le projet de loi antitabac et le projet de décret  portant sur le conditionnement , l\étiquetage et la commercialisation des produits du tabac.","toutes les questions de la présente section sont prises en compte dans dans le projet de loi antitabac et le projet de décret  portant sur le conditionnement , létiquetage et la commercialisation des produits du tabac.","Answer not provided","WHO African Region"
"41","Croatia","Answer not provided","Answer not provided","Answer not provided","WHO European Region"
"42","Cyprus","Report not provided","Answer not provided","Answer not provided","WHO European Region"
"43","Czech Republic","Answer not provided","Answer not provided","There are very strict sanctions for non-compliance with national legislation/requirements as regards sales to minors (e.g. fine for operator who sell tobacco product to minor - from 50 000 CZK up to 500 000 CZK) however weak enforcement is a problem which should be dealt with mainly by the revision of current law (as mentioned in 3.3.2.12). 
Sale of electronic cigarettes to and by minors is banned as well (since 2010 stipulated by the Act 379/2005 Coll. – amended in 2009","WHO European Region"
"44","Democratic People's Republic of Korea","Answer not provided","Report not provided","Answer not provided","WHO South-East Asia Region"
"45","Democratic Republic of the Congo","Answer not provided","Answer not provided","Report not provided","WHO African Region"
"46","Denmark","Answer not provided","Answer not provided","Answer not provided","WHO European Region"
"47","Djibouti","Answer not provided","Answer not provided","Answer not provided","WHO Eastern Mediterranean Region"
"48","Dominica","Report not provided","Answer not provided","Report not provided","WHO Region of the Americas"
"49","Ecuador","En la LORCT establece en el art.14.- Prohibiciones respecto de menores de edad.- La venta y expendio de productos de tabaco, a menores y por menores de 18 años, está prohibida. 
Art.15.- Prohibición de venta.- Se prohíbe la venta de productos de tabaco en centros de cuidado infantil, instituciones educativas públicas y privadas en todos sus niveles, establecimientos de salud públicos y privados, farmacias, instituciones y escenarios destinados a la práctica del deporte y espectáculos deportivos, artísticos y culturales, instituciones y dependencias públicas y espacio públicos y privados de recreación de niños, niñas y adolescentes.
Art.16.- Restricciones para la venta.- La venta de los productos de tabaco está sujeta, en forma obligatoria, a las siguientes restricciones, por lo que se prohíbe:
a.	Colocar cigarrillos en sitios que permitan al consumidor tomarlos directamente;
b.	Comercializar, vender, distribuir, exhibir cualquier producto de tabaco mediante máquinas expendedoras.
c.	Comercializar, vender, distribuir, exhibir, promocionar o producir cualquier objeto, que no sea un producto de tabaco, que contenga elementos de una marca del producto de tabaco; y,
d.	Fabricar, importar, vender y distribuir dulces, refrigerios, juguetes y otros objetos que tengan la forma y el diseño de productos del tabaco y que puedan resultar atractivos para los niños, niñas y adolescentes. 
Art. 17.- Prohibición de distribución gratuita.- Se prohíbe distribuir gratuitamente productos de tabaco al público en general con fines de promoción, así como emplear incentivos que fomenten la compra de tales productos.
Art. 33.- Incumplimiento a las restricciones a la venta.- Quien en sus instituciones o locales incumplan las prohibiciones señaladas en el Capítulo del Título II de esta Ley referente a las restricciones a la venta se le impondrá una multa de (1) a cinco (5) remuneraciones básicas unificadas del trabajador privado general. En caso de reincidencia, se le impondrá multa de seis (6) a diez (10) remuneraciones básicas unificadas del trabajador privado en general. En caso de segunda reincidencia, la sanción será de clausura temporal del establecimiento de uno (1) a ocho (8) días; y, para casos de reincidencia ulterior, el establecimiento será sancionado con clausura de quince (15) días. La sanción de clausura no se aplicará a instituciones de salud, educativas ni a organismos y dependencias del sector público.
En el Reglamento se establece en el artículo 9.- La publicidad de cigarrillos y otros productos de tabaco será permitida exclusivamente en el interior…Las comunicaciones directas a través de correo electrónico o servicio postal para publicidad y promoción de productos de tabaco a personas adultas, deberán realizarse contando con un registro y documentos de sustento que aseguren que las personas receptoras han solicitado por escrito, con su número de cédula de ciudadanía, recibir información. 
Será responsabilidad de los productores, importadores y comercializadores, comprobar la mayoría de edad del destinatario de la publicidad y promoción.","En la LORCT establece en el art.14.- Prohibiciones respecto de menores de edad.- La venta y expendio de productos de tabaco, a menores y por menores de 18 años, está prohibida. 
Art.15.- Prohibición de venta,. Se prohíbe la venta de productos de tabaco en centros de cuidado infantil, instituciones educativas públicas y privadas en todos sus niveles, establecimientos de salud públicos y privados, farmacias, instituciones y escenarios destinados a la práctica del deporte y espectáculos deportivos, artísticos y culturales, instituciones y dependencias públicas y espacio públicos y privados de recreación de niños, niñas y adolescentes.
Art.16.- Restricciones para la venta.- La venta de los productos de tabaco está sujeta, en forma obligatoria, a las siguientes restricciones ,por lo que se prohíbe:
a.	Colocar cigarrillos en sitios que permitan al consumidor tomarlos directamente;
b.	Comercializar, vender, distribuir, exhibir cualquier producto de tabaco mediante máquinas expendedoras.
c.	Comercializar, vender, distribuir, exhibir, promocionar o producir cualquier objeto, que no sea un producto de tabaco, que contenga elementos de una marca del producto de tabaco; y,
d.	Fabricar, importar, vender y distribuir dulces, refrigerios, juguetes y otros objetos que tengan la forma y el diseño de productos del tabaco y que puedan resultar atractivos para los niños, niñas y adolescentes. 
Art. 17.- Prohibición de distribución gratuita.- Se prohíbe distribuir gratuitamente productos de tabaco al público en general con fines de promoción, así como emplear incentivos que fomenten la compra de tales productos.
En el Reglamento se establece en el artículo 9.- La publicidad de cigarrillos y otros productos de tabaco será permitida exclusivamente en el interior…Las comunicaciones directas a través de correo electrónico o servicio postal para publicidad y promoción de productos de tabaco a personas adultas, deberán realizarse contando con un registro y documentos de sustento que aseguren que las personas receptoras han solicitado por escrito, con su número de cédula de ciudadanía, recibir información. 
Será responsabilidad de los productores, importadores y comercializadores, comprobar la mayoría de edad del destinatario de la publicidad y promoción.","Answer not provided","WHO Region of the Americas"
"50","Egypt","Answer not provided","Answer not provided","The law is not fully implemented.","WHO Eastern Mediterranean Region"
"51","El Salvador","La ley de control de tabaco cumple con la totalidad de requisitos sobre prohibición de la venta a menores y por menores. Se tienen algunos problemas de implementación de las leyes.
La Encuesta Mundial sobre Tabaco en Jóvenes 2015 mostró que:
•	4 de cada 10 estudiantes (44.1 %) que fuman cigarrillos, suelen comprarlos en tiendas, negocios, a vendedores callejeros o en quioscos, mostrando que existe una alta disponibilidad de cigarrillos entre los estudiantes de 13 a 15 años.
•	6 de cada 10 estudiantes (60.9 %) no tuvieron problemas para realizar la compra de cigarrillos debido a su edad, a pesar de que la Ley para el Control de Tabaco estipula la prohibición total de venta de cigarrillos a menores de edad, así como la venta de cigarrillos por menores de edad. 
•	La mitad de los estudiantes fumadores (49.1 %) compran cigarrillos por unidad o al menudeo, reflejando el incumplimiento del Art. 9 de la Ley para el Control del Tabaco, que expresa la prohibición de venta de cigarrillo al menudeo.

Estos datos plantean la necesidad de fortalecer la vigilancia del cumplimiento de la Ley para el Control del Tabaco, principalmente en relación a la venta a menores de edad y la venta al menudeo.","Answer not provided","Answer not provided","WHO Region of the Americas"
"52","Equatorial Guinea","NO EXISTE UNA LEY","NO EXISTE UNA LEY","Report not provided","WHO African Region"
"53","Estonia","Answer not provided","Answer not provided","Answer not provided","WHO European Region"
"54","Ethiopia","Report not provided","Report not provided","Report not provided","WHO African Region"
"55","European Union","Council Recommendation (2003/54/EC) on the Prevention of Smoking and on Initiatives to improve tobacco control recommends EU Member States inter alia to:

- require vendors of tobacco products to establish that tobacco purchasers have reached the age for purchase required by national law;
- remove tobacco products from self-service displays;
- restrict access to tobacco vending machines to locations accessible to persons over the age set for tobacco purchase in national law;
- prohibit the sale of sweets and toys intended for children and manufactured with the clear intention that it would resemble in appearance a type of tobacco product.","Council Recommendation (2003/54/EC) on the Prevention of Smoking and on Initiatives to improve tobacco control recommends EU Member States inter alia to:

- require vendors of tobacco products to establish that tobacco purchasers have reached the age for purchase required by national law;
- remove tobacco products from self-service displays;
- restrict access to tobacco vending machines to locations accessible to persons over the age set for tobacco purchase in national law;
- prohibit the sale of sweets and toys intended for children and manufactured with the clear intention that it would resemble in appearance a type of tobacco product.","EU Directive 2014/40/EU stipulates that a unit packet of cigarettes shall include at least 20 cigarettes. A unit packet of roll-your-own tobacco shall contain tobacco weighing not less than 30g. 
In complementation ''Council Recommendation (2003/54/EC) on the Prevention of Smoking and on Initiatives to improve tobacco control'' recommends EU Member States inter alia to:
- require vendors of tobacco products to establish that tobacco purchasers have reached the age for purchase required by national law;
- remove tobacco products from self-service displays;
- restrict access to tobacco vending machines to locations accessible to persons over the age set for tobacco purchase in national law;
- prohibit the sale of sweets and toys intended for children and manufactured with the clear intention that it would resemble in appearance a type of tobacco product.","WHO European Region"
"56","Fiji","Report not provided","Report not provided","Still sell 10-packs","WHO Western Pacific Region"
"57","Finland","Answer not provided","Answer not provided","Answer not provided","WHO European Region"
"58","France","Answer not provided","Answer not provided","Answer not provided","WHO European Region"
"59","Gabon","Answer not provided","Answer not provided","Answer not provided","WHO African Region"
"60","Gambia","Answer not provided","Answer not provided","Answer not provided","WHO African Region"
"61","Georgia","Answer not provided","Answer not provided","Answer not provided","WHO European Region"
