"","Party","2018","2016","2014","Region"
"1","Afghanistan","Answer not provided","Answer not provided","Answer not provided","WHO Eastern Mediterranean Region"
"2","Albania","Report not provided","Report not provided","Answer not provided","WHO European Region"
"3","Algeria","Answer not provided","Answer not provided","Answer not provided","WHO African Region"
"4","Angola","National Revenue Authority (ARA) works with the National Police, the finance police (or financial police) and the Mobile Support Group to control illicit trade. The Finance and Mobile Support Group are independent of the National Police but administratively are located in the National Police offices across the country.","National Revenue Authority (ARA) works with the National Police, the finance police (or financial police) and the Mobile Support Group to control illicit trade. The Finance and Mobile Support Group are independent of the National Police but administratively are located in the National Police offices across the country.","Report not provided","WHO African Region"
"5","Antigua and Barbuda","Report not provided","Answer not provided","Answer not provided","WHO Region of the Americas"
"6","Armenia","Report not provided","Report not provided","Manufacturing of tobacco products is licensed according to the RA Law ''On Licensing''. Distribution of tobacco products does not require a direct licensing but according to the RA Law “On Local Duties and Payments ” the points of sale in order to sell tobacco products have to pay local duties and then to get the right (certificate) to sell tobacco products","WHO European Region"
"7","Australia","In relation to (Article 15.2(a)), under the Tobacco Plain Packaging Act 2011, tobacco product retail packaging must be free from any markings other than the permitted markings, as specified in the Tobacco Plain Packaging Regulations 2011. 
Permitted markings include, for example, brand and variant name; statements of measurement (e.g. the pack size or volume); and origin marks (alphanumeric codes and covert marks).     
      
The Tobacco Plain Packaging Act 2011 provides for tobacco companies to use certain anti-counterfeiting techniques, including alphanumeric codes, barcodes and an unlimited number of covert marks (marks that are not visible to the naked eye), on packaging on a voluntary basis.","In relation to question C313 (Article 15.2(a)), under the Tobacco Plain Packaging Act 2011, tobacco product retail packaging must be free from any markings other than the permitted markings, as specified in the Tobacco Plain Packaging Regulations 2011. 

Permitted markings include, for example, brand and variant name; statements of measurement (e.g. the pack size or volume); and origin marks (alphanumeric codes and covert marks).           

In relation to C312, the Tobacco Plain Packaging Act 2011 provides for tobacco companies to use certain anti-counterfeiting techniques, including alphanumeric codes, barcodes and an unlimited number of covert marks (marks that are not visible to the naked eye), on packaging on a voluntary basis.","Answer not provided","WHO Western Pacific Region"
"8","Austria","","Answer not provided","Para. 7 of the Austrian tobacco act requires marking of all tobacco products in an adequete way that secures the identification and tracing of the products. Therefore every packing unit must carry a batch number or an equivalent indication allowing to identfy the place and date of its production.
Para. 11 (2) of the Austrian tobacco taxation act (''Tabaksteuergesetz'' Federal Law Gazette No. 704/1994 idgF) requires that tobacco products that are dedicated for sale on the Austrian market are marked with the indication ''for sale in Austria''. For details see https://www.ris.bka.gv.at/GeltendeFassung.wxe?Abfrage=Bundesnormen&Gesetzesnummer=10004877
Under Austrian law there is a state monopoly on the sale of tobacco. The sale of tobacco products to customers is limited to tobacconists hospitality venues and pit stops with gastronomical services. Tobacconists need a license issued by the monopoly administration authority (Monopolverwaltungsgesellschaft). 
Smuggling of cigarettes and other tobacco products constitutes the offence of smuggling or evasion of import duties (Hinterziehung von Eingangs-abgaben) under Para. 35 of the Austrian Fiscal Penalties Act (Finanzstrafgesetz Federal Law Gazette No 129/1958 idgF).
The fiscal offence of smuggling and evasion of import duties is punishable under Para. 35 (4) of the Fiscal Penalties Act with a fine of up to the twice amount of the tax being payable on the goods imported or with a fine of up to the twice amount of the aforesaid reduction illegally gained by the evasion of import duties. In addition to the fine a term imprisonment of up to two years may be imposed.
In addition to the fiscal offence under Para. 35 of the Fiscal Penalties act the financial offence of intentional violation of state monopoly on tobacco regulations under Para. 44 of the fiscal penalties act also applies and is punishable with a fine of up to the amount of the so called basis of assessment (Bemessungsgrundlage) which is equivalent to the price attainable for the tobacco product on the regular domestic market or to the retail price fixed for such items being subject to monopoly regulations.
Counterfeiting of tobacco products can be prosecuted according to the provisions of § 14 of the Austrian Tobacco Act (Tabakgesetz) since it usually constitutes a violation of requirements to mark tobacco products in order to identify their indicated manufacturer and determine their origin (fines up to Para. 7 260 - in the case of repetition up to Para. 14 530 -) or be prosecuted as offence of Para. 60 of the Austrian trade mark protection act (Markenschutzgesetz - Federal Law Gazette No. 260/1970 idgF). Violations under § 60 of the trade mark protection act are only prosecuted on request of victim. Fines of up to 360 daily rates or in the case of a commission on a professional basis term imprisonment of up to 2 years can be imposed.
For financial offences under Para. 35 and 44 of the Financial Penalties Act Para. 17 (2) a","WHO European Region"
"9","Azerbaijan","Sources: 
Law on Tobacco and Tobacco Product of Azerbaijan Republic – Articles 15, 16 and 19;
The Tax Code of the Republic of Azerbaijan","Sources: 
Law on Tobacco and Tobacco Product of Azerbaijan Republic – Articles 15, 16 and 19;
The Tax Code of the Republic of Azerbaijan","Sources: 
Law on Tobacco and Tobacco Product of Azerbaijan Republic – Articles 15 16 and 19;
The Tax Code of the Republic of Azerbaijan – Article 89","WHO European Region"
"10","Bahamas","Report not provided","•	Enactment of Excise Stamp (Tobacco Products) Control Act 2013
•	http://laws.bahamas.gov.bs/cms/images/LEGISLATION/PRINCIPAL/2013/2013-0008/ExciseStampTobaccoProductsControlAct2013_1.pdf","Answer not provided","WHO Region of the Americas"
"11","Bahrain (Kingdom of)","Answer not provided","Answer not provided","Answer not provided","WHO Eastern Mediterranean Region"
"12","Bangladesh","Answer not provided","Answer not provided","Answer not provided","WHO South-East Asia Region"
"13","Barbados","Answer not provided","Answer not provided","A broad stakeholder meeting was convened late in 2013 including the Office of the Attorney General and the Department of Commerce. It is proposed that this dialogue should be continued with law enforcement agencies and the Customs Department. The complex nature of the protocol will require significance changes to the laws of Barbados and therefore can only be achieved through a step-wise approach.","WHO Region of the Americas"
"14","Belarus","Регулирование оборота табачных изделий предусмотрено Декретом Президента Республики Беларусь от 17.12.2002 № 28 «О государственном регулировании производства, оборота и потребления табачного сырья и табачных изделий» и Указом Президента Республики Беларусь от 1 сентября 2010 № 450 «О лицензировании отдельных видов деятельности». Производство табачных изделий могут осуществлять только юридические лица Республики Беларусь.
Также вышеназванными нормативными правовыми актами установлены требования к технологическому оборудованию для производства табачных изделий, а именно: государственная регистрация основного технологического оборудования, находящегося в собственности или хозяйственном ведении юридического лица; оснащение оборудования исправными и поверенными приборами учета готовой продукции, прошедшими государственные испытания (включенными в Государственный реестр средств измерений Республики Беларусь) или метрологическую аттестацию; приборы учета должны иметь установленные средства контроля, фискальную память, обеспечивающую долговременное хранение и защиту от несанкционированного изменения учетных данных, возможность подключения и совместной работы с IBM-совместимым компьютером.","Регулирование оборота табачных изделий предусмотрено Декретом Президента Республики Беларусь от 17.12.2002 № 28 «О государственном регулировании производства, оборота и потребления табачного сырья и табачных изделий» и Указом Президента Республики Беларусь от 1 сентября 2010 № 450 «О лицензировании отдельных видов деятельности». Производство табачных изделий могут осуществлять только юридические лица Республики Беларусь.
Также вышеназванными нормативными правовыми актами установлены требования к технологическому оборудованию для производства табачных изделий, а именно: государственная регистрация основного технологического оборудования, находящегося в собственности или хозяйственном ведении юридического лица; оснащение оборудования исправными и поверенными приборами учета готовой продукции, прошедшими государственные испытания (включенными в Государственный реестр средств измерений Республики Беларусь) или метрологическую аттестацию; приборы учета должны иметь установленные средства контроля, фискальную память, обеспечивающую долговременное хранение и защиту от несанкционированного изменения учетных данных, возможность подключения и совместной работы с IBM-совместимым компьютером.","Regulation of tobacco products provided by Presidential Decree of 17.12.2002 ? 28 ''On state regulation of production trafficking and consumption of tobacco and tobacco products'' and Presidential Decree of September 1 2010 ? 450 ''On licensing certain types of activities.'' Manufacture of tobacco products may only be legal persons of the Republic of Belarus. 
Also the above mentioned normative legal acts establish requirements for production equipment for the manufacture of tobacco products namely the state registration of the main technological equipment owned or economic management of a legal entity; optional equipment serviceable and attorneys metered finished products that have passed state tests (included in the State register of measuring the Republic of Belarus) or metrological certification; Meters must be installed controls fiscal memory providing long-term storage and protection from unauthorized change credentials and ability to connect and collaborate with IBM-compatible PC.","WHO European Region"
"15","Belgium","Answer not provided","Answer not provided","Answer not provided","WHO European Region"
"16","Belize","Report not provided","Answer not provided","Answer not provided","WHO Region of the Americas"
"17","Benin","au niveau des frontières terrestres, il y a à renforcer le contrôle car il existe de la contrebande transfrontalières hors de la douane, des données existent à ce sujet","Answer not provided","Answer not provided","WHO African Region"
"18","Bhutan","Answer not provided","Answer not provided","Answer not provided","WHO South-East Asia Region"
"19","Bolivia (Plurinational State of)","Answer not provided","Report not provided","Report not provided","WHO Region of the Americas"
"20","Bosnia and Herzegovina","Article 3 (1) of the Rulebook on excise stamps for tobacco products, alcoholic beverages, fruit natural brandy, coffee and wine stipulates that manufacturers or importers of tobacco products are obliged to mark every single product with excise stamp.","Answer not provided","Answer not provided","WHO European Region"
"21","Botswana","The country has also signed protocol that Eliminate on Illicit Trade on Tobacco Products.","Report not provided","Report not provided","WHO African Region"
"22","Brazil","In 2016, the Secretariat of the Convention, as part of an effort to push for ratification of the Protocol by Parties to the Convention, organized a Multisectoral Workshop for Parties to the WHO Framework Convention on Tobacco Control in Latin America with the participation of Brazil, Venezuela, Uruguay, Chile, Colombia, Ecuador and Peru. The objective of this meeting was to promote the entry into force of the Protocol to Eliminate Illicit Trade in Tobacco Products in partnership with the Government of Brazil, through the Sanitary Surveillance Agency (ANVISA) and the Executive Secretariat of CONICQ / INCA, and support of the Pan American Health Organization (PAHO Brazil). The purpose of the meeting held at ANVISAs premises in Brasilia was to (i) raise awareness of the Protocol to Eliminate Illicit Trade in Tobacco Products among the different sectors of the Public Administration related to the ratification or implementation of the Protocol (such as the departments of health, federal revenue, farm, justice, trade and legislative), and (ii) discuss with the Parties technical requirements of the Protocol, including tracking and localization and existing good practices to implement the Protocols measures.

In 2017, CONICQ promoted a seminar in Brasília, whose main objective was to bring together different areas of government that will contribute to the implementation of the measures provided for in the Protocol once the process of ratification of Brazils accession is completed. To this end, the seminar was attended by representatives from different sectors such as: Ministry of Finance (Operational Coordination of Surveillance and Repression of Smuggling and Relocation, and General Coordination of Inspection of the Federal Revenue Service of Brazil), Ministry of Justice and the Federal Highway Police), the Ministry of Foreign Affairs (Division of Social Issues and Division to Combat Transnational Illicit Trade), ANVISA (General Management of Tobacco Products), the International Advisory Office of the Ministry of Health, the Center for Tobacco Studies and Health Cetab / Ensp / Fiocruz, of the Ministry of Agriculture, Livestock and Food Supply (MAPA), Pan American Health Organization (PAHO), INCA (Population Research Division, Tobacco Control Division, International Cooperation, and the Executive Secretariat of CONICQ), the ACT Health Promotion, The Union, tobacco use in São Paulo and Acre, and the State Sanitary Surveillance of Mato Grosso do Sul.","xxx","Answer not provided","WHO Region of the Americas"
"23","Brunei Darussalam","Answer not provided","Report not provided","Answer not provided","WHO Western Pacific Region"
"24","Bulgaria","Answer not provided","Answer not provided","Answer not provided","WHO European Region"
"25","Burkina Faso","Answer not provided","Answer not provided","Answer not provided","WHO African Region"
"26","Burundi","Report not provided","Answer not provided","Report not provided","WHO African Region"
"27","Cambodia","Answer not provided","Report not provided","Answer not provided","WHO Western Pacific Region"
"28","Cameroon","Answer not provided","Answer not provided","Answer not provided","WHO African Region"
"29","Canada","Answer not provided","In March 2013, the Government of Canada announced: the establishment of an RCMP Anti-Contraband Tobacco Force of 50 resources; the Trafficking in Contraband Tobacco Act  to establish mandatory minimum penalties for repeat offenders; and, funding of $3 million over two years for ten additional resources in First Nations police services to focus on contraband tobacco.","Answer not provided","WHO Region of the Americas"
"30","Cape Verde","Answer not provided","Answer not provided","Report not provided","WHO African Region"
"31","Central African Republic","Report not provided","Report not provided","Report not provided","WHO African Region"
"32","Chad","Afin de Lutter contre le commerce illicité au Tchad, chaque paquet de Cigarette en vente  doit comporter la mention suivante:""fabriquées et vendues au Tchad"". Il est important de souligner aussi que le Tcad a engagé le processus de ratification protocole commerce illicite des produits de tabac. Actuellement, le protocole a été adopté aux conseils de cabinet du Ministre Secrataire Général du Gouvernement","Report not provided","Report not provided","WHO African Region"
"33","Chile","Se está estudiando junto al Ministerio de Relaciones Exteriores el Protocolo de Comercio Ilícito de Productos de Tabaco.","Se está estudiando junto al Ministerio de Relaciones Exteriores el Protocolo de Comercio Ilícito de Productos de Tabaco.","Se está estudiando junto al Ministerio de Relaciones Exteriores el Protocolo de Comercio Ilícito de Productos de Tabaco.","WHO Region of the Americas"
"34","China","Answer not provided","Answer not provided","Answer not provided","WHO Western Pacific Region"
"35","Colombia","Se está en proceso de ratificación del Protocolo para la eliminación del comercio ilícito de productos de tabaco (Colombia lo firmó en la Quinta Conferencia de las Partes en Seúl, 2012).","Se está en proceso de ratificación del Protocolo para la eliminación del comercio ilícito de productos de tabaco (Colombia lo firmó en la Quinta Conferencia de las Partes en Seúl, 2012).","Se está en proceso de ratificación del Protocolo para la eliminación del comercio ilícito de productos de tabaco (Colombia lo firmó en la Quinta Conferencia de las Partes en Seúl. 2012).","WHO Region of the Americas"
"36","Comoros","Answer not provided","Report not provided","Report not provided","WHO African Region"
"37","Congo","Report not provided","Le Congo, membre actif de la CEMAC et de lOMD, bénéficie dune aide de lUnion Européenne et de la FMI pour la reforme fiscale","Answer not provided","WHO African Region"
"38","Cook Islands","no change since the last report","Answer not provided","Cook Islands did not sign the WHO FCTC Protocol on Illicit Trade on Tobacco Products","WHO Western Pacific Region"
"39","Costa Rica","Se implementó  una línea de  coordinación interinstitucional e intersectorial entre Ministerio de Salud, la Dirección General de Aduanas del Ministerio de Hacienda, Policía de Control Fiscal, Fuerza Pública y Policía Municipal permitiendo el trabajo conjunto para optimizar los recursos y evitar duplicidad de funciones, cuyo objetivo es detectar productos de tabaco  ilícitos falsificados y  contrabando ¨que circula en el país de manera ilegal, según lo contempla la Ley 9028.

El proyecto N° 19.448 APROBACIÓN DEL PROTOCOLO PARA LA ELIMINACIÓN DEL COMERCIO ILÍCITO DE PRODUCTOS DE TABACO, fue votado por la Asamblea Legislativa a finales del 2016.

A partir de diciembre del 2014 el Ministerio de Hacienda y la Cámara Costarricense Norteamericana de Comercio (AmCham) utilizan  la aplicación web www.mercado ilegal.com que permite a los ciudadanos reportar de forma directa situaciones de comercio ilegal en el país y se creó el www.catalogomercadoilegal.comDecreto # 35410 MEIC-G-SP-H publicado en la Gaceta N° 95 del 20 de mayo del 2014 se declara de interés público y nacional la lucha contra el comercio ilícito  y se crea la comisión mixta contra el comercio ilícito
Ley para mejorar la lucha contra el contrabando N° 9328 Gaceta 220 del 12 de noviembre del 2015.

Actualmente, el Programa de Control de Tabaco del Ministerio de Salud intentó implementar el sistema de trazabilidad para productos de tabaco, en conjunto con otra empresa estatal, el cual pretende contar con un sistema que permita detectar las prácticas ilegales de comercialización de cigarrillos, pero la industria tabacalera y las cámaras empresariales han hecho presión para evitar que se instale, por lo que por orden de la ministra de salud el proyecto se mantiene en stand by.","Se implementó  una línea de  coordinación  interinstitucional e intersectorial entre Ministerio de Salud,  Ministerio de Hacienda: Dirección General de Aduanas, Policía de Control Fiscal, Fuerza Pública  y Policía Municipal permitiendo el trabajo conjunto para optimizar los recursos y evitar duplicidad de funciones, cuyo objetivo es detectar productos de tabaco  ilícitos falsificados y  contrabando ¨que circula en el país de manera ilegal, según lo contempla la Ley General de Control de Tabaco y sus Efectos Nocivos en la Salud Pública (Ley 9028).

Se efectuaron  acciones de abogacía de manera tal que los  miembros de la Comisión Permanente Especial de Relaciones Internacionales y Comercio Exterior emitieron el  DICTAMEN  UNÁNIME AFIRMATIVO sobre el proyecto:  “APROBACIÓN DEL PROTOCOLO PARA LA ELIMINACIÓN DEL COMERCIO ILÍCITO DE PRODUCTOS DE TABACO”,   expediente N.º 19.448, iniciativa del Poder Ejecutivo.  El proyecto fue iniciado el 20 de enero de 2015, y publicado en La Gaceta N.º 40,  de 26 de febrero de 2015. Y en este momento ocupa el lugar número 22 en la corriente legislative. Es importante mencionar que se reanudó la coordinación con los funcionarios del Ministerio de Hacienda dado el interés de las autoridades actuales, a fin de  implementar un  sistema  de seguimiento y localización de los productos de tabaco y sus derivados, el cual permitiría identificar los puntos de desvío de las cajetillas para su distribución illegal.  

A partir de diciembre del 2014 el Ministerio de Hacienda y la Cámara Costarricense Norteamericana de Comercio (AmCham) utilizan  la aplicación web www.mercado ilegal.com que permite a los ciudadanos reportar de forma directa situaciones de comercio ilegal en el país y se creó el www.catalogomercadoilegal.comDecreto # 35410 MEIC-G-SP-H publicado en la Gaceta N° 95 del 20 de mayo del 2014 se declara de interés público y nacional la lucha contra el comercio ilícito  y se crea la comisión mixta contra el comercio ilícito
Ley para mejorar la lucha contra el contrabando N| 9328 Gaceta 220 del 12 de noviembre del 2015","Answer not provided","WHO Region of the Americas"
"40","Côte d'Ivoire","Il existe, dune manière générale, des mesures réglementaires relatives au commerce illicite et à la contrebande.","Answer not provided","Source :1) Base juridique sur le commerce illicite du tabac Décret N° 65-74 DU 06/03/1965 fixant les règles particulières de marquage des tabacs à fumer des cigares et des cigarettes ; 2) loi N° 2013-865 du 23/12/2013 RELATIVE A LA LUTTE CONTRE LA CONTREFACON ET LE PIRATAGE","WHO African Region"
