"","Party","2018","2016","2014","Region"
"1","Afghanistan","Report not provided","Answer not provided","To have technical advisors and support on the training of the relevant section personals.","WHO Eastern Mediterranean Region"
"2","Albania","Report not provided","Report not provided","Answer not provided","WHO European Region"
"3","Algeria","Report not provided","Answer not provided","Answer not provided","WHO African Region"
"4","Angola","Report not provided","Its a very good and useful tool for countries to monitor the FCTC. Training for the capacity building of national staff at country level in this area would be very useful.","Report not provided","WHO African Region"
"5","Antigua and Barbuda","Report not provided","Answer not provided","Answer not provided","WHO Region of the Americas"
"6","Armenia","Report not provided","Report not provided","Answer not provided","WHO European Region"
"7","Australia","Report not provided","This reporting instrument is far less user friendly that the 2014 report. This instrument does not allow for collaboration across and within Government, as there is no way to save externally and allow the WHO FCTC focal points to seek additional information that falls outside the health scope. For example, to ensure accuracy, Australia usually sends the report to colleagues at customs and  tax offices to ensure we report accurate seizure and tax information. This was not possible with this report as we couldnt guarantee that unrelated answers wouldnt be changed by accident, and the submitting officer needs to be accountable for all responses in the instrument. 

Further, Australia assumes that we will be sent our final responses for official record keeping purposes, but in the absence of this, the new instrument does not allow Parties to take responsibly for their own record keeping.  We note this is particularly important for consistency of responses between reporting periods.  

Australia had many problems with saving our responses, with the internet connection timing out and cutting out many times, resulting in the reporting instrument having to be reviewed many more times than in previous years, to ensure that input was saved as intended. 

Australia would welcome a return to the old reporting instrument.","Answer not provided","WHO Western Pacific Region"
"8","Austria","Report not provided","Answer not provided","Answer not provided","WHO European Region"
"9","Azerbaijan","Report not provided","Answer not provided","Answer not provided","WHO European Region"
"10","Bahamas","Report not provided","Answer not provided","Answer not provided","WHO Region of the Americas"
"11","Bahrain (Kingdom of)","Report not provided","This year the format was web-based but not user friendly. We attached many documents but none were received by you. There was also no save button at each stage and near each question, which would have helped. I totally disliked the new reporting instrument and feel  that a better job could be done in the future. Maybe you can find a different company to do it for you. I suggest you make a group from those who really fill this for you and test it with them in a one day meeting.","Answer not provided","WHO Eastern Mediterranean Region"
"12","Bangladesh","Report not provided","Answer not provided","Answer not provided","WHO South-East Asia Region"
"13","Barbados","Report not provided","The reporting instrument is very braod based and all encompassing and can be more concise.","Answer not provided","WHO Region of the Americas"
"14","Belarus","Report not provided","Answer not provided","Answer not provided","WHO European Region"
"15","Belgium","Report not provided","Answer not provided","Answer not provided","WHO European Region"
"16","Belize","Report not provided","Answer not provided","Answer not provided","WHO Region of the Americas"
"17","Benin","Report not provided","Answer not provided","Answer not provided","WHO African Region"
"18","Bhutan","Report not provided","Answer not provided","Answer not provided","WHO South-East Asia Region"
"19","Bolivia (Plurinational State of)","Report not provided","Report not provided","Report not provided","WHO Region of the Americas"
"20","Bosnia and Herzegovina","Report not provided","Answer not provided","More frequent meetings/teleconferences of national focal points more available transfer of FCTC reports possible technical visits of Secretariat to some countries with strong tobacco lobby support on collection of data from non-health sectors","WHO European Region"
"21","Botswana","Report not provided","Report not provided","Report not provided","WHO African Region"
"22","Brazil","Report not provided","xxx","Answer not provided","WHO Region of the Americas"
"23","Brunei Darussalam","Report not provided","Report not provided","Answer not provided","WHO Western Pacific Region"
"24","Bulgaria","Report not provided","Answer not provided","Answer not provided","WHO European Region"
"25","Burkina Faso","Report not provided","Néant","Nous avions relevé quelques petites insuffisances de forme dans la conception de l’instrument de notification qui pourraient être améliorées ultérieurement. Il s’agit :
Le point 3.2.4.4 sur « Utilisation des directives adoptées par la COP » ne peut être renseigné parce que l’espace consacré à cet effet n’est pas activé.
Il n’existe pas de box relatifs aux options de réponses « NON » de point 5.2.","WHO African Region"
"26","Burundi","Report not provided","Voir les rubriques non répondues par la majorité des pays lors de la compilation pour tenir en considération lors de la détermination des problèmes prioritaires à résoudre.","Report not provided","WHO African Region"
"27","Cambodia","Report not provided","Report not provided","Answer not provided","WHO Western Pacific Region"
"28","Cameroon","Report not provided","Nous suggérons de bien revisiter ce dispositif de collecte de données et dinformation sur le contrôle du tabac ; Dispositif pratique et adapté pour une collecte plus aisée des données, mais peu adapté au contexte des pays en développement pour lesquels laccès à linternet haut débit reste problématique.","Des appuis techniques sont requis pour la mise en œuvre des ces activités dans un cadre multidisciplinaire","WHO African Region"
"29","Canada","Report not provided","Answer not provided","Canada encourages the continued efforts of the WHO to develop synergies in the WHO reporting tools used to collect data on national and subnational activities on tobacco control. 
Canada would also encourage the development of a scaled reporting process that could serve the needs of Parties with tobacco control programs in transition by reporting on early implementation activities. while more robust/detailed reporting processes could be developed for Parties with fully implemented programs.","WHO Region of the Americas"
"30","Cape Verde","Report not provided","Answer not provided","Report not provided","WHO African Region"
"31","Central African Republic","Report not provided","Report not provided","Report not provided","WHO African Region"
"32","Chad","Report not provided","Report not provided","Report not provided","WHO African Region"
"33","Chile","Report not provided","Answer not provided","Se sugiere nuevamente. al igual que el informe enviado el 2012. establecer un sistema que permita anexar documentos y papers oficiales que permitan respaldar la información entregada y que no impliquen tener que trascribir artículos de leyes. reglamentos o directrices nacionales.
Un formato adecuado se puede revisar en el monitoreo que se realiza de la Estrategia Internacional de Reducción de Riesgo de Desastres EIRD que tiene un sistema en Línea más amigable para llenar este tipo de informes","WHO Region of the Americas"
"34","China","Report not provided","Answer not provided","Answer not provided","WHO Western Pacific Region"
"35","Colombia","Report not provided","Answer not provided","Answer not provided","WHO Region of the Americas"
"36","Comoros","Report not provided","Report not provided","Report not provided","WHO African Region"
"37","Congo","Report not provided","Answer not provided","Answer not provided","WHO African Region"
"38","Cook Islands","Report not provided","To categories the reporting instruments into Regional aspects.  For example - WPRO, AMRO, EURO Region etc.....: all countries under each region could have it own reporting instrument.  And another suggestion, if the regional office could table the global report to the main office in Geneva, where each country under each WHO Regional office can submit the report straight to the Regional WHO office that is responsible for these countries.","Answer not provided","WHO Western Pacific Region"
"39","Costa Rica","Report not provided","Answer not provided","Answer not provided","WHO Region of the Americas"
"40","Côte d'Ivoire","Report not provided","Answer not provided","Answer not provided","WHO African Region"
"41","Croatia","Report not provided","If you are working on-line on this questionnaire for a too long time, entered data could not be stored and are lost.","Answer not provided","WHO European Region"
"42","Cyprus","Report not provided","Answer not provided","Answer not provided","WHO European Region"
"43","Czech Republic","Report not provided","Answer not provided","Some specific questions on regulation of Electronic Nicotine Delivery Systems (e.g. electronic cigarettes) could be involved in relevant parts (advertisement sale to minors etc.). A possibility to add notes or explanations should be given at each closed-ended question.","WHO European Region"
"44","Democratic People's Republic of Korea","Report not provided","Report not provided","Answer not provided","WHO South-East Asia Region"
"45","Democratic Republic of the Congo","Report not provided","Answer not provided","Report not provided","WHO African Region"
"46","Denmark","Report not provided","Answer not provided","Answer not provided","WHO European Region"
"47","Djibouti","Report not provided","Answer not provided","Answer not provided","WHO Eastern Mediterranean Region"
"48","Dominica","Report not provided","Answer not provided","Report not provided","WHO Region of the Americas"
"49","Ecuador","Report not provided","Se han encontrado problemas para activar las macros y obtener el documento en Word, además de tener el link con el que llenar el cuestionario online.
Además, problemas para añadir cuadros con información, con la intención de transmitirla de manera adecuada, sencilla y clara. 
Finalmente, en la pregunta B12 (Prevalencia del consumo de tabaco para fumar en la población adulta por grupos de edad) cabe mencionar que no permite establecer decimales; por lo tanto, los datos contestados no corresponden exactamente a los de la fuente mencionada. Es por ello, que se recomienda para siguientes encuestas, permitir contestar con decimales.","Contar en idioma español. todos los documentos principales y de apoyo. así como las capacitaciones en línea para facilitar la preparación del informe.
En algún ítem como el 3.2.7.2.. las posibilidades de respuesta en ciertos acápites no excluyen a las Partes que hayan respondido NO en el ítem previo (prohibición total de publicidad. promoción y patrocinio). Detalles como este pueden ser depurados para el instrumento en el futuro","WHO Region of the Americas"
"50","Egypt","Report not provided","Answer not provided","Answer not provided","WHO Eastern Mediterranean Region"
"51","El Salvador","Report not provided","Answer not provided","En el llenado de este formulario participaron delegados de estas instituciones: Comisión Nacional de Adicciones; Instituto Salvadoreño del Seguro Social. Policía Nacional Civil. Ministerio de Hacienda por medio de la Dirección de Aduanas Terrestres. Ministerio de Salud por medio de la UDAT y Fondo Solidario para la Salud (FOSALUD). Los talleres para la compilación de la información y su posterior análisis fueron realizados por FOSALUD","WHO Region of the Americas"
"52","Equatorial Guinea","Report not provided","NO HAY","Report not provided","WHO African Region"
"53","Estonia","Report not provided","Answer not provided","Answer not provided","WHO European Region"
"54","Ethiopia","Report not provided","Report not provided","Report not provided","WHO African Region"
"55","European Union","Report not provided","Answer not provided","Answer not provided","WHO European Region"
"56","Fiji","Report not provided","Report not provided","Answer not provided","WHO Western Pacific Region"
"57","Finland","Report not provided","This new technical system for filling the questionnaire is much better than the previous one, thank you!","We have the same suggestion than last year. The questionnaire should be shortened and made more concise. In this format it is too long and detailed. It would be more practical to use mainly multiple-choice questions which would also make it easier to compare the answers between countries.","WHO European Region"
"58","France","Report not provided","Answer not provided","Une version informatique plus simple d’utilisation","WHO European Region"
"59","Gabon","Report not provided","aucune","Answer not provided","WHO African Region"
"60","Gambia","Report not provided","we will suggest that the template be prepared and sent as an attachment so that it can be filled even in the absence of good internet connection because not all countries are opportune to have good internet connections.","THE REPORTING TOOL IS USER FRIENDLY","WHO African Region"
"61","Georgia","Report not provided","Answer not provided","Answer not provided","WHO European Region"
"62","Germany","Report not provided","Answer not provided","Answer not provided","WHO European Region"
"63","Ghana","Report not provided","Answer not provided","Answer not provided","WHO African Region"
"64","Greece","Report not provided","Answer not provided","Answer not provided","WHO European Region"
"65","Grenada","Report not provided","Answer not provided","Answer not provided","WHO Region of the Americas"
"66","Guatemala","Report not provided","Answer not provided","Answer not provided","WHO Region of the Americas"
"67","Guinea","Report not provided","Linstrument de notification devrait être plus simplifié de façon a ce que toute information demandée soit utile pour construire un indicateur pertinent.
Je propose que cet instrument soit harmonisé a travers limplication des points focaux des différents pays.","Report not provided","WHO African Region"
"68","Guinea-Bissau","Report not provided","Answer not provided","Report not provided","WHO African Region"
"69","Guyana","Report not provided","Report not provided","Report not provided","WHO Region of the Americas"
"70","Honduras","Report not provided","Ningún. todo bien y muchas gracias por tomarnos en cuenta. Un abrazo fraternal desde Honduras.","Con mucho gusto responderemos los próximos instrumentos de presentación de informes. de antemano muchas gracias por parte del IHADFA por su atención a la presente.","WHO Region of the Americas"
"71","Hungary","Report not provided","We recommend for consideration to fill in a questionnaire to assist countries in the previous report data, displaying responses in the report as a possible answer to a specific question in the questionnaire.","Answer not provided","WHO European Region"
"72","Iceland","Report not provided","Answer not provided","Answer not provided","WHO European Region"
"73","India","Report not provided","Answer not provided","Answer not provided","WHO South-East Asia Region"
"74","Iran (Islamic Republic of)","Report not provided","Answer not provided","In order to facilitate in responding to the questions with regards to the guidelines of the convention it would be better if the Secretariat provide areas relevant to the guidelines in a format like other sections of the reporting instrument 
The other issue is about the period of reporting which is not as long as we need to collect data from relevant agencies so it is suggested to increase the period to at least 6 month.","WHO Eastern Mediterranean Region"
"75","Iraq","Report not provided","Answer not provided","Answer not provided","WHO Eastern Mediterranean Region"
"76","Ireland","Report not provided","Answer not provided","Answer not provided","WHO European Region"
"77","Israel","Report not provided","Report not provided","Report not provided","WHO European Region"
"78","Italy","Report not provided","Answer not provided","Answer not provided","WHO European Region"
"79","Jamaica","Report not provided","You could consider implementing a system whereby the information inserted on each page can be saved while working on the said page/section. The session currently times out too quickly and this allows for loss of data and delay in completion.","Reduce the length of the instrument. Make the instrument more accessible with an online version.","WHO Region of the Americas"
"80","Japan","Report not provided","Answer not provided","Answer not provided","WHO Western Pacific Region"
"81","Jordan","Report not provided","Answer not provided","Answer not provided","WHO Eastern Mediterranean Region"
"82","Kazakhstan","Report not provided","Report not provided","Answer not provided","WHO European Region"
"83","Kenya","Report not provided","Answer not provided","The Reporting tool could be amended to reflect previous reports to facilitate easy updates instead of filling it up all once again. It also helps when a new person is reporting.","WHO African Region"
"84","Kiribati","Report not provided","Answer not provided","Answer not provided","WHO Western Pacific Region"
"85","Kuwait","Report not provided","Answer not provided","Answer not provided","WHO Eastern Mediterranean Region"
"86","Kyrgyzstan","Report not provided","Форма отчетности очень большая, возможно следует  сократить, а отдельные под вопросы включить  дополнительный вопросник","Answer not provided","WHO European Region"
"87","Lao People's Democratic Republic","Report not provided","The report format is not friendly.","Answer not provided","WHO Western Pacific Region"
"88","Latvia","Report not provided","Answer not provided","Answer not provided","WHO European Region"
"89","Lebanon","Report not provided","Answer not provided","Answer not provided","WHO Eastern Mediterranean Region"
"90","Lesotho","Report not provided","Report not provided","Answer not provided","WHO African Region"
"91","Liberia","Report not provided","Answer not provided","Report not provided","WHO African Region"
"92","Libya","Report not provided","Answer not provided","Answer not provided","WHO Eastern Mediterranean Region"
"93","Lithuania","Report not provided","Answer not provided","Answer not provided","WHO European Region"
"94","Luxembourg","Report not provided","Answer not provided","Answer not provided","WHO European Region"
"95","Madagascar","Report not provided","Envoyer à temps les questionnaires par exemple pour  un délai de trois mois.","SIMPLIFIER L’USAGE DU LOGICIEL SURTOUT SUR LE TABLEAU DE LA FISCALITE DES PRODUITS DU TABAC","WHO African Region"
"96","Malaysia","Report not provided","Answer not provided","Answer not provided","WHO Western Pacific Region"
"97","Maldives","Report not provided","Answer not provided","The reporting instrument is not very user friendly. Perhaps a web-based tool that is compatible with multiple platforms will ease the technical issues related to the instrument such as issues related to macros and also version compatibility.","WHO South-East Asia Region"
"98","Mali","Report not provided","Il faut penser appuyer les responsables puisquil faut des déplacement  et contacter dautres personnes pour des questions précises.","Answer not provided","WHO African Region"
"99","Malta","Report not provided","Answer not provided","Answer not provided","WHO European Region"
"100","Marshall Islands","Report not provided","Answer not provided","Answer not provided","WHO Western Pacific Region"
"101","Mauritania","Report not provided","-","Answer not provided","WHO African Region"
"102","Mauritius","Report not provided","It is a very powerful and user friendly reporting instrument..","It is an excellent report instrument.","WHO African Region"
"103","Mexico","Report not provided","Answer not provided","Answer not provided","WHO Region of the Americas"
"104","Micronesia (Federated States of)","Report not provided","Shorten this reporting. When it is too time consuming there is a tendency of losing the energy to provide the relevant responses","Instrument is okay","WHO Western Pacific Region"
"105","Mongolia","Report not provided","Report not provided","Answer not provided","WHO Western Pacific Region"
"106","Montenegro","Report not provided","Instrument had been has improved but we think that access should be facilitated.","Answer not provided","WHO European Region"
"107","Myanmar","Report not provided","Answer not provided","Answer not provided","WHO South-East Asia Region"
"108","Namibia","Report not provided","Report not provided","Report not provided","WHO African Region"
"109","Nauru","Report not provided","Allow countries to identify areas of the responses required that are not relevant to their context with a note box for explanation of reasons why the country considers the specific area not relevant, or to detail alternative measures","Report not provided","WHO Western Pacific Region"
"110","Nepal","Report not provided","Report not provided","Reporting instrument is fine.","WHO South-East Asia Region"
"111","Netherlands","Report not provided","- More optional questions about national measurements to come to a worldwide landscape.","We''ve experienced difficulties in working in this document ourselves and also with sharing this document with our counterparts. The security settings made it difficult to for instance add tables. Also as can be seen in 2.8.3 sometimes words disappear in the fixed table within the document. Perhaps measures can be taken to make it easier to work in this document?","WHO European Region"
"112","New Zealand","Report not provided","Answer not provided","Answer not provided","WHO Western Pacific Region"
"113","Nicaragua","Report not provided","Answer not provided","Report not provided","WHO Region of the Americas"
"114","Niger","Report not provided","Answer not provided","Report not provided","WHO African Region"
"115","Nigeria","Report not provided","Reporting tool is not user friendly, cumbersome and choked with so many items at a time.","Make the reporting format SMART","WHO African Region"
"116","Niue","Report not provided","Report not provided","Consider a short version of the questionnaire.","WHO Western Pacific Region"
"117","Norway","Report not provided","Answer not provided","Answer not provided","WHO European Region"
"118","Oman","Report not provided","توجد كثر من العوائق 
الرجاء الاتصال بنا","Create an online form and also ensure that information from previous reports is included in the form.","WHO Eastern Mediterranean Region"
"119","Pakistan","Report not provided","With this online instrument, last reported data should be available.","MCQs should be added in addition to dichotomous questions.","WHO Eastern Mediterranean Region"
"120","Palau","Report not provided","This revised/current reporting instrument is great, however, instead of a link sent on an email reminder, a website with username and password provided to all member countries could be better.  Also, a save button along with the resume later button could be very useful too. Both suggestions are good for countries like us with slow internet connection. It makes it easier for us to log in to the site whenever possible, and make necessary edits to any parts of it, or continue on any sections that we left blank. 

It would also be helpful if the % of survey completed was updated each time a response is entered and is relevant to the whole survey, not just certain sections.

With this new instrument, we experienced some difficulties - there were times that we had to restart all over again as we were not prompted to the sections we left blank or to continue, and sometimes the page did not save the answers automatically - all of which is due to our slow internet connection. Thank you.","Answer not provided","WHO Western Pacific Region"
"121","Panama","Report not provided","Revisar el Plan Nacional para el Control del Tabaco en Panamá. Quinquenio: 2014-2018 en
http://www.gorgas.gob.pa/SitioWebTabaco/Documentos.htm

Se han adjuntado disposiciones legales vigentes relacionadas con los sistemas electrónicos administradores o no de nicotina, en la sección anterior ya que no se ha identificado posibilidades de hacerlo en esta.","Answer not provided","WHO Region of the Americas"
"122","Papua New Guinea","Report not provided","Answer not provided","So far the instrument looks okay","WHO Western Pacific Region"
"123","Paraguay","Report not provided","Answer not provided","Answer not provided","WHO Region of the Americas"
"124","Peru","Report not provided","Answer not provided","Answer not provided","WHO Region of the Americas"
"125","Philippines","Report not provided","Please refer to separate document outlining our explanations on the suggestions.","Answer not provided","WHO Western Pacific Region"
"126","Poland","Report not provided","Answer not provided","Answer not provided","WHO European Region"
"127","Portugal","Report not provided","It is not easy to explain with detail all the legal dispositions. Perhaps only the major areas shoul be evaluated in a comparable way across the parties.
The criteria to fill in certain areas shoul be more clear in order to raise the comparability of data.","Answer not provided","WHO European Region"
