"33","Colombia","Se ha diseñado y desarrollado un curso virtual en la Universidad de Antioquia. con el apoyo del Ministerio de Salud. sobre Estilos de Vida Saludable. En este curso se ha dispuesto un módulo sobre tabaquismo y control de tabaco. El curso está dirigido a profesionales de la salud. y tiene por objetivo fortalecer las capacidades del sistema de salud en cesación y prevención del consumo. particularmente de la población joven. 
En cuanto a la Guía para cesación de tabaco en población adulta. ésta está en la fase de evaluación económica que está desarrollando el Instituto de Evaluación y Tecnologías en Salud (IETS).
De igual forma. tanto en el Plan Decenal de Salud Pública. como en el Plan Decenal de Cáncer se establecieron metas para cesación:
Plan Decenal de Salud Pública: dentro del componente de condiciones crónicas prevalentes. se estableció como meta “Incrementar programas y/o clínicas de cesación de tabaco en el 80% de los departamentos“.
Plan Decenal de Cáncer: en la Línea estratégica 1 (Control del riesgo-Prevención primaria. entre las acciones a nivel político y normativo. está el desarrollar guías de práctica clínica para la cesación tabáquica. y gestionar la inclusión de programas de cesación en el Plan Obligatorio de Salud (POS). Entre las acciones en los servicios de salud se encuentran : a) Implementar la guía de práctica clínica para la cesación tabáquica ; b) Introducir programas de cesación de tabaco basados en evidencia científica ; c) Entrenar al personal de salud para la implementación de la consejería breve como herramienta para la identificación de riesgos y cesación del consumo de tabaco y sus derivados ; d) Capacitar al personal de salud en la normatividad vigente relacionada con el control del consumo de tabaco y sus derivados; e) 1.1.5. Desarrollar e implementar las estrategias educativas para los profesionales de los servicios de salud. como complemento a la comunicación masiva y a las intervenciones comunitarias en los temas de control del consumo y exposición al humo de tabaco y sus derivados; f) Implementar clínicas de cesación con cobertura nacional.","Se ha diseñado y desarrollado un curso virtual en la Universidad de Antioquia con el apoyo del Ministerio de Salud sobre Estilos de Vida Saludable. En este curso se ha dispuesto un módulo sobre tabaquismo y control de tabaco. El curso está dirigido a profesionales de la salud y tiene por objetivo fortalecer las capacidades del sistema de salud en cesación y prevención del consumo particularmente de la población joven. 
De igual manera se ha desarrollado un Protocolo para elaborar una guía integral de cesación para la atención de la población no fumadora. Con el desarrollo de la guía se espera poner en práctica todo el programa de ayuda al abandono del tabaquismo.","Answer/report not provided"
"34","Comoros","Answer/report not provided","Answer/report not provided","Answer/report not provided"
"35","Congo","les substituts nicotiniques sont disponibles dans la majorité des pharmacies et s’obtiennent sans ordonnance par rapport aux autres","les substituts nicotiniques sont disponibles dans la majorité des pharmacies il y a de cela 3ans.","Answer/report not provided"
"36","Cook Islands","Smoking Cessation clinic established with a systematically structure started second week of February 2014","Answer/report not provided","Only private pharmacy are selling nicotine repalcement therapy however MoH provide Tips on How to Quit smoking brochure and counselling for people who wants to quit smoking."
"37","Costa Rica","El Ministerio de Salud. el Instituto de Alcoholismo y Farmacodependencia. así como la Caja Costarricense de Seguro social. han implementado la mensajería de texto en telefonía móvil a nivel nacional como un medio para promover la cesación del fumado; También la CCSS tiene programado clínicas de cesación de fumado en todos los hospitales para el 2018 aproximadamente y en éste 2014 se espera dotar a todas las clínicas existentes hasta éste momento de la Vareniclina como tratamiento para la cesación del fumado","Se aprobó acorde al CMCT una articulo para ello en la nueva ley.","Answer/report not provided"
"38","Côte d'Ivoire","Elaboration dun projet de protocole de sevrage tabagique.","Dans le cadre de la mise en œuvre de son plan daction opérationnel 2012 le Programme national de Lutte contre le Tabagisme et les autres Addictions (PNLTA) a entamé des démarches en vue dinstaller des unités de prise en charge des sujets dépendants à la nicotine. 
Dans le cadre de cette même politique un draft de protocole de prise en charge de ces sujets tabagiques a été élaboré. Une recherche de financement est entamée pour ladoption de cet important document au cours dun atelier réunissant des spécialistes de la santé préalablement à sa mise en oeuvre.","Answer/report not provided"
"39","Croatia","With the establishment of the Tobacco Control Section in April 2013 as a Section of the Mental Health and Addiction Prevention Unit within the Department of Health Promotion of the Croatian Institute of Public Health the opportunity for developing network of counselling services within public health sector has been created as well as professional training plans regarding smoking cessation. Already some regional counselling services for smoking cessation support have been established and two day training for public health professionals organized.","Answer/report not provided","Answer/report not provided"
"40","Cyprus","There is an increase of 30% of smokers demanding cessation during 2013. The ministry of health has trained 30 new professionals in order to be able to cover the increase in demand. Accessibility to the cessation centres is very simple and with immediate response. The clinical approach consists of nicotine replacement therapy and behavioural approaches. The rate of success at the moment is 40%. 
Please also note that for point 3.2.8.13 these pharmaceutical products are legally available but they are not used for the treatment of tobacco dependence at the moment.","The restricted use of varenicline in cessation clinics at the chest clinics of the public hospitals.","The restricted use of varenicline in cessation clinics at the chest clinics of the public hospitals."
"41","Czech Republic","There is a legally binding obligation for health professionals to conduct a brief intervention consisting of the timely diagnosis of abuse among persons who use tobacco products which is incorporated in the above mentioned Act No. 379/2005 Coll. The brief intervention is mostly offered by physicians and increasingly also by nurses. There are specialised courses in place on prevention of harmful use of addictive substances and treatment of addictions is obligatory for all physicians of all branches as a part of specialization trainings (as mentioned already in 3.2.6.8.). The Society for Treatment of Tobacco Dependence (www.SLZT.CZ) provides continuing education in treatment of tobacco dependence for physicians (CME credits of the Czech medical Chamber 2-day courses) nurses (CME credits of the Czech Association of Nurses one-day course) and pharmacists (CME credits of the Pharmacist''s Chamber 2-day course). It provides also education and regular update for nurses and physicians of Centres for Tobacco-Dependent including regular conferences at least twice a year. There is a collaboration of nurses from the General University Hospital in Prague and the Society for Treatment of Tobacco Dependence with International Society of Nurses in Cancer Care (www.isncc.org) which is focused on educating nurses in brief interventions. Most of health professions undergo occasional trainings in treatment of tobacco dependence but it is not systematic. Trainings include treatment of pregnant psychiatric adolescent and other disadvantaged smokers as well.
Guidelines for treatment of tobacco dependence were published for physicians/general practitioners (2005 2006) pharmacists (2010) and nurses (2010). (Available on-line: www.slzt.cz). 
Intensive treatment is offered in the frame of the Centres for Tobacco-Dependent based in hospitals mostly at pneumology cardiology internal clinics - currently 37 Centres across the country (see http://www.slzt.cz/centra-lecby). They are under supervision of the Society for Treatment of Tobacco Dependence.
In terms of coverage of treatment by public funding there are two treatment codes covered by the health insurance companies (60 minutes intervention 30 minutes follow-up visit). The treatment service is free of charge (only 30 CZK/each visit is to be paid as a regular medical office fee) apart from medication for patients. The pharmacotherapy is not reimbursed by health insurance companies only one of them gave support to pharmacotherapy for their clients by up to 4 000 CZK (= about 2 months treatment) in 2014. 
Treatment is also provided by some physicians pneumologists and other medical specialists. It is not systematic. Treatment can be provided also by addictologists (a new official branch of health professionals in the Czech Republic who focus on prevention and treatment of addictive diseases). A new legislation adopted in 2013 allows to cover a treatment provided by addictologists from health insurance system. 
Czech Pharmacist´s Chamber has started with a program “Smoking Cessation in Pharmacies”.
A “Quit line” (number 844 600 500) is available for a reduced charge between 11 – 16 hours during working days. However it is provided by the NGO “Czech Coalition against Tobacco” without any systematic support by the state. Consultants work on volunteer basis.
Campaigns/projects:
There have not been any national specially designed programmes for specific social groups in the past two years. Campaigns/projects were rather generally focused. There were some local events mainly related to World No Tobacco Day organised by several NGOs every year. 
Several hospitals are active in Health Promoting Hospitals/Smokefree Hospitals Program. Smoking cessation may be part of some other community health promotion projects (Healthy Cities etc.) 
Treatment of tobacco dependence is provided also in the Army of the Czech Republic (ACR). A preventive project of ACR on “Smoking reduction in ACR career soldiers - Smoking cessation“ carried out at the Ministry of Defence was approved in 2011 with the purpose to improve health state of smoking career soldiers.","Answer/report not provided","Answer/report not provided"
"42","Democratic People's Republic of Korea","Health facilities provide the free services like consultation. diagnosis and treatment at the state expense and. when individuals want. no-tobacco centres and pharmacies sell the nicotine-depending drugs at cheap price.","application of the NRT needs many money in our country. To overcome this problem we have been trying to develop the nicotine substitutes such as nicotine gum and sublingual tablet and have some experiences now.And we are testing the effectiveness of traditional medicine to help quiting smoking of smokers.","Answer/report not provided"
"43","Democratic Republic of the Congo","Answer/report not provided","Answer/report not provided","Answer/report not provided"
"44","Denmark","Counselling sessions concerning smoking cessation are offered in every municipality at no costs for the smokers. Some municipalities cover some expenses to smoking cessation medications at their own costs. General practitioners (GP´s) are more involved in giving brief advice to smokers than seen before.
In 2011 the Government and the majority of the political parties of the Parliament have earmarked new funds for 2012-2015 (16 million DKK) to prevention measures aimed at preventing youth smoking and to the launch of a national strategy to combat smoking among young people. 
In 2013 the Government ensured funds for 2014-2017 (42 million DKK) to help heavy smokers to quit smoking which also include the covering of cost of pharmaceutical products to smokers where relevant together with counselling sessions concerning smoking cessation.","In 2011 we developed and implemented recommandations for treating tobacco dependence at the clinical level and in the municipalities. The municipalities are the main responsable partner in tems of smoking cessation","The legal act of health from 2006 has placed the responsobility for health promotion and disease prevantion among citizens in the municipalities. 90 % of the munipals are providing smoking cessation serviceses free of costs but not including pharmaceutical products."
"45","Djibouti","Answer/report not provided","Answer/report not provided","Answer/report not provided"
"46","Ecuador","Se elaboró la Guía de Abordaje del Tabaquismo en Atención Primaria de Salud. la misma que fue entregada a cada una de las Áreas de Salud del Ministerio de Salud Pública.
Capacitación a todo el personal del Primer Nivel de Atención del Área 8 de la ciudad de Quito y del Área 7 de la ciudad de Guayaquil con la finalidad de que realicen la detección precoz del consumo de tabaco y brinden asesoramiento y tratamiento breve a las personas que asisten al Primer Nivel de Atención.
Como parte del Proyecto Bilateral entre Uruguay y Ecuador se realizó la visita de dos especialistas (psicólogo y psiquiatra) a los Servicios de tratamiento del Ministerio de Salud de Uruguay y como producto de esta visita se elaboró el “Plan de Acción de Tratamiento del Tabaquismo” que será ejecutado a partir de los años 2014 y 2015. La falta de acceso a medicamentos gratuitos es una barrera.
Está previsto para el año 2014 la implementación del “Programa de Tratamiento ambulatorio en usos y consumo de tabaco. alcohol y otras drogas a nivel nacional en el Primer Nivel de Atención”.","Esta previsto la compra de mediamentos para brindar el tratamiento farmacológico en esas unidades","Answer/report not provided"
"47","Egypt","Answer/report not provided","Hotline set up to help quit smoking advice","Create a Mobile Clinics"
"48","El Salvador","FOSALUD mantiene cuatro (4) centros de prevención y tratamiento para la cesación del tabaco desde 2007. donde ofrece los servicios a las personas que manifiesten su deseo de cesar el consumo de tabaco. Los centros no están buscando activamente a los y las tabaquistas en centros escolares. instituciones públicas. o privadas.","Answer/report not provided","Answer/report not provided"
"49","Estonia","No changes from previous report","Answer/report not provided","Answer/report not provided"
"50","European Union","Answer/report not provided","Answer/report not provided","A study General Practitioners and the economics of smoking cessation in Europe co-financed by the EU Public Health Programme was published in May 2008."
"51","Fiji","We have however incorporated this into our NCD Strategic Plan 2015-2019","A handbook and pamphlets on smoking cessation (Kick the habit - for a healthy Fiji smile) were produced by the National Centre for Health Promotion in collaboration with the Fiji School of Medicine and the Fiji Dental Association to assist medical professionals during counselling; 
Nicotine replacement therapy (NRT) is available over the counter in pharmacies but the cost of a treatment is very high; the Tobacco Control Unit is currently engaged in discussions with a reputable pharmaceutical manufacturer for the supply of NRTs.","Answer/report not provided"
"52","Finland","Current Care -cessation guideline (summary): 
http://www.kaypahoito.fi/web/kh/suositukset/naytaartikkeli/.../ccs00026
Current Care is a Finnish unit producing evidence-based treatment guidelines for the Finnish Medical Society Duodecim. These guidelines are drawn up in support of health care professionals and for the benefit of patients.
Finnish Lung Health Association: cessation peer support groups amongunemployed cessation support in the Defence Forces of Finland nation-wide trainings of health professionals (lately more focus on tailored trainings for mental health maternal and child health surgeons = tobacco free surgery
Quit an Win competition annually","The Government has decided on a Health Promotion Policy programme including tobacco cessation activities in order to reach the smokefree Finland 2040 goal. The National Institute for Health and Welfare has been responsible for the development and execution of the training of health professionals. http://www.stm.fi/c/document_library/get_file?folderId=28707&name=DLFE-4170.pdf
Current Care -cessation guideline (in Finnish): http://www.terveysportti.fi/xmedia/hoi/hoi40020.pdf
Current Care is a Finnish unit producing evidence-based treatment guidelines for the Finnish Medical Society Duodecim. These guidelines are drawn up in support of health care professionals and for the benefit of patients.
Online tobacco cessation course for health professionals (in Finnish): http://www.terveysportti.fi/kotisivut/sivut.nayta?p_navi=70045&p_sivu=67269","The Government has decided on a Health Promotion Policy Programme. In the implementation of the programme there is a specific part concerning cessation of tobacco use. The National Institute for Health and Welfare has been responsible for the development and execution of the training of health professionals. http://www.vn.fi/toiminta/politiikkaohjelmat/terveys/ohjelman-sisaeltoe/en.pdf http://www.stm.fi/c/document_library/get_file?folderId=28707&name=DLFE-4170.pdf
Current Care -cessation guidelines: http://www.terveyskirjasto.fi/xmedia/hoi/hoi40020.pdf 
English summary: http://www.kaypahoito.fi/web/kh/suositukset/naytaartikkeli/tunnus/ccs00026
Current Care is a Finnish unit producing evidence-based treatment guidelines for the Finnish Medical Society Duodecim. These guidelines are drawn up in support of health care professionals and for the benefit of patients. 
Online course for medics: http://www.terveysportti.fi/kotisivut/sivut.nayta?p_navi=70045&p_sivu=67269"
"53","France","RAS pour 2012 et 2013","Le forfait de prise en charge des traitements de substitution de la nicotine a été augmenté pour les femmes enceintes en septembre 2011 passant de 50 à 150 euros.
La varénicline a été retirée de la liste des médicaments pris en charge par lassurance maladie dans le cadre du forfait daide au sevrage depuis le 29 juin 2011.","De nombreuses campagnes dinformation sur larrêt et laide au sevrage ont été conduites aussi bien auprès du grand public que des professionnels de santé. La ligne téléphonique Tabac-Info-Service a été renforcée dun site internet proposant des profils de suivi personnalisé. Par ailleurs le plan cancer 2009-2013 prévoit le triplement à venir pour les femmes enceintes et les personnes bénéficiaires de la couverture médicale universelle complémentaire du forfait de 50 euros proposé pour la prise en charge des traitements de substitution nicotinique."
"54","Gabon","Answer/report not provided","Answer/report not provided","Answer/report not provided"
"55","Gambia","Answer/report not provided","Answer/report not provided","Answer/report not provided"
"56","Georgia","Currently quit line is financed from the state budget. As for the pharmaceutical products for treatment of the dependency Varenicline is available for sale in the pharmacies.
Draft version of guidelines exists and currently they are in the process of finalization and approval.","Currently quit line is financed fromoffi state budget. As for the pharmaceutical products for treatment of the depedency varenicline is available for sale in the pharmacies and some NGOs have been spreading it for free as a one time event. 
draft version of guidelines exist and currently they are in the process of finalization and approval.","Answer/report not provided"
"57","Germany","Answer/report not provided","New cessation programmes especially for young people were developed and implemented. The federal center of health promotion is currently testing and evaluating the programme. An internet-based cessation programm for young people can be found under www.rauch-frei.info.","New cessation programmes especially for young people were developed and implemented."
"58","Ghana","In-service training on Cessation was organised for 40 health professional (Physicians Psychiatrists Pharmacists and Mental Health Nurses) from Regional Hospitals Mental Health Hospitals and Regional Health Directorates in 2013. The training was funded and facilitated by WHO Afro.
Currently Cessation Manual is under preparation and reached about 80% completion. 
Cessation Clubs formation establishment of Quit Hotlines and procurement of nicotine replacement medicines are planned","Answer/report not provided","Only counselling is done"
"59","Greece","Answer/report not provided","Answer/report not provided","Answer/report not provided"
"60","Grenada","Answer/report not provided","Answer/report not provided","Answer/report not provided"
"61","Guatemala","En agosto 2012 se publicó la Guía Clínica para la Cesación","Se tiene previsto que el Instituto Guatemalteco de Seguridad Social proporcione atención para el abandono de tabaco incluirá medicamentos y tratamiento con especialistas. En proceso la elaboración de la guía clínica para la sesaci","Answer/report not provided"
"62","Guyana","Answer/report not provided","As of 2010 the Ministry of Health has established an approved Cessation Strategy to assist current smokers who are interested to quit. The passage of this strategy was facilitated by the Health Promotion Chronic Diseases Pan American Health Organization and Guyana Chest Society ( This is an NGO that works with the Ministry of Health in Tobacco Control activities. Through collaboration with the National Tuberculosis Clinic a.k.a. the Chest Clinic a department under the Ministry of Health that offers services for chest related diseases the Cessation Program has now been made a permanent service that will be budgetted and offered. A pilot study was conducted at the Chest Clinic and a service is currently being offered there. For 2011 and 2012 plans have been established to roll out the cessation program nationally with the establishment of sixteen permanent sites and forty staff trained and equipped for tobacco cessation.","As of 2010 the Ministry of Health has established an approved Cessation Strategy to assist current smokers who are interested to quit. The passage of this strategy was facilitated by the Health Promotion Chronic Diseases Pan American Health Organization and Guyana Chest Society ( This is an NGO that works with the Ministry of Health in Tobacco Control activities. Through collaboration with the National Tuberculosis Clinic a.k.a. the Chest Clinic a department under the Ministry of Health that offers services for chest related diseases the Cessation Program has now been made a permanent service that will be budgetted and offered. A pilot study was conducted at the Chest Clinic and a service is currently being offered there. For 2011 and 2012 plans have been established to roll out the cessation program nationally with the establishment of sixteen permanent sites and forty staff trained and equipped for tobacco cessation."
"63","Honduras","La Ley Especial para el Control del Tabaco y su Reglamentación LECT y su Reglamentación establece que el sistema de salud desarrolle clínicas de cesación para el tratamiento del consumo de tabaco y proporcionar los medicamentos para tal efecto.","Art# 31 de La Ley Especial para el control del tabaco contempla programas de tratamiento que tiene incluido brindar accesibilidad a los servicios del sector salud y los productos farmaceuticos.","Art# 31 de La Ley Especial para el control del tabaco contempla programas de tratamiento que tiene incluido brindar accesibilidad a los servicios del sector salud y los productos farmaceuticos."
