"","Party","2014","2012","2010"
"1","Afghanistan","So far there is no practical activities are practiced but as soon as the law approved it will immediately started.","no progress","Answer/report not provided"
"2","Albania","Answer/report not provided","In 2010 Albania MOH of Albania developed the first national smoking
cessation guidelines for all health care professionals and especially for
primary health care professionals.","Answer/report not provided"
"3","Algeria","Answer/report not provided","Answer/report not provided","Le traitement de la dépendance disponible depuis 2009"
"4","Antigua and Barbuda","Answer/report not provided","This Article of the FCTC is embodied in our draft legislation of which we are currently awaiting legal processing","Answer/report not provided"
"5","Armenia","Answer/report not provided","Answer/report not provided","In 2009 Armenia MOH of Armenia developed the first national smoking cessation guidelines for all health care professionals and especially for primary health care professionals."
"6","Australia","In addition to the extensive education. communication. training and public awareness measures detailed at section 3.2.6 above. the Australian Government promotes cessation of tobacco use and treatment for tobacco dependence through support for Quitline services and subsidies for nicotine replacement products. These initiatives are part of a balanced package of measures which in the long term will contribute to efforts to reduce smoking rates in Australia. 
The Australian Government has provided funding to support Quitline services. which provide information and advice or counselling for people who want to quit smoking. The Quitlines are the responsibility of the state and territory governments. Quitlines offer a free call-back service. expert help in planning a quit attempt and advice on the use of nicotine replacement products. Quitline services are available in English and other languages. A ''Quit book'' can be mailed to callers with information and advice or callers can speak to someone with information on the best ways to quit. coping with withdrawal symptoms. guidance on quit courses and details of local organisations which provide individual support and counselling. 
The Australian Government also provides financial support to help people quit smoking by the listing of nicotine replacement therapies on the Pharmaceutical Benefits Scheme (PBS). which provides access for lower-income Australians and people with a prescription from the GP. and extended listings for the smoking cessation support drugs bupropion (available in two brands) and varenicline (Champix®). All of these products are available at a reduced price for eligible patients through the PBS with a prescription from a general practitioner. Please see Annex 1 for additional information regarding cessation support measures in place in the State of New South Wales and Western Australia.","In addition to the extensive education communication training and public awareness measures detailed at section 3.2.6 above the Australian Government promotes cessation of tobacco use and treatment for tobacco dependence through support for Quitline services and subsidies for nicotine replacement products. These initiatives are part of a balanced package of measures which in the long term will contribute to efforts to reduce smoking rates in Australia. 
In 2010 the Australian Government provided funding of AUD $5 million to support Quitline services which provide information and advice or counselling for people who want to quit smoking. The Quitlines are the responsibility of State and Territory governments. Quitlines offer a free call-back service expert help in planning a quit attempt and advice on the use of nicotine replacement products. Quitline services are available in English and other languages. A Quit book can be mailed to callers with information and advice or callers can speak to someone with information on the best ways to quit coping with withdrawal symptoms guidance on quit courses and details of local organisations which provide individual support and counselling. 
The Australian Government also provides financial support to help people quit smoking by subsidising a range of medicines on the Pharmaceutical Benefits Scheme (PBS). These include Zyban (Bupropion) Champix (Varenicline) and nicotine patches (Nicorette Nicabate P and Nicotinell). All of these products are available at a reduced price for eligible patients through the PBS with a prescription from a general practitioner. These subsidies were extended in February 2011 to help to remove cost as a barrier for people who want to quit smoking. 
To be eligible to access nicotine patches through the PBS patients must indicate that they are ready to quit smoking and have entered or are entering a comprehensive support and counselling program that is designed to assist people who wish to quit smoking. Patients can access one 12-week course of the nicotine patches per year. If a patient is unsuccessful in quitting using the nicotine patches they can access the other smoking cessation therapies on the PBS (bupropion and varenicline) during that 12 month period. 
Additional measures are in place to reduce the cost of PBS medicines for eligible Aboriginal and Torres Strait Islander people living with or at risk of chronic disease. The PBS Co-payment Measure which commenced on 1 July 2010 is one of 14 measures in the Australian Governments Indigenous Chronic Disease Package and provides lower or nil patient co-payments for PBS medicines. 
Please see Annex 1 for additional information regarding cessation support measures in place in the State of New South Wales.","See sub-jurisdictions responses as these vary - Attachment A."
"7","Austria","Creation of a quality assured tobacco cessation and tobacco counseling curriculum; training since 2012 (Curriculum zur RaucherInnenentwöhnung und -beratung nach den Standards der österreichischen Sozialversicherung) 
Communication between the regions who provide smoking counselling and smoking cessation programs

Networking between the regions and experts
Continuation of the smoking quit line (As from 1st May 2014 the Austrian quitline will be renaimed from “Rauchertelefon” (“smoking quitline”) into” Rauchfrei Telefon” (“smokefree quitline”) and will be furthermore offered free of charge).
Internet-based offers for smoking cessation www.endlich-aufatmen.at
National dependence concept is being planned by the state (see newspaper article attached) 
Different settings are being targeted (hospitals workplaces schools..","The national quitline Rauchertelefon has extended its services (opening hours possibility of contact via fax etc.) health insurance funds have extended their range of smoking cessation programmes smoking cessation seminars were organized in most federal states by federal competence centres/municipal responsibles for addiction prevention. Pharmacies organize smoking cessation weeks every year with advice on cessation strategies/aid and treatment of nicotine addiction. Specialized courses for health professinals on how to deal with nicotine addiction and advise in helping to quit smoking were offered by medical associations competence centres for addiction prevention etc.","Answer/report not provided"
"8","Azerbaijan","The National Clinical Protocol on Smoking Cessation developed and approved The National Clinical Protocol on Prevention of Cardio-Vascular Diseases developed but not yet approved.","The draft of National Clinical Guidelines on Smoking Cessation is currently being developed.","The draft of National Clinical Guidelines on Smoking Cessation is currently being developed."
"9","Bahamas","Draft Tobacco Control Bill 2014 which is being discussed among Cabinet Members for official tabling and passage contains provisions for all operational portions of the WHO FCTC (except taxation as this is already covered in the Tobacco Excise Stamp Tax Act 2013) addresses demand reduction measures","Draft legislation produced in the Ministry of Health by reviewing legislation enacted withing the Caribbean subregion. Drafts forwarded to Attorney Generals office for review","Answer/report not provided"
"10","Bahrain (Kingdom of)","Nicotine replacement therapies such as patches and gums were approved recently as part of the essential drugs list in Bahrain","started offering free nicotine replacement therapy and buprpion in ministry of health and some other non governmental companies for their staff","Answer/report not provided"
"11","Bangladesh","Answer/report not provided","Answer/report not provided","Answer/report not provided"
"12","Barbados","These products are widely available but in the private sector only and therefore require out-of-pocket payment or insurance coverage by the patient.","Answer/report not provided","Answer/report not provided"
"13","Belarus","Increased in recent years the number of persons who received advice on quitting","In recent years increased the number of persons who have received advice on smoking cessation","Over the past few years has increased the number of persons who have received counseling on smoking cessation"
"14","Belgium","Pas de changements concernant ces aspects depuis le dernier rapport","A new Royal Decree concerning cessation support was elaborated in 2009. See Annex 3 for details.
Further information at the following websites:
www.tabacstop.be
http://www.tabacstop.be/index.php/remboursement-/remboursement/id-menu-5753.html","A new Royal Decree concerning cessation support was elaborated in 2009. See Annex 3 for details.
Further information at the following websites:
www.tabacstop.be
http://www.tabacstop.be/index.php/remboursement-/remboursement/id-menu-5753.html"
"15","Belize","Answer/report not provided","Answer/report not provided","Answer/report not provided"
"16","Benin","Answer/report not provided","les produits de substitution de la nicotine ne sont pas disponibles en Pharmacie dans notre pays mais on peut les avoir sur commande et ils reviennent très chers ces produits sont considérés comme des produits cosmétiques de luxe en pharmacie","les produits de substitution de la nicotine ne sont pas disponibles en Pharmacie dans notre pays mais on peut les avoir sur commande et ils reviennent très chers"
"17","Bhutan","Although the Demand reduction measures concerning tobacco dependence and cessation is included in the national legislation the cessations programmes are yet to be implemented and therefore there is no proper facility for tobacco cessation in Bhutan at the moment. The ministry of health and Bhutan Narcotics agency takes the responsibility of educating on the harms of Tobacco Use. IEC materials have been developed and health staffs are trained and counselling services offered through health facilities and rehabilitations centres.
Currently the Government is working on to establish a tobacco cessation programs including quitline and access to low cost pharmaceutical products.","The Ministry of Health takes the responsibility of educating on the harms of tobacco use.Use of both print and broadcast media has been used for informing about the hazards of tobacco use. IEC materials have been developed and health staffs are trained and counseling services offered through health facilities and rehabilitation centres.
The government is working to further train health workers at a national level in addressing health risks of tobacco use and developing cessation interventions among health and education personnel. The training would also focus on imparting skills needed on counseling and advice to quit tobacco.","There is no proper facility for tobacco cessation in Bhutan. The Ministry of Health takes the responsibility of educating on the harms of tobacco use. Use of both print and broadcast media has been used for informing about the hazards of tobacco use. IEC materials have been developed and health staffs are trained and counseling services offered through health facilities and rehabilitation centres.
The government is working to train health workers and school health coordinators at a national level in addressing health risks of tobacco use and developing cessation interventions among health and education personnel. The training would also focus on imparting skills needed on counseling and advice to quit tobacco."
"18","Bolivia","Answer/report not provided","Answer/report not provided","Answer/report not provided"
"19","Bosnia and Herzegovina","PHC centres and Family medicine units are main centres for available smoking prevention and cessation services provided by trained family doctors and nurses mainly covering identification of smoking status advice counselling and group counselling for cessation as also prescription of NRP and other medicaments which are not covered by health insurance. PHI is involved in under and postgraduate training of family practitioners as well some NGO in topics of smoking prevention and cessation.","Answer/report not provided","Answer/report not provided"
"20","Botswana","Answer/report not provided","Treatment and cessation of tobaccco dependence is offered free. The government pays for the services unless provided at private facilities.","Answer/report not provided"
"21","Brazil","In 2012 the National Public Health System provided free tobacco cessation treatment for 159.980 smokers in 1557 health units from a total of 685 municipalities (dates from 2013 hadn´t been consolidated yet).","Answer/report not provided","Answer/report not provided"
"22","Brunei Darussalam","The smoking cessation services and its activities in Brunei Darussalam is provided through the Health Promotion Centre Ministry of Health","Smoking cessation service in Brunei Darussalam is being reviewed.","Answer/report not provided"
"23","Bulgaria","pageid=401&newsid=4140","Since 5 years there are free of charge 28-th Consultative Quit Offices in MoHs 28 Regional Health Inspections.
There is a National Quitline 0700 10 323.
There is a forum in our internet page www.aznepusha.bg.
We have trained in methods for quit consultations 56 general practitioners/family doctors.
Each year the MoH participates in a National Exibition Alley of Health where gives free of charge consultations of smokers and non-smokers and measures the CO in exhaled air of smokers and non-smokers.","Since 5 years there are free of charge 28-th Consultative Quit Offices in MoHs 28 Regional Health Inspections.
There is a National Quitline 0700 10 323.
There is a forum in our internet page www.aznepusha.bg.
We have trained in methods for quit consultations 56 general practitioners/family doctors.
Each year the MoH participates in a National Exibition Alley of Health where gives free of charge consultations of smokers and non-smokers and measures the CO in exhaled air of smokers and non-smokers."
"24","Burkina Faso","Les réflexions sont en cours pour l’élaboration des directives d’aide au sevrage tabagique. En attendant quelques médecins des hôpitaux nationaux et régionaux ont reçu un renforcement des compétences sur la dépendance et le sevrage tabagique. 
Certains médecins de pneumologie et de la société civile offrent des services de sevrage aux clients mais ce service reste très limité.","Answer/report not provided","Answer/report not provided"
"25","Burundi","Answer/report not provided","Answer/report not provided","Answer/report not provided"
"26","Cambodia","Answer/report not provided","Answer/report not provided","Answer/report not provided"
"27","Cameroon","Answer/report not provided","Answer/report not provided","Answer/report not provided"
"28","Canada","Demand reduction. in the Canadian context. is a responsibility shared through federal policy and provincial/territorial service delivery. A number of projects have been developed/supported in implementing Article 14. Annex D provides a detailed description and web access as available.
In response to question 3.2.8 Canada experienced difficulty in reporting on variations between the sub-national authorities. Responses are provided to those questions that had consistent answers by all jurisdictions. The following narratives addresses the variations between jurisdictions.
In response to 3.2.8.6. of those jurisdictions that responded:
60% provided programs for the diagnosis and treatment of tobacco dependence in specialized centers for cessation counseling.
55% responding as having programs in rehabilitation centers.
In response to question 3.2.8.7 on reimbursements:
60% reported “full” and 40% reported “partial” coverage in primary health care.
55% reported “full” and 45 % reported “partial” in secondary health care programs. 
In respsonse to specialized health care. 25% reported having “full” coverage. while 45% reported having “partial” coverage.
In response to specialized centers. 40% reported “partial” coverage.
In responds to rehabilitation centers. 30% had “full funding”. 20% “partial”. while reported as not 50% providing funding.
In response to question 3.2.8.8 on health proffesionals:
50% of those responding indicated “Yes” for practitioners of traditional medicine.
71% reported “Yes”for community workers.
62% reported “Yes” for social workers.
In responding to 3.2.8.9 on training curriculum. there was varied response. Education is governed at the sub-national level. Of the sub-national jurisdictions that responded:
66% did not provide training in medical and dental programs. 
57% did not provide training in nursing programs.
50% did not provide training in pharmacy programs.
In responding to question 3.2.8.10 on providing access to treatement. 90% responded “Yes” with the primary source being a pharmacy.
In responding to question 3.2.8.13 on funding for NRT. the majority of jurisdictions indicated support for partial funding. Specifically:
70% reported support for NRT. 
60% reported support for bupropion.
71% reported support for varenicline.","Demand reduction in the Canadian context is a responsibility shared through federal policy and provincial/territorial service delivery. A number of projects have been developed/supported in implementing Article 14. Annex F provides a detailed description and web access as available.
In responding to Section 3.2.8 Canada experienced difficulty in reporting on variations between the sub national authorities. Responses are provided to those questions that had consistent answers by all jurisdictions. The following narratives addresses the variations between jurisdictions.
In 3.2.8.6 of those jurisdictions that responded 50% provided programs for the diagnosis and treatment of tobacco dependence in specialized centers for cessation counseling and 40% responding as having programs in rehabilitation centers.
In responding to 3.2.8.7 on reimbursements 60% had full and 40% had partial coverage in primary health care and 60% for full and 40 % partial in secondary health care programs. In responding to specialized health care 50% had partial with 25% with full and no coverage. Forty percent reported partial coverage in specialized centers. In responding to rehabilitation centers 30% had full funding 20% partial and 50% did not provide funding.
In responding to 3.2.8.8 indicating which health care professionals are involved in treatment/counseling programs 50% of those responding indicated Yes for practitioners of traditional medicine 71% for community workers 62% for social workers.
In responding to 3.2.8.9 on training curriculum there was varied response from sub national jurisdictions as education is governed at the sub national level. Of the sub national jurisdictions that responded 66% did not provide training in medical and dental programs 57% did not provide training in nursing programs and 50% in pharmacy programs.
In response to 3.2.8.10 50% responded Yes with the primary source being the pharmacy.
In response to 3.2.8.13 on funding for NRT the majority of jurisdictions indicated support for partial funding. Specifically 70% for NRT 60% for bupropion and 71% for varenicline.","Demand reduction in the Canadian context is a responsibility shared through federal policy and provincial/territorial service delivery. A number of projects have been developed/supported in implementing Article 14. Annex 5 provides a detailed description and web access as available.
In responding to Section 3.2.8 Canada was challenged in reporting on variations between the sub national authorities. Responses are provided to those questions that had consistent answers by all jurisdictions. The following narratives addresses the variations between jurisdictions.
In 3.2.8.6 of those jurisdictions that responded 50% provided programs for the diagnosis and treatment of tobacco dependence in specialized centers for cessation counseling and 28% responding as having programs in rehabilitation centers.
In responding to 3.2.8.7 on reimbursements 22% had full and 88% had partial coverage in primary health care and 50% for full and partial in secondary health care programs. In responding to specialized health care 50% had partial with 25% with full and no coverage. Sixty percent reported partial coverage in specialized centers. In responding to rehabilitation centers 30% had full funding 20% partial and 50% did not provide funding.
In responding to 3.2.8.8 indicating which health care professionals are involved in treatment/counseling programs 50% of those responding indicted Yes for practitioners of traditional medicine 71% for community workers 62% for social workers.
In responding to 3.2.8.9 on training curriculum there was varied response from sub national jurisdictions as education is governed at the sub national level. Of the sub national jurisdictions that responded 66% did not provide training in medical and dental programs 57% did not provide training in nursing programs and 50% in pharmacy programs.
In response to 3.2.8.10 50% responded Yes.
In response to 3.2.8.12 on funding for NRT the majority of jurisdictions indicated support for partial funding. Specifically 70% for NRT 60% for bupropion and 71% for varenicline."
"29","Central African Republic","Answer/report not provided","Answer/report not provided","Answer/report not provided"
"30","Chad","Answer/report not provided","Au Tchad nous privilégions de conseils pour faire face au sevrage tabagique.","Answer/report not provided"
"31","Chile","Se ha elaborado por un equipo de profesionales del Ministerio de Salud. una cartilla de Cesación Tabáquica. sobre la base del Modelo A.B.C (Averiguar. Breve Consejo. y Consejería). Su difusión abarco el total de los Centros de Salud del nivel primario del Sistema de Salud. 
Este documento técnico denominado Orientaciones prácticas para la Consejería Anti Tabáquica. está destinada para ser utilizada por los profesionales de dichos centros y contiene orientación y lineamientos generales para aquellas personas que quieren dejar de fumar. de acuerdo al Modelo ya mencionado
 La primera evaluación. da cuenta de un aumento de un 40% de Consejería Breve proporcionada a los pacientes consultantes. durante el primer semestre del 2013","Se ha realizado capacitación de cesación tabaquica a traves de e-learnig y talleres presenciales a los profesionales del nivel primario del Sistema de Salud. Además a través de una linea telefónica del ministerio denominada Salud Responde se da orientación y lineamientos generales para aquellas personas que quieren dejar de fumar.","Answer/report not provided"
"32","China","In 2013 the Ministry of Health revised the clinical smoking cessation Guide and completed after a publication.
China''s health and family planning sectors in 2010 to develop the Chinese version of a short manual of smoking cessation interventions. Through the Central Government 3 year grants to local medical workers to promote tobacco control project brief smoking cessation interventions establish a number of large stable work force. National medical personnel brief smoking cessation skills-training courses on a regular basis every year improve the ability to provide brief smoking cessation intervention of medical professionals.","The completion of the modification to the Guideline for Clinical Smoking Cessation organized by the Ministry of Health shall provide guidance for relevant work in China. The short-term training on intervention of smoking cessation was offered to clinicians by virtue of the central government funds and international fund. In May 2009 the Ministry of Health together with other three ministries and departments jointly issued the Decision on Full Smoking Ban in the National Health Care System Effective as of 2011 which clearly specifies that medical staffs shall provide smoking cessation guidance for smoke","The completion of the modification to the Guideline for Clinical Smoking Cessation organized by the Ministry of Health shall provide guidance for relevant work in China. The short-term training on intervention of smoking cessation was offered to clinicians by virtue of the central government funds and international fund. In May 2009 the Ministry of Health together with other three ministries and departments jointly issued the Decision on Full Smoking Ban in the National Health Care System Effective as of 2011 which clearly specifies that medical staffs shall provide smoking cessation guidance for smoke"
