"64","Hungary","Pictorial warnings on tobacco products have been introduced as reported under the relevant section. The warnings contain the website (www. leteszemacigit.hu) and telephone number (06 40 200 493) of the cessation aid service.

The Methodological Support Center for Smoking Cessation began operation at the National Korányi Institute of Tuberculosis and Pulmonology in October 2012 with European Union Funds support. 

The most important functions of the Methodological Centre:
- tasks with the process. characteristics and methodology of smoking cessation. 
- organize trainings for workers of pulmonary care and for GPs.
- there is a call centre with qualified psychologists and physicians give information and advice relating smoking. and make cessation service through telephone calls. The Centre''s free call is 06 80 44-20-44.
- on the website (www.leszokaspont.hu) there is oppurtunity for widespread communication with the  population.
- up to date communication with the pulmonary care. With the regular data service of pulmonary care the trend of the smoking cessation can be followed.

Connected websites:
http://egeszseg.hu/

In the second half of 2013. 58 health promotion offices was established from European Union Funds Support. which also provide brief intervention on smoking cessation in primary health care.","Pictorial warnings on tobacco products have been introduced as reported under the relevant section. The warnings contain the website (www. leteszemacigit.hu) and telephone number (06 40 200 493) of the cessation aid service.
A media campaign has been launched aiming at tobacco cessation.
 Based on already approved health promotion concepts the following programs shall be launched this year:
-A methodological center for cessation aid will be established.
- A quitline for supporting the population in individual cessation will be launched. 
- Health promotion offices integrated to ambulatory health services in primary health care will provide brief intervention on smoking cessation.
- Programs on smoking prevention and cessation will be launched in settlements of less than 10 thousand inhabitants and workplaces.","There has been no further progress in the last three years in implementing Article 14."
"65","Iceland","There is full awareness of lack of cessation and likely to be addressed in official public policy that is now in process. There is also ongoing work with a new webpage on how to stop using tobacco along with support material.","Answer/report not provided","Answer/report not provided"
"66","India","Under the National Tobacco Control Programme funds have been provided to each district tobacco control cell to make a provision of free NRT to those willing to quit tobacco.","National guidelines for Tobacco Cessation Treatment developed.","These existing TCCs have been strengthened and their role has been extended as Resource Centers for Tobacco Control for providing tobacco cessation training to other health care institutions and will also help the District Tobacco Control Cells in establishing cessation facilities."
"67","Iran (Islamic Republic of)","Article 9 of the Act obligates the Ministry of Health and Medical Education to integrate preventive curative and rehabilitative measures for smokers and consultative services for cessation into primary health care services. It also obligates the Ministry of Health and Medical Education to provide support to NGOs active in tobacco cessation and treatment. 
The HQ has established with the collaboration of medical universities and NGOs approximately 158 smoking cessation clinics integrated in primary health care services. In parallel several training of trainers workshops for health professionals on smoking cessation have been carried out throughout the country. The National Oral Hygiene Program within the Ministry of Health and Medical Education and in collaboration with the Dental School in the Shahid Beheshti University introduced within the curriculum a smoking cessation course and conducted several national smoking cessation courses for dentists. Moreover public and private firm have established smoking cessation clinics for their employees. These cessation services and treatments are provided free of charge. An NGO has helped to establish a quit line in the capital. 
The Health Organization of Petroleum Industry offers cessation consultation and treatment of tobacco dependence to its staff and their families in 20 regions of the country. They also train doctors and nurses on providing brief advice on cessation. 
In general I.R. Iran''s experience of implementation of Article 14 merits promotion within the region and beyond as a potential South–South cooperation project. 
According to the Government pharmaceutical products for treatment of tobacco dependence such as Bupropion and Varenicline are not available in the country because of the sanctions in place and patches for nicotine replacement therapy freely available in the public health service have become more expensive for the Government due to the sanctions which may lead to further reduction in availability of the drug. 
Recently one of the domestic pharmaceutical companies produced a pharmaceutical product named Velban which is based on Bupropion constituents.","Pursuant to the ratification of the National comprehensive tobacco control law and based on assigned duties under Article 9 of this Act the Ministry of Health and Medical Education has mandated in developing prevention activities treatment and rehabilitation of individuals suffering from consuming tobacco products and support private tobacco cessation counselling services and integration of this activity in primary health network. Similarly the Ministry with the support of tobacco cessation counselling centers and holding workshops expanded the number of governmental clinics to 158.","Answer/report not provided"
"68","Iraq","Services will provide assistance and treatment of addiction to tobacco free at health institutions and the possibility of references to get these products from pharmacies at the users'' own expense.","Was planning to set up a number of clinics to quit smoking in Iraq and on this basis Send a team of doctors and researchers psychologists out of Iraq to get training on the mechanisms providing help to quit smoking and work underway to provide the equipment and medicines necessary for the functioning of these clinics","Answer/report not provided"
"69","Ireland","There is on-line help through (www.quit.ie) where smokers can sign up to quitplan i.e. get an assessment of nicotine dependence and receive a series supportive emails both prior to their quit date on their quit date and for 4 weeks post their quit date.
•Smokers can Link on to the new facebook page and get support through social networking.
•Smokers can call the national quitline and speak to a counsellor (one call followed by ongoing telephone support as per the national standard treatment programme if required)
•Smokers can attend a professionally trained tobacco cessation specialist face to face or attend a group facilitated by a tobacco cessation specialist (Hospital/Community based) where available.
•Smokers can get support through their GP and or pharmacist plus or minus pharmacological support through evidenced based pharmacotherapies (NRT and other cessation medications which are available free to GMS patients).
On 3.2.8.2: 
•	women
•	(Irish Cancer Society in conjunction
•	with HSE and Sterling University
•	piloting a cessation programme targeting disadvantaged women)
•	pregnant women 
•	(One maternity service has a dedicated intensive smoking cessation service. Brief Intervention in Smoking Cessation (BISC) training and Tobacco Free campus policies being rolled out in all maternity services).
On 3.2.8.9:
•	text for medical: Brief Intervention in Smoking Cessation (BISC) training is delivered to a number of GP training programmes nationally – (not all programmes and not consistently in all undergrad medical schools). The Royal College of Physicians of Ireland (Irelands largest post graduate training body for physicians is offering a smoking cessation training course to all front line staff and will promote smoking cessation as appropriate through current events such as Master Classes and Clinical Updates)
•	dental: (BISC training has been incorporated in to the undergraduate teaching programme in one dental school –The Dublin school of dentistry in 2013/14)
•	nursing : (work is ongoing with the Nursing and Midwifery board of Ireland to make BISC training a compulsory component of undergrad/postgrad training nationally however training is currently delivered to a number of undergrad and post grad programmes nationally on a voluntary basis – UCD and UCC Letterkenny Institute of Technology and Sligo Institute of Technology)","On-line help through signing up to quitplan i.e. getting an assessment of nicotine dependence and signing up for supportive emails.
o	Linking on to the new facebook page and getting support through social networking.
o	Calling the quitline and speaking to a counsellor (one call followed by ongoing telephone support if required)
o	Meeting either face to face or attending a group facilitated by a tobacco cessation specialist (Hospital/Community based) where available.
o	Getting support through their GP plus or minus pharmacological support through evidenced based pharmacotherapies (NRT and other cessation medications available free to GMS patients).","o	On-line help through signing up to quitplan i.e. getting an assessment of nicotine dependence and signing up for supportive emails.
o	Linking on to the new facebook page and getting support through social networking.
o	Calling the quitline and speaking to a counsellor (one call followed by ongoing telephone support if required)
o	Meeting either face to face or attending a group facilitated by a tobacco cessation specialist (Hospital/Community based) where available.
o	Getting support through their GP plus or minus pharmacological support through evidenced based pharmacotherapies (NRT and other cessation medications available free to GMS patients)."
"70","Israel","Answer/report not provided","Since January 2010 according to Israels Health services basket any smoker can attend a smoking cessation counsling group in his HMO free of charge and during that time can purchase smoking cessation Prescription drugs in 85% discount. If the smoker choose not to join the smoking cessation counsling group he/she can still purchase the drugs but without the discount.
During the last four years the four HMO in Israel organized several training courses to train new smoking cessation group counselors and personal counselor. Since the beginning of 2010 there was an increase of 330% in the number of smokers attending smoking cessation group counseling courses in the HMO. 
In addition two universities in Israel opened training courses for smoking cessation group counselors.","Answer/report not provided"
"71","Italy","Answer/report not provided","Answer/report not provided","Answer/report not provided"
"72","Jamaica","A National Guideline for Nicotine Use Disorder was developed in 2007. Training was conducted in the guidelines. 
A directory of tobacco cessation services available islandwide was developed. Teams also were trained throughout the island to support scaling up of services.","Answer/report not provided","Answer/report not provided"
"73","Japan","Answer/report not provided","Answer/report not provided","NRT receives over-the-counter designation"
"74","Jordan","Nicotine substitutes (nicotine gum and patches etc.) are purchased at the expense of the budget of the Ministry of Health and provided free to all Jordanian citizens.","Funding from the budget of the Ministry of Public Health is provided to make nicotine patches and gum and varenicline available free to all citizens who wish to quit and attend a cessation clinic. The volume of the support has reached 90 thousand dollars so far.
Cessation guidelines were developed in 2011 text is given in Annex 14.","Was to provide the amount of Plasters and nicotine gum in the clinic and disbursement rfree of charge to the Board of the clinic. Was to provide the amount of the drug varenicline all of these drugs was one of the general budget of the Ministry of Health"
"75","Kazakhstan","monitoring the execution of Article 14 was not conducted","monitoring of the implementation of Article 14 was not conducted","Answer/report not provided"
"76","Kenya","Nicotine replacement therapies are available in private pharmacies and they are not affordable for most people","Answer/report not provided","There are no cessation services in most public health care facilities however most private pharmacies provide on sale nicotine replacement therapy on demand. These products are very costly in the market and out of reach for many."
"77","Kiribati","A “Protocol for counseling on cessation of tobacco use” was included in the CVD Risk Factor Assessment and Management Guidelines finalized in June 2013. See Annex.","Answer/report not provided","Answer/report not provided"
"78","Kuwait","Answer/report not provided","There are seven clinics in the country to help those who want to quit smoking and the proportion of successful quitters range between 20-25%.","There are seven clinics in the country to help those who want to quit smoking and the proportion of successful quitters range between 20-25%."
"79","Kyrgyzstan","Answer/report not provided","Adopted by the clinical protocol Treatment of tobacco dependence","Answer/report not provided"
"80","Lao People's Democratic Republic","Answer/report not provided","Answer/report not provided","Answer/report not provided"
"81","Latvia","Answer/report not provided","Treatment for smoking addiction is fully reimbursed by state for adolescents (up to age 18) including multidisciplinary team.
In the last two years since submission of the previous report no changes in tobacco addiction treatment were made.","In order to make treatment more accessible a diagnosis of tobacco addiction is included in the list of state funded diagnoses. To stimulate smoking cessation multiple Heart health cabinets trained nurses provide advice on smoking cessation but are not privileged to prescribe smoking cessation medication such as bupropion. Narcologists provide both psychological and pharmaceutical approach. Nicotine replacement therapy products such as patches gums are freely available in pharmacies but are not reimbursed by government or health care insurance."
"82","Lebanon","The NTCP and allied NGOs have been promoting cessation since 2009. however it has unfortunately taken a second priority as the focus was on implementing the new law on TAPS bans. and banning indoor smoking. There is limited activity by specific health professionals in hospitals to offer smoking cessation. only a handful of specialized private facilities. and otherwise campaigns highlight the benefits of smoking cessation. In general. we believe medication for smoking cessation is relatively unaffordable to most smokers.","Answer/report not provided","Answer/report not provided"
"83","Lesotho","Answer/report not provided","Answer/report not provided","Answer/report not provided"
"84","Libyan Arab Jamahiriya","Six medical and paramedical staff was trained to offer help to quit smoking. Budget has been allocated for the establishment of five tobacco cessation clinics.","We trained 6 medical doctors and 2 assistants to provide advice on cessation of tobacco use and treatment of tobacco dependence.","Answer/report not provided"
"85","Lithuania","p_nr=1080","Demand reduction measures concerning tobacco dependence and cessation is adopted in the Alcohol and Tobacco Control Programme 
http://www.lrs.lt/pls/inter3/dokpaieska.rezult_/?p_nr=1080","Demand reduction meassures concerning tobacco dependence and cessation is adopted in the State TobaccoControl Programme:http://www3.lrs.lt/pls/inter2/dokpaieska.showdoc_l?p_id=241547"
"86","Luxembourg","Le programme NATIONAL DAIDE AU SEVRAGE TABAGIQUE a débuté en 2008","Le programme NATIONAL DAIDE AU SEVRAGE TABAGIQUE a débuté en 2008 avec une année dapprentissage et le nombre de fumeurs ayant recours à cette offre est en augmentation: En 2009 221 personnes se sont inscrites dans le programme 49% (108) des participants ont envoyé après le délai de 8 mois le feuillet B de la consultation finale. De ces 108 personnes 81% ont arrêté de fumer. En 2010 423 personnes sy sont inscrits et 39% (n= 165) ont été vues en consultation finale après 8 mois. 84% de ces patients (n= 139) ont arrêté de fumer.","Le programme NATIONAL DAIDE AU SEVRAGE TABAGIQUE a débuté en 2008 avec une année dapprentissage. Lannée 2009 était une année de réussite étant donné que des 221 personnes inscrites dans le programme 49% (108) des participants ont envoyé après le délai de 8 mois le feuillet B de la consultation finale. De ces 108 personnes 81% ont arrêté de fumer."
"87","Madagascar","Le guide de sevrage tabagique à Madagascar est en cours d’élaboration.","A Madagascar en collaboration avec des ONG nous utilisons le Plan de 5 jours de sevrage tabagique (Dans le système de la Santé adventiste)","nd"
"88","Malaysia","NRT and varenicline are included in MOH Drug Formulary updated 9th Dec 2011. Since last 2 years MOH has requested special budget for purchasing these drugs.","The availability of pharmacotherapies such as NRTs and Varenicline has significantly improved with the inclusion of both medications into the MOH Drug Formulary No.3/2011 (updated 9th. December 2011). 
The latest policy for provision of primary health care services includes smoking cessation treatment as one of the items for full integration into the overall service at primary care facilities nationwide.","The availability of pharmacotherapy i.e. NRT & varenicline has significantly improved with the inclusion of both drugs into the MOH drug list. The latest policy for provision of primary health care services includes smoking cessation treatment as one of the items for full integration into the overall service at primary care facilities nationwide."
"89","Maldives","Answer/report not provided","Answer/report not provided","Answer/report not provided"
"90","Mali","Answer/report not provided","Le diagnostic et le traitement de la dépendance à legard du tabac bien que non opérationnels au niveau des structures sanitaires pour le moment restent pris en compte dans le plan national de lutte contre les maladies non transmissibles","Answer/report not provided"
"91","Malta","- Adverts on TV
- Training of facilitators at the main acute hospital - Mater Dei State Hospital (MDH)
- Seminar on role of the Health Care Professional at MDH
- Designing and implementing smoking cessation programmes for Health Care Professionals in their work place
- Committee on Smoking and Health for the eventuality of a Smoke free State Hospital","Adverts on TV
Training of facilitators at the main acute hospital - Mater Dei Hospital (MDH)
Seminar on the role of the Health Care Professional at MDH
Designing and implementing smoking cessation programmes for Health Care Professionals in their work place
Committee on Smoking and Health - for the eventuality of a Smoke free Hospital 
Health Promotion and Disease Prevention support https://ehealth.gov.mt/healthportal/health_promotion/library/publications.aspx","Adverts on TV
Training of facilitators at the main acute hospital - Mater Dei Hospital (MDH)
Seminar on the role of the Health Care Professional at MDH
Designing and implementing smoking cessation programmes for Health Care Professionals in their work place
Committee on Smoking and Health - for the eventuality of a Smoke free Hospital
Health Promotion and Disease Prevention support https://ehealth.gov.mt/healthportal/health_promotion/library/publications.aspx"
"92","Marshall Islands","– RMI has not adapted or developed guidelines on tobacco dependence and cessation.
There is no comprehensive and integrated programme on tobacco dependence and cessation in RMI.
Some health workers at primary health-care level have been trained and mobilized to provide cessation counselling and brief cessation advice but such counselling/advice is not routinely provided.
There is no national quit line.
Pharmaceutical products for the treatment of tobacco dependence are not freely available or affordable through the public health service.
No outcome analysis has been undertaken to evaluate the effectiveness of these cessation clinics and interventions.","Yes the Marshall Islands has provided cessation training to the staff of the Ministry of Health as well as to the NGOs and civil societies. As such counseling of those who wants to quit is the main intervention as far as cessation. Further the physicians can prescribe medicines as nicotine gum and patches.","Actually the medications as specified above are dispensed for those who needs them. However The Ministry of Health has just completed a comprehensive tobacco cessation counseling training and a program is yet to be installed and operated. About 21 participants from the hospital participated in the comprehensive training on tobacco cessation counseling."
"93","Mauritania","Answer/report not provided","Rien","Answer/report not provided"
"94","Mauritius","A Training of trainers workshop on smoking cessation was held in October 2011 and subsequently 7 smoking cessation clinics became operational in the five health regions. The World Health Organisation provided for expertise which enabled training of health personnel.","A Training of trainers workshop on smoking cessation was held in October 2011 and subsequently 7 smoking cessation clinics became operational in the five health regions. The World Health Organisation provided for expertise which enabled training of health personnel.","A smoking cessation clinic is operational on a pilot basis at one health care point in the public health sector. The clinic is manned by a doctor a psychologist an educator and a nurse. It provides free counselling and drug therapy. Training of health personnel is planned during the current year after which more such clinics will be opened to cater for a wider population in need of cessation services. These clinics will be integrated in the routine health care delivery system of the Ministry of Health."
"95","Mexico","Elaboración de convenios con la industria farmacéutica","Durante la presente administración se ha fortalecido el sistema de atención y prevención de la adicción a la nicotina y los productos de tabaco a través de la creación de 334 Centros Nueva Vida dependientes del Centra Nacional para la Prevención y Control de las Adicciones (Cenadic) de la Secretaría de Salud los cuales se agregan al Sistema de más de 250 Clínicas para Dejar de Fumar existentes en el país y se enfocan principalmente al primer Nivel de Atención o atención primaria. Dichos centros se enfocan a la prevención sobre los daños ocasionados por el tabaquismo así como a brindar Consejería Breve para dejar de fumar.","Durante el primer semestre de 2010 Secretaría de Salud ha acompañado a las Comisiones de Salud de la Cámara de Senadores y la Cámara de Diputados en la presenteación de una iniciativa de incremento a los impuestos de los productos de tabaco. Dicha iniciativa fue presentada en abril de 2010 al final del primer periodo ordinario de sesiones del Congreso el cual concluyó el 30 de abril y se espera que sea votada a partir del 1 de septiembre 2010 fecha en que inicia el segundo periodo ordinario de sesiones. la propia Secretaríoa de Salud ha realizado trámite ante instancias del poder ejecutivo como la Secretaría de Economía y la Secretaría de Hacienda para robustecer la iniciativa de los legisladores"
"96","Micronesia (Federated States of)","There were capacity buildings to staff to carry out the service to the people. Utilization of culturally based smoking cessation was piloted during the past two years.","There were capacity buildings to staff to carry out the service to the people. Utilization of culturally based smoking cessation was applied during the past two years.","Answer/report not provided"
"97","Mongolia","Answer/report not provided","in order to improve suply of NRT patches and gums they are included in the revised Essential drug list in 2009 but accessibility and affordability are low","In 2009 NRT patches and gums were included in the revised Essential drug list but accessibility and affordability are low."
