"32","China","The Chinese Government has formulated relevant laws and regulations on tobacco control in order to achieve the public health objective and does not take into account the commercial interests of the tobacco companies and other vested interests. In order to prevent public health policy in relation to tobacco control from commercial and other vested interests of the tobacco industry influence we have set up a multisectoral collaborative compliance tobacco control mechanisms to ensure that obligations in the Convention have been fulfilled.
The Chinese public have a variety of channels to obtain extensive information about the tobacco industry and industries like Government Web sites annual reports various tobacco-related policies and regulations and so on.","The Chinese government promulgated relevant laws and regulations on tobacco control with a view to protect the physical health of the mass without considering the commercial and other vested interests of the tobacco companies. To protect the public health policies with respect to tobacco control from being affected by the commercial and other vested interests of the tobacco industry China has created a multi-departmental cooperative performance tobacco control mechanism to guarantee the performance of the obligations under the Convention.
The Chinese public can easily access extensive information on the tobacco industry through various channels such as government websites industry annual reports and various policies and regulations relating to the tobacco industry.","The Chinese government promulgated relevant laws and regulations on tobacco control with a view to protect the physical health of the mass without considering the commercial and other vested interests of the tobacco companies. To protect the public health policies with respect to tobacco control from being affected by the commercial and other vested interests of the tobacco industry China has created a multi-departmental cooperative performance tobacco control mechanism to guarantee the performance of the obligations under the Convention.
The Chinese public can easily access extensive information on the tobacco industry through various channels such as government websites industry annual reports and various policies and regulations relating to the tobacco industry."
"33","Colombia","Por primera vez. en el Plan Decenal de Salud Pública se definió explícitamente como estrategia. la protección de las políticas públicas de salud frente a los intereses comerciales o de otra índole de la industria tabacalera. 
Así mismo. el Tribunal Administrativo de Cundinamarca. en Sentencia de 5 de septiembre de 2013. avaló las actuaciones del Ministerio de Salud en el retiro de las frases promocionales presentes en la cajetilla. dándole respaldo a las medidas en el CMCT y sentando un importante precedente en cuanto al cumplimiento de las obligaciones internacionales derivadas del mismo instrumento jurídico.","Answer/report not provided","Answer/report not provided"
"34","Comoros","Answer/report not provided","Après la convention la pays sest doté dune loi nationale en appliquation à la convention cadre","Answer/report not provided"
"35","Congo","Answer/report not provided","Answer/report not provided","Answer/report not provided"
"36","Cook Islands","General raising awareness through media and workshop presentations/sessions","Ongoing media awareness school sessions as well as community presentations to make people aware of the tobacco control policies","Media and community awareness programs regarding the 2007 Tobacco Act in the past two years to protect public health policies"
"37","Costa Rica","3.1.2.1 “Priva interés de la salud pública” Promulgándose la ley General y Reglamento de Control del Tabaco y sus Efectos Nocivos en la Salud. Ley N° 9028.","La nueva Ley contempla todos los aspectos incluidos en el CMCT. Los Reglamentos ya está avanzados. Los podemos enviar en 3 semanas.","Answer/report not provided"
"38","Côte d'Ivoire","Answer/report not provided","Des conférences publiques ciblant en particulier les jeunes et des émissions radio servent de cadre pour véhiculer au sein des populations des informations sur le dit thème","Answer/report not provided"
"39","Croatia","Answer/report not provided","Answer/report not provided","Answer/report not provided"
"40","Cyprus","The tobacco control legislation ensures the protection of public health policies with respect to tobacco control from commercial and other vested interests of the tobacco industry","Answer/report not provided","Answer/report not provided"
"41","Czech Republic","The Code of Ethics for state officials and employees in public administration which was approved by the Government Resolution No. 331 of 9 May 2012 and the Codes of Ethics of relevant state authorities in general apply to this matter.","Answer/report not provided","Answer/report not provided"
"42","Democratic People's Republic of Korea","It is enlisted in the Law on Tobacco Control of DPR Korea.","Answer/report not provided","Answer/report not provided"
"43","Democratic Republic of the Congo","Answer/report not provided","Answer/report not provided","Answer/report not provided"
"44","Denmark","The Agency for the Modernisation of Public Administration published in 2007 “Good behaviour in public administration” which describes the basic terms and conditions of work in the public sector.","Answer/report not provided","Administrative laws and legal practice issues concerning private interests versus public administration"
"45","Djibouti","Answer/report not provided","Article 6.4 de la Loi portant organisation de la protection de santé contre le tabagisme exige que en définissant et en appliquant les politiques sectorielles de santé publique en matière de lutte antitabac les différents secteurs veillent à ce que ces politiques ne soient pas influencées par les intérêts commerciaux et autres de lindustrie du tabac conformément à la législation nationale.","Answer/report not provided"
"46","Ecuador","Aprobación de los Acuerdos Ministeriales de la Primera. Segunda y Tercera Ronda de advertencias sanitarias con pictogramas elaboradas por la Autoridad Sanitaria Nacional. sin la injerencia de la industria del tabaco. La primea Ronda circuló entre julio del 2012 a julio del 2013. la segunda ronda de julio del 2013 a julio del 2014 y la tercera ronda de julio de 2014 a julio de 2015. 
Si bien no existe un instrumento legal específico en relación al Art. 5.3 del CMCT. sin embargo en eventos institucionales. interinstitucionales y a través de instrumentos administrativos como oficios o memorandos. se difunde entre las instituciones públicas. autoridades y funcionarios los contenidos del Art. 5.3 y sus Directrices","La aprobación del Acuerdo Ministerial de la primera ronda de advertencias sanitarias con pictogramas elaboradas por la Autoridad Sanitaria Nacional sin la ingerencia de la Industria del tabaco. Advertencias sanitarias que estarán en circulación en las cajetillas de cigarrrillos y otros productos de tabaco desde el 15 de julio de 2012.","Answer/report not provided"
"47","Egypt","Total ban of direct advertising and sponsorship by law 85 for the year 2002","Answer/report not provided","Answer/report not provided"
"48","El Salvador","Answer/report not provided","Answer/report not provided","Answer/report not provided"
"49","Estonia","Answer/report not provided","Answer/report not provided","Answer/report not provided"
"50","European Union","The Staff Regulations for officials of the European Union contain legally binding ethical standards and ensure that the principles of independence impartiality objectivity and loyalty are applied in the European Public Service. Notably the principle of independence guarantees that conduct and decision-making are determined by the need to serve the common good and the public interest and never by any other interests.","The Staff Regulations for officials of the European Union contain legally binding ethical standards and ensure that the principles of independence impartiality objectivity and loyalty are applied in the European Public Service. Notably the principle of independence guarantees that conduct and decision-making are determined by the need to serve the common good and the public interest and never by any other interests.","The Staff Regulations for officials of the European Union contain legally binding ethical standards and ensure that the principles of independence impartiality objectivity and loyalty are applied in the European Public Service. Notably the principle of independence guarantees that conduct and decision-making are determined by the need to serve the common good and the public interest and never by any other interests."
"51","Fiji","Answer/report not provided","Information is relayed to the Tobacco Control Enforcement Unit via the Minister or Permanent Secretary of Health when BAT submits quaterly reports on manufacture imports and sale of tobacco products. No specific activity implemented so far that would fit within the scope of this article of the Convention.","Answer/report not provided"
"52","Finland","Finnish public health policies are well protected from the tobacco industry. The interaction with the industry is limited mainly to open requests for comment. However there is no extensive public repository on industry''s activities. Several reports on the tobacco industry activities have been published.
Many non-governmental organizations report that they actively disseminate information and raise discussion on the industry''s activities interests and methods. For example Finland''s ASH disseminates information and reveals the tactics of the tobacco industry and encourages public discussion on the tobacco industry´s methods to ensure their profits.In addition Finland´s ASH and many other NGOshave adopted the policy not to interact with the tobacco companies their affiliates or any other companies which work with tobacco industry such as advertising agencis.","Finnish public health policies are well protected from the tobacco industry. The interaction with the industry is limited mainly to open requests for comment. However there is no extensive public repository on industrys activities. Several reports on the tobacco industry activities have been published.
Many non-governmental organizations report that they actively disseminate information and raise discussion on the industrys activities interests and methods. 
For example Finlands ASH disseminates information and reveals the tactics of the tobacco industry and encourages public discussion on the tobacco industry´s methods to ensure their profits.
In addition Finland´s ASH and many other NGOs have adopted the policy not to interact with the tobacco companies their affiliates or any other companies which work with tobacco industry such as advertising agencis.","Finnish public heatlh policies are well protected from the tobacco industry. The interaction with the industry is limited mainly to open requests for comment. However there is no extensive public repository on industrys activities.
Many non-governmental organizations report that they actively disseminate information and raise discussion on the industrys activities interests and methods.
For example Finlands Ash disseminates information on tactics of the tobacco industry and encourages public discussion on the tobacco industry´s methods to ensure their profits.
Finnish Centre for Health Promotion is maintaining a website www.tupakkaverkko.fi for introducing information about tobacco issues. Activities of tobacco industry are also reported on the website. 
Finnish Lung Health Association (Filha) has adopted the principle of no interaction with tobacco industry in any circumstances. Information on the issue is an integral part of all training of health care professionals provided by Filha by which the professionals are made aware of the interests of the tobacco industry."
"53","France","Answer/report not provided","Answer/report not provided","Answer/report not provided"
"54","Gabon","Pour le point 3.1.2.1 Le Gabon dispose d’un code de conduite destiné aux agents de la fonction publique. En plus le chapitre 7 de la Loi interdit l’ingérence de l’industrie du tabac dans les politiques nationales de lutte antitabac dans son article 32 ; il interdit également tout partenariat direct ou indirect avec l’industrie du tabac et toute subvention publique ou mesure incitative en faveur de la culture de la production ou de la transformation du tabac ou des produits du tabac. L’article 33 stipule que tout rapport avec l’industrie du tabac doit être transparent. L’article 34 interdit tout partenariat et accord avec l’industrie du tabac et avec ceux qui s’attachent à promouvoir ses intérêts. Une fois promulguée la Loi constituera une base juridique solide pour l’application de l’article 5 3 de la CCLAT et des directives le concernant. ; Pour le point 3.1.2.2 la loi prévoit au chapitre 11 article 46 ainsi qu’au chapitre 6 article 31 de renforcer laction dinformation déducation et de communication sur les effets nocifs liés à la consommation du tabac et sur les avantages du sevrage tabagique grâce à la Commission Nationale de Lutte contre le tabagisme.
Le rapport des la mission de la CCLAT a relevé que Le Gabon a mené diverses activités d’éducation de communication et de sensibilisation aux méfaits de la consommation de tabac et de l’exposition à la fumée du tabac auprès du grand public et de groupes ciblés tels que les jeunes les professionnels des médias les éducateurs et les décideurs.","Answer/report not provided","Answer/report not provided"
"55","Gambia","IT BEEN ADDRESS IN THE NEW TOBACCO CONTROL POLICY","Answer/report not provided","Answer/report not provided"
"56","Georgia","Answer/report not provided","Answer/report not provided","Answer/report not provided"
"57","Germany","There is information on tobacco control policy on the website of the Federal Ministry of Health. Further information i.e. on tobacco products (database) can be found on the website of the Federal Ministry of Food and Agriculture which had also published all statements submitted by stakeholders during the process of discussing the new draft of the tobacco directive in 2013.","There is information on tobacco control policy on the website of the Federal Ministry of Health. Information on tobacco products (database) can befound on the website of the Federal Ministry on Consumer Protection.","Answer/report not provided"
"58","Ghana","The 2013 World No Tobacco day was commemorated in Techiman given the high prevalence of smoking in the Brong-Ahafo region. The key Note address was delivered by the Hon Deputy Minister of Health Dr Alfred Tia Sugri and also attended by the Deputy Brong-Ahafo Regional Minister. A total of about 600 people were in attendance and was followed by several TV and radio talks and discussions. Schools (102) Markets (12) Transport terminals (12) and Religious organizations (15) were also sensitized 
The Food and Drug Authority carried out Media sensitization programmes on Fourteen (14) TV and Twenty three (23) Radio Stations in Accra to create awareness on the provisions of the Tobacco Control Measures as specified by the Public Health Act. FDA also made 2 000 copies of ''The Smoker''s Body'' on A2 poster and 100 copies of ''The Smoker''s Body''on 2ft x 3ft banner on flexy and distributed to all FDA regional offices Ministry of Health Media houses Schools Markets Transport terminals and Religious organizations.","Answer/report not provided","Answer/report not provided"
"59","Greece","Answer/report not provided","Answer/report not provided","Answer/report not provided"
"60","Grenada","Answer/report not provided","Answer/report not provided","Answer/report not provided"
"61","Guatemala","Answer/report not provided","Aprobación de la Ley que contiene las Disposiciones para el Fortalecimiento del sistema tributario y el combate a la defraudación y al contrabando mediante el cual se establecen impuestos al tabaco y sus productos","Answer/report not provided"
"62","Guyana","Answer/report not provided","Interms of administrative and executive bodies there is the National Tobacco Control Council in which the Tobacco Industry is not a member.
The National Health Sector Strategy for Guyana 2008- 2012 guides Tobacco Control activity and schedules.
Through the Health Communication and Health Promotions Department there is a rigorous Communication Strategy that addresses all aspects of Tobacco Education in all target groups and utilizes all medium that is suitable for each target group and the regions in which they live. The materials and information can be uplifted from the Ministry of Health. 
As mandated by the Health Facilities Licensing Act and the Ministerial Decree from the Ministry of Education All Health Facilities and Education Facilities must be 100% smoke free.
The Ministry of Health also has a Smoke Free Environments Program. At the moment it is a voluntary program and participants enter into it by choice. A declaration that is certified by the Minister of Health is presented to them along with Smoke Free Environments Signs. Assistance is also in developing enforcement strategies and penalities strategies that are suitable. 
As of 2010 the Ministry of Health has also established an approved Cessation Strategy to assist current smokers who are interested to quit. The passage of this strategy was facilitated by the Health Promotion Chronic Diseases Pan American Health Organization and Guyana Chest Society ( This is an NGO that works with the Ministry of Health in Tobacco Control activities. Through collaboration with the National Tuberculosis Clinic a.k.a. the Chest Clinic a department under the Ministry of Health that offers services for chest related diseases the Cessation Program has now been made a permanent service that will be budgetted and offered. A pilot study was conducted and a service is currently being offered there. For 2011 and 2012 plans have been established to rolloutthe cesation program nationally with the establishmnent of sixteen permanent sites and forty staff trained and equipped for tobacco cessation.","Interms of administrative and executive bodies there is the National Tobacco Control Council in which the Tobacco Industry is not a member.
The National Health Sector Strategy for Guyana 2008- 2012 guides Tobacco Control activity and schedules.
Through the Health Communication and Health Promotions Department there is a rigorous Communication Strategy that addresses all aspects of Tobacco Education in all target groups and utilizes all medium that is suitable for each target group and the regions in which they live. The materials and information can be uplifted from the Ministry of Health. 
As mandated by the Health Facilities Licensing Act and the Ministerial Decree from the Ministry of Education All Health Facilities and Education Facilities must be 100% smoke free.
The Ministry of Health also has a Smoke Free Environments Program. At the moment it is a voluntary program and participants enter into it by choice. A declaration that is certified by the Minister of Health is presented to them along with Smoke Free Environments Signs. Assistance is also in developing enforcement strategies and penalities strategies that are suitable. 
As of 2010 the Ministry of Health has also established an approved Cessation Strategy to assist current smokers who are interested to quit. The passage of this strategy was facilitated by the Health Promotion Chronic Diseases Pan American Health Organization and Guyana Chest Society ( This is an NGO that works with the Ministry of Health in Tobacco Control activities. Through collaboration with the National Tuberculosis Clinic a.k.a. the Chest Clinic a department under the Ministry of Health that offers services for chest related diseases the Cessation Program has now been made a permanent service that will be budgetted and offered. A pilot study was conducted and a service is currently being offered there. For 2011 and 2012 plans have been established to rolloutthe cesation program nationally with the establishmnent of sixteen permanent sites and forty staff trained and equipped for tobacco cessation."
"63","Honduras","No se permite la injerencia de la industria tabacalera en el patrocinio de actividades de promoción a la salud y de otra índole establecida en las políticas públicas del sector salud. así como. de lo señalado en la Ley Especial para el Control del Tabaco y su Reglamentación","Creacion material preventivo- educativo trifolios volantes banner documentales spots publicitarios.","Creacion material preventivo- educativo trifolios volantes banner documentales spots publicitarios."
"64","Hungary","Answer/report not provided","Answer/report not provided","Answer/report not provided"
"65","Iceland","Comprehensive tobacco control law that include display ban on tobacco trademarks and ban on any form of media coverage of individual products for other purposes than to warn of their harmful effects.
http://eng.velferdarraduneyti.is/acts-of-Parliament/nr/19484 (act 7)","Comprehensive tobacco control law that include display ban on tobacco trademarks and ban on any form of media coverage of individual products for other purposes than to warn of their harmful effects.
http://eng.velferdarraduneyti.is/acts-of-Parliament/nr/19484 (act 7)","Answer/report not provided"
"66","India","In view of the huge loss caused by tobacco use to the public health exchequer. a comprehensive legislation was adopted by Ministry of Health & Family Welfare in 2003 which  prohibit advertising and regulate production. supply and distribution of cigarettes and tobacco products. Further the enabling Rules and regulations have been notified under the framework of the tobacco control legislation thus insulating them from any commercial and other vested interest of the tobacco industry.","The Government of India enacted a comprehensive anti-tobacco legislation in 2003 to prohibit advertisement/promotion and to regulate production supply and distribution of cigarettes and other tobacco products. The enabling rules and regulations are notified under the framework of the anti-tobacco legislation thus insulating them from any commercial and other vested interests of the tobacco industry.","In view of the huge loss caused by tobacco use to the public health exchequer a comprehensive legislation to prohibit advertising and regulate production supply and distribution of cigarettes and tobacco products the Ministry of Health & Family Welfare adopted the comprehensive tobacco control legislation in 2003."
"67","Iran (Islamic Republic of)","Article 18 of the Bylaw prohibits any subsidy for the cultivation growth and harvest of tobacco Article 3 in the Act prohibits any form of sponsorship. I.R Iran has a code of conduct for public officials. It bans any financial relations between Government officials and the private sector. The code could be further utilized to implement Article 5.3 of the Convention and its guidelines.","According to article 4 of the national tobacco control law any policy-making supervision and issuance of permission for importing tobacco products shall be solely done by the government. As well as the article 5 of its bylaw which banned any support of tobacco manufacturers to the programs: Article 5- Grant of any aid assistance and support- financial or non-financially producers importers and exporters of tobacco products which may be considered publicity for tobacco products is forbidden.","Answer/report not provided"
"68","Iraq","Ensuring that the anti-smoking law in Iraq especially the development of standard specifications tobacco products obliges manufacturers dealers and importers in respect of rates of nicotine and tar as well as the graphic health warnings on tobacco products.","Answer/report not provided","Answer/report not provided"
"69","Ireland","A key recommendation in ''Tobacco Free Ireland'' is to: Take steps to ensure that all government officials employees of state agencies and members of any government branch (executive legislative and judiciary) responsible for setting and implementing tobacco control policies and for protecting those policies against tobacco industry interests are aware of their obligations under Article 5.3 of the WHO FCTC and are aware of the Guidelines developed to assist in meeting these obligations. –p34","In accordance with Irelands obligations under Article 5.3 of the treaty officials from the Department of Health meet with representatives of the tobacco industry when such meetings are necessary to effectively regulate the industry and progress tobacco control policies.","In accordance with Irelands obligations under Article 5.3 of the treaty officials from the Department of Health meet with representatives of the tobacco industry when such meetings are necessary to effectively regulate the industry and progress tobacco control policies."
"70","Israel","Answer/report not provided","A yearly report by the Ministry of Health to the public on the Tobacco industry expanses on promotion advertisement sponsorship and direct mailing","Answer/report not provided"
"71","Italy","Answer/report not provided","Answer/report not provided","Answer/report not provided"
"72","Jamaica","The Ministry of Health has ensured that Tobacco Industry does not participate in public health policies related to Tobacco Control. Government Officials were sensitized to and given copies of Article 5.3 for the FCTC.","Answer/report not provided","Answer/report not provided"
