"73","Japan","With reference to 3.1.2.1 commercial and other vested interests of the tobacco industry have been appropriately regulated in Japan by Articles 197.1-197.4 Article 198 of the Penal Code Articles 21-22.9 of the Political Funds Control Act.","With reference to 3.1.2.1 commercial and other vested interests of the tobacco industry have been appropriately regulated in Japan by Articles 197.1-197.4 Article 198 of the Penal Code Articles 21-22.9 of the Political Funds Control Act.","With reference to 3.1.2.1 commercial and other vested interests of the tobacco industry have been appropriately regulated in Japan by Articles 197.1-197.4 Article 198 of the Penal Code Articles 21-22.9 of the Political Funds Control Act."
"74","Jordan","Requesting tobacco companies to eliminate (due to circumvent the subject of publicity and promotion through websites) conducting tours of the press inside the factories and the emphasis on not accepting any support or sign agreements care for the various activities and to inform all parties to the Public Health Law and instructions.","Answer/report not provided","Answer/report not provided"
"75","Kazakhstan","Information about the WHO FCTC is on the Ministry of Health and public NCPHLD antismoking organizations and also distributed in thematic press releases.","Information on the WHO FCTC is on the website of the Ministry of Health NTSPFZOZH and public anti-tobacco organizations and is distributed in case the press releases.","Answer/report not provided"
"76","Kenya","The Tobacco Control Act requires that the members of the Tobacco Control Board should not have any affiliation with the tobacco industry; the Act also requires the industry to provide information to the Board including information on tobacco products and their emissions sales and advertising data information on product composition ingredients hazardous properties and brand elements","Answer/report not provided","The Tobacco Control Act 2007 Section 5 (3) & (4) prohibits any person with affiliation to the tobacco industry getting involved in any manner in the development of tobacco control policies."
"77","Kiribati","Answer/report not provided","Answer/report not provided","Answer/report not provided"
"78","Kuwait","Answer/report not provided","We do not to accept aid and donation from tobacco companies and we do not allow them to sponsor any activities in the country.","We do not to accept aid and donation from tobacco companies and we do not allow them to sponsor any activities in the country."
"79","Kyrgyzstan","Answer/report not provided","Information campaigns carried out periodically distributed informational materials developed and works Online and telephone line information support for the population","Answer/report not provided"
"80","Lao People's Democratic Republic","There are two articles in the TC Law stated to protect government officials and public health policies from Tobacco Industry Interference","Answer/report not provided","Answer/report not provided"
"81","Latvia","Comment in 3.1.2.6.","In 2010 tobacco industrys participation in the State Committee on Restriction of Smoking was prohibited by the law On restrictions regarding sale advertising and use of tobacco products. Therefore no member of the tobacco industry is allowed to participate in the process of tobacco control policy development.","Answer/report not provided"
"82","Lebanon","The NTCP has confronted the tobacco industry on several occasions where it sought to influence members of parliament in voting against law 174. Although the industry did seem to have an influence in postponing the approval of the law. it nevertheless was approved by the Parliament in 2011.
We have also hosted a WHO workshop in 2013 regarding article 5.3. and trained national stakeholders against tobacco industry interference.","We have successfuly prevented the tobacco industry and its representatives from participating in the parliamentary committee meetings which were held to debate the upcoming tobacco control law as well as replied in public media to all cases articles or reports released by the tobacco industry or its allies to deceive the public opinion.","We have successfuly prevented the tobacco industry and its representatives from participating in the parliamentary committee meetings which were held to debate the upcoming tobacco control law as well as replied in public media to all cases articles or reports released by the tobacco industry or its allies to deceive the public opinion."
"83","Lesotho","Answer/report not provided","Answer/report not provided","At present there is no formal policy for such protection.
Although Lesotho does not have a legislation but through Health Promotion plan the public has a wide range of information on tobacco industry activities."
"84","Libyan Arab Jamahiriya","Answer/report not provided","The Decree 206/2009 (see Annex) forbids advertising promoting and also sponsorship by the tobacco industry.","Answer/report not provided"
"85","Lithuania","Answer/report not provided","Answer/report not provided","Answer/report not provided"
"86","Luxembourg","Pour suivre et évaluer le plan national TABAC un groupe national dexperts a été constitué qui se réunit en cas de besoin sous la présidence du Ministère de la Santé; campagnes annuelles brochures et outils par la Fondation Cancer et par la Division de la Médecine préventive Direction de la Santé.","Pour suivre et évaluer le plan national TABAC un groupe national dexperts a été constitué qui se réunit en cas de besoin sous la présidence du Ministère de la Santé; campagnes brochures et outils par la Fondation Cancer et par la Division de la Médecine préventive Direction de la Santé.","Afin dassurer une stratégie nationale concertée un groupe national dexperts de lutte contre le tabagisme se réunit régulièrement sous la présidence du Ministère de la Santé; Campagnes brochures et outils autres de la Fondation Luxembourgeoise contre le cancer"
"87","Madagascar","Trois ateliers nationaux pour les Départements Ministériels Journalistes et ONG sur l’ingérence de l’Industrie du Tabac a été tenu à Madagascar par l’appui de l’UNION INTERNATIONAL CONTRE LA TUBERCULOSE ET LES MALADIES RESPIRATOIRES et L’OMS pays","Non alliance avec lindustrie du tabac sur le programme National de Lutte Antitabac","Non alliance avec lindustrie du tabac sur le programme National de Lutte Antitabac"
"88","Malaysia","Answer/report not provided","Answer/report not provided","Answer/report not provided"
"89","Maldives","Although this is made aware to policy makers the industry tries to infiltrate the mechanism to influence policies to the benefit of the industry. Though not fully robust and fools proof a limited mechanism is instilled to understand and recognise such instances through workshops and other information sessions to focused groups.","Answer/report not provided","Answer/report not provided"
"90","Mali","Il y a eu la relecture du décret dapplication des textes mais aussi lindustrie du tabac a été refusé dans le comité national de lutte contre le tabac .","Il ya eu la relecture du décret dapplication des textes mais aussi lindustrie du tabac a été refusé dans le commité national de lutte contre le tabac
Elaboration et ladoption de la loi anti tabac","Answer/report not provided"
"91","Malta","Administrative policies and work ethics prohibit any conflict.","Administrative policies and work ethics prohibit any conflict","Administrative policies and work ethics prohibit any conflict"
"92","Marshall Islands","Answer/report not provided","Having realized the importance of protecting the public the Marshall Islands in June of 2006 has signed and ratified a National Tobacco Act which enables the Ministry of Health and/or any interested group to educate and and provide public awareness with regard to the danger of tobacco use. MIEPI (Marshall Islands Epidemiological & Prevention Initiative Inc ) has printed a report on Substance Abuse Profile for 2011. The Annual Report for the Ministry of Health provide the awareness activities performed by the Health Education and Promotion Division Ministry of Health all years.","The Marshall Islands Tobacco Act was signed and parts of it have been implemented by relevant sectors. Again regulations with regard to Article 8 9 10 11 12 and 13 have been developed and currently awaiting approval of the RMI Congress. The Ministry of Health and other non organizations have develop health education materials and disseminated to the public as part of their tobacco awareness program; including use of media."
"93","Mauritania","Answer/report not provided","Answer/report not provided","Answer/report not provided"
"94","Mauritius","The Public Health (Restrictions on Tobacco Products) Regulations 2008 ban direct and indirect advertising promotion and sponsorship. The Tobacco Industry is not allowed to carry out activities under CSR.","The Public Health (Restrictions on Tobacco Products) Regulations 2008 ban direct and indirect advertising promotion and sponsorship.The Tobacco Industry is not allowed to carry out activities under CSR.","The tobacco industry was not involved in the development of the National Action Plan on Tobacco Control and in the drafting of the new FCTC-compliant regulations of 2008. The tobacco industry is not a member of the National Committee on Tobacco Control. Sponsorship by the tobacco industry under Corporate Social Responsibility has been completely banned."
"95","Mexico","En abril de 2010. el entonces Secretariado Técnico del Consejo Nacional contra las Adicciones (ST-CONADIC) y el Sistema Nacional para el Desarrollo Integral de la Familia (DIF). organizaron de manera conjunta tres Foros Regionales y un Foro Académico “Hacia la construcción de un modelo integral para la prevención y atención a las adicciones”. En el mes de enero de 2011. la Comisión Nacional contra las Adiciones convocó a representantes de 54 instituciones a participar en el Taller Interinstitucional de Actualización del Programa contra el Tabaquismo. Los principales actores de este esfuerzo fortalecido seguirán siendo los representantes de los sectores público. social y privado; los tres órdenes de gobierno y las tres esferas del desarrollo integral: la familia. la escuela y la comunidad. así como los profesionales y voluntarios que participan en este campo.","El Artículo 13 de la Ley General Para el Control del Tabaco (LGCT) establece el mandato a las compañías productoras importadoras o comercializadoras del productos del tabaco para que entreguen a la Secretaría de Salud la información relativa al contenido de los productos del tabaco los ingredientes más usados y las emisiones y sus efectos a la salud conforme a las disposiciones aplicables y hacerlas públicas a la población en general.","El Artículo 13 de la Ley General Para el Control del Tabaco (LGCT) establece el mandato a las compañías productoras importadoras o comercializadoras del productos del tabaco para que entreguen a la Secretaría de Salud la información relativa al contenido de los productos del tabaco los ingredientes más usados y las emisiones y sus efectos a la salud conforme a las disposiciones aplicables y hacerlas públicas a la población en general."
"96","Micronesia (Federated States of)","A Resolution on Article 5.3 was submitted to the Secretary of Health and Social Affairs for review before the President of the Nation send to the FSM Congress for action.","A Resolution on Article 5.3 was submitted to the Secretary of Health and Social Affairs for review before the President of the Nation send to the FSM Congress for action.","Answer/report not provided"
"97","Mongolia","State policy on Tobacco control reflected in the law on Tobacco control.","State Policy on Tobacco Control reflected in the law on Tobacco Control","State Policy on tobacco control reflected in the law on tobacco control 2005. See at http://www.who.int/fctc/reporting/Mongolia_annex4_tobacco_act_2005.pdf"
"98","Montenegro","We provided that tobacco industry can not finance any activity related to the protection of public health (activities of promotion prevention treatment and rehabilitation). Additionally it is forbidden any covert promotion of tobacco industry sponsorship and public events by the manufacturer or retailer of tobacco products. The Law prohibits the sale of any products which imitate tobacco products or containing names (logos) of tobacco products or tobacco companies.","We provide the tobacco industry can not finance any activity related to the protection of public health (activities of promotion prevention treatment and rehabilitation). Additionally it is forbidden any covert promotion of tobacco industry sponsorship and public events by the manufacturer or retailer of tobacco products. The Law prohibits the sale of any products which imitate tobacco products or containing names (logos) of tobacco products or tobacco companies .","We provide the tobacco industry can not finance any activity related to the protection of public health (activities of promotion prevention treatment and rehabilitation). Additionally it is forbidden any covert promotion of tobacco industry sponsorship and public events by the manufacturer or retailer of tobacco products. The Law prohibits the sale of any products which imitate tobacco products or containing names (logos) of tobacco products or tobacco companies ."
"99","Myanmar","The Tobacco Control Cell under Public Health Division of Department of Health organized a National Workshop on Countering Tobacco Industry Interference with the objective of raising awareness of governmental and non-governmental organizations. In collaboration with various partners the Tobacco Control Cell is developing the guidelines and regulations on the protection of public health policies from commercial and other vested interests of the tobacco industry based on the guidelines of Article 5.3 and discussions and recommendations from the above workshop. 
The information regarding the tobacco industry activities is not much available yet in Myanmar.","Answer/report not provided","Answer/report not provided"
"100","Namibia","Answer/report not provided","The Act provides for the protection of public health and bans public smoking in all areas. The IEC Unit currently serves as a repository for such information but there is need for a resource centre.","The Act provides for the protection of public health and bans public smoking in all areas. The IEC Unit currently serves as a repository for such information but there is need for a resource centre."
"101","Nauru","Answer/report not provided","Answer/report not provided","Answer/report not provided"
"102","Nepal","The Ministry has never included the tobacco industry or any sector perceived to be in favour of the industry in its meetings. The Regulations states that any nominated member of the Committee “found to be involved directly or indirectly in the manufacture import export or sales and marketing of tobacco products” may be removed from his or her post.","Tobacco industries are not involved in any of our activities neither we go to attend their activites.
There is complete media ban for any promotional activities of tobacco industries that are intended to promote tobacco use.","Answer/report not provided"
"103","Netherlands","The Dutch Government is transparent with regard to all contacts with the tobacco industry or retail industry and provides on request information on the nature and frequency of these contacts and the people who are involved. The Government only consults the industry on executive matters that have a direct influence on the industry and interacts with the industry only to the extent strictly necessary. 
The Government does not endorse any partnership or other non-binding agreements with tobacco industry. Tobacco control policy in general is not discussed with the industry.","The Dutch government is transparent on all contacts with the tobacco industry or retail industry. On request we provide information on the nature and frequency of these contacts and the people who are involved. The Dutch government only consults the industry on executive matters that have a direct influence on the industry. We interact with tobacco industry only to the extent strictly necessary. The Dutch government does not endorse any partnership or other non binding agreements with tobacco industry. Tobacco control policy in general will not be discussed with the industry.","Our health research institute RIVM is working on a website to inform the public on tobacco related subjects but tobacco industry activities are not part of this website."
"104","New Zealand","The Ministry of Health maintains a publicly available register of meetings it has with the tobacco industry. It provides information on the dates of meetings who attended and the topics discussed. Such meetings have been rare in recent times.","The Ministry of Health maintains a publicly available register of meetings it has with the tobacco industry. It indicates the date of such meetings who attended and the topics discussed.","Answer/report not provided"
"105","Niger","Answer/report not provided","Nous avons élaborer un argumentaire à lattention des décideurs sur les agissements de lindustrie du tabac.","Answer/report not provided"
"106","Nigeria","Answer/report not provided","Answer/report not provided","Answer/report not provided"
"107","Niue","Answer/report not provided","Answer/report not provided","Answer/report not provided"
"108","Norway","Ethical standards set in guidelines excluding tobacco producing companies from the Norwegian Government Pension Fund Global (GPFG).
http://www.regjeringen.no/en/dep/fin/Selected-topics/the-government-pension-fund/responsible-investments/guidelines-for-observation-and-exclusion.html?id=594254","There are ethical standards set in a parliamentary desicion denying the Government Pension Fund Global (GPFG) to invest in the tobacco production industry.
http://www.regjeringen.no/en/dep/fin/press-center/Press-releases/2010/New-guidelines-for-responsible-investment-practices-in-the-Government-Pension-Fund-Global-GPFG.html?id=594246","The Norwegain parliament has passed ethical standards that entail that the Government Pension Fund Global (GPFG) no longer can invest in the tobacco production industry.
http://www.regjeringen.no/en/dep/fin/press-center/Press-releases/2010/New-guidelines-for-responsible-investment-practices-in-the-Government-Pension-Fund-Global-GPFG.html?id=594246"
"109","Oman","Does not meet the tobacco companies in general; developed a form to be signed by the members of the National Committee for Tobacco Control on conflict of interest. A circular letter was sent to all ministries not to buy medicines from the tobacco companies and agents and to prevent them from accepting aid and donations from tobacco companies.","We found a conflict of interest form for members of the National Committee for Tobacco Control and alert to the departments of the Ministry not to buy medicines from tobacco companies and agents. As well as alert all concerned government units not to accept aid and donations from tobacco companies.","We found a conflict of interest form for members of the National Committee and alert to the departments of the Ministry not to buy drugs from tobacco companies and agents. As well as to alert all units Komi concerned not to accept aid and donations from tobacco companies"
"110","Pakistan","Pakistan is ensuring to protect public health policies with respect to tobacco control from the commercial and other vested interests of tobacco industry by following the guiltiness issued under Article 5.3 of FCTC.","Pakistan is ensuring to protect public health policies with respect to tobacco control from the commercial and other vested interests of tobacco indusry by following the guidelines issued under Article 5.3 of FCTC.","Answer/report not provided"
"111","Palau","Answer/report not provided","See attached copy of RPPL 8-27 (Republic of Palau Public Law)","Answer/report not provided"
