"","Party","2014","2012","2010"
"1","Afghanistan","Answer/report not provided","Answer/report not provided","Answer/report not provided"
"2","Albania","Through press conferences and through training of inspectors dealing with the implementation of theses legal acts of law like the directorate of tax investigation. Through information education and communication campaign for the implementation of the Law for the Protection from Tobacco Products in corporation with NGO. We have prepare effective and appropriate or sensitization and awareness programmes on tobacco control addressed to persons such as students of public health and PHC and also schools doctors.","Through press conferences collaboration with NGOs and throught training of inspectors dealing with the imeplementation of theses legal acts of law like the directorate of tax investigation","Answer/report not provided"
"3","Algeria","-Loi sanitaire 85-05 (article 63-64-65) qui interdit la publicité des produits du tabac quelque soit le type.
- Décret exécutif n°04-331 du 18 octobre 2004 portant réglementation et activités de fabrication et de distribution des produits tabagiques 
- Décret exécutif n°01-396 du 09 décembre 2001 portant réglementation et activités de fabrication et de distribution de tabacs
-Décret exécutif n°01-397 du 09 décembre 2001 fixant les conditions d’importation des produits du tabac manufacturés par les personnes morales justifiant d’un agrément.","Loi Sanitaire 85-05 (article 63-64-65)
Decrét executif n 04-331 du 18 oct 2004 portant réglementation et activités de fabrication et de distribution des produits tabagiques","- Loi sanitaire 85 05 (Article 63 -64-65) 
 - Décret exécutif N 04-331 du 18 octobre 2004 portant réglementation et activités de fabrication et de distribution des produits tabagiques."
"4","Antigua and Barbuda","In Antigua and Barbuda. we do not involve the Tobacco Industry in any of our decisions regarding Public Health Policy.","We do not involve the Tobacco Industry in any of our decisions reguarding Public Health Policy.","Answer/report not provided"
"5","Armenia","Answer/report not provided","Answer/report not provided","Answer/report not provided"
"6","Australia","Details of meetings held between the Australian Government Department of Health and the tobacco industry. including recent consultations in relation to Australia''s plain packaging measures. are publicly notified on the website of the Department of Health at: http://www.health.gov.au/internet/main/publishing.nsf/Content/tobacco-conv-public. 
The Australian Government maintains a Register of Lobbyists and a Lobbying Code of Conduct to ensure that contact between lobbyists and Government representatives is conducted in accordance with public expectations of transparency. integrity and honesty. For further information. see http://lobbyists.pmc.gov.au/. 
Australian Government officials are required to comply with the Australian Public Service Code of Conduct. The Code includes. inter alia. requirements to behave honestly and with integrity; to disclose. and take reasonable steps to avoid. any conflict of interest (real or apparent); and not to make improper use of duties. status. power or authority. or any inside information. to gain or seek to gain a benefit or advantage for any person. For further information. see http://www.apsc.gov.au/conduct/index.html. 
It is a legal requirement in Australia that any donation to a registered political party to the value of or greater than AUD $10.000 must be declared to the Australian Electoral Commission. Donor annual returns are posted online at http://fadar.aec.gov.au/. The Australian Government does not accept donations from the tobacco industry.","Details of meeings held between the Australian Government Department of Health and Ageing and the tobacco industry including recent consultations in relation to Australias plain packaging measures are publicly notified on the website of the Department of Health and Ageing at http://www.health.gov.au/internet/main/publishing.nsf/Content/tobacco-conv-public. 
The Australian Government maintains a Register of Lobbyists and a Lobbying Code of Conduct to ensure that contact between lobbyists and Government representatives is conducted in accordance with public expectations of transparency integrity and honesty. For further information see http://lobbyists.pmc.gov.au/. 
Australian Government officials are required to comply with the Australian Public Service Code of Conduct. The Code includes inter alia requirements to behave honestly and with integrity; to disclose and take reasonable steps to avoid any conflict of interest (real or apparent); and not to make improper use of duties status power or authority or any inside information to gain or seek to gain a benefit or advantage for any person. For further information see http://www.apsc.gov.au/conduct/index.html. 
It is a legal requirement in Australia that any donation to a registered political party to the value of or greater than AUD $10 000 must be declared to the Australian Electoral Commission. Donor annual returns are posted online at http://fadar.aec.gov.au/. The Australian Government does not currently accept donations from the tobacco industry.","Answer/report not provided"
"7","Austria","Answer/report not provided","Answer/report not provided","Answer/report not provided"
"8","Azerbaijan","Answer/report not provided","Answer/report not provided","Answer/report not provided"
"9","Bahamas","Answer/report not provided","Answer/report not provided","Answer/report not provided"
"10","Bahrain (Kingdom of)","According to antismoking law tobacco industry are not allowed to directly or indirectly sponsor any event related to health sports or welfare.","Answer/report not provided","Answer/report not provided"
"11","Bangladesh","As per tobacco control law Tobacco Advertising Promotion and Sponsorship (TAPS) is prohibited","Answer/report not provided","Smoking and Using of Tobacco Products (Control) Act has been passed in perliament in 2005 and rules were formulated in 2006. In the law smoking in selected public places and advertisement of tobacco products has been banned. Incorporation of pre-defined health warnings on packets of tobacco products made compulsary."
"12","Barbados","Answer/report not provided","Answer/report not provided","Answer/report not provided"
"13","Belarus","Information on activities relevant to the objectives of the WHO FCTC annually covered press conferences to mark World No Tobacco Day on May 31. not smoking and Day ( the third Thursday in November ) published in the media besides the draft Technical Regulations of the Customs Union '' Technical regulations for tobacco products '' developed to meet the provisions of the WHO FCTC was posted on the website of the Customs Union for public discussion . Ministry of Health is also subject to the provisions of the WHO FCTC yl draft Law of the Republic of Belarus ''On the protection of public health from the effects of tobacco consumption and exposure to environmental tobacco smoke '' which is available for public comment on the Department of Health of the Republic of Belarus (http://minzdrav.gov.by/ru/static/Lets_discuss). In addition the Ministry of Health is fundamentally opposed to the proliferation of smoking implementing policy documents participating in the development of the technical regulations of the Customs Union on tobacco products in collaboration with the Ministries of Health of other post-Soviet countries developing agreed positions in opposition to the interests of tobacco companies.","The work to implement the orders of the Council of Ministers of 16.12.2010g. ? 38/577-327 of acceptance together with the concerned governments of measures to implement Article 5 (item 3) of the WHO FCTC. Information on activities related to the objectives of the WHO FCTC was highlighted at a press conference on World No Tobacco Day 31 May 2011. not smoking and Day 17 November 2011t year published in the media besides the draft of the Technical Regulations of the Customs Union Technical Regulations on Tobacco Products developed in the light of the WHO FCTC has been posted on the website of the Customs Union for public comment. Ministry of Health in principle opposes the proliferation of tobacco use by implementing the policy documents participating in the development of technical regulations and the EurAsEC Customs Union on tobacco products in collaboration with the Ministries of Health of other post-Soviet countries developing coordinated positions in opposition to the interests of tobacco companies","Ministry of Health has fundamentally opposes the proliferation of tobacco use by implementing policy documents participating in the development of technical regulations EEC tobacco products in collaboration with the Ministries of Health of other post-Soviet countries developing coordinated positions in opposition to the interests of tobacco companies"
"14","Belgium","Answer/report not provided","Answer/report not provided","Answer/report not provided"
"15","Belize","Answer/report not provided","Answer/report not provided","Answer/report not provided"
"16","Benin","Atelier sur lapplication de larticle 5.3 de la CCLAT au Bénin en 17 au 18 octobre 2013","Answer/report not provided","Answer/report not provided"
"17","Bhutan","Answer/report not provided","Answer/report not provided","Answer/report not provided"
"18","Bolivia","Answer/report not provided","Answer/report not provided","Answer/report not provided"
"19","Bosnia and Herzegovina","New Tobacco Control Law in the Federation of B&H enforced in 2011 enforced ban of all commercial activities of the tobacco industry","Answer/report not provided","Answer/report not provided"
"20","Botswana","Answer/report not provided","Educational materials targeting different age groups have been produced and disseminated. Workshops and media are used to educate the public about tobacco control.","Answer/report not provided"
"21","Brazil","On April. 2012. the Ministry of Health established the ethical guidelines for the members of National Committee for FCTC Implementation (CONICQ). composed by 18 representatives of federal government. The objective is contribute to avoid tobacco industry interference in tobacco control policies. These ethical guidelines state that activities of CONICQ shall be transparent and responsible. and the public health measures are irreconcilable with the tobacco industry interests. as recommended by FCTC article 5.3. The CONICQ members shall not receive incentives from the tobacco industry. shall not have research or activities funded by this sector. and only participate in events sponsored by the tobacco industry when there is governmental interests involved.","INCA has disseminated information to the people on the tobacco industrys tactics through its website the newsletter For a World Without Tobacco and the Ibero-American Network for Tobacco Control.
In 2010 tobacco industry started a national campaign to avoid Brazilian delegation to approve the guidelines on articles 9 and 10 regarding additives restriction. CONICQ Executive Secretariat elaborated an analytic report with information on tobacco industry strategies and the hazards of additives use. Internal communication among CONICQ members was crucial to avoid tobacco industry strategy to convince different sectors of the government to not approve those guidelines.","INCA has disseminated information to the people on the tobacco industrys tactics through its website the newsletter For a World Without Tobacco and the Ibero-American Network for Tobacco Control.
In 2010 tobacco industry started a national campaign to avoid Brazilian delegation to approve the guidelines on articles 9 and 10 regarding additives restriction. CONICQ Executive Secretariat elaborated an analytic report with information on tobacco industry strategies and the hazards of additives use. Internal communication among CONICQ members was crucial to avoid tobacco industry strategy to convince different sectors of the government to not approve those guidelines."
"22","Brunei Darussalam","Answer/report not provided","Answer/report not provided","Answer/report not provided"
"23","Bulgaria","lang=bg-BG&newsid=3554&home=true","There is a web page of National Program for Tobacco Control:
www.aznepusha.bg. We publish there articles which reveal the tactic of
tobacco industry to make more Bulgarian psychoaddictive. We escape
meetings or other forms of communication with representatives of tobacco
industry.","There is a web page of National Program for Tobacco Control: www.aznepusha.bg. We publish there articles which reveal the tactic of tobacco industry to make more Bulgarian psychoaddictive. We escape meetings or other forms of communication with representatives of tobacco industry."
"24","Burkina Faso","Confer les articles 11 29 30 et 32 de la Loi 040","Le chapitre XI de la loi fait état de la protection des politiques de sante publique en matière de lutte antitabac face aux intérêts commerciaux et autres de lindustrie du tabac. En effet les articles 29 et 30 de ce chapitre règlent les relations entre ladministration publique et lindustrie du tabac en vue dempêcher les interférences de cette dernière.","Answer/report not provided"
"25","Burundi","Answer/report not provided","Answer/report not provided","Answer/report not provided"
"26","Cambodia","Answer/report not provided","Answer/report not provided","Answer/report not provided"
"27","Cameroon","Le marquage sanitaire qui est rendu obligatoire l’interdiction de tout parrainage sponsoring des firmes de tabac","Answer/report not provided","Answer/report not provided"
"28","Canada","While Parties to the FCTC are not bound by the Guidelines. Canada has reviewed the Article 5.3 Guidelines in relation to the Canadian policy. legal and constitutional context. Canada has adopted administrative measures. such as Health Canada''s policy of not partnering with the tobacco industry on tobacco control programming. 
Lobbying at the federal level in Canada is regulated under the Lobbyist Registration Act. It is illegal for corporations of any kind to contribute to political campaigns for electoral purposes. Some provinces also regulate lobbying. Furthermore. the Lobbyist Registration Act introduced a requirement that consultant lobbyists (ie: tobacco related activities) file a return with the Commissioner of Lobbying if they communicate with a designated public office holder under certain conditions. This registry can be searched by anyone through a publicly-accessible website. 
Health Canada has discussed the Article 5.3 Guidelines with its federal partner departments and with relevant departments of provinical/territorial governments who are collaborators in the Federal Tobacco Control Strategy (FTCS). Generally. in Canada the primary channels of communication between governments and the tobacco industry are limited to (i) technical discussions in regard to both health and tax-related regulations and (ii) litigation-related responses.
In Canada. many aspects of the tobacco industry''s health policy. business and promotional activities are matters of public record. In addition. civil society organizations keep close track of tobacco industry activities and maintain web sites. publications etc for this and related purposes. The tobacco industry must report to government on its research and promotional activities pursuant to Tobacco Reporting Regulations of the Tobacco Act. Public access to information about the tobacco industry which is reported to the government pursuant to these Regulations is governed by the Canadian Charter of Rights and Freedoms. Access to Information & Privacy Act. and the common law as it relates to confidential business information.","Canada has reviewed the Article 5.3 Guidelines in relation to the Canadian policy legal and constitutional context. Canada has adopted administrative measures such as Health Canadas policy of not partnering with the tobacco industry on tobacco control programming. Lobbying at the federal level in Canada is regulated under the Lobbyist Registration Act and it is illegal for corporations of any kind to contribute political campaign contributions for electoral purposes. Some provinces also regulate lobbying. Furthermore the Lobbyist Registration Act introduced a requirement that consultant lobbyists (ie: tobacco related activities) file a return with the Commissioner of Lobbying if they communicate with a designated public office holder (DPOH) under certain conditions. This registry can be searched by anyone through a publicly-accessible Website. 
Health Canada has discussed the Article 5.3 Guidelines with its federal partner departments and with relevant departments of provinical/territorial governments who are collaborators in the Federal Tobacco Control Strategy (FTCS). Health Canada is considering what if any further measures related to the recommendation of the Article 5.3 Guidelines may be appropriate and feasible in the Canadian context. Generally in Canada the primary channels of communication between governments and the tobacco industry are limited to (i) technical discussions as required by national law in regard to both health and tax-related regulations and (ii) litigation-related responses as required by national law and practice.
In Canada many aspects of the tobacco industrys health policy business and marketing activities are matters of public record. In addition civil society organizations keep close track of tobacco industry activities and maintain web sites publications etc for this and related purposes. The tobacco industry must report to government on its research and promotional activities pursuant to Tobacco Reporting Regulations of the Tobacco Act. Public access to information about the tobacco industry which is reported to the government pursuant to these Regulations is governed by the Canadian Charter of Rights and Freedoms Access to Information & Privacy Act and the common law as it relates to confidential business information.","Canada has reviewed the Article 5.3 Guidelines in relation to the Canadian policy legal and constitutional context. Canada has adopted administrative measures such as Health Canadas policy of not partnering with the tobacco industry on tobacco control programming. Lobbying at the federal level in Canada is regulated under the Lobbyist Registration Act and it is illegal for corporations of any kind to contribute political campaign contributions for electoral purposes. Some provinces also regulate lobbying. Furthermore the Lobbyist Registration Act introduced a requirement that consultant lobbyists (ie: tobacco related activities) file a return with the Commissioner of Lobbying if they communicate with a designated public office holder (DPOH) under certain conditions. This registry can be searched by anyone through a publicly-accessible Website. 
Health Canada has discussed the Article 5.3 Guidelines with its federal partner departments and with relevant departments of provinical/territorial governments who are collaborators in the Federal Tobacco Control Strategy (FTCS). Health Canada is considering what if any further measures related to the recommendation of the Article 5.3 Guidelines may be appropriate and feasible in the Canadian context. Generally in Canada the primary channels of communication between governments and the tobacco industry are limited to (i) technical discussions as required by national law in regard to both health and tax-related regulations and (ii) litigation-related responses as required by national law and practice.


In Canada many aspects of the tobacco industrys health policy business and marketing activities are matters of public record. In addition civil society organizations keep close track of tobacco industry activities and maintain web sites publications etc for this and related purposes. The tobacco industry must report to government on its research and marketing activities pursuant to Regulations of the Tobacco Act. Public access to information about the tobacco industry which is reported to the government is governed by those Regulations and by the Access to Information & Privacy Act which among other things takes into consideration Confidential Business Information."
"29","Central African Republic","Answer/report not provided","Answer/report not provided","Answer/report not provided"
"30","Chad","Answer/report not provided","Emission conférences débats à la radio et télévision sur le langage mensogier de lindustrie du tabac aussi bien sur les composantes chimiques et toxiques du tabac","Answer/report not provided"
"31","Chile","El año 2013. Chile promulga la Ley 20.660 que introduce modificaciones a la Ley 19.419 
Dichos cambios a este cuerpo legal. incrementan ostensiblemente la regulación de los productos de Tabaco como asimismo. incluye aspectos relacionados a proteger a la población de los riesgos del tabaquismo.
 Se incorpora una prohibición absoluta de toda forma de publicidad de la industria. se obliga a la industria a reportar anualmente al Ministerio de Salud toda donación que realice (Artículo 3. inciso final). se aumenta las sanciones a la ley y se genera mayores sanciones cuando estas son cometidas por representantes de la Industria (Artículo 16)","Chile promulga modificaciones a la Ley 19.419 el año 2005 que mantiene una regulación expresa sobre productos de Tabaco. Los artículos de la ley incluyen aspectos relacionados a proteger a la población de estos aspectos.
El Presidente de la República Sebastián Piñera Echenique junto a sus Ministros entregan al país en Diciembre del 2011 las METAS 2011-2020 Elige Vivir Sano: Estrategia Nacional de Salud para el cumplimiento de los Objetivos Sanitarios de la década 2011 - 2020 Ministerio de Salud Chile. Estas metas desarrollan un objetivo específico para el control de tabaco:
Objetivo Estratégico 3.2: Consumo de Tabaco
RE 1. Abogacía y Fiscalización 
1.1 Recomendaciones de Políticas Públicas relacionadas con consumo de tabaco destinadas al intersector actualizadas cada 3 años
RE2. Fiscalización
2.1 Tasa anual de fiscalizaciones por recintos cerrados de uso público por SEREMI
2.2 Porcentaje anual de infracciones a la Ley 19.419 que son denunciadas a juzgados de policía local por SEREMI
RE3. Intervención Escolar
3.1 Prevalencia de consumo de último mes en escolares de 8 básico
3.2 Orientaciones Técnicas para la prevención del consumo de tabaco en menores de 14 años revisadas/actualizadas cada 3 años
3.3 Porcentaje de establecimientos educacionales que participan en actividades de promoción* para la prevención del consumo de tabaco por SEREMI
RE4. Cesación del Consumo
4.1 Porcentaje de personas menores de 35 años que han fumado más de 100 cigarrillos que hace más de un año dejó de fumar
4.2 Orientaciones Técnicas para la Cesación del Hábito Tabáquico revisadas/actualizadas cada 3 años
4.3 Porcentaje anual de comunas con acceso a Programas de Cesación de Tabaco por Servicios de Salud (S. S)
4.4 Tasa anual de consultas con intervención breve* en tabaco del total de consultas de los establecimientos de Atención Primaria (A.P) por Servicios de Salud
RE5. Intervención Comunitaria
5.1 Porcentaje anual de establecimientos de Atención Primaria que cuentan con vinculación formal con dispositivo comunitario de grupos de autoayuda en tabaco por SS
5.2 Porcentaje anual de comunas que desarrollan programas de promoción de estilos de vida sin tabaco por SEREMI.
Actualmente se está trabajando en la operacionalización de cada uno de estos objetivos y el primer paso es el ingreso el 31 de Mayo del 2011 a un nuevo proyecto que modifica Ley de Tabaco con el objetivo de alinear la legislación vigente con los compromisos planteados en el Convenio Marco de Control de Tabaco.","Answer/report not provided"
